2101170050,信義健康服務中心,臺北市信義區信義路５段１５號,(02)27234598
2312041028,新竹市北區衛生所,新竹市北區國華街六十九號一樓,(03)5353969
2336210034,臺中市和平區梨山衛生所,臺中市和平區梨山里中正路６８號,(04)25989540
2339110013,雲林縣二崙鄉衛生所,雲林縣二崙鄉崙西村中興路９、１１號,(05)5982004
2341220015,臺南市山上區衛生所,臺南市山上區山上里３５－２號,(06)5781013
2344050015,澎湖縣望安鄉衛生所,澎湖縣望安鄉西安村３６－７號,(06)9991036
2390010010,金門縣金城鎮衛生所,金門縣金城鎮民權路１４７號,(082)325059
2390040518,金門縣金寧鄉衛生所,金門縣金寧鄉盤山村仁愛新屯２之１號,(082)325735
2390050032,金門縣烈嶼鄉衛生所,金門縣烈嶼鄉西口村西方６－５號,(082)362078
5901012650,銘德藥局,臺北市松山區八德路２段３６６巷２８號,(02)27511833
5901020616,龍護大藥局,臺北市大安區大安路１段２２４巷７號１Ｆ,(02)23250686
5901022898,永康藥局,臺北市大安區麗水街６之２號,(02)23279362
5901023519,惠盈藥局,臺北市大安區辛亥路２段１７１巷３１號,(02)87321366
5901023653,信安健康藥局,臺北市大安區仁愛路４段１２２巷５８號,(02)27084858
5901024472,忠孝康承健保藥局,臺北市大安區復興南路１段１０７巷４號,(02)87733378
5901024721,麗泰藥局,臺北市大安區復興南路２段１５１巷４號,(02)27079595
5901090074,慈仁藥局,臺北市大同區歸綏街２６１號１樓,(02)25572733
5901101205,大直藥局,臺北市中山區北安路６１７號１樓,(02)25320522
5901102515,華康藥局,臺北市中山區民生西路３巷２之１號,(02)25211772
5901102971,保德明水藥局,臺北市中山區北安路６０８巷４弄１號,(02)85097769
5901103405,大直永安藥局,臺北市中山區北安路５６７之２號,(02)25332125
5901103487,錦州春天生活藥局,臺北市中山區錦州街２１３號、２１３號２樓,(02)25213586
5901103585,禾全藥局,臺北市中山區龍江路３３２號,(02)25165721
5901103629,十二願藥局,臺北市中山區林森北路３０９號,(02)25311223
5901110302,富盛藥局,臺北市內湖區成功路４段６１巷２５弄１２號１樓,(02)27908667
5901113367,瑞暉藥局,臺北市內湖區文德路１０５號,(02)26276828
5901113554,葫光藥局,臺北市內湖區康寧路３段５４巷６號,(02)26336611
5901122035,成福大藥局,臺北市南港區成福路８號,(02)27859221
5901150548,田倉藥局,臺北市士林區士東路１２４號,(02)88662188
5901152873,幸福藥局,臺北市士林區德行東路１０９巷８號,(02)28346650
5901153790,天母盛康藥局,臺北市士林區天母東路８巷８４號,(02)28720208
5901160053,天蓮藥局,臺北市北投區石牌路１段１６６巷１１５號,(02)28211824
5901162173,小明藥局,臺北市北投區中央南路１段６９號２樓,(02)28928950
5901162879,杏嘉藥局,臺北市北投區清江路６８號,(02)28982340
5901163527,理得藥局,臺北市北投區石牌路１段１５０號,(02)28289680
5901173603,松德盛康藥局,臺北市信義區松德路４０號,(02)87891622
5901173738,尚頤中西藥局,臺北市信義區虎林街１４５號,(02)27253818
5901173756,信義盛康藥局,臺北市信義區永吉路２８６號,(02)23460521
5901173809,愛維喜藥局,臺北市信義區莊敬路２７８號,(02)27586989
5901173818,博亞藥局,臺北市信義區莊敬路４６２號,(02)27580506
5901173845,躍獅永吉藥局,臺北市信義區永吉路５２０號,(02)27658924
5901184446,北車維康藥局,臺北市中正區青島西路７號,(02)23613623
5901184491,躍獅南門藥局,臺北市中正區中華路２段３９巷１０號,(02)23141111
5901184535,桐心藥局,臺北市中正區金華街１８之６號１樓,(02)23581663
5901192180,康之友藥局,臺北市萬華區青年路２０號,(02)23011598
5901201728,東京晟藥局,臺北市文山區辛亥路４段９７號,(02)29356354
5901201746,仙瑩藥局,臺北市文山區景華街１６６號,(02)89321817
5901202994,躍獅永健藥局,臺北市文山區木柵路１段１７７號,(02)77285780
5901203339,光點景興藥局,臺北市文山區景興路１０９號,(02)29335881
5902020012,永松藥局,高雄市鼓山區鼓山三路１３０－１５號,(07)5810657
5902040096,宗隆藥局,高雄市楠梓區右昌街２２０號,(07)3622203
5902040210,益民藥局,高雄市楠梓區建楠路４７號,(07)3522161
5902050154,杏安藥局,"高雄市三民區十全一路91 號",(07)3111606
5902054858,勝發藥局,高雄市三民區金鼎路３５０號,(07)3474780
5902057680,健爾康藥局,高雄市三民區正興路２３號,(07)3965658
5902057920,必好藥局,高雄市三民區義華路４６０號,(07)3851751
5902085308,幸福藥師藥局,高雄市苓雅區青年一路１６７－３號,(07)5368701
5902090167,勝惠藥局,高雄市前鎮區忠孝里三多三路７１號,(07)3354766
5902092358,惠芳藥局,高雄市前鎮區一心一路４８６號,(07)5370650
5903050210,富康沙鹿藥局,臺中市沙鹿區沙田路１４２號１樓,(04)26633399
5903090358,信實藥局,臺中市潭子區大德北路６９號１樓,(04)25359220
5903150064,智盛藥局,臺中市烏日區中山路１段３３３號１樓,(04)23378286
5903190228,中山德侑藥局,臺中市太平區中山路３段２之２號１樓,(04)23920682
5903190317,欣天然藥局,臺中市太平區樹德路２９６號１樓,(04)23982018
5903190335,育賢德侑藥局,臺中市太平區育賢路１０７號、１０９號,(04)23920696
5903190442,天慈大藥局,臺中市太平區太平路５４０號,(04)22785052
5903190497,太平惠民藥師藥局,臺中市太平區東平路３６８號１樓,(04)22768799
5903190586,樹孝炘星藥局,臺中市太平區樹孝路４７６號１樓,(04)23929578
5903200096,仁化藥局,臺中市大里區仁化路５４０號,(04)24915902
5903200194,博德藥局,臺中市大里區成功２路１０４號１樓,(04)24968642
5903200318,廣信藥局,臺中市大里區益民路１段１６４號１樓,(04)24829981
5903200587,大里安德健保藥局,臺中市大里區大明路１１７號,(04)24875607
5903200649,躍獅日新藥局,臺中市大里區日新路３４２號１樓,(04)24822345
5903220141,雙十小林健保藥局,臺中市中區雙十路一段３５號,(04)22253662
5903250514,泰友藥局,臺中市南區復興路二段９９巷１３號１樓,(04)22615701
5903250523,長榮藥局,臺中市南區新華街１８６號１樓,(04)22220210
5903260270,冠安藥局,臺中市北區進化路５１０、５１２號,(04)22335770
5903260350,宏信藥局,臺中市北區崇德路１段４５３號,(04)22355476
5903260592,台中丁丁藥局,臺中市北區漢口路４段２５５號,(04)22374596
5903260743,黎明安德藥局,臺中市北區中清路１段８５２號１樓,(04)22956098
5903260789,瑞昌藥局,臺中市北區學士路１５５號１樓,(04)22056819
5903270347,甘肅安德藥局,臺中市西屯區甘肅路２０２－３號,(04)23165935
5903271102,杏東美藥局,臺中市西屯區智惠街１５６號１樓,(04)24523798
5903280165,南屯福倫藥局,臺中市南屯區南屯路２段３１７號,(04)24758018
5903280594,東林藥局,臺中市南屯區黎明路二段１４０號,(04)23810567
5903280754,弘泰藥師藥局,臺中市南屯區向心南路９４８號１樓,(04)24750790
5903280781,美十樂藥局,臺中市南屯區東興路二段２７９號１樓,(04)24710219
5903290312,大連大愛藥局,臺中市北屯區大連路２段２２１號,(04)22428899
5903290483,兩隻老虎藥局,臺中市北屯區崇德路２段１２號,(04)22364635
5903290723,崙湞藥局,臺中市北屯區進化北路４５號,(04)22370189
5903290787,新一代何藥局,臺中市北屯區環中東路二段２６６、２６８號１樓,(04)24364366
5903290947,德寶健保藥局,臺中市北屯區熱河路一段７０號１樓,(04)22325511
5903290974,興安永佳藥局,臺中市北屯區興安路一段３３３號１樓,(04)22437876
5903290992,益川健保藥局,臺中市北屯區昌平路二段４７－１號１樓,(04)24213696
5903291006,五和健保藥局,臺中市北屯區崇德路二段４６０號１樓,(04)22415533
5905030010,美恩健保藥局,臺南市白河區永安里中山路８１號１樓,(06)6858865
5905210036,一翔藥局,臺南市安定區港南里港口１９６號１樓,(06)5935208
5905280136,悅橙歸仁藥局,臺南市歸仁區大通路４３號１樓,(06)2396660
5905310344,昱賢藥師藥局中正店,臺南市永康區中正路１４１、１４３號１樓,(06)2021535
5905310639,美日新藥局,臺南市永康區中正北路６２號,(06)2420980
5905310657,昂德藥局,臺南市永康區復華里復國一路１５２號１樓,(06)3121220
5905310746,珊瑚藥局,臺南市永康區南灣里大灣路５０３號,(06)2054235
5905310933,樂馨藥局,臺南市永康區中山路８５號１樓,(06)2038100
5905310979,復華藥師藥局,臺南市永康區復興里復華一街１３１號１樓,(06)3123597
5905320582,東門啄木鳥藥局,臺南市東區東門路三段２３９號１樓,(06)2884569
5905320644,崇善藥局,臺南市東區崇善路３９２號１樓,(06)2896619
5905320779,安麗兒藥局仁和店,臺南市東區仁和路１０５－１號１樓,(06)2908000
5905330159,勝一藥局,臺南市南區省躬里灣裡路９０號１樓,(06)2626168
5905330275,太子藥局大同店,臺南市南區大同路二段３４８號１樓,(06)2158339
5905350393,和緯啄木鳥藥局,臺南市北區和緯路２段１７６號,(06)2519805
5905380097,宜康永華藥局,臺南市安平區國平里永華路二段７８５號１樓,(06)2930119
5905380266,永華啄木鳥藥局,臺南市安平區文平里永華路二段３６９號１樓,(06)2985173
5907010525,長青連鎖藥局光遠店,高雄市鳳山區光遠路２７１號１樓,(07)7103487
5907010963,喬生藥局,高雄市鳳山區文福里文建街１７８、１８０號,(07)7803366
5907010981,康是美五甲藥局,高雄市鳳山區鎮南里五甲二路７５２號１至２樓、７５４號１至２樓,(07)8121586
5907011184,肉豆公藥局南榮店,高雄市鳳山區善美里南榮路１６９號１樓,(07)7278385
5907030116,樂寧藥局,高雄市旗山區大德里大同街１７號,(07)6622689
5907060043,永成專業藥師藥局,高雄市大寮區中興里鳳林四路６２號,(07)7816221
5907110155,丁丁藥局橋頭店,高雄市橋頭區成功南路１４８巷３號,(07)6113633
5907290274,明誠丁丁藥局,高雄市鼓山區明誠三路４６５號,(07)5520120
5907300757,奕康藥局,高雄市左營區明華一路７６號,(07)5561908
5907300784,新高橋藥局博正店,高雄市左營區忠言路１８０號,(07)5509810
5907320553,三民明誠藥局,高雄市三民區明誠一路５００號１、２Ｆ５０２號,(07)3493137
5907320633,勁康健保藥局,高雄市三民區義華路４０２號１樓,(07)3966716
5907320697,鄰好藥師藥局,高雄市三民區褒揚街２８７號,(07)3909589
5907320973,振源藥局,高雄市三民區熱河一街３５５號１樓,(07)3112541
5907320982,康圓藥局,高雄市三民區大豐二路３５９．３６１號１樓,(07)3909978
5907330139,新興復興藥局,高雄市新興區復興一路７６號１樓,(07)2352550
5907330148,康園藥局,高雄市新興區六合一路５３－１２號,(07)2372069
5907340046,銘益藥局,高雄市前金區七賢二路２０８、２１０號１樓,(07)2853107
5907350113,英祥藥局,高雄市苓雅區英祥街１９號,(07)7522786
5907350300,辰安藥局,高雄市苓雅區青年一路１８５－２號,(07)5365545
5907350346,武廟幸福藥局,高雄市苓雅區武廟路３５號,(07)7170085
5907350499,鑫美健保特約藥局,高雄市苓雅區光華一路１４８－５８號１樓,(07)7715088
5907360226,順康健保藥局,高雄市前鎮區一心二路６７號,(07)5364438
5907360584,聖名健保藥局,高雄市前鎮區復興三路２４６號１樓,(07)3319431
5907370062,歐德藥局,高雄市旗津區旗津三路９６２巷８號１樓,(07)5711868
5911010168,承泰藥局,基隆市中正區新豐街４４２號,(02)24601316
5911011601,義一啄木鳥藥局,基隆市中正區義一路１１１號１、２樓,(02)24271456
5911011629,百福新豐活力藥局,基隆市中正區新豐街４０５號,(02)24699990
5911021394,百福專業藥師藥局,基隆市七堵區自治街１３號１樓,(02)24556688
5911040175,回春藥局,基隆市仁愛區仁五路４３號,(02)24224728
5911041618,永樂藥局,基隆市仁愛區忠二路２２號,(02)24214878
5911050064,日星藥局,基隆市中山區安一路２５號,(02)24222090
5911051481,仁登藥局,基隆市中山區復興路１２２號,(02)24375789
5911051490,大哈密藥局,基隆市中山區中山二路５號,(02)24285368
5911060131,長春藥局,基隆市安樂區基金一路１７４號之２０,(02)24344550
5912010484,聖心藥局,新竹市東區南大里食品路２６９號,(03)5610697
5912012139,康博中西藥局,新竹市東區明湖里明湖路四四六之四號,(03)5191010
5912012353,康田大藥局,新竹市東區金山街１０２號１樓,(03)5638217
5912013243,合康連鎖藥局光復店,新竹市東區光復路１段３７８號,(03)5670111
5912013305,合康連鎖藥局,新竹市東區中華路２段２２２號,(03)5321636
5912013430,合康連鎖藥局西門店,新竹市東區西門街４１號１樓,(03)5211188
5912013449,小樹藥局,新竹市東區慈濟路３號３樓,(03)5670099
5912042098,欣欣藥局,新竹市北區西大路736巷1號,(03)5351205
5912042235,均祐健康藥局,新竹市北區境福里１５鄰中正路３８９號１樓,(03)5325369
5912042495,吉康藥局,新竹市北區東大路３段５０３號,(03)5369916
5912042593,合康連鎖藥局湳雅店,新竹市北區湳雅街７７號,(03)5315188
5912042691,合康連鎖藥局林森店,新竹市北區林森路２３０號１樓,(03)5242888
5917010082,仁壽藥局,臺中市中區東墩里三民路三段１號,(04)22228058
5917011934,一安堂藥局,臺中市中區臺灣大道一段２０號１樓,(04)22259616
5917030388,富永藥局,臺中市西區三民西路１６１號,(04)23714681
5917030646,華隆藥局,臺中市西區樂群街６之２號,(04)22243785
5917030995,麗新健保大藥局,臺中市西區向上路一段１６２號,(04)23017100
5917032739,婕康藥妝藥局,臺中市西區民生路１５９號１樓,(04)22298777
5917040222,保健藥局,臺中市南區工學路５３號,(04)22622869
5917040302,元聖藥局,臺中市南區積善里五權南路６５０號１樓,(04)22627468
5917052955,康諾得藥局,臺中市北區梅川西路４段１６３號１樓,(04)22923037
5917053756,中心旗艦藥局,臺中市北區五權路４０４號,(04)22068113
5917060644,大東藥局,臺中市西屯區西墩里黎明路三段５７號,(04)27020418
5917063921,東京藥師藥局,臺中市西屯區太原一段７７號,(04)23165378
5917070060,仁人藥局,臺中市南屯區南屯里黎明路一段１０８５號,(04)23890451
5917070462,長映藥局,臺中市南屯區黎明路二段４３２號１樓,(04)22510951
5917070677,康得美專業藥局,臺中市南屯區忠勇路１２之２６號,(04)23801185
5917072242,政豐大愛藥局,臺中市南屯區大業路１４５、１４７號１樓,(04)23274726
5917080379,大元藥局,臺中市北屯區北屯里昌平路一段２３號,(04)22357722
5917080388,濟生藥局,臺中市北屯區松安里昌平路二段２之３１號,(04)22472327
5917081170,順天大藥局,臺中市北屯區中清路二段２３２號１樓,(04)22918847
5917083343,豋盛藥局,臺中市北屯區北平路三段１０７號,(04)22373863
5921010447,宏荏藥局,臺南市東區崇學里崇明街１１街５２巷２號,(06)2684725
5921010689,億安大藥局,臺南市東區大福里大同路２段２６５號,(06)2159881
5921020489,市安藥師藥局,臺南市南區國民路１４２號,(06)2882627
5921021584,大愛藥局,臺南市南區大同路２段１８２號１樓,(06)2137587
5921042289,公園店菁安藥局,臺南市北區公園路６１１號,(06)2834488
5921050423,吉仁大藥局,臺南市中西區白金里民權路２段８６號,(06)2263777
5922010263,秉榮藥局,嘉義市東區東仁里中山路１８９號,(05)2224320
5922010361,壽生堂藥局,嘉義市東區府路里延平街２８０號,(05)2225058
5922010405,信輝藥局,嘉義市東區安寮里吳鳳南路３５３號,(05)2252415
5922012178,聖心藥局,嘉義市東區大雅路二段５７７號,(05)2777189
5922012285,聖安藥局,嘉義市東區仁武里民權路３６５號１樓,(05)2222941
5922012945,大明藥局,嘉義市東區大雅路二段６８２號,(05)2760958
5922020125,照安藥局,嘉義市西區福全里博愛路２段３６１號,(05)2332883
5922020527,友愛藥局,嘉義市西區福全里友愛路１７０號,(05)2330599
5922020661,大正藥局,嘉義市西區書院里民族路７０２號,(05)2285812
5922028881,中興中西藥局,嘉義市西區垂楊路５０１號,(05)2353096
5922028925,健安藥局,嘉義市西區民族路６２６號,(05)2281219
592202A296,秉原藥局,嘉義市西區書院里民族路７００號,(05)2285811
5931010011,埔墘藥局,新北市板橋區中山路２段２２７號,(02)29646705
5931010459,欣民藥局,新北市板橋區雙十路３段３９號,(02)22545938
5931011241,利安藥局,新北市板橋區南雅東路１０８號,(02)29696295
5931011376,杏泰藥局,新北市板橋區雙十路２段４－７號,(02)82527162
5931014555,廣益藥局,新北市板橋區自由路２１號,(02)22545726
5931016139,莊敬健康人生藥局,新北市板橋區莊敬路８７號１樓,(02)22570028
5931016737,必生好藥局,新北市板橋區松柏街６７號１樓,(02)22511057
5931016924,裕苠藥局,新北市板橋區裕民街６號,(02)22535227
5931017207,振昌藥局,新北市板橋區溪崑二街１４號１樓,(02)26862119
5931017396,美康四維藥局,新北市板橋區四維路１２２號１樓,(02)22506616
5931020964,穗元大藥局,新北市三重區力行路１段１４９號１樓、１５１號１樓,(02)29827688
5931023036,華泰藥師藥局,新北市三重區五華街６６號１樓,(02)29866009
5931024622,萊康健保藥局,新北市三重區溪尾街１７６號１樓,(02)82871076
5931024935,健康藥局,新北市三重區安樂街５８號１樓,(02)29841882
5931025236,祐銘藥局,新北市三重區龍門路２２號１樓,(02)29769001
5931025254,仁愛健保藥局,新北市三重區力行路２段１５３號,(02)22805160
5931025290,康新藥局,新北市三重區正義北路１８５號２樓,(02)29865982
5931025638,華安生活藥局,新北市三重區重新路２段１２６號１樓,(02)29756534
5931025825,美康中正北藥局,新北市三重區中正北路１４９號１樓２樓,(02)29882836
5931032302,威康藥局,新北市永和區中正路１５３號,(02)29461128
5931032875,上安藥局,新北市永和區仁愛路８０號１樓,(02)22328565
5931033952,澄品藥局,新北市永和區永利路９６號１樓,(02)22329871
5931033989,悠活藥局,新北市永和區得和路３３０號１樓,(02)31516288
5931040055,瑞發藥局,新北市中和區民享街５６－１號,(02)22235319
5931040724,梓芳大藥局,新北市中和區圓通路２７８號,(02)22405025
5931042326,璟福藥局,新北市中和區安平路７６號１樓,(02)29408669
5931042648,恩溢藥局,新北市中和區復興路７９號１樓.２樓,(02)22452450
5931043930,三德和藥局,新北市中和區吉興里南山路２８９號１樓,(02)22471028
5931044704,惠民藥局,新北市中和區中興街１５３號１樓,(02)22475303
5931045032,朝安藥局,新北市中和區復興路２６２號１樓,(02)31511269
5931045069,禾昌藥局,新北市中和區中安街１７８巷２號１樓,(02)29267330
5931051601,昇旺藥局,新北市新店區建國路１０－１號１樓,(02)86659233
5931052984,北一藥師藥局,新北市新店區北新路２段１６０號１樓、２樓,(02)89115686
5931060315,文安藥局,新北市新莊區福壽街１１６號,(02)29978477
5931067216,鍵豐藥局,新北市新莊區中和街１５８號１樓,(02)29917452
5931068660,翔昱健保藥局,新北市新莊區恆安里中港路１２０號,(02)29983056
5931068819,東京大藥局,新北市新莊區民安路１７６號１樓,(02)22063806
5931068884,樂寶兒藥局,新北市新莊區中正路８２－２號１樓,(02)0229900185
5931069023,陽光藥局,新北市新莊區福壽街７２號,(02)22774399
593106A646,薇妮雙鳳藥局,新北市新莊區雙鳳路２１號１樓,(02)29076993
593106A860,新莊至誠藥局,新北市新莊區中平路２９號２樓,(02)29980345
593106A897,陽光豐年藥局,新北市新莊區豐年街１４號１樓,(02)22060665
593106A977,丹鳳藥局,新北市新莊區中正路７４５、７４７號（１樓）,(02)29065755
5931071649,博生藥師藥局,新北市樹林區文化街３４號,(02)26825798
5931072299,小蜜蜂中西健保藥局,新北市樹林區東榮街１１８號１樓,(02)86853677
5931081485,信義健保藥局,新北市鶯歌區信義街６３號１樓,(02)86775563
5931092059,三峽啄木鳥藥局,新北市三峽區中正路１段１４１號１樓,(02)26744321
5931101668,長佑藥局,新北市淡水區新市一路３段３６號,(02)26268560
5931101955,伯宇藥局,新北市淡水區新春街１０３號－８,(02)26236006
5931111773,江北藥局,新北市汐止區汐萬路１段３３號,(02)26918870
5931112494,長頸鹿藥局,新北市汐止區新台五路１段１７８號１樓,(02)26917810
5931112912,富康藥局,新北市汐止區忠孝東路４５９號１樓,(02)86481302
5931130223,久達藥局,新北市土城區中央路３段４７號,(02)22696982
5931130241,協成藥局,新北市土城區延吉街３３３號,(02)22653212
5931130394,一和藥局,新北市土城區中央路１段６７之３號,(02)22631378
5931131882,裕達藥局,新北市土城區延吉街１７１號,(02)22739328
5931132334,家泰藥局,新北市土城區青雲路１８１號１、２樓,(02)22749490
5931132389,凱一藥局,新北市土城區裕民路９２巷２１弄８號１樓,(02)22707679
5931133171,誠恩藥局,新北市土城區金城路３段１３７號１樓,(02)22665533
5931133206,樂利藥局,新北市土城區裕民路７７號１樓,(02)22630092
5931141959,長榮大藥局,新北市蘆洲區長榮路５１號,(02)82863837
5931142554,宏祐藥局,新北市蘆洲區復興路２０２號１樓,(02)82815252
5931142858,愛佳健保藥局,新北市蘆洲區長榮路９６號１樓,(02)22825835
5931143015,喜健康藥局,新北市蘆洲區長安街２６０號１樓,(02)82815329
5931143051,萊康中華健保藥局,新北市蘆洲區中華街４５－１號１樓,(02)28486787
5931143060,美林藥局,新北市蘆洲區長樂路１６８－１號１樓,(02)22832288
5931150056,常安藥局,新北市五股區工商路７１號,(02)22917912
5931161344,北安藥妝藥局,新北市泰山區明志路２段６１號,(02)22967199
5931170165,龍點藥局,新北市林口區民族路６７號１樓,(02)26080636
5931231225,小蘋果藥局,新北市八里區中山路１段２２９號,(02)26108206
5931250015,松南藥局,新北市雙溪區中華路２９號,(02)24931085
5932010908,大愛藥師藥局,桃園市桃園區中正路４３５號,(03)3376771
5932011370,家福聯合藥局,桃園市桃園區中山路６２３號,(03)2289492
5932013016,熊寶寶藥局,桃園市桃園區延平路１１１號,(03)3636915
5932013374,芳鄰藥局,桃園市桃園區昆明路３９號,(03)3679498
5932013445,乙川藥局,桃園市桃園區中正路５７６號,(03)3368758
5932013605,新華興藥局,桃園市桃園區中正路６６５號,(03)3267777
5932013909,莊敬長青藥師藥局,桃園市桃園區莊敬路一段３２３號１樓,(03)3587676
5932013963,康橋藥局,桃園市桃園區國際路１０２９號,(03)2173588
5932018539,新永安藥師藥局,桃園市桃園區永安路４６６號,(03)3471180
5932019929,元氣藥局,桃園市桃園區民光東路一Ｏ九號,(03)3332201
593201A284,康泰藥局,桃園市桃園區大業路一段三二三號,(03)3588299
593201A640,大心藥局,桃園市桃園區中平路１４１號,(03)2209842
593201A668,佑您康聯合藥局,桃園市桃園區寶山街３８５號,(03)3463999
5932021090,新生藥師藥局,桃園市中壢區民權路５２號,(03)4919796
5932022300,育康藥局,桃園市中壢區中正路３６６號,(03)4278266
5932023432,敏康藥局,桃園市中壢區福德路３４號之１樓,(03)4611961
5932023558,德春藥局,桃園市中壢區中山路４４５號,(03)4933495
5932023683,祥合藥局,桃園市中壢區中北路二段４３１號,(03)2841880
593202B787,中央藥局,桃園市中壢區中北路二段５６號,(03)4579676
5932040255,中美藥局,桃園市楊梅區埔心里中興路７７號,(03)4822483
5932043121,埔心藥局,桃園市楊梅區永美路２２５號,(03)4311539
5932051472,康而美聖安藥師藥局,桃園市蘆竹區南山路一段二之一號,(03)3228753
5932052826,青新藥師藥局,桃園市蘆竹區南竹路五段２５１之１號,(03)3134328
5932060088,銘方大藥局,桃園市大園區大園里中華路３２號,(03)3865077
5932060168,永固安藥局,桃園市大園區中山南路五六號,(03)3867233
5932062439,青埔長青藥師藥局,桃園市大園區新生路四段２５１號,(03)3815097
5932076657,家佑藥師藥局,桃園市龜山區文化二路３０之１號１樓,(03)3280055
5932076791,誠安生活藥局,桃園市龜山區文化七路７９之２號,(03)3271997
5932076942,凱悅藥局,桃園市龜山區復興一路１２６號,(03)3972052
5932077476,安寶親子藥局,桃園市龜山區文化二路５１號,(03)3281688
5932077510,左外野藥局,桃園市龜山區文光街６號１樓,(03)3271503
5932084515,第二店廣福藥局,桃園市八德區廣福路９１號,(03)3660848
