5932100701,壢新藥局,桃園市平鎮區廣泰路１２６號,(03)4950785
5932100845,全球和平藥局,桃園市平鎮區和平路１６０號１、２樓,(03)4683247
5932101066,日安藥局,桃園市平鎮區復興街１０８號,(03)4916178
593210A238,美樂蒂藥局,桃園市平鎮區民族路二三七號二樓,(03)4023131
5933021254,梁藥局,新竹縣新埔鎮中正路２３３號,(03)5885439
5933030066,鄧藥局,新竹縣竹東鎮榮樂里大同路４３號,(03)5952908
5933030084,國瑞藥局,新竹縣竹東鎮竹東里大同路２１號,(035)966698
5933052286,健元藥局,新竹縣竹北市中正東路265號,(03)5529891
5933053158,竹北啄木鳥藥局,新竹縣竹北市博愛街１８３號,(03)5539420
5933091112,暘光藥局,新竹縣芎林鄉文山路385號,(03)5121001
5934012179,宜蘭和睦藥局,宜蘭縣宜蘭市大新里和睦路４７號１、２樓,(03)9313622
5934012240,東成藥局,宜蘭縣宜蘭市東港路２段３０６號１樓,(03)9380353
5934020251,黃藥局,宜蘭縣羅東鎮公正路３７４號,(03)9545857
5934030033,仁大藥局,宜蘭縣蘇澳鎮中原路４７號,(039)967528
5934031165,宏一藥局,宜蘭縣蘇澳鎮中山路１段２９號,(03)9962125
5934031254,佑全蘇澳中山藥局,宜蘭縣蘇澳鎮蘇西里２０鄰中山路１段２３１號１樓,(03)9961063
5934051229,廣福藥師藥局,宜蘭縣礁溪鄉礁溪路１段６６號,(03)9285887
5935012324,上林藥局,苗栗縣苗栗市建功里２４鄰府前路９１號,(037)320685
5935042046,永安藥局,苗栗縣竹南鎮照南里立達街３號,(037)469333
5935081123,景元藥局,苗栗縣大湖鄉中正路９７號,(037)996465
5936012515,中正藥局,臺中市豐原區中正路１８６號,(04)25298379
5936020017,郭藥局,臺中市東勢區南平里豐勢路３９４號,(04)25883382
5936020053,生生藥局,臺中市東勢區延平里豊勢路２８２號,(04)25875187
5936021363,小太陽藥局,臺中市東勢區豐勢路４１２之１、４１６號１樓,(04)25773481
593620A891,御和藥局,臺中市大里區東興里益民路二段３２３號,(04)24821555
5937010140,三立大藥局,彰化縣彰化市中華西路１１１號,(04)7635422
5937010819,日榮堂藥局,彰化縣彰化市光華里和平路５０號,(04)7222396
5937010917,尚豪藥局,彰化縣彰化市大埔路６９５號,(04)7113332
5937012126,彰化福倫藥局,彰化縣彰化市中正路２段２２４號,(04)7233018
5937012662,回生藥局,彰化縣彰化市民族路４１０號,(04)7227266
5937021330,順安藥局,彰化縣鹿港鎮泰興里復興路１２５號,(04)7765510
5937031765,和美啄木鳥藥局,彰化縣和美鎮德美路２７０號,(04)7552924
5937041476,丁丁藥局北斗店,彰化縣北斗鎮斗苑路二段３０號,(04)8873032
5937051794,愛康生活保健中西藥局,彰化縣員林市靜修東路３４號,(04)8328826
5937052317,員郭藥局,彰化縣員林市三民街３８－１號,(04)8356201
5937060060,慶華藥局,彰化縣溪湖鎮光華里二溪路一段１４號,(04)8852441
5937080115,鎮安藥局,彰化縣二林鎮東和里中山路５２號之２,(04)8960473
5937080277,嘉信藥局,彰化縣二林鎮中山路１４０號,(04)8954029
5937081434,二林福倫藥局,彰化縣二林鎮豐田里斗苑路４段６６９、６７１號,(04)8956818
5937081498,新杏林藥局,彰化縣二林鎮東和里斗苑路５段２６０號,(04)8953863
5937140054,正明藥局,彰化縣芬園鄉茄荖村芬草路一段２７３號,(049)2523918
5937191275,社頭榮生藥局,彰化縣社頭鄉清水岩路２５３號,(04)8732172
5937201061,長春藥局,彰化縣二水鄉文化村光文路１０３號,(04)8795289
5938020104,新仁壽藥局,南投縣埔里鎮南門里南榮路１３號１樓,(049)2983210
5938032391,祥暘藥局,南投縣草屯鎮中正路８２２、８２４號,(049)2353393
5938032408,草屯丁丁藥局,南投縣草屯鎮太平路二段１７９號,(049)2330058
5938032453,福安藥局,南投縣草屯鎮碧山路９３號,(049)2333349
5938041756,集山啄木鳥藥局,南投縣竹山鎮集山路３段４０５號,(049)2659287
5938041845,博愛藥局,南投縣竹山鎮雲林路３５號,(049)2642748
5938041872,優適藥局,南投縣竹山鎮大明路１４９－５號,(049)2630355
5938050139,省安藥局,南投縣集集鎮民生路３１號,(049)2763442
5938090026,源和藥局,南投縣魚池鄉魚池村魚池街２７８號,(049)2897666
5938101159,山芙蓉藥局,南投縣國姓鄉中興路１４６號,(049)2720351
5938111271,柔欣藥局,南投縣水里鄉中山路１段５０８號,(049)2770199
5939012188,上海啄木鳥藥局,雲林縣斗六市上海路２３４號,(05)5374296
5939012339,永光藥局,雲林縣斗六市中山路９號,(05)5379939
5939012464,二水鄭家藥局,雲林縣斗六市文化路２３４號,(05)5323788
5939020224,菩提大藥局,雲林縣斗南鎮延平路二段４１２號,(05)5951539
5939021445,杏元藥局,雲林縣斗南鎮東仁里１３鄰中山路６號,(05)5963998
5939031585,利芳藥局,雲林縣虎尾鎮光復路３１０號,(05)6311016
5939031996,端發藥局,雲林縣虎尾鎮林森路一段３２９號,(05)6314168
5939032573,林森啄木鳥藥局,雲林縣虎尾鎮明正東路８號,(05)6320417
5939032617,永德健保藥局,雲林縣虎尾鎮德興路８３號,(05)6322802
5939032626,林藥師藥局,雲林縣虎尾鎮中正路２０７號,(05)6334135
5939060255,家庭藥局,雲林縣北港鎮文化路１０１號,(05)7826739
5939061903,大同瑞安藥局,雲林縣北港鎮大同路２１５號,(05)7831720
5939071285,振明藥局,雲林縣古坑鄉中山路１７０號,(05)5821229
5939071310,禾安藥局,雲林縣古坑鄉中正路９６號,(05)5828318
5939091170,西河藥局,雲林縣莿桐鄉饒平村饒平路１０２號,(05)5842950
5939121208,詠大藥局,雲林縣崙背鄉南陽村中山路１０９－２號,(05)6967990
5939130029,見春藥局,雲林縣麥寮鄉橋頭村仁德路７４號,(05)6912265
5939130047,中崙保健藥局,雲林縣麥寮鄉中山路４４０號,(05)6935697
5939131151,三芳藥局,雲林縣麥寮鄉橋頭村仁德路１７６號,(05)6911053
5939140061,義和堂中西藥局,雲林縣東勢鄉東南村東勢東路１２號,(05)6991028
5939190061,盟生藥局,雲林縣口湖鄉梧南村文光路９５之６號,(05)7907159
5939201238,正大藥局,雲林縣水林鄉水林路４２號１樓,(05)7852069
5939201318,玉璽藥局,雲林縣水林鄉水南村水林路１１５號,(05)7856019
5940011286,榮一藥局,嘉義縣朴子市山通路６１號,(05)3792448
5940041435,嘉方藥局,嘉義縣民雄鄉中樂村昇平路５８號,(05)2066747
5940111469,嘉安藥局,嘉義縣太保市麻寮里中山路２段４６號,(05)2387670
5940111549,嘉康中西藥局,嘉義縣太保市南新里中山路一段２９５之２號,(05)2376200
5940140111,大豐藥局,嘉義縣竹崎鄉內埔村元興路１１１號,(05)2542688
5940141314,竹崎啄木鳥藥師藥局,嘉義縣竹崎鄉竹崎村中華路９２號,(05)2617786
5941010416,佑康藥局,臺南市新營區新進路２段１０３號,(06)6354620
5941030043,源大醫藥局,臺南市白河區永安里中正路５５號,(06)6831128
5941040012,杏林藥局,臺南市麻豆區晉江里興中路１３６號,(06)5722692
5941040085,信興藥局,臺南市麻豆區保安里興中路１１５號,(06)5722002
5941041297,台灣藥局,臺南市麻豆區信義路１１之１３號,(06)5726126
5941061342,安麗兒藥局新化店,臺南市新化區忠孝路１１６之３號,(06)5986029
5941200045,慶豐綜合藥局,臺南市新市區新和里民生路５７號,(06)5014888
5941231111,大眾藥局,臺南市玉井區中華路２３７號,(06)5744099
5941260014,又佳藥局,臺南市左鎮區中正里１５６之９號,(06)5732367
5941270216,聖豐藥局,臺南市仁德區中洲里中洲路７８８號,(06)2663588
5941280089,躍達藥局,臺南市歸仁區大智街１０號,(06)2301360
5941291215,新素界保養藥局,臺南市關廟區山西里武聖路２６號,(06)5959290
5941310171,正華藥局,臺南市永康區永康里永康街１７號,(06)2323618
5941310484,慈惠藥師保健藥局,臺南市永康區國光七街７１號,(06)2718968
5941310859,菁安藥局,臺南市永康區大橋里中華路５９７號,(06)2031203
5941312184,大灣藥局,臺南市永康區大灣里民族路２９８號,(06)2728774
5941312826,昱賢藥師藥局,臺南市永康區永大路二段１２６０、１２６２號,(06)2315371
5942014212,菩提大藥局,高雄市鳳山區新興里維新路１２１號１樓,(07)7903323
5942031428,奇奇藥局,高雄市旗山區旗文路１４４－７號,(07)6622910
5942061828,日大藥局,高雄市大寮區會社里正氣路２９巷４號,(07)7836114
5942070194,早安藥師藥局,高雄市大樹區久堂里中興街４２號,(07)6527371
5942240043,光輝藥局,高雄市內門區鄉觀亭里南屏路２３０號,(07)6671106
5943010281,應安藥局,屏東縣屏東市必信里民族路３０５－７號,(08)7327128
5943010478,信成藥局,屏東縣屏東市大武路９５號,(08)7538647
5943011037,正源藥局,屏東縣屏東市龍華路１８４號,(08)7558891
5943013648,信安藥局,屏東縣屏東市金泉里漢口街１１號,(08)7322332
5943013746,柏吉藥師藥局,屏東縣屏東市勝利路３２２巷１３號,(08)7668255
5943013915,怡安生活藥粧藥局,屏東縣屏東市大連里瑞光路２段１３８號１樓,(08)7377162
5943014181,廣東台安藥局,屏東縣屏東市廣東路６２３號,(08)7363988
5943020161,惠安藥局,屏東縣潮州鎮新榮里新生路３１號,(08)7882368
5943020232,健惠藥局,屏東縣潮州鎮大同路４９號,(08)7894797
5943021426,日得藥局,屏東縣潮州鎮延平路１７６號,(08)7885685
5943021604,葉錦霖藥局,屏東縣潮州鎮新榮里中山五巷３－４號,(08)7885629
5943021695,立康藥局,屏東縣潮州鎮介壽路７７號１樓,(08)7800995
5943090029,亞洲藥局,屏東縣里港鄉永春路８號,(08)7752938
5943091179,里港全心藥局,屏東縣里港鄉永春村中山路９４號,(08)7757222
5943110044,宏順藥局,屏東縣高樹鄉長榮村南昌路２－２號,(08)7962136
5943131534,內埔啄木鳥藥局,屏東縣內埔鄉光明路４７１號,(08)7787078
5944010043,新見安藥局,澎湖縣馬公市光明里光復路９５號,(06)9277346
5944011326,益立康藥局,澎湖縣馬公市中華路２９３號,(06)9271017
5944011433,東文藥局,澎湖縣馬公市東文里文山路６６號,(06)9221433
5945011795,晉嘉藥局,花蓮縣花蓮市明禮路７１之８號,(03)8347329
5945012783,益康大藥局,花蓮縣花蓮市國富里富國路１４６號１樓,(03)8564099
5945012863,承祐藥局,花蓮縣花蓮市建國路２６６號,(03)8338261
5945013039,金喜藥局,花蓮縣花蓮市中山路７３３號,(03)8466829
5945051664,吉安丁丁藥局,花蓮縣吉安鄉中華路二段１１號,(03)8536772
5945061204,益昌藥局,花蓮縣壽豐鄉壽豐村中山路５段１１３號,(03)8653718
5946011691,宜康藥局,臺東縣臺東市更生路６８５號,(089)227061
5946011780,禾安藥局,臺東縣臺東市正氣北路１４５號,(089)347999
5946012107,甫原中西人合藥局,臺東縣臺東市光明路１２０號,(089)328166
