0145080011,衛生福利部花蓮醫院豐濱原住民分院,花蓮縣豐濱鄉豐濱村光豐路４１號,(03)8358141,550,255,"2020/02/12 09:30:39"
0291010010,連江縣立醫院,連江縣南竿鄉復興村２１７號,(083)623995,40,68,"2020/02/12 09:30:39"
2331200010,新北市坪林區衛生所,新北市坪林區坪林街１０４號,(02)26656272,24,32,"2020/02/12 09:30:39"
2345130012,花蓮縣卓溪鄉衛生所,花蓮縣卓溪鄉卓溪村中正路６５號,(03)8882592,239,147,"2020/02/12 09:30:39"
5901150057,菁安藥局,台北市士林區美侖街１３號１樓,(02)28323951,166,48,"2020/02/12 09:30:39"
5901150397,博惠藥局,台北巿士林區華榮街１６號,(02)28320379,0,128,"2020/02/12 09:30:39"
5901182255,全民藥局,台北市中正區廈門街８７號,(02)23695759,2,68,"2020/02/12 09:30:39"
5902030287,慈德藥局,高雄市左營重愛路５３號,(07)3416212,188,180,"2020/02/12 09:30:39"
5903010412,佑全豐原圓環東藥局,臺中市豐原區圓環東路５４８、５５０、５５２、５５４號,(04)25246069,0,10,"2020/02/12 09:30:39"
5903200194,博德藥局,臺中市大里區成功２路１０４號１樓,(04)24968642,146,88,"2020/02/12 09:30:39"
5903230085,翔新藥局,臺中市東區東英１７街１６７－３號,(04)22131269,226,122,"2020/02/12 09:30:39"
5903270383,佳德健保藥局,臺中市西屯區工業３８路２６號,(04)23598285,0,54,"2020/02/12 09:30:39"
5903270749,大墩藥局,臺中市西屯區大墩１９街６８號１樓,(04)23209602,140,124,"2020/02/12 09:30:39"
5903280067,博川健保藥局,臺中市南屯區大墩５街２９８號１樓,(04)24732995,0,94,"2020/02/12 09:30:39"
5903280101,成記大藥局,臺中市南屯區大墩１７街１２３號１樓,(04)23288877,0,100,"2020/02/12 09:30:39"
5903280245,大墩何藥局,臺中市南屯區大敦南路４３１號１．２樓,(04)24710655,34,54,"2020/02/12 09:30:39"
5905060161,和德藥局新化店,臺南市新化區清水里中山路４２０號１樓,(06)5802518,0,52,"2020/02/12 09:30:39"
5905100035,華恩藥局,臺南市後壁區墨林里１９８號,(06)6623491,276,194,"2020/02/12 09:30:39"
5905170037,建昌藥局,臺南市七股區大寮里１之１１號,(06)7873777,130,154,"2020/02/12 09:30:39"
5905340155,東北藥局,臺南市中西區福安里西門路二段１４號１樓,(06)2226753,124,136,"2020/02/12 09:30:39"
5905350455,幼德和緯藥局,臺南市北區文元里和緯路３段３２２號１樓,(06)2584000,170,78,"2020/02/12 09:30:39"
5907100088,本館藥局,高雄市鳥松區大華里本館路１９０號１樓,(07)3707655,0,102,"2020/02/12 09:30:39"
5907300677,佳寧峰藥局,高雄市左營區部後街２號,(07)5886408,142,210,"2020/02/12 09:30:39"
5912012148,新竹實和藥局,新竹市東區中正里中山路２７號,(03)5227636,0,126,"2020/02/12 09:30:39"
5912012569,法瑪士藥局,新竹巿東區鐵道路2段8號,(03)5152255,66,46,"2020/02/12 09:30:39"
5912042098,欣欣藥局,新竹巿北區西大路736巷1號,(03)5351205,212,40,"2020/02/12 09:30:39"
5917010046,大協藥局,台中巿中區中山路１２４號,(04)22250745,134,180,"2020/02/12 09:30:39"
5917010279,中一藥局,台中市中區建國里建國路２２２號１Ｆ,(04)22235326,68,194,"2020/02/12 09:30:39"
5917020097,泰興藥局,台中巿東區東南里十甲路１１–１號,(04)22112537,126,204,"2020/02/12 09:30:39"
5917020211,何藥局,台中巿東區東勢里精武路１８０號,(04)23604631,307,158,"2020/02/12 09:30:39"
5917030100,裕源藥局,台中巿西區公館里南屯路一段６６–７號一樓,(04)23763133,0,44,"2020/02/12 09:30:39"
5917030146,新永富藥局,台中巿西區吉龍里美村路一段６７０號,(04)23766127,0,132,"2020/02/12 09:30:39"
5917030388,富永藥局,台中巿西區三民西路１６１號,(04)23714681,56,142,"2020/02/12 09:30:39"
5917032382,中港大藥局,台中市西區台中港路１段１０４號之１０,(04)22080708,190,266,"2020/02/12 09:30:39"
5917040124,慧寧藥局,台中巿南區德義里忠孝路２號,(04)22851858,122,158,"2020/02/12 09:30:39"
5917050433,松鶴藥局,台中巿北區文莊里篤行路２２４號,(04)22028790,106,186,"2020/02/12 09:30:39"
5917050666,大祥藥局,台中巿北區淡溝里民權路４０３號,(04)22035103,124,98,"2020/02/12 09:30:39"
5917050719,百鴻藥局,台中巿北區金龍里北屯路１３–１號,(04)22336330,82,200,"2020/02/12 09:30:39"
5917060108,博新藥局,台中巿西屯區福安里中工三路２２０號,(04)23583412,2,36,"2020/02/12 09:30:39"
5917060359,明達藥局,台中巿西屯區何厝里青海路一段１７號,(04)23137079,200,124,"2020/02/12 09:30:39"
5917063921,東京藥師藥局,臺中市西屯區太原一段７７號,(04)23165378,62,134,"2020/02/12 09:30:39"
5917070275,聖仁藥局,台中市南屯區田心里向上南路１段２７４號１樓,(04)24726980,58,114,"2020/02/12 09:30:39"
5917072644,全成藥局,台中市南屯區大墩６街２２３號,(04)24712897,0,60,"2020/02/12 09:30:39"
5917072699,博仕健保藥局,臺中市南屯區大墩１１街４４５號,(04)23817009,0,72,"2020/02/12 09:30:39"
5917080119,李藥局,台中巿北屯區和順路３９８號,(04)22390950,206,50,"2020/02/12 09:30:39"
5917080137,日盛藥局,臺中巿北屯區東山路一段１４２-１１號,(04)24360810,46,66,"2020/02/12 09:30:39"
5917080342,弘光藥局,台中巿北屯區太原路三段４５８號１樓,(04)22342999,98,97,"2020/02/12 09:30:39"
5917080388,濟生藥局,台中市北屯區松安里昌平路二段２之３１號,(04)22472327,116,84,"2020/02/12 09:30:39"
5917080413,中央藥局,台中市北屯區北屯里進化北路２７號１樓,(04)22340208,208,214,"2020/02/12 09:30:39"
5917080548,志誠藥局,台中巿北屯區仁美里豊樂路３２–９號,(04)24225682,22,100,"2020/02/12 09:30:39"
5917082364,慈慧藥師藥局,台中市北屯區平田里昌平路１段１７８號１Ｆ,(04)22389846,78,114,"2020/02/12 09:30:39"
5921010447,宏荏藥局,台南市東區崇學里崇明街１１街５２巷２號,(06)2684725,160,176,"2020/02/12 09:30:39"
5921012281,菁安藥局,台南東區富強里中華東路二段４９號,(06)3361683,276,150,"2020/02/12 09:30:39"
5921012325,林英文藥局,台南市東區關聖里裕農路８６６–２號,(06)3311252,112,138,"2020/02/12 09:30:39"
5921020194,鹽埕藥局,台南市南區白雪里鹽埕路６８號,(06)2651961,11,114,"2020/02/12 09:30:39"
5921020345,重光藥局,台南市南區鹽埕路２７２號,(06)2618087,114,98,"2020/02/12 09:30:39"
5921040301,永生藥局,台南市北區六甲里公園路４８１號,(06)2813681,34,88,"2020/02/12 09:30:39"
5921050227,協和藥局,台南市中區清水里青年路１９５號,(06)2263061,168,156,"2020/02/12 09:30:39"
5921050245,泰元藥局,台南市中區文昌里民權路一段８７號,(06)2205745,1194,422,"2020/02/12 09:30:39"
5922013059,杏光藥局,嘉義市東區保健街１４７號附４,(05)2745642,90,54,"2020/02/12 09:30:39"
5931015605,僑中藥師藥局,新北市板橋區僑中１街１０２巷５弄１５號１樓,(02)29692547,0,18,"2020/02/12 09:30:39"
5931067903,西華藥局,新北市新莊區後港１路１０２號１樓,(02)82012697,48,138,"2020/02/12 09:30:39"
5931070419,暉民西藥局,新北巿樹林區千歲街３６號,(02)26835868,0,26,"2020/02/12 09:30:39"
5931101919,優德仕藥局,淡水區新市一路３段１０３號,(02)26236573,0,30,"2020/02/12 09:30:39"
5931132736,大眾藥局,新北市土城區明峰街６巷１號,(02)22666057,200,96,"2020/02/12 09:30:39"
5931171788,泰臨中西藥局,新北市林口區忠孝１路５號（１樓）,(02)26087538,100,51,"2020/02/12 09:30:39"
5931270044,金宏仁藥局,新北巿金山區中山路１９０巷２號,(02)24982402,0,48,"2020/02/12 09:30:39"
5931280013,萬里藥局,新北市萬里區瑪鍊路９０號,(02)24922235,0,50,"2020/02/12 09:30:39"
5931281074,北海岸藥局,新北市萬里區瑪鍊路９８號,(02)24922022,160,168,"2020/02/12 09:30:39"
5932013918,益壽藥局,桃園市桃園區中山路８２８、８３０、８３２、８３４、８３６號,(03)3693100,0,84,"2020/02/12 09:30:39"
5932020753,立昇藥局,桃園市中壢區成功里成功路１２３號,(03)4557032,0,92,"2020/02/12 09:30:39"
5932029952,佳倫藥局,桃園市中壢區內壢里忠孝路１５１號之一,(03)4358385,0,18,"2020/02/12 09:30:39"
5932050180,長榮藥師藥局,桃園市盧竹區南崁路２１０號,(03)3520589,172,104,"2020/02/12 09:30:39"
5932052737,知博藥師藥局,桃園市蘆竹區營盤里中山路１６０號,(03)2221886,0,30,"2020/02/12 09:30:39"
5932060177,勝峰藥師藥局,桃園市大園區菓林里３鄰菓林路５１號１樓,(03)3835588,200,50,"2020/02/12 09:30:39"
5932062171,菓林村藥局,桃園市大園區菓林里菓林路１００號,(03)3832065,16,26,"2020/02/12 09:30:39"
5932076835,光峰藥局,桃園市龜山區光峰路６７號,(03)3207630,0,70,"2020/02/12 09:30:39"
5932077305,全興藥局,桃園市龜山區光峰路１５３號１樓,(03)3597901,12,32,"2020/02/12 09:30:39"
5932083438,八德藥局,桃園市八德區廣褔路一七八號二樓,(03)3761856,3,42,"2020/02/12 09:30:39"
5932083509,上方藥局,桃園市八德區廣褔路一八八號,(03)3635902,0,158,"2020/02/12 09:30:39"
5933052044,禾松藥局,新竹縣竹北市勝利5路23號,(03)6577267,96,28,"2020/02/12 09:30:39"
5933061249,家康藥局,新竹縣湖口鄉中央路２８號二樓,(03)5903226,0,64,"2020/02/12 09:30:39"
5933061463,如家藥師藥局,新竹縣湖口鄉工業區光復東路２４９號,(03)5972606,2,26,"2020/02/12 09:30:39"
5933061570,湖口藥局,新竹縣湖口鄉民族路４５號,(03)5991842,0,24,"2020/02/12 09:30:39"
5933081429,惠生藥局,新竹縣新豐鄉學府路113號,(03)5597110,0,20,"2020/02/12 09:30:39"
5934040039,仁康藥局,宜蘭縣頭城鎮纘祥路７９之１號,(03)9776651,197,118,"2020/02/12 09:30:39"
5935050262,東仙藥局,苗栗縣頭份市蟠桃里建國路１９９號,(037)667267,2,2,"2020/02/12 09:30:39"
5935050306,康利藥局,苗栗縣頭份市忠孝里仁愛路８６號,(037)666101,14,54,"2020/02/12 09:30:39"
5935051616,康寧藥局,苗栗縣頭份和平路８０號一樓,(037)594173,200,70,"2020/02/12 09:30:39"
5935131075,安康藥局,苗栗縣三義鄉廣盛中正路114號,(037)875958,0,5,"2020/02/12 09:30:39"
5936020099,益春藥局,台中市東勢區南平里三民路１３７號,(04)25878730,14,130,"2020/02/12 09:30:39"
5936101795,文雅藥局,台中市大雅區大雅里中山北路４９２–１號,(04)25683943,0,96,"2020/02/12 09:30:39"
5936181337,長弘藥局,臺中市霧峰區樹仁２街２－１號,(04)23334967,190,110,"2020/02/12 09:30:39"
5936190078,愛心藥局,台中市太平區光華里中山路二段４１２–７號,(04)23929396,106,168,"2020/02/12 09:30:39"
5937010159,彰化明德藥局,彰化巿興北里三民路２０９號,(04)7299085,210,160,"2020/02/12 09:30:39"
5937010293,明功藥局,彰化巿中央里長安街１５５號,(04)7222362,0,120,"2020/02/12 09:30:39"
5937010882,茂新藥局,彰化縣彰化市牛埔里彰南路三段２００號,(04)7374546,74,72,"2020/02/12 09:30:39"
5937010908,日光堂藥局彰美分店,彰化縣彰化市彰美路１段２３５號,(04)7236611,1,94,"2020/02/12 09:30:39"
5937012251,慶全藥局,彰化市福山里福山街１８９號,(04)7386747,0,22,"2020/02/12 09:30:39"
5937013436,大埔藥局,彰化縣彰化市大埔路４０６、４０８、４１０、４１２號,(04)7117511,0,64,"2020/02/12 09:30:39"
5937051963,東山永安藥局,彰化縣員林市南東里山腳路４段３１號,(04)8311471,0,42,"2020/02/12 09:30:39"
5937230035,路上中華藥局,彰化縣芳苑鄉路平村上林路３８８號,(04)8983831,99,144,"2020/02/12 09:30:39"
5938010242,惠光藥局,南投縣南投巿復興路２１２號,(049)2222633,0,78,"2020/02/12 09:30:39"
5939010200,永聖藥局,雲林縣斗六市鎮北里南京路３９３號１樓,(05)5329858,86,112,"2020/02/12 09:30:39"
5939040253,福安藥局,雲林縣西螺鎮福田里社口路８３號,(05)5871281,256,211,"2020/02/12 09:30:39"
5939131437,立昇藥局,雲林縣麥寮鄉華興路９１號,(05)6933066,200,50,"2020/02/12 09:30:39"
5939170023,永昇藥局,雲林縣元長鄉下寮村東庄路３５號,(05)7861838,178,142,"2020/02/12 09:30:39"
5940011820,華信藥局,嘉義縣朴子市朴子市平和里市東路２８號,(05)3705889,118,122,"2020/02/12 09:30:39"
5940120039,李藥局,嘉義縣水上鄉民生村忠孝路１１１號,(05)2355389,60,56,"2020/02/12 09:30:39"
5941040085,信興藥局,臺南市麻豆區保安里興中路１１５號,(06)5722002,224,136,"2020/02/12 09:30:39"
5941060050,炳騰藥局,台南市新化區那拔里２９０號,(06)5911687,110,142,"2020/02/12 09:30:39"
5941080052,一安藥局,臺南市學甲區新生里華宗路４４１號,(06)7835504,166,174,"2020/02/12 09:30:39"
5941100040,瑞益藥局,臺南市後壁區嘉田里５８－１號,(06)6881486,158,158,"2020/02/12 09:30:39"
5941161043,慧安藥局,臺南市西港區西港里慶安路９５之９號,(06)7955535,0,98,"2020/02/12 09:30:39"
5941190017,憲宗藥局,臺南市北門區東壁里７０４號,(06)7864225,308,176,"2020/02/12 09:30:39"
5942030092,天明藥局,高雄市旗山區大同路至誠巷１５號,(07)6621311,218,211,"2020/02/12 09:30:39"
5942080038,日建藥局,高雄市仁武區灣內里仁忠路３２號,(07)3713497,52,34,"2020/02/12 09:30:39"
5942101112,有健藥局,高雄市鳥松區本館路３４７號,(07)3790784,40,138,"2020/02/12 09:30:39"
5943010254,大和藥局,屏東市太平里中正路１６７－１號,(08)7328052,42,104,"2020/02/12 09:30:39"
5943010263,進東藥局,屏東市平和里民權路４３－３號,(08)7333446,130,158,"2020/02/12 09:30:39"
5943010272,新東海藥局,屏東市長春里民生路１１６號,(08)7224861,78,97,"2020/02/12 09:30:39"
5943010432,億泰藥局,屏東市勝利里自由路５８２號,(08)7324005,95,132,"2020/02/12 09:30:39"
5943010665,中美藥局,屏東市扶風里林森路４５號,(08)7348697,162,156,"2020/02/12 09:30:39"
5943011135,昱昇藥師藥局,屏東市北勢里中正路３７３－１號,(08)7377471,129,144,"2020/02/12 09:30:39"
5943013148,杏芳藥局,屏東縣屏東市豐田建豐路１６７號,(08)7364643,78,68,"2020/02/12 09:30:39"
5944010070,合珍藥局,為澎湖縣馬公市鎖港里３８７－１號,(06)9953082,2,30,"2020/02/12 09:30:39"
5945011517,宏卿藥局,花蓮縣花蓮市林森路４１９號,(03)8328152,200,50,"2020/02/12 09:30:39"
5945012247,和信藥局,花蓮市中福路１３３號,(03)8330916,0,134,"2020/02/12 09:30:39"
5945070516,平安藥局,花蓮縣光復鄉光華里忠孝路９８號,(03)8700765,248,198,"2020/02/12 09:30:39"
5946010256,健康大藥局,９５０台東市新生路４８９號,(089)347049,84,70,"2020/02/12 09:30:39"
