5901150057,菁安藥局,臺北市士林區美侖街１３號１樓,(02)28323951
5901150397,博惠藥局,臺北市士林區華榮街１６號,(02)28320379
5901182255,全民藥局,臺北市中正區廈門街８７號,(02)23695759
5902030287,慈德藥局,高雄市左營區重愛路５３號,(07)3416212
5903200194,博德藥局,臺中市大里區成功２路１０４號１樓,(04)24968642
5903230085,翔新藥局,臺中市東區東英１７街１６７－３號,(04)22131269
5903270383,佳德健保藥局,臺中市西屯區工業３８路２６號,(04)23598285
5903270749,大墩藥局,臺中市西屯區大墩１９街６８號１樓,(04)23209602
5903280067,博川健保藥局,臺中市南屯區大墩５街２９８號１樓,(04)24732995
5903280101,成記大藥局,臺中市南屯區大墩１７街１２３號１樓,(04)23288877
5903280245,大墩何藥局,臺中市南屯區大敦南路４３１號１．２樓,(04)24710655
5905060161,和德藥局新化店,臺南市新化區清水里中山路４２０號１樓,(06)5802518
5905100035,華恩藥局,臺南市後壁區墨林里１９８號,(06)6623491
5905170037,建昌藥局,臺南市七股區大寮里１之１１號,(06)7873777
5905340155,東北藥局,臺南市中西區福安里西門路二段１４號１樓,(06)2226753
5905350455,幼德和緯藥局,臺南市北區文元里和緯路３段３２２號１樓,(06)2584000
5907100088,本館藥局,高雄市鳥松區大華里本館路１９０號１樓,(07)3707655
5907300677,佳寧峰藥局,高雄市左營區部後街２號,(07)5886408
5912012148,新竹實和藥局,新竹市東區中正里中山路２７號,(03)5227636
5912042098,欣欣藥局,新竹市北區西大路736巷1號,(03)5351205
5917010046,大協藥局,臺中市中區中山路１２４號,(04)22250745
5917010279,中一藥局,臺中市中區建國里建國路２２２號１Ｆ,(04)22235326
5917020097,泰興藥局,臺中市東區東南里十甲路１１－１號,(04)22112537
5917020202,一心藥局,臺中市東區合作里力行路４２-１號,(04)23609012
5917020211,何藥局,臺中市東區東勢里精武路１８０號,(04)23604631
5917030100,裕源藥局,臺中市西區公館里南屯路一段６６－７號一樓,(04)23763133
5917030146,新永富藥局,臺中市西區吉龍里美村路一段６７０號,(04)23766127
5917030388,富永藥局,臺中市西區三民西路１６１號,(04)23714681
5917032382,中港大藥局,臺中市西區臺中港路１段１０４號之１０,(04)22080708
5917040124,慧寧藥局,臺中市南區德義里忠孝路２號,(04)22851858
5917050666,大祥藥局,臺中市北區淡溝里民權路４０３號,(04)22035103
5917050719,百鴻藥局,臺中市北區金龍里北屯路１３－１號,(04)22336330
5917060108,博新藥局,臺中市西屯區福安里中工三路２２０號,(04)23583412
5917060359,明達藥局,臺中市西屯區何厝里青海路一段１７號,(04)23137079
5917063921,東京藥師藥局,臺中市西屯區太原一段７７號,(04)23165378
5917070275,聖仁藥局,臺中市南屯區田心里向上南路１段２７４號１樓,(04)24726980
5917072644,全成藥局,臺中市南屯區大墩６街２２３號,(04)24712897
5917072699,博仕健保藥局,臺中市南屯區大墩１１街４４５號,(04)23817009
5917080119,李藥局,臺中市北屯區和順路３９８號,(04)22390950
5917080137,日盛藥局,臺中市北屯區東山路一段１４２-１１號,(04)24360810
5917080388,濟生藥局,臺中市北屯區松安里昌平路二段２之３１號,(04)22472327
5917080413,中央藥局,臺中市北屯區北屯里進化北路２７號１樓,(04)22340208
5917080548,志誠藥局,臺中市北屯區仁美里豊樂路３２－９號,(04)24225682
5917082364,慈慧藥師藥局,臺中市北屯區平田里昌平路１段１７８號１Ｆ,(04)22389846
5921010447,宏荏藥局,臺南市東區崇學里崇明街１１街５２巷２號,(06)2684725
5921012281,菁安藥局,臺南市東區富強里中華東路二段４９號,(06)3361683
5921012325,林英文藥局,臺南市東區關聖里裕農路８６６之２號,(06)3311252
5921020194,鹽埕藥局,臺南市南區白雪里鹽埕路６８號,(06)2651961
5921020345,重光藥局,臺南市南區鹽埕路２７２號,(06)2618087
5921040301,永生藥局,臺南市北區六甲里公園路４８１號,(06)2813681
5921050245,泰元藥局,臺南市中西區文昌里民權路一段８７號,(06)2205745
5931015605,僑中藥師藥局,新北市板橋區僑中１街１０２巷５弄１５號１樓,(02)29692547
5931101919,優德仕藥局,新北市淡水區新市一路３段１０３號,(02)26236573
5931132736,大眾藥局,新北市土城區明峰街６巷１號,(02)22666057
5931171788,泰臨中西藥局,新北市林口區忠孝１路５號（１樓）,(02)26087538
5931270044,金宏仁藥局,新北市金山區中山路１９０巷２號,(02)24982402
5931280013,萬里藥局,新北市萬里區瑪鍊路９０號,(02)24922235
5931281074,北海岸藥局,新北市萬里區瑪鍊路９８號,(02)24922022
5932013918,益壽藥局,桃園市桃園區中山路８２８、８３０、８３２、８３４、８３６號,(03)3693100
5932020753,立昇藥局,桃園市中壢區成功里成功路１２３號,(03)4557032
5932029952,佳倫藥局,桃園市中壢區內壢里忠孝路１５１號之一,(03)4358385
5932052737,知博藥師藥局,桃園市蘆竹區營盤里中山路１６０號,(03)2221886
5932062171,菓林村藥局,桃園市大園區菓林里菓林路１００號,(03)3832065
5932083438,八德藥局,桃園市八德區廣褔路一七八號二樓,(03)3761856
5932083509,上方藥局,桃園市八德區廣褔路一八八號,(03)3635902
5933052044,禾松藥局,新竹縣竹北市勝利5路23號,(03)6577267
5933061249,家康藥局,新竹縣湖口鄉中央路２８號二樓,(03)5903226
5933061463,如家藥師藥局,新竹縣湖口鄉工業區光復東路２４９號,(03)5972606
5933061570,湖口藥局,新竹縣湖口鄉民族路４５號,(03)5991842
5934040039,仁康藥局,宜蘭縣頭城鎮纘祥路７９之１號,(03)9776651
5935050306,康利藥局,苗栗縣頭份市忠孝里仁愛路８６號,(037)666101
5935131075,安康藥局,苗栗縣三義鄉廣盛中正路114號,(037)875958
5936010486,輝生藥局,臺中市豐原區鐮村路４１１號,(04)25379563
5936020099,益春藥局,臺中市東勢區南平里三民路１３７號,(04)25878730
5936040135,德厚藥局,臺中市清水區慷榔里慷榔２街５０號,(04)26560733
5936101795,文雅藥局,臺中市大雅區大雅里中山北路４９２－１號,(04)25683943
5936181337,長弘藥局,臺中市霧峰區樹仁２街２－１號,(04)23334967
5936190078,愛心藥局,臺中市太平區光華里中山路二段４１２－７號,(04)23929396
5937010159,彰化明德藥局,彰化縣彰化市興北里三民路２０９號,(04)7299085
5937010293,明功藥局,彰化縣彰化市中央里長安街１５５號,(04)7222362
5937012251,慶全藥局,彰化縣彰化市福山里福山街１８９號,(04)7386747
5937013436,大埔藥局,彰化縣彰化市大埔路４０６、４０８、４１０、４１２號,(04)7117511
5937051963,東山永安藥局,彰化縣員林市南東里山腳路４段３１號,(04)8311471
5937230035,路上中華藥局,彰化縣芳苑鄉路平村上林路３８８號,(04)8983831
5938010242,惠光藥局,南投縣南投市復興路２１２號,(049)2222633
5939040253,福安藥局,雲林縣西螺鎮福田里社口路８３號,(05)5871281
5939170023,永昇藥局,雲林縣元長鄉下寮村東庄路３５號,(05)7861838
5940011820,華信藥局,嘉義縣朴子市朴子市平和里市東路２８號,(05)3705889
5940120039,李藥局,嘉義縣水上鄉民生村忠孝路１１１號,(05)2355389
5941040085,信興藥局,臺南市麻豆區保安里興中路１１５號,(06)5722002
5941060050,炳騰藥局,臺南市新化區那拔里２９０號,(06)5911687
5941080052,一安藥局,臺南市學甲區新生里華宗路４４１號,(06)7835504
5941100040,瑞益藥局,臺南市後壁區嘉田里５８－１號,(06)6881486
5941161043,慧安藥局,臺南市西港區西港里慶安路９５之９號,(06)7955535
5941190017,憲宗藥局,臺南市北門區東壁里７０４號,(06)7864225
5942030092,天明藥局,高雄市旗山區大同路至誠巷１５號,(07)6621311
5942080038,日建藥局,高雄市仁武區灣內里仁忠路３２號,(07)3713497
5942101112,有健藥局,高雄市鳥松區本館路３４７號,(07)3790784
5943010254,大和藥局,屏東縣屏東市太平里中正路１６７－１號,(08)7328052
5943010263,進東藥局,屏東縣屏東市平和里民權路４３－３號,(08)7333446
5943010272,新東海藥局,屏東縣屏東市長春里民生路１１６號,(08)7224861
5943010432,億泰藥局,屏東縣屏東市勝利里自由路５８２號,(08)7324005
5943010665,中美藥局,屏東縣屏東市扶風里林森路４５號,(08)7348697
5943011135,昱昇藥師藥局,屏東縣屏東市北勢里中正路３７３－１號,(08)7377471
5943013148,杏芳藥局,屏東縣屏東市豐田建豐路１６７號,(08)7364643
5944010070,合珍藥局,澎湖縣馬公市鎖港里３８７－１號,(06)9953082
5945012247,和信藥局,花蓮縣花蓮市中福路１３３號,(03)8330916
5945012256,惠好藥局,花蓮縣花蓮市國聯四路７７號,(03)8338911
5945070516,平安藥局,花蓮縣光復鄉光華里忠孝路９８號,(03)8700765
5946010256,健康大藥局,臺東縣臺東市新生路４８９號,(089)347049
