0145080011,衛生福利部花蓮醫院豐濱原住民分院,花蓮縣豐濱鄉豐濱村光豐路４１號,(03)8358141,1029,617,"2020/02/20 16:06:35"
0291010010,連江縣立醫院,連江縣南竿鄉復興村２１７號,(083)623995,0,192,"2020/02/20 16:06:35"
2101090011,台北市立聯合醫院附設大同門診部,台北市大同區昌吉街５２號１至２樓,(02)25948971,400,200,"2020/02/20 16:06:35"
2101110027,臺北市立聯合醫院附設內湖門診部,台北市內湖區民權東路６段９９號,(02)27908387,400,200,"2020/02/20 16:06:35"
2101161033,臺北市立聯合醫院附設北投門診部,台北市北投區新市街３０號５樓,(02)28912670,400,200,"2020/02/20 16:06:35"
2101200017,台北市立聯合醫院附設政大門診部,台北市文山區指南路２段１１７號,(02)82377441,400,200,"2020/02/20 16:06:35"
