0145080011,衛生福利部花蓮醫院豐濱原住民分院,花蓮縣豐濱鄉豐濱村光豐路４１號,8358141
0291010010,連江縣立醫院,連江縣南竿鄉復興村２１７號,623995
2101010013,松山健康服務中心,臺北市松山區八德路４段６９２號６樓,(02)27671757
2101020019,大安健康服務中心,臺北市大安區辛亥路３段１５號,(02)27335831
2101090011,大同健康服務中心,臺北市大同區昌吉街５２號,(02)25853227
2101100227,中山健康服務中心,臺北市中山區松江路３６７號７樓,(02)25014616
2101110027,內湖健康服務中心,臺北市內湖區民權東路６段９９號２樓,(02)27911162
2101120014,南港健康服務中心,臺北市南港區南港路１段３６０號７樓,(02)27825220
2101150012,士林健康服務中心,臺北市士林區中正路１段４３９號２樓,(02)28813039
2101161033,北投健康服務中心,臺北市北投區石牌路２段１１１號,(02)28261026
2101170050,信義健康服務中心,臺北市信義區信義路５段１５號,(02)27234598
2101180038,中正健康服務中心,臺北市中正區牯嶺街２４號,(02)23215158
2101191068,萬華健康服務中心,臺北市萬華區東園街１５２號,(02)23033092
2101200017,政大(文山健康服務中心),臺北市文山區木柵路３段２２０號,(02)22343501
2390030030,金門縣金湖鎮衛生所,金門縣金湖鎮正義里成功７號之１,(082)336662
2390040518,金門縣金寧鄉衛生所,金門縣金寧鄉盤山村仁愛新屯２之１號,(082)325735
2390050032,金門縣烈嶼鄉衛生所,金門縣烈嶼鄉西口村西方６－５號,(082)362078
2391020010,連江縣北竿鄉衛生所,連江縣北竿鄉塘岐村２５號,(083)655592
2391030016,連江縣莒光鄉西莒衛生所,連江縣莒光鄉青帆村１４－１號,(083)689122
2391030026,連江縣莒光鄉東莒衛生所,連江縣莒光鄉大坪村３０－１號,(083)689038
2391040012,連江縣東引鄉衛生所,連江縣東引鄉中柳村１２３號,(083)677206
5901013406,美優康藥局,臺北市松山區民生東路４段１１７之１號,(02)27152319
5901112413,維安藥局,臺北市內湖區成功路３段１７４巷２３號,(02)27944520
5901113581,加一藥師藥局,臺北市內湖區星雲街２４號,87912653
5901121592,忠孝藥局,臺北市南港區成福路１６號,(02)27862829
5901162815,天康大藥局,臺北市北投區中央南路１段５７號,(02)28930168
5901163483,天富大藥局,臺北市北投區石牌路２段１７１號１、２樓,(02)28225812
5901173498,御安藥局,臺北市信義區和平東路３段３５９號,(02)27323997
5901173676,杏一光復藥局,臺北市信義區光復南路４４９之１號,(02)87804626
5901173701,壹間藥師藥局,臺北市信義區虎林街１２０巷１４８號,(02)27672833
5901173756,信義盛康藥局,臺北市信義區永吉路２８６號,(02)23460521
5901173774,立赫北醫藥局,臺北市信義區吳興街１１８巷２６弄１７號,(02)27320100
5901173792,柏愛藥局,臺北市信義區基隆路２段１３１之９號,(02)27325472
5901193258,和德藥局,臺北市萬華區西園路２段２９２號,(02)23331522
5901203259,杏一萬芳藥局,臺北市文山區興隆路３段１１８號、１１８號２樓,(02)82301606
5901203277,大樹景美藥局,臺北市文山區羅斯福路６段２３４之１號,(02)29322951
5902030303,翔生藥局,高雄市左營區尾南里左營大路５１４號,(07)5827329
5902084776,杏合藥局,高雄市苓雅區福德二路２１６號,(07)7268966
5903220105,平等安德藥局,臺中市中區平等街１１６號,(04)22222889
5903260350,宏信藥局,臺中市北區崇德路１段４５３號,(04)22355476
5903260529,多倫多藥局,臺中市北區太原路二段１１號１樓,(04)22980210
5903260636,進化瑞昌藥局,臺中市北區進化路３３２號,(04)23608199
5903271040,美康逢甲健保藥局,臺中市西屯區福星路４３１號１樓、４３１－１號２樓,(04)24528707
5903271077,合和健保藥局,臺中市西屯區福科路７９３號１樓,(04)24630321
5905010161,安佳藥局,臺南市新營區民治路３７４號１樓,(06)6560535
5905310853,大力藥局大灣店,臺南市永康區大灣路３７６號１樓,(06)2054292
5905380113,永康藥局永華店,臺南市安平區永華路２段７０２號,(06)2951552
5907011166,佑全鳳山藥局,高雄市鳳山區文德里青年路二段４６３號１－２樓,(07)7801568
5907030125,旗山藥局,高雄市旗山區中華路２３號,(07)6621158
5907050074,林園藥局,高雄市林園區仁愛路１３號１樓,(07)6425855
5907060187,桂林活力藥師藥局鳳林店,高雄市大寮區山頂里鳳林三路８２３˙８２５號１樓,(07)7912331
5907300917,左營藥局,高雄市左營區華夏路３２５號,(07)5501017
5907320884,自由藥局,高雄市三民區自由一路７８號,(07)3223113
5907330166,中正台安藥局,高雄市新興區中山一路１８３號一樓,(07)2856336
5911051516,復興藥局,基隆市中山區復興路１２８、１３０、１３２、１３４號１、２樓,(02)24362566
5911061156,青樺藥局,基隆市安樂區安樂路２段１７７號,(02)24325410
5912013449,小樹藥局,新竹市東區慈濟路３號３樓,5670099
5912042673,仁佑藥局,新竹市北區南寮里西濱路１段５００號,(03)5363818
5912042735,新竹北門藥局,新竹市北區中正路３６０、３６２號（１樓）,(03)5333234
5921021637,赤繐藥師健保藥局,臺南市南區金華路２段９６號,(06)2656368
5921071333,人仁藥局,臺南市安平區慶平路２８１號,(06)2998667
5922013022,忠孝啄木鳥藥局,嘉義市東區荖藤里忠孝北街１８５號,(05)2204948
5922020732,仁愛弘安藥局,嘉義市西區仁愛路３９３號１樓,(05)2239000
5931016700,葆康藥局,新北市板橋區四川路２段２４５巷３號１樓,(02)89678373
5931025665,宏原健保藥局,新北市三重區中正北路１８３號１樓,(02)29871515
5931033943,崇恩藥局,新北市永和區成功路２段１３５號１樓,(02)89214022
5931044713,信毅藥局,新北市中和區捷運路５６號１樓,(02)29423663
593106A137,力源藥局,新北市新莊區復興路２段１３３號１樓,(02)89929919
593106A655,家嘉藥局,新北市新莊區自立街１０３號１樓,(02)89926488
593106A691,大樹新莊藥局,新北市新莊區新泰路５９號１、２樓,(02)22010566
593106A940,樂福藥局,新北市新莊區幸福路４８號１樓,(02)29923388
5931102167,天康大藥局,新北市淡水區學府路４９號１樓,(02)26206517
5931102274,淡水藥局,新北市淡水區中山路１２７號１、２樓,(02)86313663
5931112181,青山藥局,新北市汐止區莊敬街１２７號１樓,(02)26907959
5931112467,建忠藥局,新北市汐止區建成路３７巷１１號１樓,(02)26422101
5931112609,健康晨光藥局,新北市汐止區大同路二段５１６號１樓,(02)26433111
5931113026,車站藥局,新北市汐止區忠孝東路２４７號１樓,(02)26919222
5931132521,儷生藥局,新北市土城區金城路２段３９０號１樓,(02)22609911
5931151642,明月藥局,新北市五股區工商路８９號,(02)82956028
5931161568,立赫輔大藥局,新北市泰山區貴子路６５號１樓,(02)29060306
5932012804,桃園南平藥局,桃園市桃園區南平路３０２－１號１樓,(03)3165222
5932013383,多多藥局,桃園市桃園區南平路１８３號１樓,(03)3162133
5932013589,龍壽大藥局,桃園市桃園區龍壽街６４－１號１樓,(03)3705663
5932013767,小飛象藥局,桃園市桃園區慈文路１９２號,(03)3552771
5932013785,愛兒康藥局,桃園市桃園區龍安街１４７號１樓,(03)3789142
5932023272,龍東藥局,桃園市中壢區龍東路２０５號,(03)4383088
5932023503,內壢忠孝藥局,桃園市中壢區忠孝路３６號,(03)4636641
5932023629,壢好藥局,桃園市中壢區興農路１０３號１樓,(03)4528886
5932023852,朝日藥局,桃園市中壢區新生路１２９號,(03)2805882
5932077467,維康藥局,桃園市龜山區復興一路８８號１樓,(03)3283880
5932101075,杏一平鎮環南藥局,桃園市平鎮區環南路２號,(03)4951758
5933053149,成功藥局,新竹縣竹北市成功三路６９號,(03)5509117
5934021963,羅東啄木鳥藥局,宜蘭縣羅東鎮中山路２段３０３號,(03)9604670
5935012379,橙易藥局,苗栗縣苗栗市中正路２９１號１樓,(037)376608
5937012126,彰化福倫藥局,彰化縣彰化市中正路２段２２４號,(04)7233018
5937013310,彰化必安藥局,彰化縣彰化市莿桐里彰水路１４９號,(04)7619127
5937021812,大樹鹿港藥局,彰化縣鹿港鎮中正路１９３號,(04)7772226
5937111188,好鄰居藥局,彰化縣福興鄉沿海路三段２７３號,(04)7707887
5938022144,久泰藥局,南投縣埔里鎮南興街３２４、３２６號,(049)2980968
5938041827,華誠藥局,南投縣竹山鎮下橫街７５－８號,(049)2633500
5939061869,德豐藥局,雲林縣北港鎮公園路１２號,(05)7835338
5939091303,莿桐台丞藥局,雲林縣莿桐鄉中正路１６６號,(05)5840808
5939171119,順元藥局,雲林縣元長鄉中山路２５號,(05)7886555
5940041702,大祐藥局,嘉義縣民雄鄉西安村２１－１號１樓,(05)2067077
5940061197,新港啄木鳥藥局,嘉義縣新港鄉菜公村咬仔竹８９號,(05)3748809
5941271455,成吉藥局仁義店,臺南市仁德區仁義路４２之１號,(06)2497307
5943012605,中正藥局,屏東縣屏東市中正路１９１號,(08)7339012
5943031799,欣大眾藥局,屏東縣東港鎮中正路一段９２號,(08)8351177
5943081137,九如藥局,屏東縣九如鄉東寧村九如路二段２３０號,(08)7397777
5943091160,里港寶康藥局,屏東縣里港鄉仁和路２４號,(08)7721189
5945051691,安康藥局,花蓮縣吉安鄉中山路三段３８４號,(03)8513951
