醫事機構代碼,醫事機構名稱,醫事機構地址,醫事機構電話,成人口罩剩餘數,兒童口罩剩餘數,來源資料時間
5931023107,容安藥局,新北市三重區正義北路２３７號２樓,(02)89851582,3,6,2020/04/13 15:59:34
5931023116,宏安藥局,新北市三重區集美街１５８號１樓,(02)29785866,8,5,2020/04/13 15:59:34
5931023161,烈委藥局,新北市三重區五華街１３２號,(02)89812846,495,0,2020/04/13 15:59:34
5931023198,成立藥局,新北市三重區正義北路３１０－１號２樓,(02)89852355,24,0,2020/04/13 15:59:34
5931023527,德慈藥局,新北市三重區重新路３段１６號１樓,(02)29736693,0,7,2020/04/13 15:59:34
5931023536,江村藥局,新北市三重區重新路３段９號,(02)29821024,4,0,2020/04/13 15:59:34
5931023563,寶貝藥局,新北市三重區仁愛街３０２－１號,(02)29802190,9,0,2020/04/13 15:59:34
5931023581,大重仁藥局,新北市三重區重新路５段５９２號１樓,(02)29958283,1,0,2020/04/13 15:59:34
5931023625,聖美膚藥局,新北市三重區正義北路１３０號,(02)29863456,198,2,2020/04/13 15:59:34
5931023670,誠泰藥師藥局,新北市三重區重新路３段１０２號,(02)89721125,9,20,2020/04/13 15:59:34
5931023732,松泰藥師藥局,新北市三重區大同北路６５號,(02)29859593,729,30,2020/04/13 15:59:34
5931023750,興安藥局,新北市三重區正義北路２７５之１號,(02)29885795,2300,0,2020/04/13 15:59:34
5931023830,忠信藥局,新北市三重區仁興街３２號,(02)29762963,0,6,2020/04/13 15:59:34
5931023858,開元藥局,新北市三重區正義北路３２４號２樓,(02)29873976,2300,0,2020/04/13 15:59:34
5931023901,銘泰藥局,新北市三重區三和路４段１５３號２樓,(02)22865092,589,0,2020/04/13 15:59:34
5931024097,義榮藥局,新北市三重區三和路２段１４２號１樓,(02)29727598,41,0,2020/04/13 15:59:34
5931024355,天賜藥局,新北市三重區自強路１段８５號１樓,(02)29856852,1439,2,2020/04/13 15:59:34
5931024462,惠理藥局,新北市三重區重陽路１段１５２號,(02)29856710,966,0,2020/04/13 15:59:34
5931024499,信承藥局,新北市三重區信義西街４４號１樓,(02)29866476,1,0,2020/04/13 15:59:34
5931024515,陳藥局,新北市三重區三民街７７號,(02)29848601,0,3,2020/04/13 15:59:34
5931024524,陽明藥師藥局,新北市三重區三和路４段１６３巷１５號,(02)22867848,162,0,2020/04/13 15:59:34
5931024588,陽光藥師藥局,新北市三重區三和路２段１８２號１樓,(02)29788120,288,14,2020/04/13 15:59:34
5931024622,萊康健保藥局,新北市三重區溪尾街１７６號１樓,(02)82871076,27,0,2020/04/13 15:59:34
5931024668,景康藥局,新北市三重區集美街２９號１樓,(02)89731717,2,403,2020/04/13 15:59:34
5931024677,博愛藥局,新北市三重區三民街２２０號１樓,(02)29711606,72,0,2020/04/13 15:59:34
5931024891,康慈藥局,新北市三重區忠孝路２段４０號１樓,(02)89813529,6,8,2020/04/13 15:59:34
5931024908,力行德榮藥局,新北市三重區力行路２段１７０號１樓,(02)22867170,3,2,2020/04/13 15:59:34
5931024935,健康藥局,新北市三重區安樂街５８號１樓,(02)29841882,3,0,2020/04/13 15:59:34
5931024962,建祥三和藥局,新北市三重區三和路２段１６０號１樓,(02)29703379,5,0,2020/04/13 15:59:34
5931024971,欽勝藥局,新北市三重區重陽路４段６號２樓,(02)29857389,23,0,2020/04/13 15:59:34
5931025076,慈愛藥局,新北市三重區溪尾街１７３號１樓,(02)89851330,14,0,2020/04/13 15:59:34
5931025110,慈惠藥局,新北市三重區仁愛街５１６號１、２樓,(02)22809009,27,30,2020/04/13 15:59:34
5931025192,榮康藥局,新北市三重區成功路８１號１樓,(02)29772723,0,200,2020/04/13 15:59:34
5931025236,祐銘藥局,新北市三重區龍門路２２號１樓,(02)29769001,0,6,2020/04/13 15:59:34
5931025245,黎明藥師藥局,新北市三重區三和路４段２２７號１樓,(02)82870958,1903,0,2020/04/13 15:59:34
5931025254,仁愛健保藥局,新北市三重區力行路２段１５３號,(02)22805160,720,0,2020/04/13 15:59:34
5931025290,康新藥局,新北市三重區正義北路１８５號２樓,(02)29865982,261,51,2020/04/13 15:59:34
5931025307,佑全三重正義藥局,新北市三重區正義北路２０７號１、２樓；２０９號１、２樓,(02)29815341,0,10,2020/04/13 15:59:34
5931025325,欣悅藥局,新北市三重區正義北路２１０號１樓,(02)29711733,0,2655,2020/04/13 15:59:34
5931025343,益成藥局,新北市三重區正義北路１５４號３樓之１,(02)89827261,0,26,2020/04/13 15:59:34
5931025432,利民藥局,新北市三重區自強路１段１７１號、１７３號１樓及２樓,(02)29852826,36,0,2020/04/13 15:59:34
5931025558,藥比健保藥局,新北市三重區成功路１０２號１樓,(02)29730069,15,0,2020/04/13 15:59:34
5931025610,大樹三重藥局,新北市三重區正義北路６６號１樓,(02)29713188,9,10,2020/04/13 15:59:34
5931025638,華安生活藥局,新北市三重區重新路２段１２６號１樓,(02)29756534,2,5,2020/04/13 15:59:34
5931025647,幸康藥局,新北市三重區正義北路２０５號２樓,(02)29816052,0,1927,2020/04/13 15:59:34
5931025683,政昇藥局,新北市三重區正義北路１２３號２樓之３,(02)29815690,45,3,2020/04/13 15:59:34
5931025736,五華春天生活藥局,新北市三重區五華街７３號１、２樓,(02)29876838,1044,10,2020/04/13 15:59:34
5931025763,美康三和藥局,新北市三重區三和路４段３２２號１、２樓,(02)22866858,6,2,2020/04/13 15:59:34
5931025781,芯慈藥局,新北市三重區永安北路２段１０５號１樓,(02)28570670,9,0,2020/04/13 15:59:34
5931025790,銀河藥局,新北市三重區五華街２４７號１樓,(02)28578688,4,0,2020/04/13 15:59:34
5931025825,美康中正北藥局,新北市三重區中正北路１４９號１樓２樓,(02)29882836,585,0,2020/04/13 15:59:34
5931030184,新昇大藥局,新北市永和區永亨路１２２號,(02)29298523,10,41,2020/04/13 15:59:34
5931030317,聖英藥局,新北市永和區福和路５５－１號,(02)29293613,4,0,2020/04/13 15:59:34
5931032286,宏瑞藥局,新北市永和區文化路７８號,(02)32330993,424,0,2020/04/13 15:59:34
5931032311,立安藥局,新北市永和區永和路２段２０３號１樓,(02)89211786,216,0,2020/04/13 15:59:34
5931032339,宜泰藥局,新北市永和區永貞路２９７號,(02)89210657,0,3,2020/04/13 15:59:34
5931032419,台大藥局,新北市永和區保平路２４０號,(02)29242484,4,0,2020/04/13 15:59:34
5931032964,德上藥局,新北市永和區中正路１０６號,(02)89411077,18,0,2020/04/13 15:59:34
5931033087,康宏安藥局,新北市永和區保福路２段７８號１樓,(02)29288118,315,130,2020/04/13 15:59:34
5931033103,皇家藥師藥局,新北市永和區中正路７２０號１樓,(02)89216867,140,22,2020/04/13 15:59:34
5931033176,緣來藥師藥局,新北市永和區福和路２５０、２５２號１樓,(02)29211798,36,371,2020/04/13 15:59:34
5931033194,廣惠藥局,新北市永和區中正路６４９號２樓,(02)29290675,1503,450,2020/04/13 15:59:34
5931033201,級立健保藥局,新北市永和區保平路１３９號１樓,(02)29299995,156,6,2020/04/13 15:59:34
5931033363,保安藥局,新北市永和區保安路２１２號１樓,(02)29277623,2727,212,2020/04/13 15:59:34
5931033416,詠悅藥局,新北市永和區中山路１段１７４號１樓,(02)29205760,7,990,2020/04/13 15:59:34
5931033498,亞佐藥局,新北市永和區中山路１段１２８巷１７號１樓,(02)89219038,0,541,2020/04/13 15:59:34
5931033578,悅美保健藥局,新北市永和區保生路２２巷２１號１樓,(02)22323515,8,3,2020/04/13 15:59:34
5931033603,安安藥局,新北市永和區竹林路２０３號１樓,(02)89263651,2,0,2020/04/13 15:59:34
5931033621,永正健康人生藥局,新北市永和區中正路１９１、１９３號１樓、１９７號２樓,(02)29467351,234,0,2020/04/13 15:59:34
5931033649,敦品民治藥局,新北市永和區民治街８１號１樓,(02)29494150,12,0,2020/04/13 15:59:34
5931033658,威成藥局,新北市永和區中和路４２９號１樓,(02)29263191,24,190,2020/04/13 15:59:34
5931033774,台化藥局,新北市永和區勵行街１１９號１樓,(02)22318585,9,0,2020/04/13 15:59:34
5931033783,星韻藥局,新北市永和區福和路８８號,(02)89282999,35,0,2020/04/13 15:59:34
5931033890,康杏安藥局,新北市永和區保平路６０號１樓,(02)29298968,36,40,2020/04/13 15:59:34
5931033916,宜田藥局,新北市永和區中正路１１１號２樓,(02)29425935,0,1076,2020/04/13 15:59:34
5931033943,崇恩藥局,新北市永和區成功路２段１３５號１樓,(02)89214022,0,1,2020/04/13 15:59:34
5931033952,澄品藥局,新北市永和區永利路９６號１樓,(02)22329871,90,0,2020/04/13 15:59:34
5931040082,中和光田藥局,新北市中和區連城路４８號,(02)22459602,9,0,2020/04/13 15:59:34
5931040153,上仁藥局,新北市中和區中山路２段１３１巷１１－１號,(02)22480074,5,0,2020/04/13 15:59:34
5931040313,亮安藥局,新北市中和區宜安路２號,(02)29469898,102,1,2020/04/13 15:59:34
5931040322,宏信藥局,新北市中和區永貞路２６２巷４號,(02)29294976,0,3,2020/04/13 15:59:34
5931040359,劉永安藥局,新北市中和區景安路２２７號,(02)29458377,1,7,2020/04/13 15:59:34
5931040475,顧藥局,新北市中和區圓通路１４０號,(02)22470133,3,0,2020/04/13 15:59:34
5931040617,田邊藥局,新北市中和區泰和街４３號１樓,(02)22407725,1,6,2020/04/13 15:59:34
5931040662,仙正藥局,新北市中和區福美路３０９號,(02)22494081,0,8,2020/04/13 15:59:34
5931040680,博健藥局,新北市中和區忠孝街３７巷４號,(02)29402107,999,0,2020/04/13 15:59:34
5931041061,裕壬藥局,新北市中和區新生街２０６、２０８號１樓,(02)32349358,191,0,2020/04/13 15:59:34
5931042371,真成大藥局,新北市中和區光華街３８號,(02)22447008,324,6,2020/04/13 15:59:34
5931042611,安華藥局,新北市中和區圓通路２９３之２號２樓,(02)22489079,4,5,2020/04/13 15:59:34
5931042648,恩溢藥局,新北市中和區復興路７９號１樓.２樓,(02)22452450,860,42,2020/04/13 15:59:34
5931042782,弘安藥局,新北市中和區德光路１２１之１號１樓,(02)29646489,676,0,2020/04/13 15:59:34
5931042899,家家藥局,新北市中和區民德路４３號,(02)29587512,3,0,2020/04/13 15:59:34
5931043136,聖康藥師藥局,新北市中和區自立路３９號１樓,(02)29478002,0,1243,2020/04/13 15:59:34
5931043181,建琳藥局,新北市中和區景安路２０２－１號,(02)22427887,18,0,2020/04/13 15:59:34
5931043216,億華藥局,新北市中和區景安路１５７號,(02)89421993,4,0,2020/04/13 15:59:34
5931043369,泰泰健保藥局,新北市中和區德光路９７號,(02)89642049,0,5,2020/04/13 15:59:34
5931043421,錦和藥局,新北市中和區錦和路１６４號１樓,(02)82282296,387,0,2020/04/13 15:59:34
5931043430,慶華藥師藥局,新北市中和區華新街９０號１樓,(02)29420666,3,0,2020/04/13 15:59:34
5931043538,三越藥局,新北市中和區復興路２７７號１樓,(02)22427215,2,7,2020/04/13 15:59:34
5931043565,一安藥妝藥局,新北市中和區中和路９號１.２樓,(02)22483778,729,40,2020/04/13 15:59:34
5931043636,雙合藥局,新北市中和區中正路２９１號１樓,(02)22476607,0,308,2020/04/13 15:59:34
5931043663,群芳藥局,新北市中和區和興里中興街７３號１樓,(02)22433729,531,70,2020/04/13 15:59:34
5931043770,宜安健康人生藥局,新北市中和區宜安路１６２號１樓,(02)29224648,255,0,2020/04/13 15:59:34
5931043798,永成藥局,新北市中和區景平路１５６號１樓,(02)29407619,369,40,2020/04/13 15:59:34
5931043921,良安藥局,新北市中和區文元里連城路３６６號１樓,(02)22225798,99,110,2020/04/13 15:59:34
5931044286,好意藥局,新北市中和區景新街４６７巷３號１樓,(02)89416598,3,0,2020/04/13 15:59:34
5931044357,順心藥局,新北市中和區景新街４３９號１樓,(02)29429680,387,0,2020/04/13 15:59:34
5931044419,喬登藥局,新北市中和區景平路６９７號１樓,(02)22470273,7,0,2020/04/13 15:59:34
5931044482,悠悅藥局,新北市中和區安樂路２５號２樓,(02)29463755,1467,0,2020/04/13 15:59:34
5931044508,和欣泰藥局,新北市中和區永貞路２２３號１樓,(02)29290867,869,35,2020/04/13 15:59:34
5931044599,成合藥局,新北市中和區景平路４２９之２號１樓,(02)22483605,50,2,2020/04/13 15:59:34
5931044606,詠安藥局,新北市中和區員山路１５０之８號１樓,(02)22231606,409,0,2020/04/13 15:59:34
5931044624,奕采藥局,新北市中和區宜安路７７號１樓,(02)29429770,1,1,2020/04/13 15:59:34
5931044660,吉佑藥局,新北市中和區大勇街３４號１樓,(02)89416539,0,8,2020/04/13 15:59:34
5931044713,信毅藥局,新北市中和區捷運路５６號１樓,(02)29423663,900,100,2020/04/13 15:59:34
5931044740,廣元藥局,新北市中和區興南路２段２７號１樓,(02)86681906,5,0,2020/04/13 15:59:34
5931044820,禾心藥局,新北市中和區秀朗路３段６４號１樓,(02)86688922,211,0,2020/04/13 15:59:34
5931044884,壹品藥局,新北市中和區福祥路５５號１樓,(02)22481818,315,0,2020/04/13 15:59:34
5931044928,芳碩藥局,新北市中和區連城路４７巷２號１樓,(02)82458816,387,0,2020/04/13 15:59:34
5931044946,綠杏廟口藥局,新北市中和區中和路１１５號１樓,(02)22470547,630,47,2020/04/13 15:59:34
5931044955,安騏生活藥局,新北市中和區南華路１５號１樓,(02)22445130,3,0,2020/04/13 15:59:34
5931045069,禾昌藥局,新北市中和區中安街１７８巷２號１樓,(02)29267330,0,20,2020/04/13 15:59:34
5931045087,公園親子藥局,新北市中和區安平路１５８號２樓,(02)86688726,3,5,2020/04/13 15:59:34
5931045103,榮記大藥局,新北市中和區員山路４８２號１樓,(02)22239546,0,3,2020/04/13 15:59:34
5931050131,再生藥局,新北市新店區北新路３段６５巷９號,(02)29113781,33,5,2020/04/13 15:59:34
5931050408,昌順藥局,新北市新店區安康路３段２６５號,(02)22156798,0,6,2020/04/13 15:59:34
5931051558,信龍大藥局,新北市新店區安康路２段５６號,(02)22115533,756,0,2020/04/13 15:59:34
5931051601,昇旺藥局,新北市新店區建國路１０－１號１樓,(02)86659233,2,3,2020/04/13 15:59:34
5931051692,安康佑康健保藥局,新北市新店區安康路３段１７號,(02)22144938,234,0,2020/04/13 15:59:34
5931051790,家得福藥局,新北市新店區安康路２段１２３號１樓,(02)22118346,0,6,2020/04/13 15:59:34
5931051816,康宜庭北新藥局,新北市新店區北新路２段４３號１樓,(02)89147015,90,0,2020/04/13 15:59:34
5931051852,康裕藥局,新北市新店區民權路８號,(02)29135479,9,0,2020/04/13 15:59:34
5931052091,康宜庭大坪林藥局,新北市新店區北新路３段１２７號１樓,(02)89116029,144,0,2020/04/13 15:59:34
5931052215,三民藥局,新北市新店區三民路７８號１樓－１,(02)89146301,21,0,2020/04/13 15:59:34
5931052251,昇育健康藥局,新北市新店區中央三街１１５號１樓,(02)86679631,1,7,2020/04/13 15:59:34
5931052313,欣康藥局,新北市新店區中正路２９３號１樓,(02)89113189,135,60,2020/04/13 15:59:34
5931052368,正安藥局,新北市新店區明德路５０號１樓,(02)29115809,0,3,2020/04/13 15:59:34
5931052439,德莘藥局,新北市新店區中正路４１３號１樓,(02)86655462,3,2,2020/04/13 15:59:34
5931052751,新康藥局,新北市新店區北新路１段１９５號１樓、２樓,(02)29178179,9,10,2020/04/13 15:59:34
5931052804,新店家安藥局,新北市新店區三民路３２－１號２樓,(02)29117207,0,5,2020/04/13 15:59:34
5931052868,均安藥局,新北市新店區民權路８９號１樓,(02)29127861,624,1,2020/04/13 15:59:34
5931052920,碧潭大藥局,新北市新店區碧潭路４１號１樓,(02)22112271,576,80,2020/04/13 15:59:34
5931052966,禾宜藥局,新北市新店區北新路３段１２８號１樓,(02)29150411,7,4,2020/04/13 15:59:34
5931052984,北一藥師藥局,新北市新店區北新路２段１６０號１樓、２樓,(02)89115686,137,8,2020/04/13 15:59:34
5931053007,康曜藥師藥局,新北市新店區安康路２段２４０號１樓,(02)86669660,169,0,2020/04/13 15:59:34
5931053052,巧新藥局,新北市新店區北宜路１段８４號１樓,(02)29183565,1683,200,2020/04/13 15:59:34
5931053061,耕莘健康人生藥局,新北市新店區民族路１８６號１樓,(02)22194743,906,98,2020/04/13 15:59:34
5931053098,仁心藥局,新北市新店區中正路４０２號１樓,(02)22186322,711,0,2020/04/13 15:59:34
5931053132,康宜庭碧潭藥局,新北市新店區北宜路１段４１號１樓,(02)29186266,360,30,2020/04/13 15:59:34
5931053141,禾康藥局,新北市新店區德正街４４號１樓,(02)29160596,699,5,2020/04/13 15:59:34
5931053150,十二願藥局,新北市新店區中正路６８２號１樓,(02)22181899,1589,359,2020/04/13 15:59:34
5931060146,海山藥局,新北市新莊區景德路４２５號,(02)22019804,11,5,2020/04/13 15:59:34
5931060226,忠山藥局,新北市新莊區雙鳳路２號,(02)29027588,0,4,2020/04/13 15:59:34
5931060342,十安藥局,新北市新莊區中港路３１６號,(02)29922859,486,20,2020/04/13 15:59:34
5931060557,一安藥局,新北市新莊區立德里新泰路２６８號,(02)29941618,378,0,2020/04/13 15:59:34
5931060619,蘇藥局,新北市新莊區中平路６巷３７號,(02)29917818,1690,172,2020/04/13 15:59:34
5931060628,錄新藥局,新北市新莊區後港一路７６巷１０弄１號,(02)22051849,298,0,2020/04/13 15:59:34
5931060682,勝安藥局,新北市新莊區中正路３３４巷２３號１樓,(02)29963394,2,0,2020/04/13 15:59:34
5931065927,聯成藥局,新北市新莊區中正路３３２號,(02)29941915,796,1245,2020/04/13 15:59:34
5931067092,恩泰藥局,新北市新莊區民安西路２６５號－１,(02)22038680,3,0,2020/04/13 15:59:34
5931067136,蒲陽藥局,新北市新莊區中港路５１４號,(02)29930069,4,4,2020/04/13 15:59:34
5931067172,民安藥局,新北市新莊區民安路２３２號,(02)22038910,441,0,2020/04/13 15:59:34
5931067216,鍵豐藥局,新北市新莊區中和街１５８號１樓,(02)29917452,198,0,2020/04/13 15:59:34
5931067494,福營藥局,新北市新莊區富國路１０７號２樓,(02)22059697,5,2,2020/04/13 15:59:34
5931067547,金翔藥局,新北市新莊區幸福路５９５號１樓,(02)29988528,3,5,2020/04/13 15:59:34
5931067565,豐年藥局,新北市新莊區中正路３７７巷１６號,(02)22071182,243,0,2020/04/13 15:59:34
5931067850,聯合藥局,新北市新莊區新泰路１９４號２樓,(02)22796464,108,4,2020/04/13 15:59:34
5931067903,西華藥局,新北市新莊區後港１路１０２號１樓,(02)82012697,9,0,2020/04/13 15:59:34
5931067985,蘋果藥局,新北市新莊區八德街１０５號,(02)22053933,450,0,2020/04/13 15:59:34
5931068008,北醫藥局,新北市新莊區思源路１１９號１樓,(02)29983670,312,0,2020/04/13 15:59:34
5931068160,三大藥局,新北市新莊區建安里民安路１９７號,(02)22030503,18,0,2020/04/13 15:59:34
5931068268,新莊大東藥局,新北市新莊區幸福路８０６號１樓,(02)22766026,1098,80,2020/04/13 15:59:34
5931068375,惠欣藥局,新北市新莊區全泰里建中街７２－１號１樓,(02)29978962,8,7,2020/04/13 15:59:34
5931068455,合康藥師藥局,新北市新莊區中平里中平路３０６號,(02)29924496,547,0,2020/04/13 15:59:34
5931068464,健安藥局,新北市新莊區光和里民安西路２０９號１樓,(02)22043765,181,0,2020/04/13 15:59:34
5931068599,建昌藥局,新北市新莊區福營里中正路５５７號,(02)29015422,4,8,2020/04/13 15:59:34
5931068624,瑞豐大藥局,新北市新莊區建福里後港一路１０５號,(02)22049932,4,0,2020/04/13 15:59:34
5931068722,庭安藥局,新北市新莊區民有里西盛街１７２號１樓,(02)22080528,18,0,2020/04/13 15:59:34
5931068759,森活藥局,新北市新莊區民安路２２０－１號,(02)22027927,1904,0,2020/04/13 15:59:34
5931068866,大愛藥師藥局,新北市新莊區後港一路６９號１樓,(02)22042119,23,0,2020/04/13 15:59:34
5931068875,旭生藥局,新北市新莊區裕民街４２號１樓,(02)29021289,1422,170,2020/04/13 15:59:34
5931068884,樂寶兒藥局,新北市新莊區中正路８２－２號１樓,(02)0229900185,18,0,2020/04/13 15:59:34
5931068973,富安藥局,新北市新莊區復興路１段２５號－１，２樓,(02)22767620,2,4,2020/04/13 15:59:34
5931068991,新莊健業藥局,新北市新莊區昌平街３７號１樓至２樓,(02)22798808,153,0,2020/04/13 15:59:34
5931069265,錦安藥局,新北市新莊區民安路２０１號１樓,(02)22011242,805,6,2020/04/13 15:59:34
5931069274,微笑埔銓藥局,新北市新莊區中平路７７號,(02)29901680,72,15,2020/04/13 15:59:34
5931069363,明亮藥局,新北市新莊區幸福路５１１號１樓,(02)29962671,0,1,2020/04/13 15:59:34
5931069498,新杏藥局,新北市新莊區新泰路９９號１樓,(02)22011012,693,0,2020/04/13 15:59:34
5931069532,聯盟藥局,新北市新莊區中港路２６７巷１號１樓,(02)29941168,41,5,2020/04/13 15:59:34
5931069569,心安藥局,新北市新莊區新泰路１９３號２樓,(02)22779773,0,289,2020/04/13 15:59:34
5931069765,健業藥妝藥局,新北市新莊區中和街１３０號１樓,(02)22796279,1097,182,2020/04/13 15:59:34
5931069792,宏泰藥局,新北市新莊區自信街３７號１樓,(02)29964649,657,0,2020/04/13 15:59:34
593106A011,八德藥局,新北市新莊區八德街３號２樓,(02)22071315,831,0,2020/04/13 15:59:34
593106A020,紅豆藥局,新北市新莊區龍安路７８號１樓,(02)29047700,0,5,2020/04/13 15:59:34
593106A039,大仁藥局,新北市新莊區公園一路３２號１樓,(02)22776023,447,0,2020/04/13 15:59:34
593106A137,力源藥局,新北市新莊區復興路２段１３３號１樓,(02)89929919,45,0,2020/04/13 15:59:34
593106A155,日榮藥局,新北市新莊區龍安路４６１號１樓,(02)22051523,0,7,2020/04/13 15:59:34
593106A182,和昌藥局,新北市新莊區中安街１５號１樓,(02)29900669,1107,141,2020/04/13 15:59:34
593106A226,詠康聯合藥局,新北市新莊區中榮街６６巷１號１樓,(02)29964436,1062,420,2020/04/13 15:59:34
593106A244,巧心藥局,新北市新莊區建中街９２號１樓,(02)22778584,2,0,2020/04/13 15:59:34
593106A324,向日葵健保藥局,新北市新莊區建福路５０號１樓,(02)22060377,26,0,2020/04/13 15:59:34
593106A351,平安藥局,新北市新莊區民安西路６０號２樓,(02)22082368,5,5,2020/04/13 15:59:34
593106A379,輔大美康藥局,新北市新莊區中正路５１０號之１，１樓,(02)29013056,0,10,2020/04/13 15:59:34
593106A388,元大藥局,新北市新莊區富國路２０４號１、２樓,(02)22020082,672,0,2020/04/13 15:59:34
593106A477,喜悅藥局,新北市新莊區後港一路５５號１樓,(02)22047442,414,20,2020/04/13 15:59:34
593106A520,臻善美藥局,新北市新莊區幸福路７８６號１樓,(02)89914303,0,2008,2020/04/13 15:59:34
593106A566,一心春天藥局,新北市新莊區中和街１３號１樓、地下室,(02)89929482,1395,90,2020/04/13 15:59:34
593106A584,記安大藥局,新北市新莊區天祥街４６號１樓,(02)22095331,1179,10,2020/04/13 15:59:34
593106A628,中原藥局,新北市新莊區中原路９３號１樓,(02)89920668,90,0,2020/04/13 15:59:34
593106A637,薇妮藥妝藥局,新北市新莊區民安路９９號１樓,(02)82010817,432,20,2020/04/13 15:59:34
593106A646,薇妮雙鳳藥局,新北市新莊區雙鳳路２１號１樓,(02)29076993,72,20,2020/04/13 15:59:34
593106A691,大樹新莊藥局,新北市新莊區新泰路５９號１、２樓,(02)22010566,4,0,2020/04/13 15:59:34
593106A735,樂家藥局,新北市新莊區中平路２７３號１樓,(02)29960723,10,0,2020/04/13 15:59:34
593106A762,新康健保藥局,新北市新莊區自立街１７２號１樓,(02)29962558,18,0,2020/04/13 15:59:34
593106A771,新佑康健保藥局,新北市新莊區中華路１段３５號１樓,(02)29947490,180,40,2020/04/13 15:59:34
593106A806,北安藥妝健康廣場佳康藥局,新北市新莊區雙鳳路２７號１樓，２樓,(02)29069899,9,30,2020/04/13 15:59:34
593106A842,鼎極藥局,新北市新莊區民安西路３７６號之１、之３（１樓）,(02)22073228,881,0,2020/04/13 15:59:34
593106A851,躍獅新豐藥局,新北市新莊區豐年街１６號１樓,(02)22058055,3,0,2020/04/13 15:59:34
593106A860,新莊至誠藥局,新北市新莊區中平路２９號２樓,(02)29980345,2,0,2020/04/13 15:59:34
593106A897,陽光豐年藥局,新北市新莊區豐年街１４號１樓,(02)22060665,18,0,2020/04/13 15:59:34
593106A913,洋欣藥局,新北市新莊區中平路２７７號１樓及夾層,(02)89927489,0,3,2020/04/13 15:59:34
593106A922,德翰藥局,新北市新莊區四維路１７１巷１、３號１樓,(02)22025576,900,0,2020/04/13 15:59:34
593106A940,樂福藥局,新北市新莊區幸福路４８號１樓,(02)29923388,288,0,2020/04/13 15:59:34
593106A959,新莊大藥局,新北市新莊區福壽街１３０號１樓,(02)29933885,0,1,2020/04/13 15:59:34
5931070142,江藥局,新北市樹林區日新街１０２號１樓,(02)26828001,6,629,2020/04/13 15:59:34
5931070348,久青藥局,新北市樹林區東華街３３號,(02)86844326,0,4,2020/04/13 15:59:34
5931071523,蔚海藥局,新北市樹林區鎮前街１７號１樓,(02)86754203,6,0,2020/04/13 15:59:34
5931071658,大慶藥局,新北市樹林區鎮前街４２－１號,(02)26759212,2,2,2020/04/13 15:59:34
5931071836,弘昌藥師藥局,新北市樹林區保安街１段６５號１樓,(02)26871276,24,0,2020/04/13 15:59:34
