醫事機構代碼,醫事機構名稱,醫事機構地址,醫事機構電話,成人口罩剩餘數,兒童口罩剩餘數,來源資料時間
5901013371,玖田藥局,臺北市松山區八德路４段６５５號,(02)27666578,3,425,2020/09/20 08:53:35
5901162173,小明藥局,臺北市北投區中央南路１段６９號２樓,(02)28928950,702,350,2020/09/20 08:53:35
5901163527,理得藥局,臺北市北投區石牌路１段１５０號,(02)28289680,4,370,2020/09/20 08:53:35
5902040087,世詠藥局,高雄市楠梓區楠都東街１３８號,(07)3539869,552,1357,2020/09/20 08:53:35
5902050154,杏安藥局,高雄市三民區十全一路91 號,(07)3111606,389,760,2020/09/20 08:53:35
5902051240,明皇藥局,高雄市三民區寶國里義華路１８１號,(07)3860121,2313,927,2020/09/20 08:53:35
5902080376,政德藥局,高雄市苓雅區正大里武廟路２９號,(07)7114371,252,1220,2020/09/20 08:53:35
5903090116,上宇藥局,臺中市潭子區中山路２段３８１號１樓,(04)25321258,945,1005,2020/09/20 08:53:35
5903270570,百富藥局,臺中市西屯區福上巷１６號,(04)22970708,857,852,2020/09/20 08:53:35
5905050094,建昌藥局佳里店,臺南市佳里區光復路３７１號,(06)7221369,540,190,2020/09/20 08:53:35
5905290025,義德藥局,臺南市關廟區關廟里忠孝街７號,(06)5954061,298,811,2020/09/20 08:53:35
5907310173,安健藥局,高雄市楠梓區鳳楠路２５０號,(07)3520167,3315,1464,2020/09/20 08:53:35
5907340046,銘益藥局,高雄市前金區七賢二路２０８、２１０號１樓,(07)2853107,839,188,2020/09/20 08:53:35
5907360226,順康健保藥局,高雄市前鎮區一心二路６７號,(07)5364438,1183,1006,2020/09/20 08:53:35
5911051409,順豐藥局,基隆市中山區中華路４號,(02)24369176,2178,727,2020/09/20 08:53:35
5917030388,富永藥局,臺中市西區三民西路１６１號,(04)23714681,0,630,2020/09/20 08:53:35
5917030646,華隆藥局,臺中市西區樂群街６之２號,(04)22243785,1341,1020,2020/09/20 08:53:35
5917060331,宏吉藥局,臺中市西屯區大福里長安路二段３１６號１樓,(04)22910825,1296,1100,2020/09/20 08:53:35
5917081170,順天大藥局,臺中市北屯區中清路二段２３２號１樓,(04)22918847,1760,0,2020/09/20 08:53:35
5921042289,公園店菁安藥局,臺南市北區公園路６１１號,(06)2834488,0,350,2020/09/20 08:53:35
5922010441,穎川保健藥局,嘉義市東區仁武里中山路２０４號,(05)2223609,1159,484,2020/09/20 08:53:35
5922013031,德昌藥局,嘉義市東區中央里吳鳳北路２１１號,(05)2280306,1992,1236,2020/09/20 08:53:35
592202A349,力健藥局,嘉義市西區文化路５９１號,(05)2323217,1013,765,2020/09/20 08:53:35
5931025236,祐銘藥局,新北市三重區龍門路２２號１樓,(02)29769001,2939,882,2020/09/20 08:53:35
5931071774,澤安藥師藥局,新北市樹林區保安二街２６號１樓,(02)26872764,496,120,2020/09/20 08:53:35
5931071934,樹新藥局,新北市樹林區樹新路３０－３號１樓,(02)26821080,2115,320,2020/09/20 08:53:35
5932023432,敏康藥局,桃園市中壢區福德路３４號之１樓,(03)4611961,720,1040,2020/09/20 08:53:35
5932023450,環中藥局,桃園市中壢區環中東路１８１號,(03)4618873,1651,679,2020/09/20 08:53:35
5932029934,康和藥局,桃園市中壢區中光路５３號一樓,(03)4253281,595,739,2020/09/20 08:53:35
5932052531,竹康藥師藥局,桃園市蘆竹區大竹路５２５號,(03)3139657,1018,0,2020/09/20 08:53:35
5932060088,銘方大藥局,桃園市大園區大園里中華路３２號,(03)3865077,630,700,2020/09/20 08:53:35
5932060168,永固安藥局,桃園市大園區中山南路五六號,(03)3867233,666,140,2020/09/20 08:53:35
5933080119,建仁藥局,新竹縣新豐鄉建興路一段１２２號,(03)5595850,1611,190,2020/09/20 08:53:35
5934010086,圓滿堂藥局,宜蘭縣宜蘭市中山路３段４８號,(03)9323413,1416,0,2020/09/20 08:53:35
5934012366,熊賀大藥局,宜蘭縣宜蘭市女中路３段２６號,(03)9352950,1506,0,2020/09/20 08:53:35
5934022013,康莊藥局,宜蘭縣羅東鎮康樂巷１號,(03)9553168,3618,120,2020/09/20 08:53:35
5936010280,快安藥局,臺中市豐原區三豐路一段２０５號,(04)25228169,2613,404,2020/09/20 08:53:35
5936020080,仁生藥局,臺中市東勢區東安里豐勢路４２１號,(04)25872245,81,100,2020/09/20 08:53:35
593620A891,御和藥局,臺中市大里區東興里益民路二段３２３號,(04)24821555,1764,410,2020/09/20 08:53:35
5937071385,正益藥局,彰化縣田中鎮北路里新福路５３巷１３號１樓,(04)8761001,1881,1241,2020/09/20 08:53:35
5937140018,民生藥局,彰化縣芬園鄉社口村彰南路４段１１３號,(049)2522595,3,882,2020/09/20 08:53:35
5937140054,正明藥局,彰化縣芬園鄉茄荖村芬草路一段２７３號,(049)2523918,2969,1236,2020/09/20 08:53:35
5937201061,長春藥局,彰化縣二水鄉文化村光文路１０３號,(04)8795289,1761,1021,2020/09/20 08:53:35
5938020104,新仁壽藥局,南投縣埔里鎮南門里南榮路１３號１樓,(049)2983210,279,906,2020/09/20 08:53:35
5939012133,鎮東藥局,雲林縣斗六市中華路４６０號,(05)5332449,2385,380,2020/09/20 08:53:35
5939012455,禾民藥局,雲林縣斗六市民生南路７３號,(05)5342486,1239,769,2020/09/20 08:53:35
5939021392,南安藥局,雲林縣斗南鎮南昌路１３７號１樓,(05)5952777,1098,325,2020/09/20 08:53:35
5939031585,利芳藥局,雲林縣虎尾鎮光復路３１０號,(05)6311016,2330,593,2020/09/20 08:53:35
5939091170,西河藥局,雲林縣莿桐鄉饒平村饒平路１０２號,(05)5842950,1691,493,2020/09/20 08:53:35
5939110027,清華藥局,雲林縣二崙鄉崙東村中山路一段２８４號,(05)5982438,1047,638,2020/09/20 08:53:35
5939130010,瀧升藥局,雲林縣麥寮鄉麥豐村中正路１０３號,(05)6933880,916,720,2020/09/20 08:53:35
5939130029,見春藥局,雲林縣麥寮鄉橋頭村仁德路７４號,(05)6912265,2446,1129,2020/09/20 08:53:35
5939131151,三芳藥局,雲林縣麥寮鄉橋頭村仁德路１７６號,(05)6911053,1215,1175,2020/09/20 08:53:35
5939191139,寶健藥局,雲林縣口湖鄉梧南村光明路１７２號,(05)7907453,2299,793,2020/09/20 08:53:35
5940111469,嘉安藥局,嘉義縣太保市麻寮里中山路２段４６號,(05)2387670,0,52,2020/09/20 08:53:35
5941040012,杏林藥局,臺南市麻豆區晉江里興中路１３６號,(06)5722692,2413,1475,2020/09/20 08:53:35
5941041297,台灣藥局,臺南市麻豆區信義路１１之１３號,(06)5726126,927,1420,2020/09/20 08:53:35
5941051453,佳佳藥局,臺南市佳里區中山路３８６號,(06)7227639,1664,1340,2020/09/20 08:53:35
5941200045,慶豐綜合藥局,臺南市新市區新和里民生路５７號,(06)5014888,1116,570,2020/09/20 08:53:35
5941270109,振裕藥局,臺南市仁德區二行里二行一路１６５號,(06)2661478,1095,1008,2020/09/20 08:53:35
5941310715,都都藥局,臺南市永康區中山南路１２８號,(06)2314815,2175,929,2020/09/20 08:53:35
5942013260,辰好藥局,高雄市鳳山區中山東路２８１號,(07)7027064,61,305,2020/09/20 08:53:35
5942021726,天德藥局,高雄市岡山區碧紅里中山北路３９號,(07)6230111,819,0,2020/09/20 08:53:35
5943010665,中美藥局,屏東縣屏東市扶風里林森路４５號,(08)7348697,1660,970,2020/09/20 08:53:35
5943013648,信安藥局,屏東縣屏東市金泉里漢口街１１號,(08)7322332,2541,645,2020/09/20 08:53:35
5943161121,永明藥局,屏東縣枋寮鄉安樂村中山路１１９－１號,(08)8781481,1817,1408,2020/09/20 08:53:35
5945011795,晉嘉藥局,花蓮縣花蓮市明禮路７１之８號,(03)8347329,2142,804,2020/09/20 08:53:35
5990010515,大賀藥局,金門縣金城鎮北門里民生路３號,(082)327678,324,0,2020/09/20 08:53:35
