醫事機構代碼,醫事機構名稱,醫事機構地址,醫事機構電話,成人口罩剩餘數,兒童口罩剩餘數,來源資料時間
5902080376,政德藥局,高雄市苓雅區正大里武廟路２９號,(07)7114371,1980,280,2020/09/27 07:23:53
5933080119,建仁藥局,新竹縣新豐鄉建興路一段１２２號,(03)5595850,1584,150,2020/09/27 07:23:53
5936090171,信源藥局,臺中市潭子區潭北里潭子街三段３９號,(04)25367233,1539,0,2020/09/27 07:23:53
5937060088,合生大藥局,彰化縣溪湖鎮湖東里員鹿路二段４０６號,(04)8851560,2754,310,2020/09/27 07:23:53
5939130029,見春藥局,雲林縣麥寮鄉橋頭村仁德路７４號,(05)6912265,4248,450,2020/09/27 07:23:53
5941051453,佳佳藥局,臺南市佳里區中山路３８６號,(06)7227639,4140,370,2020/09/27 07:23:53
5943012445,家安藥師藥局,屏東縣屏東市廣東路７４７號,(08)7354236,3095,299,2020/09/27 07:23:53
5945010289,易生藥局,花蓮縣花蓮市中正路４４３號,(03)8322927,3158,298,2020/09/27 07:23:53
