醫事機構代碼,醫事機構名稱,醫事機構地址,醫事機構電話,成人口罩剩餘數,兒童口罩剩餘數,來源資料時間
5905320644,崇善藥局,臺南市東區崇善路３９２號１樓,(06)2896619,0,80,2020/04/12 15:59:37
5905320653,東門台安藥局,臺南市東區中華東路三段２號１樓,(06)2904377,3,0,2020/04/12 15:59:37
5905320662,台南鼎澄藥局,臺南市東區崇明路二十街１３號１樓,(06)2908855,0,156,2020/04/12 15:59:37
5905320680,晏佑藥局,臺南市東區崇善路４３８－１號１樓,(06)3358668,0,4,2020/04/12 15:59:37
5905320699,恆大藥局,臺南市東區崇明路５９０號１樓,(06)2905586,6,2,2020/04/12 15:59:37
5905320715,令和藥局,臺南市東區崇善路２６９號１樓,(06)2673578,2,50,2020/04/12 15:59:37
5905320733,大樹大同藥局,臺南市東區大同路二段２２７、２２９號１樓,(06)2158700,195,204,2020/04/12 15:59:37
5905320742,榮記藥健康藥局,臺南市東區成大里育樂街１５６－４號底層,(06)2760588,1181,118,2020/04/12 15:59:37
5905320751,倍加藥局,臺南市東區東門路一段２５５號１樓,(06)2364173,15,0,2020/04/12 15:59:37
5905330024,聖安健保藥局,臺南市南區健康路二段１７３號１樓,(06)2916898,1455,0,2020/04/12 15:59:37
5905330097,千越藥局,臺南市南區金華路二段２４７號,(06)2910303,7,4,2020/04/12 15:59:37
5905330113,進祥藥局,臺南市南區文南里健康路２段３４２－１號１樓,(06)2630571,0,288,2020/04/12 15:59:37
5905330140,亮潔藥師藥局,臺南市南區廣州里金華路２段３４４號,(06)2217306,6,6,2020/04/12 15:59:37
5905330220,合樂藥局,臺南市南區灣裡路３０９號,(06)2625016,166,0,2020/04/12 15:59:37
5905330239,宏祐健保藥局,臺南市南區新孝路５９號,(06)2632580,0,2,2020/04/12 15:59:37
5905330284,大樹佳華藥局,臺南市南區金華路二段１２９號１樓,(06)2641238,4,0,2020/04/12 15:59:37
5905330300,思元藥局,臺南市南區金華路一段４８６號１樓,(06)2632377,864,610,2020/04/12 15:59:37
5905340011,日日康藥局,臺南市中西區武聖路１３７號,(06)2595259,1,29,2020/04/12 15:59:37
5905340057,福氣藥局,臺南市中西區民族路三段１７９號１樓,(06)222,0,563,2020/04/12 15:59:37
5905340075,麗欣健保藥局,臺南市中西區永華路一段１９４號１樓,(06)2209393,0,169,2020/04/12 15:59:37
5905340137,全心藥局,臺南市中西區青年里民權路一段２５３號１樓,(06)2217536,0,6,2020/04/12 15:59:37
5905340164,田邊藥局,臺南市中西區中正路２３６號,(06)2200106,5,3,2020/04/12 15:59:37
5905340226,楊藥局,臺南市中西區西和路３３號１樓,(06)2806353,0,2,2020/04/12 15:59:37
5905340235,人人藥局,臺南市中西區和緯路５段１９７號１樓,(06)3583668,0,905,2020/04/12 15:59:37
5905340253,永華台安藥局,臺南市中西區永華路一段１８４、１８４－１號１、２、３樓,(06)2225531,280,21,2020/04/12 15:59:37
5905340262,瑞城藥局,臺南市中西區赤嵌里忠義路二段１７６號１樓,(06)2215810,8,10,2020/04/12 15:59:37
5905340271,南光藥局,臺南市中西區永福路２段７３號１、２樓,(06)2226539,4,0,2020/04/12 15:59:37
5905350017,健盟藥局,臺南市北區北安路一段２０６號１樓,(06)2523988,263,0,2020/04/12 15:59:37
5905350062,嘉星藥師大藥局,臺南市北區開元路３３９號１樓,(06)2093737,7,1,2020/04/12 15:59:37
5905350080,長榮健保藥局,臺南市北區長榮路４段１３９號１樓,(06)2757012,22,451,2020/04/12 15:59:37
5905350099,若安藥局,臺南市北區開元路１０３號１樓,(06)2095666,609,149,2020/04/12 15:59:37
5905350133,大昌藥局,臺南市北區北安路１段１３２號１樓,(06)2519121,406,209,2020/04/12 15:59:37
5905350142,佳佳藥局,臺南市北區開元路３０６－１號,(06)2740783,6,1,2020/04/12 15:59:37
5905350151,公園台安藥局,臺南市北區公園路８４０號,(06)2518402,621,130,2020/04/12 15:59:37
5905350240,健康藥局,臺南市北區長榮路５段２１號,(06)2003078,216,0,2020/04/12 15:59:37
5905350302,旻恩藥局,臺南市北區公園里北門路二段３７－１號,(06)2260590,7,982,2020/04/12 15:59:37
5905350311,美康藥局,臺南市北區公園路３７５－５號,(06)2810311,503,34,2020/04/12 15:59:37
5905350339,育德健康藥局,臺南市北區成德里育德路５３０號,(06)2525360,5,0,2020/04/12 15:59:37
5905350384,北安台安藥局,臺南市北區北安路一段１６３號,(06)2518166,9,0,2020/04/12 15:59:37
5905350428,大正藥局,臺南市北區公園南路３２４號１樓,(06)2226899,99,0,2020/04/12 15:59:37
5905350446,杏一藥局台南成大店,臺南市北區東豐路１５５號,(06)2382747,2220,1241,2020/04/12 15:59:37
5905350464,北海藥局,臺南市北區華德里海安路三段９７２號１樓,(06)2525533,6,0,2020/04/12 15:59:37
5905370135,安南日日康藥局,臺南市安南區安和路五段３３號,(06)3550995,61,0,2020/04/12 15:59:37
5905370144,仁大藥局,臺南市安南區海佃路三段３４６號１樓,(06)2561777,1,0,2020/04/12 15:59:37
5905370206,美家藥局,臺南市安南區安和路一段３５２號１樓,(06)2566006,1548,120,2020/04/12 15:59:37
5905370215,新安和安東藥局,臺南市安南區安東里安和路一段４６８號,(06)2561204,22,0,2020/04/12 15:59:37
5905370297,三多藥師藥局,臺南市安南區溪墘里海佃路一段１９４號１樓,(06)2581189,0,9,2020/04/12 15:59:37
5905370340,保安康藥局,臺南市安南區梅花里安中路一段７９３號１樓,(06)2552586,1008,0,2020/04/12 15:59:37
5905370359,宜康安和藥局,臺南市安南區安和路一段６８號１樓,(06)2521250,42,0,2020/04/12 15:59:37
5905380015,康馥藥局,臺南市安平區華平路５４５-１號,(06)2998328,3,672,2020/04/12 15:59:37
5905380097,宜康永華藥局,臺南市安平區國平里永華路二段７８５號１樓,(06)2930119,1816,0,2020/04/12 15:59:37
5905380122,趙藥師藥局,臺南市安平區安北路３９０號,(06)3915695,162,0,2020/04/12 15:59:37
5905380159,永華藥局,臺南市安平區永華路二段７８７－１號,(06)2953618,4743,0,2020/04/12 15:59:37
5905380195,新高橋藥局台南永華店,臺南市安平區華平路２７９號１樓,(06)2992362,90,0,2020/04/12 15:59:37
5905380248,康富聯合藥局,臺南市安平區華平路６５２號１樓,(06)2971960,0,11,2020/04/12 15:59:37
5907010043,北京藥局文山店,高雄市鳳山區青年路二段３６７號１．２樓,(07)7676766,3,0,2020/04/12 15:59:37
5907010141,維安社區藥局,高雄市鳳山區國富路２５-１號,(07)7630980,0,7,2020/04/12 15:59:37
5907010169,美安藥局,高雄市鳳山區文衡路４３號,(07)7993209,0,26,2020/04/12 15:59:37
5907010178,華美藥局,高雄市鳳山區建國路三段１６１號,(07)7452732,0,2,2020/04/12 15:59:37
5907010212,北京藥局中崙店,高雄市鳳山區中崙四路１６號１樓,(07)7550655,36,0,2020/04/12 15:59:37
5907010267,禾康藥局,高雄市鳳山區瑞竹路１６號１樓,(07)7997139,0,7,2020/04/12 15:59:37
5907010276,愛家社區藥局,高雄市鳳山區福德街１４１號,(07)8123698,540,0,2020/04/12 15:59:37
5907010285,康盈藥局,高雄市鳳山區鳳林路２６０號１樓,(07)7820968,0,2,2020/04/12 15:59:37
5907010365,科健藥局,高雄市鳳山區八德路２４６－５號１樓,(07)7777868,5,0,2020/04/12 15:59:37
5907010409,好郝藥局,高雄市鳳山區武松里經武路１７８號１樓,(07)7468840,9,0,2020/04/12 15:59:37
5907010427,好郝藥局鳳林店,高雄市鳳山區誠智里鳳林路２９０號,(07)7869188,3,0,2020/04/12 15:59:37
5907010454,上泰健保藥局,高雄市鳳山區鎮西里中華街２７號１樓,(07)7455127,0,9,2020/04/12 15:59:37
5907010641,美好藥局,高雄市鳳山區文德里文龍路２５號１樓,(07)7677774,3,0,2020/04/12 15:59:37
5907010810,志全藥局,高雄市鳳山區五福里五甲三路１２１巷１號,(07)7688986,1,3,2020/04/12 15:59:37
5907010883,大樹五甲藥局,高雄市鳳山區福祥里五甲三路２４號１樓及２樓、２６號１樓及２樓,(07)8224926,18,0,2020/04/12 15:59:37
5907010936,鳳山全民藥局,高雄市鳳山區中正里瑞興路３８０巷８號,(07)7037078,1171,586,2020/04/12 15:59:37
5907010945,光田藥局,高雄市鳳山區鎮東里光遠路９５號１樓,(07)7460773,0,4,2020/04/12 15:59:37
5907010963,喬生藥局,高雄市鳳山區文福里文建街１７８、１８０號,(07)7803366,54,8,2020/04/12 15:59:37
5907010981,康是美五甲藥局,高雄市鳳山區鎮南里五甲二路７５２號１至２樓、７５４號１至２樓,(07)8121586,1791,0,2020/04/12 15:59:37
5907011004,永豐久億藥局,高雄市鳳山區和興里五甲一路１１號１樓,(07)7104281,20,0,2020/04/12 15:59:37
5907011031,德安藥局,高雄市鳳山區文衡里文衡路２９５號１樓,(07)7805249,57,1765,2020/04/12 15:59:37
5907011068,新高橋藥局文龍東店,高雄市鳳山區鎮北里文龍東路３１０號,(07)7353946,3,1,2020/04/12 15:59:37
5907011086,長青連鎖藥局中山西店,高雄市鳳山區忠義里中山西路３７６－７號１樓,(07)7197787,7,0,2020/04/12 15:59:37
5907011095,鳳山五甲藥局,高雄市鳳山區正義里五甲二路１３９號１樓,(07)7269899,6,0,2020/04/12 15:59:37
5907011111,壹然藥局,高雄市鳳山區中正里瑞興路４８２號１樓,(07)7014755,0,7,2020/04/12 15:59:37
5907011166,佑全鳳山藥局,高雄市鳳山區文德里青年路二段４６３號１－２樓,(07)7801568,0,4,2020/04/12 15:59:37
5907011175,鳳西藥局,高雄市鳳山區忠義里中山西路２３８號１樓,(07)7902717,16,0,2020/04/12 15:59:37
5907011184,肉豆公藥局南榮店,高雄市鳳山區善美里南榮路１６９號１樓,(07)7278385,0,2,2020/04/12 15:59:37
5907011264,新高橋藥局青年店,高雄市鳳山區文衡里青年路二段２８９號１樓,(07)7676179,108,20,2020/04/12 15:59:37
5907011273,鳳山服安藥局,高雄市鳳山區忠義里中山西路３８０號１樓,(07)7406330,0,10,2020/04/12 15:59:37
5907011291,桂林活力藥師藥局鳳山店,高雄市鳳山區中正里瑞興路４８８號１樓,(07)7012827,191,2,2020/04/12 15:59:37
5907011317,凱旋藥局,高雄市鳳山區國隆里新富路３７３號１樓,(07)7671181,21,0,2020/04/12 15:59:37
5907011335,杏樹林藥局,高雄市鳳山區中和里自由路４３０號,(07)7101118,1109,0,2020/04/12 15:59:37
5907011344,佳恩藥局,高雄市鳳山區和德里中山路７５－１號,(07)7460297,336,0,2020/04/12 15:59:37
5907020021,柏康藥局,高雄市岡山區壽天路２２號,(07)6241688,8,0,2020/04/12 15:59:37
5907030072,旗美藥局,高雄市旗山區東平里延平二路４１號,(07)6629839,0,8,2020/04/12 15:59:37
5907030107,大同藥局,高雄市旗山區大德里大同街１３號１樓,(07)6611336,0,64,2020/04/12 15:59:37
5907040023,大佳藥局,高雄市美濃區獅山里中華路５９－７號,(07)6852988,6,0,2020/04/12 15:59:37
5907050010,新朋友藥師連鎖藥局,高雄市林園區東林東路４４號,(07)6460588,1676,0,2020/04/12 15:59:37
5907050056,晉升益藥局,高雄市林園區文賢里沿海路３段１５０號１樓,(07)6425665,0,2,2020/04/12 15:59:37
5907050065,林園啄木鳥藥局,高雄市林園區鳳林路二段８０３號１樓,(07)6414772,3,0,2020/04/12 15:59:37
5907060043,永成專業藥師藥局,高雄市大寮區中興里鳳林四路６２號,(07)7816221,0,3,2020/04/12 15:59:37
5907060098,佳和健保藥局,高雄市大寮區鳳林三路５１２號,(07)7821500,6,2,2020/04/12 15:59:37
5907060132,大承藥局,高雄市大寮區鳳屏一路４６６號１樓,(07)7013225,7,0,2020/04/12 15:59:37
5907060187,桂林活力藥師藥局鳳林店,高雄市大寮區山頂里鳳林三路８２３˙８２５號１樓,(07)7810101,537,100,2020/04/12 15:59:37
5907060212,仁德健保藥局,高雄市大寮區內坑里仁德新村１號１樓,(07)7885003,7,118,2020/04/12 15:59:37
5907060221,淑德健保藥局,高雄市大寮區內坑里淑德新村１號３樓,(07)7923556,972,100,2020/04/12 15:59:37
5907070012,舒康藥師藥局,高雄市大樹區久堂路１２９號,(07)6520268,2,0,2020/04/12 15:59:37
5907070021,大和藥局,高雄市大樹區久堂路１４９號,(07)6526412,0,3,2020/04/12 15:59:37
5907080081,英祥連鎖藥局仁雄店,高雄市仁武區仁雄路３６之２號,(07)3722509,117,0,2020/04/12 15:59:37
5907080125,仁武丁丁藥局,高雄市仁武區仁和里鳳仁路２１之８號,(07)3721896,0,4,2020/04/12 15:59:37
5907080170,鴻州藥局,高雄市仁武區八卦里八德西路２２９８號１樓,(07)3752888,32,6,2020/04/12 15:59:37
5907080189,德昌藥局仁雄店,高雄市仁武區灣內里仁雄路３８、３８－１、３８－２號,(07)3749166,54,0,2020/04/12 15:59:37
5907080214,新高橋藥局八德中店,高雄市仁武區八卦里八德中路８６、８８、９０號,(07)3485857,642,38,2020/04/12 15:59:37
5907080250,仁同藥局,高雄市仁武區八卦里永仁街７０６號１樓,(07)3736142,0,5,2020/04/12 15:59:37
5907080269,興德昌藥局,高雄市仁武區文武里中華路２３２號,(07)3757005,0,30,2020/04/12 15:59:37
5907080278,博適倫藥局,高雄市仁武區八卦里永仁街２６５號１樓,(07)3755708,932,99,2020/04/12 15:59:37
5907080296,新四季藥局,高雄市仁武區仁慈里仁慈路１９０號１樓,(07)7333606,9,0,2020/04/12 15:59:37
5907090032,上鼎藥師健保藥局,高雄市大社區中山路４２３號,(07)3531053,15,4,2020/04/12 15:59:37
5907090069,德泰健保藥局,高雄市大社區大新路３５之１號１樓,(07)3524296,4,3,2020/04/12 15:59:37
5907090087,安泰專業藥師藥局,高雄市大社區中山路２６７號１樓,(07)3553715,38,0,2020/04/12 15:59:37
5907100088,本館藥局,高雄市鳥松區大華里本館路１９０號１樓,(07)3707655,18,4,2020/04/12 15:59:37
5907110066,安麗兒藥局橋頭店,高雄市橋頭區隆豐路１４８號,(07)6111209,24,0,2020/04/12 15:59:37
5907110075,言安藥局,高雄市橋頭區樹德路６５號,(07)6110719,770,0,2020/04/12 15:59:37
5907110146,民權藥局,高雄市橋頭區橋頭里２８鄰成功路２２７號１樓－２２９號１樓,(07)6113632,3,0,2020/04/12 15:59:37
5907120017,和德藥局燕巢店,高雄市燕巢區西燕里中民路６２８號,(07)6143499,450,100,2020/04/12 15:59:37
5907140019,佑聖健保藥局,高雄市阿蓮區民生路７９號,(07)6321516,0,4,2020/04/12 15:59:37
5907140108,德昌藥局阿蓮店,高雄市阿蓮區阿蓮里中正路４５６號,(07)6318868,0,3,2020/04/12 15:59:37
5907150024,安麗兒藥局路竹店,高雄市路竹區大社路５１號１樓,(07)6071699,15,0,2020/04/12 15:59:37
5907150097,金德昌藥師藥局,高雄市路竹區大社路９０之６號,(07)6978143,8,0,2020/04/12 15:59:37
5907150202,永昌藥局,高雄市路竹區延平路８１號,(07)6964321,7,5,2020/04/12 15:59:37
5907150248,宗明藥局路竹店,高雄市路竹區中正路１０６－１號１樓,(07)6962391,0,5,2020/04/12 15:59:37
5907160020,振裕藥局,高雄市湖內區逸賢里保生路５５３號,(07)6995796,0,5,2020/04/12 15:59:37
5907160039,華安藥局,高雄市湖內區中山路一段４５１－１９號,(07)6938208,6,0,2020/04/12 15:59:37
5907160048,吉成藥局,高雄市湖內區太爺里中正路１段１２號,(07)6993681,0,717,2020/04/12 15:59:37
5907160075,安麗兒藥局東方店,高雄市湖內區湖東里東方路９０號,(07)6936029,232,0,2020/04/12 15:59:37
5907200047,永恒健康生活藥局,高雄市梓官區智蚵里通安路１７６號１樓,(07)6102755,1779,205,2020/04/12 15:59:37
5907200065,復安堂藥局,高雄市梓官區信蚵里廣澤路２號１樓,(07)6103147,3,0,2020/04/12 15:59:37
5907210016,東冠健保藥局,高雄市六龜區太平路５號１樓,(07)6891852,0,141,2020/04/12 15:59:37
5907210034,大晉藥局,高雄市六龜區義寶里太平路１１６號,(07)6894951,2945,596,2020/04/12 15:59:37
5907230018,立康健保藥師藥局,高雄市杉林區上平里山仙路８０號,(07)6773353,123,192,2020/04/12 15:59:37
5907240014,博林健保藥局,高雄市內門區觀亭里中正路１６０巷５１號,(07)6671883,7,504,2020/04/12 15:59:37
5907290050,新高橋藥局裕明店,高雄市鼓山區裕誠路１６８０號,(07)5224680,0,1,2020/04/12 15:59:37
5907290121,柏順藥局,高雄市鼓山區龍德路１０６巷３０、３２號,(07)5559567,0,4,2020/04/12 15:59:37
5907290158,美館久億藥局,高雄市鼓山區美術東二路２４５、２４７號,(07)5227762,342,0,2020/04/12 15:59:37
5907290176,為安藥局,高雄市鼓山區九如四路９５９號,(07)5212912,1,1,2020/04/12 15:59:37
5907290201,開心藥局,高雄市鼓山區中華一路９４８號,(07)5555572,8,1,2020/04/12 15:59:37
5907290229,芳博藥局,高雄市鼓山區明倫路４５６號,(07)5501173,3,0,2020/04/12 15:59:37
5907290265,新美館藥局,高雄市鼓山區中華一路９７２號,(07)5522006,12,0,2020/04/12 15:59:37
5907290274,明誠丁丁藥局,高雄市鼓山區明誠三路４６５號,(07)5520120,9,0,2020/04/12 15:59:37
5907300088,神農健保藥局,高雄市左營區重和路１１７號,(07)3418228,1122,13,2020/04/12 15:59:37
5907300177,人尚大藥局,高雄市左營區榮總路１０９號１樓,(07)3100000,0,5,2020/04/12 15:59:37
5907300211,勁好健保藥局,高雄市左營區果峰街１２巷２６號１樓,(07)5855767,3,0,2020/04/12 15:59:37
5907300239,左野藥局,高雄市左營區崇德路２２２號,(07)3486883,55,1,2020/04/12 15:59:37
5907300300,宜康健保藥局,高雄市左營區翠華路６０１巷４０號,(07)5889919,7,3,2020/04/12 15:59:37
5907300319,士凱藥局,高雄市左營區孟子路１７８號,(07)3430257,54,0,2020/04/12 15:59:37
5907300588,明禾藥局,高雄市左營區華夏路１７３２號１樓,(07)3493734,6,7,2020/04/12 15:59:37
5907300686,左營自由藥局,高雄市左營區自由二路３５０、３５０－１號,(07)5589991,6,4,2020/04/12 15:59:37
5907300702,禾順左營藥局,高雄市左營區自由三路４１０號２樓,(07)3592582,8,0,2020/04/12 15:59:37
5907300711,富元聯合健康藥局,高雄市左營區博愛三路３７號,(07)3488585,900,220,2020/04/12 15:59:37
5907300766,悠仁藥局,高雄市左營區自由三路１７０號,(07)3457979,7,4,2020/04/12 15:59:37
5907300784,新高橋藥局博正店,高雄市左營區忠言路１８０號,(07)5509810,6,9,2020/04/12 15:59:37
5907300819,志全藥局,高雄市左營區富國路１６８號１樓,(07)5568217,27,0,2020/04/12 15:59:37
5907300855,新高橋藥局裕誠店,高雄市左營區裕誠路２９１號１樓,(07)5573857,130,0,2020/04/12 15:59:37
5907300891,新高橋藥局華夏店,高雄市左營區華夏路１１１０號,(07)3410915,125,5,2020/04/12 15:59:37
5907300917,左營藥局,高雄市左營區華夏路３２５號,(07)5501017,591,0,2020/04/12 15:59:37
5907310173,安健藥局,高雄市楠梓區鳳楠路２５０號,(07)3520167,12,0,2020/04/12 15:59:37
5907310235,新興藥局,高雄市楠梓區後昌路８７號,(07)3629735,34,0,2020/04/12 15:59:37
5907310271,漢宏健保藥局,高雄市楠梓區加宏路９７號,(07)3626086,1,0,2020/04/12 15:59:37
5907310280,光玉藥局,高雄市楠梓區德民路１００６－５號,(07)3659555,2,0,2020/04/12 15:59:37
5907310306,大雄藥局,高雄市楠梓區德民路１６６號,(07)3643290,896,3,2020/04/12 15:59:37
5907310315,小太陽康健藥局,高雄市楠梓區德民路９９３號１－２樓,(07)3635808,1,5,2020/04/12 15:59:37
5907310342,楠梓久億藥局,高雄市楠梓區德祥路２２１號,(07)3657099,63,0,2020/04/12 15:59:37
5907310351,惠民楠梓藥局,高雄市楠梓區建楠路２１７號,(07)3521896,346,16,2020/04/12 15:59:37
5907310360,百康藥局,高雄市楠梓區右昌街４１６號,(07)3601281,153,3,2020/04/12 15:59:37
5907310379,德昌藥局,高雄市楠梓區德賢路２１５號,(07)3619998,13,6,2020/04/12 15:59:37
5907320062,大豐藥局,高雄市三民區大豐一路４７１號,(07)3980133,4,3,2020/04/12 15:59:37
5907320133,莊敬藥局,高雄市三民區大昌一路２８號,(07)3976079,0,2,2020/04/12 15:59:37
5907320179,新高橋藥局天祥店,高雄市三民區天祥一路１１７號,(07)3102683,1,3,2020/04/12 15:59:37
5907320259,明誠藥局,高雄市三民區明誠一路１７２號,(07)3108636,0,2,2020/04/12 15:59:37
5907320302,新高橋藥局明誠店,高雄市三民區明誠一路４９２號,(07)3107072,10,1,2020/04/12 15:59:37
5907320419,大林藥局,高雄市三民區大昌一路１７０－１號,(07)3833593,6,4,2020/04/12 15:59:37
5907320428,東京藥局,高雄市三民區建工路６８５號,(07)3874567,17,0,2020/04/12 15:59:37
5907320464,建元健保藥局,高雄市三民區興昌街８３巷９號,(07)3927865,5,3,2020/04/12 15:59:37
5907320535,康誠藥局,高雄市三民區建工路６１６號,(07)3893889,22,0,2020/04/12 15:59:37
5907320553,三民明誠藥局,高雄市三民區明誠一路５００號１、２Ｆ５０２號,(07)3493137,5,4,2020/04/12 15:59:37
5907320562,康威藥局,高雄市三民區九如二路３０１號,(07)3223189,504,0,2020/04/12 15:59:37
5907320571,德安藥局,高雄市三民區陽明路８３號,(07)3970323,5,0,2020/04/12 15:59:37
5907320633,勁康健保藥局,高雄市三民區義華路４０２號１樓,(07)3966716,7,0,2020/04/12 15:59:37
5907320688,惠川藥局,高雄市三民區文安南街７８號,(07)7806618,5,14,2020/04/12 15:59:37
5907320697,鄰好藥師藥局,高雄市三民區褒揚街２８７號,(07)3909589,693,0,2020/04/12 15:59:37
5907320704,建工台安藥局,高雄市三民區建工路４９９號之１,(07)3807521,725,54,2020/04/12 15:59:37
5907320740,忠仁藥局,高雄市三民區中都街３５號１樓,(07)3125305,92,58,2020/04/12 15:59:37
5907320768,心樂保健藥局,高雄市三民區光裕路７８號１樓,(07)3855377,3,0,2020/04/12 15:59:37
5907320777,桉家藥師藥局,高雄市三民區明誠一路３９３號,(07)3929732,5,0,2020/04/12 15:59:37
5907320795,建工藥局,高雄市三民區建工路３９６號１樓,(07)3839900,25,0,2020/04/12 15:59:37
5907320802,欣盛藥局,高雄市三民區平等路１０１號１樓,(07)3851377,5,57,2020/04/12 15:59:37
5907320811,力生藥局,高雄市三民區鼎中路１６８號１樓,(07)3105231,0,5,2020/04/12 15:59:37
5907320848,仕康健保藥妝藥局,高雄市三民區建興路２２２號,(07)3845050,63,0,2020/04/12 15:59:37
5907320857,陽明上鼎藥師健保藥局,高雄市三民區陽明路１０１號１樓,(07)3962358,510,0,2020/04/12 15:59:37
5907320875,耀美麗藥局,高雄市三民區中華三路２８３號,(07)2153885,620,0,2020/04/12 15:59:37
5907320900,大昌藥局,高雄市三民區大昌二路３９７號,(07)3961396,171,0,2020/04/12 15:59:37
5907320928,高杏健保藥局,高雄市三民區義華路４３２號,(07)3819918,1696,0,2020/04/12 15:59:37
5907320946,熊安心藥局,高雄市三民區黃興路５３號,(07)3815212,6,2,2020/04/12 15:59:37
5907320955,禾藥局,高雄市三民區博愛一路２２３－１號１樓,(07)3225777,171,0,2020/04/12 15:59:37
5907320964,森心藥局,高雄市三民區自強一路２１６號１樓,(07)2818580,24,315,2020/04/12 15:59:37
5907330031,健美藥局,高雄市新興區復興一路４０之４號,(07)2291108,0,5,2020/04/12 15:59:37
5907330095,林森合豐藥局,高雄市新興區林森一路３７號,(07)2823313,9,18,2020/04/12 15:59:37
5907330148,康園藥局,高雄市新興區六合一路５３－１２號,(07)2372069,1080,90,2020/04/12 15:59:37
5907330166,中正台安藥局,高雄市新興區中山一路１８３號一樓,(07)2856336,3,19,2020/04/12 15:59:37
5907340046,銘益藥局,高雄市前金區七賢二路２０８、２１０號１樓,(07)2853107,73,0,2020/04/12 15:59:37
5907350015,祐安藥局,高雄市苓雅區英明路１４４號,(07)7135577,2,72,2020/04/12 15:59:37
5907350079,吉康藥局,高雄市苓雅區大順三路６５號,(07)2259930,495,832,2020/04/12 15:59:37
5907350177,佳康藥局,高雄市苓雅區建國一路３３４號,(07)2266685,0,60,2020/04/12 15:59:37
5907350300,辰安藥局,高雄市苓雅區青年一路１８５－２號,(07)5365545,15,0,2020/04/12 15:59:37
5907350319,御康藥局,高雄市苓雅區光華一路３５號,(07)3313535,0,6,2020/04/12 15:59:37
5907350328,安杏藥局,高雄市苓雅區四維二路９４－１７號,(07)7511739,55,0,2020/04/12 15:59:37
5907350346,武廟幸福藥局,高雄市苓雅區武廟路３５號,(07)7170085,0,5,2020/04/12 15:59:37
5907350364,興中好藥局,高雄市苓雅區興中二路４１號１樓,(07)3353899,304,62,2020/04/12 15:59:37
5907350417,高杏藥局,高雄市苓雅區大順三路４４號,(07)7277802,0,282,2020/04/12 15:59:37
5907350480,健森藥局,高雄市苓雅區林森二路１３８號１、２樓,(07)3365169,453,177,2020/04/12 15:59:37
5907350499,鑫美健保特約藥局,高雄市苓雅區光華一路１４８－５８號１樓,(07)7715088,1,4,2020/04/12 15:59:37
5907350551,大樹武廟藥局,高雄市苓雅區武廟路４３、４５號１樓,(07)7222268,162,0,2020/04/12 15:59:37
5907350560,成功合豐藥局,高雄市苓雅區成功一路１７０號１樓,(07)2695657,4,0,2020/04/12 15:59:37
5907360048,仙光藥局,高雄市前鎮區瑞隆路３９３號,(07)7253131,9,0,2020/04/12 15:59:37
5907360146,好芳鄰藥局,高雄市前鎮區光華二路２５７號,(07)3318657,8,22,2020/04/12 15:59:37
5907360191,欣欣藥局,高雄市前鎮區翠亨北路５７９號,(07)8124862,5,9,2020/04/12 15:59:37
5907360388,宏安藥局,高雄市前鎮區瑞隆路２４０號１樓,(07)7270100,0,5,2020/04/12 15:59:37
5907360413,益源藥局,高雄市前鎮區草衙二路４１８號,(07)8412120,0,5,2020/04/12 15:59:37
5907360431,佛公健保藥局,高雄市前鎮區后平路２０２號１樓,(07)8317755,0,5,2020/04/12 15:59:37
