醫事機構代碼,醫事機構名稱,醫事機構地址,醫事機構電話,成人口罩剩餘數,兒童口罩剩餘數,來源資料時間
5905280065,微笑藥局,臺南市歸仁區中山路二段１２５號,(06)2397495,2293,1407,2020/04/13 15:59:34
5905280092,元康保健藥局,臺南市歸仁區中山路二段２２９號,(06)2309055,966,0,2020/04/13 15:59:34
5905280118,和雅藥局,臺南市歸仁區民權三街９６號１樓,(06-)2307757,78,0,2020/04/13 15:59:34
5905280136,悅橙歸仁藥局,臺南市歸仁區大通路４３號１樓,(06)2396660,739,0,2020/04/13 15:59:34
5905310068,育安藥局,臺南市永康區中興里中華路２７４號,(06)3116850,0,1505,2020/04/13 15:59:34
5905310157,信仁藥局,臺南市永康區中華西街１４９號,(06)2337755,1726,202,2020/04/13 15:59:34
5905310273,誠康藥局,臺南市永康區中山東路１１３號１樓,(06)3022005,13,6,2020/04/13 15:59:34
5905310291,俐欣藥局,臺南市永康區大仁街２０６號１樓,(06)2050777,1,4,2020/04/13 15:59:34
5905310326,美德生醫藥局,臺南市永康區復國一路４９６號１樓,(06)2030463,9,0,2020/04/13 15:59:34
5905310531,晉大藥局復國店,臺南市永康區復國一路５８２－１號,(06)2025309,459,10,2020/04/13 15:59:34
5905310559,康群藥局,臺南市永康區復國里復華三街７２號,(06)2011839,1,3,2020/04/13 15:59:34
5905310639,美日新藥局,臺南市永康區中正北路６２號,(06)2420980,9,0,2020/04/13 15:59:34
5905310657,昂德藥局,臺南市永康區復華里復國一路１５２號１樓,(06)3121220,92,0,2020/04/13 15:59:34
5905310693,怡德藥局,臺南市永康區中山路１１８號,(06)2325678,486,0,2020/04/13 15:59:34
5905310746,珊瑚藥局,臺南市永康區南灣里大灣路５０３號,(06)2054235,1728,0,2020/04/13 15:59:34
5905310755,德昌藥局永康店,臺南市永康區中華路４６２號,(06)3020628,0,20,2020/04/13 15:59:34
5905310791,三欣藥局,臺南市永康區勝利里小東路４２３巷２號１樓,(06)3125808,0,846,2020/04/13 15:59:34
5905310817,永大啄木鳥藥局,臺南市永康區永大路二段３９７號１樓,(06)2071575,6,8,2020/04/13 15:59:34
5905310826,詠健藥局,臺南市永康區中山路１０２號１樓,(06)2033780,1,2,2020/04/13 15:59:34
5905310835,中華長億藥局,臺南市永康區中華路７３４、７３６號１樓,(06)3022322,4282,0,2020/04/13 15:59:34
5905310880,永東藥局,臺南市永康區中山路５５號１樓,(06)2318700,4,0,2020/04/13 15:59:34
5905310915,杏安心藥局,臺南市永康區六合里中山南路１２－１號１樓,(06)3029067,7,0,2020/04/13 15:59:34
5905310924,永仁藥局,臺南市永康區永大路二段８５號１樓,(06)2730816,2403,203,2020/04/13 15:59:34
5905310951,合佑藥局,臺南市永康區安康里中華路６９５－２號１樓,(06)3020147,574,0,2020/04/13 15:59:34
5905310979,復華藥師藥局,臺南市永康區復興里復華一街１３１號１樓,(06)3123597,756,100,2020/04/13 15:59:34
5905310988,小東藥局,臺南市永康區小東路５７３號１樓,(06)3127169,925,15,2020/04/13 15:59:34
5905310997,新英格蘭藥局,臺南市永康區中華路３９７號１樓,(06)3027648,6,5,2020/04/13 15:59:34
5905311001,和德藥局復國店,臺南市永康區復國里復國一路３３９之７號１樓,(06)2038728,1827,0,2020/04/13 15:59:34
5905311010,樂丞藥局,臺南市永康區中正北路６０號１樓,(06)2433319,0,1,2020/04/13 15:59:34
5905320019,英菩藥局,臺南市東區關聖里富農街二段１０８巷１０號１樓,(06)2606723,135,260,2020/04/13 15:59:34
5905320082,鶴龍健保藥局,臺南市東區林森路一段１９０號１樓,(06)2608225,211,269,2020/04/13 15:59:34
5905320135,安麗兒藥局裕農店,臺南市東區裕農路１００號１樓,(06)2377378,18,0,2020/04/13 15:59:34
5905320180,恩泉藥局,臺南市東區崇明路２０７號１樓,(06)3352078,0,16,2020/04/13 15:59:34
5905320368,巴克禮中西藥局,臺南市東區中華東路三段３７７巷８號１樓,(06-)3361100,2,5,2020/04/13 15:59:34
5905320448,一品健康藥局,臺南市東區崇學里崇學路５０－１號１樓,(06)2896366,7,7,2020/04/13 15:59:34
5905320466,佑全中華藥局,臺南市東區中華東路三段２１５號,(06)2906386,1,0,2020/04/13 15:59:34
5905320475,美生藥局,臺南市東區德高里自由路一段１６１號１樓,(06)2670035,0,43,2020/04/13 15:59:34
5905320484,和信藥局,臺南市東區裕農路２７－１號１樓,(06)2348291,25,0,2020/04/13 15:59:34
5905320537,舒惠藥局,臺南市東區青年路４３２－６號１樓,(06)2087052,0,2,2020/04/13 15:59:34
5905320546,佑丞藥局,臺南市東區中華東路二段１２９號,(06)2902709,6,5,2020/04/13 15:59:34
5905320555,崇明台安藥局,臺南市東區崇明路３０４號,(06)2900350,0,161,2020/04/13 15:59:34
5905320564,杏一台南崇德藥局,臺南市東區崇德路６７４號,(06)2671939,745,0,2020/04/13 15:59:34
5905320608,中華台安藥局,臺南市東區中華東路一段４號１樓,(06)2092622,0,10,2020/04/13 15:59:34
5905320626,禾田聯合藥局,臺南市東區崇明路１９１號１樓,(06)2892393,6,13,2020/04/13 15:59:34
5905320635,晉大藥局,臺南市東區東光里東興路２６４號１樓,(06)2092580,241,2,2020/04/13 15:59:34
5905320662,台南鼎澄藥局,臺南市東區崇明路二十街１３號１樓,(06)2908855,2,0,2020/04/13 15:59:34
5905320680,晏佑藥局,臺南市東區崇善路４３８－１號１樓,(06)3358668,0,4,2020/04/13 15:59:34
5905320699,恆大藥局,臺南市東區崇明路５９０號１樓,(06)2905586,96,32,2020/04/13 15:59:34
5905320715,令和藥局,臺南市東區崇善路２６９號１樓,(06)2673578,2,20,2020/04/13 15:59:34
5905320724,中華崇德藥局,臺南市東區中華東路三段１８１、１８３號１樓,(06)2880800,37,0,2020/04/13 15:59:34
5905320742,榮記藥健康藥局,臺南市東區成大里育樂街１５６－４號底層,(06)2760588,1352,8,2020/04/13 15:59:34
5905320751,倍加藥局,臺南市東區東門路一段２５５號１樓,(06)2364173,204,0,2020/04/13 15:59:34
5905330097,千越藥局,臺南市南區金華路二段２４７號,(06)2910303,7,4,2020/04/13 15:59:34
5905330140,亮潔藥師藥局,臺南市南區廣州里金華路２段３４４號,(06)2217306,6,6,2020/04/13 15:59:34
5905330168,安鑫藥局,臺南市南區大成里健康路一段４１５號１樓,(06)2645955,9,0,2020/04/13 15:59:34
5905330239,宏祐健保藥局,臺南市南區新孝路５９號,(06)2632580,180,12,2020/04/13 15:59:34
5905330275,太子藥局大同店,臺南市南區大同路二段３４８號１樓,(06)2158339,7,0,2020/04/13 15:59:34
5905330284,大樹佳華藥局,臺南市南區金華路二段１２９號１樓,(06)2641238,54,28,2020/04/13 15:59:34
5905330300,思元藥局,臺南市南區金華路一段４８６號１樓,(06)2632377,197,100,2020/04/13 15:59:34
5905330337,千薏台安藥局,臺南市南區金華路二段２號１樓,(06)2638265,206,0,2020/04/13 15:59:34
5905340011,日日康藥局,臺南市中西區武聖路１３７號,(06)2595259,19,9,2020/04/13 15:59:34
5905340020,慶大藥局,臺南市中西區民權路二段１８２號,(06)2251188,7,1,2020/04/13 15:59:34
5905340075,麗欣健保藥局,臺南市中西區永華路一段１９４號１樓,(06)2209393,2,109,2020/04/13 15:59:34
5905340137,全心藥局,臺南市中西區青年里民權路一段２５３號１樓,(06)2217536,0,6,2020/04/13 15:59:34
5905340164,田邊藥局,臺南市中西區中正路２３６號,(06)2200106,5,3,2020/04/13 15:59:34
5905340226,楊藥局,臺南市中西區西和路３３號１樓,(06)2806353,0,2,2020/04/13 15:59:34
5905340235,人人藥局,臺南市中西區和緯路５段１９７號１樓,(06)3583668,0,905,2020/04/13 15:59:34
5905340253,永華台安藥局,臺南市中西區永華路一段１８４、１８４－１號１、２、３樓,(06)2225531,271,1,2020/04/13 15:59:34
5905340271,南光藥局,臺南市中西區永福路２段７３號１、２樓,(06)2226539,1,0,2020/04/13 15:59:34
5905350017,健盟藥局,臺南市北區北安路一段２０６號１樓,(06)2523988,648,0,2020/04/13 15:59:34
5905350062,嘉星藥師大藥局,臺南市北區開元路３３９號１樓,(06)2093737,6,0,2020/04/13 15:59:34
5905350080,長榮健保藥局,臺南市北區長榮路４段１３９號１樓,(06)2757012,850,241,2020/04/13 15:59:34
5905350099,若安藥局,臺南市北區開元路１０３號１樓,(06)2095666,3581,130,2020/04/13 15:59:34
5905350133,大昌藥局,臺南市北區北安路１段１３２號１樓,(06)2519121,325,269,2020/04/13 15:59:34
5905350142,佳佳藥局,臺南市北區開元路３０６－１號,(06)2740783,6,1,2020/04/13 15:59:34
5905350151,公園台安藥局,臺南市北區公園路８４０號,(06)2518402,468,50,2020/04/13 15:59:34
5905350240,健康藥局,臺南市北區長榮路５段２１號,(06)2003078,349,0,2020/04/13 15:59:34
5905350268,宸安藥局,臺南市北區光民里成功路４３６號１樓,(06)2238679,729,50,2020/04/13 15:59:34
5905350302,旻恩藥局,臺南市北區公園里北門路二段３７－１號,(06)2260590,1051,802,2020/04/13 15:59:34
5905350311,美康藥局,臺南市北區公園路３７５－５號,(06)2810311,341,0,2020/04/13 15:59:34
5905350339,育德健康藥局,臺南市北區成德里育德路５３０號,(06)2525360,1,0,2020/04/13 15:59:34
5905350384,北安台安藥局,臺南市北區北安路一段１６３號,(06)2518166,4,0,2020/04/13 15:59:34
5905350428,大正藥局,臺南市北區公園南路３２４號１樓,(06)2226899,342,20,2020/04/13 15:59:34
5905350446,杏一藥局台南成大店,臺南市北區東豐路１５５號,(06)2382747,2301,711,2020/04/13 15:59:34
5905350464,北海藥局,臺南市北區華德里海安路三段９７２號１樓,(06)2525533,6,0,2020/04/13 15:59:34
5905370144,仁大藥局,臺南市安南區海佃路三段３４６號１樓,(06)2561777,7,0,2020/04/13 15:59:34
5905370297,三多藥師藥局,臺南市安南區溪墘里海佃路一段１９４號１樓,(06)2581189,0,9,2020/04/13 15:59:34
5905370340,保安康藥局,臺南市安南區梅花里安中路一段７９３號１樓,(06)2552586,1071,0,2020/04/13 15:59:34
5905370359,宜康安和藥局,臺南市安南區安和路一段６８號１樓,(06)2521250,15,0,2020/04/13 15:59:34
5905380015,康馥藥局,臺南市安平區華平路５４５-１號,(06)2998328,3,672,2020/04/13 15:59:34
5905380097,宜康永華藥局,臺南市安平區國平里永華路二段７８５號１樓,(06)2930119,1837,0,2020/04/13 15:59:34
5905380122,趙藥師藥局,臺南市安平區安北路３９０號,(06)3915695,189,0,2020/04/13 15:59:34
5905380159,永華藥局,臺南市安平區永華路二段７８７－１號,(06)2953618,2509,0,2020/04/13 15:59:34
5905380195,新高橋藥局台南永華店,臺南市安平區華平路２７９號１樓,(06)2992362,9,0,2020/04/13 15:59:34
5905380248,康富聯合藥局,臺南市安平區華平路６５２號１樓,(06)2971960,0,41,2020/04/13 15:59:34
5907010098,建明藥局,高雄市鳳山區海洋一路１２２號,(07)7668550,5,0,2020/04/13 15:59:34
5907010141,維安社區藥局,高雄市鳳山區國富路２５-１號,(07)7630980,0,7,2020/04/13 15:59:34
5907010169,美安藥局,高雄市鳳山區文衡路４３號,(07)7993209,0,6,2020/04/13 15:59:34
5907010178,華美藥局,高雄市鳳山區建國路三段１６１號,(07)7452732,8,1,2020/04/13 15:59:34
5907010212,北京藥局中崙店,高雄市鳳山區中崙四路１６號１樓,(07)7550655,99,20,2020/04/13 15:59:34
5907010267,禾康藥局,高雄市鳳山區瑞竹路１６號１樓,(07)7997139,0,7,2020/04/13 15:59:34
5907010276,愛家社區藥局,高雄市鳳山區福德街１４１號,(07)8123698,477,8,2020/04/13 15:59:34
5907010285,康盈藥局,高雄市鳳山區鳳林路２６０號１樓,(07)7820968,0,2,2020/04/13 15:59:34
5907010301,高大藥局,高雄市鳳山區南華路１８２號,(07)7718671,135,10,2020/04/13 15:59:34
5907010365,科健藥局,高雄市鳳山區八德路２４６－５號１樓,(07)7777868,977,43,2020/04/13 15:59:34
5907010427,好郝藥局鳳林店,高雄市鳳山區誠智里鳳林路２９０號,(07)7869188,3,0,2020/04/13 15:59:34
5907010454,上泰健保藥局,高雄市鳳山區鎮西里中華街２７號１樓,(07)7455127,0,9,2020/04/13 15:59:34
5907010730,鳳山啄木鳥藥局,高雄市鳳山區善美里保泰路３３６號１樓,(07)7162314,0,9,2020/04/13 15:59:34
5907010810,志全藥局,高雄市鳳山區五福里五甲三路１２１巷１號,(07)7688986,19,3,2020/04/13 15:59:34
5907010883,大樹五甲藥局,高雄市鳳山區福祥里五甲三路２４號１樓及２樓、２６號１樓及２樓,(07)8224926,0,4,2020/04/13 15:59:34
5907010936,鳳山全民藥局,高雄市鳳山區中正里瑞興路３８０巷８號,(07)7037078,883,0,2020/04/13 15:59:34
5907010945,光田藥局,高雄市鳳山區鎮東里光遠路９５號１樓,(07)7460773,189,4,2020/04/13 15:59:34
5907010963,喬生藥局,高雄市鳳山區文福里文建街１７８、１８０號,(07)7803366,0,8,2020/04/13 15:59:34
5907011004,永豐久億藥局,高雄市鳳山區和興里五甲一路１１號１樓,(07)7104281,11,0,2020/04/13 15:59:34
5907011031,德安藥局,高雄市鳳山區文衡里文衡路２９５號１樓,(07)7805249,57,1765,2020/04/13 15:59:34
5907011068,新高橋藥局文龍東店,高雄市鳳山區鎮北里文龍東路３１０號,(07)7353946,18,1,2020/04/13 15:59:34
5907011086,長青連鎖藥局中山西店,高雄市鳳山區忠義里中山西路３７６－７號１樓,(07)7197787,4,0,2020/04/13 15:59:34
5907011095,鳳山五甲藥局,高雄市鳳山區正義里五甲二路１３９號１樓,(07)7269899,6,0,2020/04/13 15:59:34
5907011111,壹然藥局,高雄市鳳山區中正里瑞興路４８２號１樓,(07)7014755,0,7,2020/04/13 15:59:34
5907011166,佑全鳳山藥局,高雄市鳳山區文德里青年路二段４６３號１－２樓,(07)7801568,0,4,2020/04/13 15:59:34
5907011175,鳳西藥局,高雄市鳳山區忠義里中山西路２３８號１樓,(07)7902717,24,0,2020/04/13 15:59:34
5907011193,新高橋藥局新富店,高雄市鳳山區新泰里新富路４２８號１樓,(07)9630233,18,0,2020/04/13 15:59:34
5907011219,協康健保藥局,高雄市鳳山區瑞竹里博愛路２１５號１樓,(07)7199259,0,10,2020/04/13 15:59:34
5907011264,新高橋藥局青年店,高雄市鳳山區文衡里青年路二段２８９號１樓,(07)7676179,99,60,2020/04/13 15:59:34
5907011291,桂林活力藥師藥局鳳山店,高雄市鳳山區中正里瑞興路４８８號１樓,(07)7012827,191,2,2020/04/13 15:59:34
5907011317,凱旋藥局,高雄市鳳山區國隆里新富路３７３號１樓,(07)7671181,12,0,2020/04/13 15:59:34
5907011335,杏樹林藥局,高雄市鳳山區中和里自由路４３０號,(07)7101118,965,0,2020/04/13 15:59:34
5907011344,佳恩藥局,高雄市鳳山區和德里中山路７５－１號,(07)7460297,5,0,2020/04/13 15:59:34
5907020021,柏康藥局,高雄市岡山區壽天路２２號,(07)6241688,5,0,2020/04/13 15:59:34
5907030072,旗美藥局,高雄市旗山區東平里延平二路４１號,(07)6629839,261,28,2020/04/13 15:59:34
5907030090,睛好活力藥局,高雄市旗山區湄洲里中山路１２７號,(07)6625119,4,0,2020/04/13 15:59:34
5907030125,旗山藥局,高雄市旗山區中華路２３號,(07)6621158,0,10,2020/04/13 15:59:34
5907050010,新朋友藥師連鎖藥局,高雄市林園區東林東路４４號,(07)6460588,1748,0,2020/04/13 15:59:34
5907060098,佳和健保藥局,高雄市大寮區鳳林三路５１２號,(07)7821500,5,2,2020/04/13 15:59:34
5907060132,大承藥局,高雄市大寮區鳳屏一路４６６號１樓,(07)7013225,6,0,2020/04/13 15:59:34
5907060187,桂林活力藥師藥局鳳林店,高雄市大寮區山頂里鳳林三路８２３˙８２５號１樓,(07)7810101,555,80,2020/04/13 15:59:34
5907060212,仁德健保藥局,高雄市大寮區內坑里仁德新村１號１樓,(07)7885003,7,8,2020/04/13 15:59:34
5907060221,淑德健保藥局,高雄市大寮區內坑里淑德新村１號３樓,(07)7923556,414,0,2020/04/13 15:59:34
5907070021,大和藥局,高雄市大樹區久堂路１４９號,(07)6526412,0,3,2020/04/13 15:59:34
5907080081,英祥連鎖藥局仁雄店,高雄市仁武區仁雄路３６之２號,(07)3722509,81,0,2020/04/13 15:59:34
5907080134,好心藥局,高雄市仁武區中正路２９９號１樓,(07)3728985,0,1,2020/04/13 15:59:34
5907080170,鴻州藥局,高雄市仁武區八卦里八德西路２２９８號１樓,(07)3752888,23,0,2020/04/13 15:59:34
5907080189,德昌藥局仁雄店,高雄市仁武區灣內里仁雄路３８、３８－１、３８－２號,(07)3749166,54,0,2020/04/13 15:59:34
5907080214,新高橋藥局八德中店,高雄市仁武區八卦里八德中路８６、８８、９０號,(07)3485857,552,48,2020/04/13 15:59:34
5907080232,大樹仁武藥局,高雄市仁武區赤山里仁雄路８０－９號,(07)3744777,63,0,2020/04/13 15:59:34
5907080250,仁同藥局,高雄市仁武區八卦里永仁街７０６號１樓,(07)3736142,2,5,2020/04/13 15:59:34
5907080269,興德昌藥局,高雄市仁武區文武里中華路２３２號,(07)3757005,0,20,2020/04/13 15:59:34
5907080278,博適倫藥局,高雄市仁武區八卦里永仁街２６５號１樓,(07)3755708,923,109,2020/04/13 15:59:34
5907090032,上鼎藥師健保藥局,高雄市大社區中山路４２３號,(07)3531053,555,54,2020/04/13 15:59:34
5907090069,德泰健保藥局,高雄市大社區大新路３５之１號１樓,(07)3524296,4,3,2020/04/13 15:59:34
5907090087,安泰專業藥師藥局,高雄市大社區中山路２６７號１樓,(07)3553715,11,0,2020/04/13 15:59:34
5907100088,本館藥局,高雄市鳥松區大華里本館路１９０號１樓,(07)3707655,2,4,2020/04/13 15:59:34
5907110066,安麗兒藥局橋頭店,高雄市橋頭區隆豐路１４８號,(07)6111209,96,10,2020/04/13 15:59:34
5907110146,民權藥局,高雄市橋頭區橋頭里２８鄰成功路２２７號１樓－２２９號１樓,(07)6113632,0,3,2020/04/13 15:59:34
5907120017,和德藥局燕巢店,高雄市燕巢區西燕里中民路６２８號,(07)6143499,441,70,2020/04/13 15:59:34
5907120026,安康健保藥局,高雄市燕巢區中興路８號,(07)6141103,0,90,2020/04/13 15:59:34
5907140019,佑聖健保藥局,高雄市阿蓮區民生路７９號,(07)6321516,0,4,2020/04/13 15:59:34
5907140108,德昌藥局阿蓮店,高雄市阿蓮區阿蓮里中正路４５６號,(07)6318868,0,3,2020/04/13 15:59:34
5907150097,金德昌藥師藥局,高雄市路竹區大社路９０之６號,(07)6978143,8,0,2020/04/13 15:59:34
5907150177,佑安藥局,高雄市路竹區中和街１８２號,(07)6072215,0,9,2020/04/13 15:59:34
5907150202,永昌藥局,高雄市路竹區延平路８１號,(07)6964321,6,5,2020/04/13 15:59:34
5907150248,宗明藥局路竹店,高雄市路竹區中正路１０６－１號１樓,(07)6962391,0,5,2020/04/13 15:59:34
5907160020,振裕藥局,高雄市湖內區逸賢里保生路５５３號,(07)6995796,0,5,2020/04/13 15:59:34
5907160039,華安藥局,高雄市湖內區中山路一段４５１－１９號,(07)6938208,480,0,2020/04/13 15:59:34
5907160048,吉成藥局,高雄市湖內區太爺里中正路１段１２號,(07)6993681,0,427,2020/04/13 15:59:34
5907160075,安麗兒藥局東方店,高雄市湖內區湖東里東方路９０號,(07)6936029,169,3,2020/04/13 15:59:34
5907200038,和德藥局梓官店,高雄市梓官區梓和里梓官路２３３號１樓,(07)6191008,36,10,2020/04/13 15:59:34
5907200047,永恒健康生活藥局,高雄市梓官區智蚵里通安路１７６號１樓,(07)6102755,1725,195,2020/04/13 15:59:34
5907210016,東冠健保藥局,高雄市六龜區太平路５號１樓,(07)6891852,86,91,2020/04/13 15:59:34
5907210034,大晉藥局,高雄市六龜區義寶里太平路１１６號,(07)6894951,3179,626,2020/04/13 15:59:34
5907230018,立康健保藥師藥局,高雄市杉林區上平里山仙路８０號,(07)6773353,492,12,2020/04/13 15:59:34
5907240014,博林健保藥局,高雄市內門區觀亭里中正路１６０巷５１號,(07)6671883,2887,0,2020/04/13 15:59:34
5907290050,新高橋藥局裕明店,高雄市鼓山區裕誠路１６８０號,(07)5224680,5,0,2020/04/13 15:59:34
5907290103,康喜藥局,高雄市鼓山區華榮路６０７號,(07)5550060,349,0,2020/04/13 15:59:34
5907290121,柏順藥局,高雄市鼓山區龍德路１０６巷３０、３２號,(07)5559567,0,4,2020/04/13 15:59:34
5907290158,美館久億藥局,高雄市鼓山區美術東二路２４５、２４７號,(07)5227762,405,20,2020/04/13 15:59:34
5907290176,為安藥局,高雄市鼓山區九如四路９５９號,(07)5212912,8,1,2020/04/13 15:59:34
5907290201,開心藥局,高雄市鼓山區中華一路９４８號,(07)5555572,7,1,2020/04/13 15:59:34
5907290229,芳博藥局,高雄市鼓山區明倫路４５６號,(07)5501173,3,0,2020/04/13 15:59:34
5907290274,明誠丁丁藥局,高雄市鼓山區明誠三路４６５號,(07)5520120,9,0,2020/04/13 15:59:34
5907300033,活力藥局,高雄市左營區自由三路３５３號１樓,(07)3504012,18,0,2020/04/13 15:59:34
5907300168,金元藥局,高雄市左營區重愛路２２０號,(07)3458378,7,0,2020/04/13 15:59:34
5907300239,左野藥局,高雄市左營區崇德路２２２號,(07)3486883,238,11,2020/04/13 15:59:34
5907300300,宜康健保藥局,高雄市左營區翠華路６０１巷４０號,(07)5889919,5,3,2020/04/13 15:59:34
5907300346,正心藥師藥局,高雄市左營區左營大路４７３之２號,(07)5880386,657,0,2020/04/13 15:59:34
5907300515,詮裕藥局,高雄市左營區華夏路７０６號１樓,(07)3453942,72,0,2020/04/13 15:59:34
5907300588,明禾藥局,高雄市左營區華夏路１７３２號１樓,(07)3493734,6,7,2020/04/13 15:59:34
5907300686,左營自由藥局,高雄市左營區自由二路３５０、３５０－１號,(07)5589991,6,4,2020/04/13 15:59:34
5907300711,富元聯合健康藥局,高雄市左營區博愛三路３７號,(07)3488585,900,130,2020/04/13 15:59:34
5907300766,悠仁藥局,高雄市左營區自由三路１７０號,(07)3457979,4,14,2020/04/13 15:59:34
5907300775,詠康藥局,高雄市左營區明華一路２６５號,(07)5580165,0,13,2020/04/13 15:59:34
5907300837,杏一高榮二店藥局,高雄市左營區榮總路１７７號１樓,(07)3463348,51,0,2020/04/13 15:59:34
5907300855,新高橋藥局裕誠店,高雄市左營區裕誠路２９１號１樓,(07)5573857,418,13,2020/04/13 15:59:34
5907300882,得孚社區藥局,高雄市左營區重立路５３３號１樓,(07)3410121,99,0,2020/04/13 15:59:34
5907300891,新高橋藥局華夏店,高雄市左營區華夏路１１１０號,(07)3410915,62,25,2020/04/13 15:59:34
5907300917,左營藥局,高雄市左營區華夏路３２５號,(07)5501017,366,0,2020/04/13 15:59:34
5907310173,安健藥局,高雄市楠梓區鳳楠路２５０號,(07)3520167,3,0,2020/04/13 15:59:34
5907310235,新興藥局,高雄市楠梓區後昌路８７號,(07)3629735,52,0,2020/04/13 15:59:34
5907310271,漢宏健保藥局,高雄市楠梓區加宏路９７號,(07)3626086,1,0,2020/04/13 15:59:34
5907310306,大雄藥局,高雄市楠梓區德民路１６６號,(07)3643290,1850,103,2020/04/13 15:59:34
5907310315,小太陽康健藥局,高雄市楠梓區德民路９９３號１－２樓,(07)3635808,0,5,2020/04/13 15:59:34
5907310342,楠梓久億藥局,高雄市楠梓區德祥路２２１號,(07)3657099,27,0,2020/04/13 15:59:34
5907310351,惠民楠梓藥局,高雄市楠梓區建楠路２１７號,(07)3521896,27,0,2020/04/13 15:59:34
5907310360,百康藥局,高雄市楠梓區右昌街４１６號,(07)3601281,333,23,2020/04/13 15:59:34
5907310379,德昌藥局,高雄市楠梓區德賢路２１５號,(07)3619998,40,6,2020/04/13 15:59:34
5907320062,大豐藥局,高雄市三民區大豐一路４７１號,(07)3980133,2,2,2020/04/13 15:59:34
5907320133,莊敬藥局,高雄市三民區大昌一路２８號,(07)3976079,0,2,2020/04/13 15:59:34
5907320179,新高橋藥局天祥店,高雄市三民區天祥一路１１７號,(07)3102683,1,3,2020/04/13 15:59:34
5907320302,新高橋藥局明誠店,高雄市三民區明誠一路４９２號,(07)3107072,10,1,2020/04/13 15:59:34
5907320419,大林藥局,高雄市三民區大昌一路１７０－１號,(07)3833593,6,4,2020/04/13 15:59:34
5907320428,東京藥局,高雄市三民區建工路６８５號,(07)3874567,8,0,2020/04/13 15:59:34
5907320464,建元健保藥局,高雄市三民區興昌街８３巷９號,(07)3927865,1179,53,2020/04/13 15:59:34
5907320535,康誠藥局,高雄市三民區建工路６１６號,(07)3893889,24,0,2020/04/13 15:59:34
5907320553,三民明誠藥局,高雄市三民區明誠一路５００號１、２Ｆ５０２號,(07)3493137,14,4,2020/04/13 15:59:34
5907320562,康威藥局,高雄市三民區九如二路３０１號,(07)3223189,441,0,2020/04/13 15:59:34
5907320571,德安藥局,高雄市三民區陽明路８３號,(07)3970323,5,0,2020/04/13 15:59:34
5907320580,丸之內藥局,高雄市三民區十全二路３２１、３２３號,(07)3156688,0,98,2020/04/13 15:59:34
5907320633,勁康健保藥局,高雄市三民區義華路４０２號１樓,(07)3966716,16,0,2020/04/13 15:59:34
5907320688,惠川藥局,高雄市三民區文安南街７８號,(07)7806618,526,14,2020/04/13 15:59:34
5907320697,鄰好藥師藥局,高雄市三民區褒揚街２８７號,(07)3909589,684,0,2020/04/13 15:59:34
5907320704,建工台安藥局,高雄市三民區建工路４９９號之１,(07)3807521,872,24,2020/04/13 15:59:34
5907320740,忠仁藥局,高雄市三民區中都街３５號１樓,(07)3125305,155,58,2020/04/13 15:59:34
5907320768,心樂保健藥局,高雄市三民區光裕路７８號１樓,(07)3855377,36,10,2020/04/13 15:59:34
5907320777,桉家藥師藥局,高雄市三民區明誠一路３９３號,(07)3929732,5,0,2020/04/13 15:59:34
