醫事機構代碼,醫事機構名稱,醫事機構地址,醫事機構電話,成人口罩剩餘數,兒童口罩剩餘數,來源資料時間
5903290938,中清崙湞藥局,臺中市北屯區中清路二段２９６號１樓,(04)22990409,0,1386,2020/03/30 22:08:36
5903290947,德寶健保藥局,臺中市北屯區熱河路一段７０號１樓,(04)22325511,0,465,2020/03/30 22:08:36
5903290965,崇德藥局,臺中市北屯區崇德路二段３１號,(04)22361331,0,140,2020/03/30 22:08:36
5903290974,興安永佳藥局,臺中市北屯區興安路一段３３３號１樓,(04)22437876,0,261,2020/03/30 22:08:36
5903290983,祥和藥局,臺中市北屯區太原路三段１４７號１樓,(04)22369603,0,249,2020/03/30 22:08:36
5905010018,永麗藥師藥局,臺南市新營區三民路７６之１０號,(06)6377898,33,985,2020/03/30 22:08:36
5905010027,大安藥局,臺南市新營區中山路２５７號,(06)6322366,1,1587,2020/03/30 22:08:36
5905010036,橘子藥局,臺南市新營區民權路１１８之２號,(06)6351881,0,155,2020/03/30 22:08:36
5905010045,台新藥局,臺南市新營區中正路８６號,(06)6350048,2195,2027,2020/03/30 22:08:36
5905010063,松柏藥局,臺南市新營區新南里新北街１號,(06)6590063,0,3,2020/03/30 22:08:36
5905010072,長壽藥局,臺南市新營區中山路２１９號,(06)6324001,2,854,2020/03/30 22:08:36
5905010090,菁安連鎖健保藥局民治店,臺南市新營區民治路１０之１號１樓,(06)6351678,453,667,2020/03/30 22:08:36
5905010107,李藥師健康藥局,臺南市新營區大宏里民族路２１號,(06)6328359,885,980,2020/03/30 22:08:36
5905010116,安全藥局,臺南市新營區民治路６之４４號１樓,(06)6321706,0,647,2020/03/30 22:08:36
5905010125,宏泰大藥局,臺南市新營區新東里東興８街２７號,(06)6327801,0,340,2020/03/30 22:08:36
5905010134,聖佳藥局,臺南市新營區大宏里民治路２９巷２６－１３號１樓,(06)6330623,916,1991,2020/03/30 22:08:36
5905010152,謙和藥師藥局,臺南市新營區延平路１０１之２號,(06)6322957,0,1542,2020/03/30 22:08:36
5905010161,安佳藥局,臺南市新營區民治路３７４號１樓,(06)6560535,2818,2661,2020/03/30 22:08:36
5905010189,華陞藥局,臺南市新營區三民路１０６號１樓,(06)6329777,2468,1009,2020/03/30 22:08:36
5905010214,大樹新營藥局,臺南市新營區民權路７４、７６、７８號１樓,(06)6328300,0,1306,2020/03/30 22:08:36
5905020014,恩加藥局,臺南市鹽水區武廟里三福路７０號,(06)6521346,0,561,2020/03/30 22:08:36
5905030010,美恩健保藥局,臺南市白河區永安里中山路８１號１樓,(06)6858865,0,639,2020/03/30 22:08:36
5905030038,美尚藥局,臺南市白河區白河里康樂路４３號,(06)6853538,2,552,2020/03/30 22:08:36
5905030047,大源醫藥局,臺南市白河區中山路１７２之２號,(06)6852306,0,351,2020/03/30 22:08:36
5905030065,安泰藥局,臺南市白河區中正路９３號１樓,(06)6856700,3,0,2020/03/30 22:08:36
5905030074,優生藥局,臺南市白河區新起街２－１９號,(06)6831583,2256,2082,2020/03/30 22:08:36
5905040070,華笙藥局,臺南市麻豆區中山路１５０－１０號,(06)5715568,1997,1787,2020/03/30 22:08:36
5905040105,幸福藥局,臺南市麻豆區光復路１２７號１樓,(06)5720977,0,9,2020/03/30 22:08:36
5905040114,禾泰藥局,臺南市麻豆區中正路５９－３號１樓,(06)5720389,344,12,2020/03/30 22:08:36
5905040132,大樹麻豆藥局,臺南市麻豆區中山路４８、５０號１樓,(06)5716556,12,644,2020/03/30 22:08:36
5905050012,延平藥局,臺南市佳里區延平路４５號,(06)7236185,669,1640,2020/03/30 22:08:36
5905050058,佳里啄木鳥藥局,臺南市佳里區六安里六安１７之２２號,(06)7236396,15,283,2020/03/30 22:08:36
5905050094,建昌藥局佳里店,臺南市佳里區光復路３７１號,(06)7221369,9,45,2020/03/30 22:08:36
5905050156,延興藥局,臺南市佳里區鎮山里延平路７６號１樓,(06)7238544,354,585,2020/03/30 22:08:36
5905050165,德昌藥局佳里店,臺南市佳里區光復路２３３號,(06)7232388,0,190,2020/03/30 22:08:36
5905050192,復佑藥局,臺南市佳里區光復路３１５號１樓,(06)7222771,0,545,2020/03/30 22:08:36
5905050209,大樹佳里藥局,臺南市佳里區延平路２３７號１樓,(06)7231323,5,530,2020/03/30 22:08:36
5905060054,全家康藥師藥局,臺南市新化區北勢里中正路１２０７號,(06)5980866,0,395,2020/03/30 22:08:36
5905060081,新化景惠藥局,臺南市新化區護國里中山路１８５號,(06)5909659,0,514,2020/03/30 22:08:36
5905060090,加賀藥局,臺南市新化區忠孝路２８１號,(06)5983865,0,995,2020/03/30 22:08:36
5905060107,新化健保藥局,臺南市新化區中山路５０７號,(06)5983328,0,238,2020/03/30 22:08:36
5905060116,美華健保藥局,臺南市新化區中山路４８７號１樓,(06)5907859,0,450,2020/03/30 22:08:36
5905060125,美麗安藥局,臺南市新化區護國里中山路１５０－１號１樓,(06)5909509,0,567,2020/03/30 22:08:36
5905060134,得安藥局,臺南市新化區忠孝路１１８號１樓,(06)5981333,0,510,2020/03/30 22:08:36
5905060143,來德藥局,臺南市新化區護國里中山路２３２號,(06)5800193,0,372,2020/03/30 22:08:36
5905060161,和德藥局新化店,臺南市新化區清水里中山路４２０號１樓,(06)5802518,1,195,2020/03/30 22:08:36
5905070050,晶德昌藥局,臺南市善化區文光里中山路８５號,(06)5856141,0,25,2020/03/30 22:08:36
5905070069,善欣藥局,臺南市善化區光文里大成路９８號１樓,(06)5833363,0,1426,2020/03/30 22:08:36
5905070096,善美藥局,臺南市善化區中正路４５６號,(06)5852540,2,40,2020/03/30 22:08:36
5905070103,有誼藥局,臺南市善化區文昌里中正路３８７號１樓,(06)5817767,110,145,2020/03/30 22:08:36
5905070112,健登藥局,臺南市善化區大成路２１２號１樓,(06)5831133,87,445,2020/03/30 22:08:36
5905070121,大樹善化藥局,臺南市善化區民權路５４、５６、５８號１樓,(06)5830550,18,85,2020/03/30 22:08:36
5905080038,大樹學甲藥局,臺南市學甲區中正路１３５號１樓,(06)7820001,0,19,2020/03/30 22:08:36
5905080047,生祥大藥局學甲店,臺南市學甲區華宗路３７６號１樓,(06)7838462,0,425,2020/03/30 22:08:36
5905090025,中山藥局,臺南市柳營區中山西路二段１４５號１樓,(06)6221696,2,568,2020/03/30 22:08:36
5905090034,維康藥局柳營店,臺南市柳營區太康里２０１－１０號,(06)6226228,176,242,2020/03/30 22:08:36
5905100035,華恩藥局,臺南市後壁區墨林里１９８號,(06)6623491,0,1048,2020/03/30 22:08:36
5905100062,美尚藥局後壁店,臺南市後壁區後壁里１６８－８號,(06)6871138,0,110,2020/03/30 22:08:36
5905120019,復興藥局,臺南市下營區營前里復興街８７號１樓,(06)6898472,1,1350,2020/03/30 22:08:36
5905120055,維任藥局,臺南市下營區中正北路７號,(06)6892259,1122,1609,2020/03/30 22:08:36
5905120073,壹勝藥局,臺南市下營區中山路二段６６號１樓,(06)6890372,3,124,2020/03/30 22:08:36
5905120082,尚營藥局,臺南市下營區營前里中正南路５５號１樓,(06)6790155,0,244,2020/03/30 22:08:36
5905130024,人大藥局,臺南市六甲區中山路７號,(06)6988802,0,265,2020/03/30 22:08:36
5905130033,鄰家藥局,臺南市六甲區甲南里珊瑚路１８號１樓,(06)6982086,0,569,2020/03/30 22:08:36
5905130042,人大聯合藥局,臺南市六甲區中山路８號１樓,(06)6987822,0,70,2020/03/30 22:08:36
5905140011,振安藥局,臺南市官田區隆田里中山路一段６０號,(06)5791810,0,343,2020/03/30 22:08:36
5905140039,安安藥局隆田店,臺南市官田區中山路一段１５號１樓,(06)5795705,0,819,2020/03/30 22:08:36
5905170019,博士藥師專業藥局,臺南市七股區大埕里３５７號１樓,(06)7874226,1361,925,2020/03/30 22:08:36
5905170037,建昌藥局,臺南市七股區大寮里１之１１號,(06)7873777,1,472,2020/03/30 22:08:36
5905180042,建昌藥局漚汪店,臺南市將軍區忠興里１－６號１樓,(06)7941889,0,300,2020/03/30 22:08:36
5905200012,新視藥局,臺南市新市區中正路３１３號,(06)5990172,0,1092,2020/03/30 22:08:36
5905200058,欣和德藥局,臺南市新市區中正路２００號,(06)5895658,2,0,2020/03/30 22:08:36
5905200067,華林藥局,臺南市新市區中正路１４３號,(06)5896703,0,201,2020/03/30 22:08:36
5905200085,大樹新市藥局,臺南市新市區中正路４９、５１號１樓,(06)5892552,162,525,2020/03/30 22:08:36
5905270041,仁德市安藥師藥局,臺南市仁德區中正西路２５號,(06)2661933,186,500,2020/03/30 22:08:36
5905270087,嘉鶴藥局,臺南市仁德區仁和里二空路９８號１樓,(06)2680608,0,130,2020/03/30 22:08:36
5905270112,昱欣藥局,臺南市仁德區中正路２段１１８１號１樓,(06)2798970,102,1570,2020/03/30 22:08:36
5905270121,安麗兒藥局仁德店,臺南市仁德區新田里中正路二段４４５號,(06)2498619,0,493,2020/03/30 22:08:36
5905270149,尚澄藥局,臺南市仁德區中正路二段１０９０號,(06)2705580,0,629,2020/03/30 22:08:36
5905270158,佳德藥局,臺南市仁德區德糖路４７０號１樓,(06)2796767,483,0,2020/03/30 22:08:36
5905270167,和德藥局仁德店,臺南市仁德區仁義里中山路５７６號１樓,(06)2703869,0,230,2020/03/30 22:08:36
5905270176,大樹仁德藥局,臺南市仁德區中正路二段１１５２號１樓,(06)2797466,420,680,2020/03/30 22:08:36
5905270185,朝伯藥局,臺南市仁德區中正路三段１號１樓,(06)2796655,0,678,2020/03/30 22:08:36
5905280010,安新藥局,臺南市歸仁區民族北街１７巷１４號,(06)3306008,0,1648,2020/03/30 22:08:36
5905280047,獅甲藥局,臺南市歸仁區六甲里六甲路２０３號,(06)3388387,0,894,2020/03/30 22:08:36
5905280065,微笑藥局,臺南市歸仁區中山路二段１２５號,(06)2397495,2562,2755,2020/03/30 22:08:36
5905280092,元康保健藥局,臺南市歸仁區中山路二段２２９號,(06)2309055,0,820,2020/03/30 22:08:36
5905280109,大樹青青藥局,臺南市歸仁區中山路三段１２號,(06)2300301,0,290,2020/03/30 22:08:36
5905280118,和雅藥局,臺南市歸仁區民權三街９６號１樓,(06-)2307757,0,27,2020/03/30 22:08:36
5905280127,義德藥局歸仁店,臺南市歸仁區民權北路７５號１樓,(06)2300399,9,450,2020/03/30 22:08:36
5905280136,悅橙歸仁藥局,臺南市歸仁區大通路４３號１樓,(06)2396660,28,0,2020/03/30 22:08:36
5905290025,義德藥局,臺南市關廟區關廟里忠孝街７號,(06)5954061,0,133,2020/03/30 22:08:36
5905310031,怡品藥局,臺南市永康區大灣路８７０號,(06)2057346,0,822,2020/03/30 22:08:36
5905310068,育安藥局,臺南市永康區中興里中華路２７４號,(06)3116850,46,2075,2020/03/30 22:08:36
5905310157,信仁藥局,臺南市永康區中華西街１４９號,(06)2337755,9,464,2020/03/30 22:08:36
5905310184,鹽行健保藥局,臺南市永康區中正南路８６１號,(06)2435112,186,0,2020/03/30 22:08:36
5905310237,睿禾藥局,臺南市永康區東橋一路１３號,(06)3023868,0,8,2020/03/30 22:08:36
5905310255,濟康藥師藥局,臺南市永康區勝利里勝學路２８１號,(06)3122057,2,1,2020/03/30 22:08:36
5905310264,仁安藥師藥局,臺南市永康區崑山里大仁街６１號,(06)2056055,0,20,2020/03/30 22:08:36
5905310273,誠康藥局,臺南市永康區中山東路１１３號１樓,(06)3022005,3,1,2020/03/30 22:08:36
5905310291,俐欣藥局,臺南市永康區大仁街２０６號１樓,(06)2050777,0,1,2020/03/30 22:08:36
5905310308,一加藥局,臺南市永康區正強街２３１號１樓,(06)2023140,0,85,2020/03/30 22:08:36
5905310326,美德生醫藥局,臺南市永康區復國一路４９６號１樓,(06)2030463,0,75,2020/03/30 22:08:36
5905310344,昱賢藥師藥局中正店,臺南市永康區中正路１４１、１４３號１樓,(06)2021535,0,92,2020/03/30 22:08:36
5905310353,家嘉藥局,臺南市永康區復國一路２０６號,(06)3121328,13,171,2020/03/30 22:08:36
5905310531,晉大藥局復國店,臺南市永康區復國一路５８２－１號,(06)2025309,0,90,2020/03/30 22:08:36
5905310559,康群藥局,臺南市永康區復國里復華三街７２號,(06)2011839,90,833,2020/03/30 22:08:36
5905310568,宜芯健康藥局,臺南市永康區大灣路７３６號１樓,(06)2722622,0,150,2020/03/30 22:08:36
5905310620,台南永康藥局,臺南市永康區中山南路８１６、８１６－１．２．３號,(06)2020201,0,360,2020/03/30 22:08:36
5905310639,美日新藥局,臺南市永康區中正北路６２號,(06)2420980,36,5,2020/03/30 22:08:36
5905310657,昂德藥局,臺南市永康區復華里復國一路１５２號１樓,(06)3121220,3,406,2020/03/30 22:08:36
5905310693,怡德藥局,臺南市永康區中山路１１８號,(06)2325678,0,1229,2020/03/30 22:08:36
5905310746,珊瑚藥局,臺南市永康區南灣里大灣路５０３號,(06)2054235,297,1676,2020/03/30 22:08:36
5905310755,德昌藥局永康店,臺南市永康區中華路４６２號,(06)3020628,15,322,2020/03/30 22:08:36
5905310773,長頸鹿藥局,臺南市永康區中華路６８１號,(06)3038515,544,206,2020/03/30 22:08:36
5905310791,三欣藥局,臺南市永康區勝利里小東路４２３巷２號１樓,(06)3125808,1037,2361,2020/03/30 22:08:36
5905310817,永大啄木鳥藥局,臺南市永康區永大路二段３９７號１樓,(06)2071575,0,20,2020/03/30 22:08:36
5905310826,詠健藥局,臺南市永康區中山路１０２號１樓,(06)2033780,2,99,2020/03/30 22:08:36
5905310835,中華長億藥局,臺南市永康區中華路７３４、７３６號１樓,(06)3022322,1876,723,2020/03/30 22:08:36
5905310853,大力藥局大灣店,臺南市永康區大灣路３７６號１樓,(06)2054292,0,443,2020/03/30 22:08:36
5905310871,晶辰藥局,臺南市永康區大灣里民族路３９６巷１號、３號、３９８號１樓,(06)2733368,192,205,2020/03/30 22:08:36
5905310880,永東藥局,臺南市永康區中山路５５號１樓,(06)2318700,1,4,2020/03/30 22:08:36
5905310924,永仁藥局,臺南市永康區永大路二段８５號１樓,(06)2730816,1005,885,2020/03/30 22:08:36
5905310942,大樹南灣藥局,臺南市永康區大灣路５５５號１樓,(06)2728822,0,186,2020/03/30 22:08:36
5905310951,合佑藥局,臺南市永康區安康里中華路６９５－２號１樓,(06)3020147,843,0,2020/03/30 22:08:36
5905310979,復華藥師藥局,臺南市永康區復興里復華一街１３１號１樓,(06)3123597,432,530,2020/03/30 22:08:36
5905310988,小東藥局,臺南市永康區小東路５７３號１樓,(06)3127169,1425,1265,2020/03/30 22:08:36
5905310997,新英格蘭藥局,臺南市永康區中華路３９７號１樓,(06)3027648,228,971,2020/03/30 22:08:36
5905311001,和德藥局復國店,臺南市永康區復國里復國一路３３９之７號１樓,(06)2038728,35,475,2020/03/30 22:08:36
5905311010,樂丞藥局,臺南市永康區中正北路６０號１樓,(06)2433319,1,107,2020/03/30 22:08:36
5905311038,莉志藥局,臺南市永康區建國里復國路８７巷３號１樓,(06)3123090,849,466,2020/03/30 22:08:36
5905320019,英菩藥局,臺南市東區關聖里富農街二段１０８巷１０號１樓,(06)2606723,0,330,2020/03/30 22:08:36
5905320082,鶴龍健保藥局,臺南市東區林森路一段１９０號１樓,(06)2608225,396,1019,2020/03/30 22:08:36
5905320091,台和群康藥局,臺南市東區崇善路５４７號１樓,(06)2891360,0,367,2020/03/30 22:08:36
5905320135,安麗兒藥局裕農店,臺南市東區裕農路１００號１樓,(06)2377378,0,773,2020/03/30 22:08:36
5905320180,恩泉藥局,臺南市東區崇明路２０７號１樓,(06)3352078,0,2051,2020/03/30 22:08:36
5905320260,群安健保藥局,臺南市東區復興里自由路三段１５１、１５３號１樓,(06)2690652,0,264,2020/03/30 22:08:36
5905320279,樂群藥局,臺南市東區裕聖里裕義路３３０號１樓,(06)3316218,0,180,2020/03/30 22:08:36
5905320331,高福藥局,臺南市東區大智里德東街１６８號,(06)2904668,0,255,2020/03/30 22:08:36
5905320368,巴克禮中西藥局,臺南市東區中華東路三段３７７巷８號１樓,(06-)3361100,0,1770,2020/03/30 22:08:36
5905320420,大漢中西藥局,臺南市東區崇德里崇明路４６５號,(06)2908939,0,445,2020/03/30 22:08:36
5905320448,一品健康藥局,臺南市東區崇學里崇學路５０－１號１樓,(06)2896366,0,4,2020/03/30 22:08:36
5905320466,佑全中華藥局,臺南市東區中華東路三段２１５號,(06)2906386,11,22,2020/03/30 22:08:36
5905320475,美生藥局,臺南市東區德高里自由路一段１６１號１樓,(06)2670035,6,17,2020/03/30 22:08:36
5905320484,和信藥局,臺南市東區裕農路２７－１號１樓,(06)2348291,0,1215,2020/03/30 22:08:36
5905320519,榮恩藥局,臺南市東區中華東路二段３３７號,(06)3350166,0,680,2020/03/30 22:08:36
5905320537,舒惠藥局,臺南市東區青年路４３２－６號１樓,(06)2087052,0,827,2020/03/30 22:08:36
5905320546,佑丞藥局,臺南市東區中華東路二段１２９號,(06)2902709,1,135,2020/03/30 22:08:36
5905320555,崇明台安藥局,臺南市東區崇明路３０４號,(06)2900350,0,119,2020/03/30 22:08:36
5905320564,杏一台南崇德藥局,臺南市東區崇德路６７４號,(06)2671939,0,1060,2020/03/30 22:08:36
5905320582,東門啄木鳥藥局,臺南市東區東門路三段２３９號１樓,(06)2884569,0,485,2020/03/30 22:08:36
5905320608,中華台安藥局,臺南市東區中華東路一段４號１樓,(06)2092622,0,161,2020/03/30 22:08:36
5905320626,禾田聯合藥局,臺南市東區崇明路１９１號１樓,(06)2892393,389,113,2020/03/30 22:08:36
5905320635,晉大藥局,臺南市東區東光里東興路２６４號１樓,(06)2092580,0,852,2020/03/30 22:08:36
5905320644,崇善藥局,臺南市東區崇善路３９２號１樓,(06)2896619,0,140,2020/03/30 22:08:36
5905320653,東門台安藥局,臺南市東區中華東路三段２號１樓,(06)2904377,0,440,2020/03/30 22:08:36
5905320662,台南鼎澄藥局,臺南市東區崇明路二十街１３號１樓,(06)2908855,854,256,2020/03/30 22:08:36
5905320680,晏佑藥局,臺南市東區崇善路４３８－１號１樓,(06)3358668,0,3,2020/03/30 22:08:36
5905320699,恆大藥局,臺南市東區崇明路５９０號１樓,(06)2905586,0,5,2020/03/30 22:08:36
5905320706,悅橙藥局,臺南市東區崇明路４５９號１樓,(06)2605168,2,230,2020/03/30 22:08:36
5905320715,令和藥局,臺南市東區崇善路２６９號１樓,(06)2673578,0,365,2020/03/30 22:08:36
5905320724,中華崇德藥局,臺南市東區中華東路三段１８１、１８３號１樓,(06)2880800,2662,838,2020/03/30 22:08:36
5905320733,大樹大同藥局,臺南市東區大同路二段２２７、２２９號１樓,(06)2158700,0,1480,2020/03/30 22:08:36
5905320742,榮記藥健康藥局,臺南市東區成大里育樂街１５６－４號底層,(06)2760588,610,1018,2020/03/30 22:08:36
5905320751,倍加藥局,臺南市東區東門路一段２５５號１樓,(06)2364173,699,180,2020/03/30 22:08:36
5905330024,聖安健保藥局,臺南市南區健康路二段１７３號１樓,(06)2916898,0,578,2020/03/30 22:08:36
5905330097,千越藥局,臺南市南區金華路二段２４７號,(06)2910303,1,733,2020/03/30 22:08:36
5905330113,進祥藥局,臺南市南區文南里健康路２段３４２－１號１樓,(06)2630571,2006,1888,2020/03/30 22:08:36
5905330140,亮潔藥師藥局,臺南市南區廣州里金華路２段３４４號,(06)2217306,0,1491,2020/03/30 22:08:36
5905330159,勝一藥局,臺南市南區省躬里灣裡路９０號１樓,(06)2626168,0,635,2020/03/30 22:08:36
5905330168,安鑫藥局,臺南市南區大成里健康路一段４１５號１樓,(06)2645955,0,1000,2020/03/30 22:08:36
5905330186,為美藥局,臺南市南區大同路二段５５８－１號,(06)2679315,0,60,2020/03/30 22:08:36
5905330220,合樂藥局,臺南市南區灣裡路３０９號,(06)2625016,1,23,2020/03/30 22:08:36
5905330239,宏祐健保藥局,臺南市南區新孝路５９號,(06)2632580,2,522,2020/03/30 22:08:36
5905330275,太子藥局大同店,臺南市南區大同路二段３４８號１樓,(06)2158339,0,542,2020/03/30 22:08:36
5905330284,大樹佳華藥局,臺南市南區金華路二段１２９號１樓,(06)2641238,2,50,2020/03/30 22:08:36
5905330300,思元藥局,臺南市南區金華路一段４８６號１樓,(06)2632377,1324,1615,2020/03/30 22:08:36
5905330337,千薏台安藥局,臺南市南區金華路二段２號１樓,(06)2638265,3,585,2020/03/30 22:08:36
5905330346,康而富藥局,臺南市南區鹽埕里金華路１段３７５號１樓,(06)2639373,0,405,2020/03/30 22:08:36
5905330355,明興啄木鳥藥局,臺南市南區明興路５１號１樓,(06)2620793,0,41,2020/03/30 22:08:36
5905340011,日日康藥局,臺南市中西區武聖路１３７號,(06)2595259,0,595,2020/03/30 22:08:36
5905340020,慶大藥局,臺南市中西區民權路二段１８２號,(06)2251188,235,1687,2020/03/30 22:08:36
5905340057,福氣藥局,臺南市中西區民族路三段１７９號１樓,(06)222,0,1513,2020/03/30 22:08:36
5905340075,麗欣健保藥局,臺南市中西區永華路一段１９４號１樓,(06)2209393,0,1429,2020/03/30 22:08:36
5905340137,全心藥局,臺南市中西區青年里民權路一段２５３號１樓,(06)2217536,0,873,2020/03/30 22:08:36
5905340155,東北藥局,臺南市中西區福安里西門路二段１４號１樓,(06)2226753,0,305,2020/03/30 22:08:36
5905340164,田邊藥局,臺南市中西區中正路２３６號,(06)2200106,2,98,2020/03/30 22:08:36
5905340173,賜安大藥局,臺南市中西區光賢里武聖路９號,(06)3589600,0,90,2020/03/30 22:08:36
5905340226,楊藥局,臺南市中西區西和路３３號１樓,(06)2806353,0,642,2020/03/30 22:08:36
5905340235,人人藥局,臺南市中西區和緯路５段１９７號１樓,(06)3583668,0,845,2020/03/30 22:08:36
5905340253,永華台安藥局,臺南市中西區永華路一段１８４、１８４－１號１、２、３樓,(06)2225531,1,704,2020/03/30 22:08:36
5905340262,瑞城藥局,臺南市中西區赤嵌里忠義路二段１７６號１樓,(06)2215810,1,1468,2020/03/30 22:08:36
5905340271,南光藥局,臺南市中西區永福路２段７３號１、２樓,(06)2226539,593,130,2020/03/30 22:08:36
5905350017,健盟藥局,臺南市北區北安路一段２０６號１樓,(06)2523988,303,949,2020/03/30 22:08:36
5905350026,良佑堂藥局,臺南市北區文賢路２９９號,(06)2586223,0,125,2020/03/30 22:08:36
5905350035,海安藥師藥局,臺南市北區海安路３段９０２號,(06)2814600,14,40,2020/03/30 22:08:36
5905350062,嘉星藥師大藥局,臺南市北區開元路３３９號１樓,(06)2093737,794,939,2020/03/30 22:08:36
5905350080,長榮健保藥局,臺南市北區長榮路４段１３９號１樓,(06)2757012,1,1607,2020/03/30 22:08:36
5905350133,大昌藥局,臺南市北區北安路１段１３２號１樓,(06)2519121,2,464,2020/03/30 22:08:36
5905350142,佳佳藥局,臺南市北區開元路３０６－１號,(06)2740783,0,1526,2020/03/30 22:08:36
5905350151,公園台安藥局,臺南市北區公園路８４０號,(06)2518402,3,0,2020/03/30 22:08:36
5905350179,尚慶藥局,臺南市北區西門路四段８６號１樓,(06)2511258,243,1325,2020/03/30 22:08:36
5905350231,祥好藥局,臺南市北區正風里公園路８７６號１樓,(06)2510366,0,1311,2020/03/30 22:08:36
5905350240,健康藥局,臺南市北區長榮路５段２１號,(06)2003078,1814,1175,2020/03/30 22:08:36
5905350268,宸安藥局,臺南市北區光民里成功路４３６號１樓,(06)2238679,0,110,2020/03/30 22:08:36
5905350302,旻恩藥局,臺南市北區公園里北門路二段３７－１號,(06)2260590,375,1968,2020/03/30 22:08:36
5905350311,美康藥局,臺南市北區公園路３７５－５號,(06)2810311,654,123,2020/03/30 22:08:36
5905350339,育德健康藥局,臺南市北區成德里育德路５３０號,(06)2525360,3,180,2020/03/30 22:08:36
5905350348,晨康藥師藥局,臺南市北區公園南路３４２號１樓,(06)2221090,0,625,2020/03/30 22:08:36
5905350366,千多藥局,臺南市北區金華路五段１號,(06)2228641,2,100,2020/03/30 22:08:36
5905350384,北安台安藥局,臺南市北區北安路一段１６３號,(06)2518166,0,675,2020/03/30 22:08:36
5905350428,大正藥局,臺南市北區公園南路３２４號１樓,(06)2226899,0,365,2020/03/30 22:08:36
5905350446,杏一藥局台南成大店,臺南市北區東豐路１５５號,(06)2382747,533,2381,2020/03/30 22:08:36
5905350455,幼德和緯藥局,臺南市北區文元里和緯路３段３２２號１樓,(06)2584000,0,68,2020/03/30 22:08:36
5905350464,北海藥局,臺南市北區華德里海安路三段９７２號１樓,(06)2525533,1,145,2020/03/30 22:08:36
5905350482,大欣藥局,臺南市北區公園路２０３號１樓,(06)2236828,0,574,2020/03/30 22:08:36
5905370064,日安藥局,臺南市安南區安和路２段２６９號１樓,(06)3559260,0,604,2020/03/30 22:08:36
5905370135,安南日日康藥局,臺南市安南區安和路五段３３號,(06)3550995,0,364,2020/03/30 22:08:36
5905370144,仁大藥局,臺南市安南區海佃路三段３４６號１樓,(06)2561777,7,2,2020/03/30 22:08:36
5905370206,美家藥局,臺南市安南區安和路一段３５２號１樓,(06)2566006,2,662,2020/03/30 22:08:36
5905370215,新安和安東藥局,臺南市安南區安東里安和路一段４６８號,(06)2561204,0,85,2020/03/30 22:08:36
5905370224,上振藥局,臺南市安南區安中路三段４３號１樓,(06)2551061,15,35,2020/03/30 22:08:36
5905370260,廣道藥局,臺南市安南區溪心里海佃路三段２１８號１樓,(06)2568383,0,204,2020/03/30 22:08:36
5905370279,安昕藥局,臺南市安南區安和路一段８０號１樓,(06)2827500,0,45,2020/03/30 22:08:36
