醫事機構代碼,醫事機構名稱,醫事機構地址,醫事機構電話,成人口罩剩餘數,兒童口罩剩餘數,來源資料時間
5935021412,信和大心藥局,苗栗縣苑裡鎮為公路３４－３號,(037)861352,6,0,2020/03/30 22:08:36
5935030091,惠生藥局,苗栗縣通霄鎮通東里信義路１２２號,(037)752773,0,1321,2020/03/30 22:08:36
5935040257,和安藥局,苗栗縣竹南鎮竹南里博愛街１５號,(037)472332,23,0,2020/03/30 22:08:36
5935040266,鴻仁大藥局,苗栗縣竹南鎮竹南里博愛街１８１號,(037)462396,35,3,2020/03/30 22:08:36
5935040328,明志藥局,苗栗縣竹南鎮照南里博愛街４號,(037)472341,114,0,2020/03/30 22:08:36
5935041450,昇暉藥局,苗栗縣竹南鎮民治街１８號,(037)464347,0,2,2020/03/30 22:08:36
5935041567,京典藥局,苗栗縣竹南鎮博愛街300-2號,(037)550661,69,0,2020/03/30 22:08:36
5935041736,佑仁藥局,苗栗縣竹南鎮光復路120號,(037)470250,132,0,2020/03/30 22:08:36
5935041745,瑞士藥師藥局,苗栗縣竹南鎮和平街59號,(037)552708,3,0,2020/03/30 22:08:36
5935041781,惠家藥局,苗栗縣竹南鎮自強街４２號,(037)463635,65,0,2020/03/30 22:08:36
5935042046,永安藥局,苗栗縣竹南鎮照南里立達街３號,(037)469333,111,0,2020/03/30 22:08:36
5935050066,義春藥局,苗栗縣頭份市珊湖里中正三路７２號,(037)601433,0,3,2020/03/30 22:08:36
5935050182,民昌藥局,苗栗縣頭份市忠孝里信東路１３０號,(037)673 232,117,0,2020/03/30 22:08:36
5935051689,怡安藥局,苗栗縣頭份市自強路１０３號,(037)592093,282,1,2020/03/30 22:08:36
5935051705,博士生活藥局,苗栗縣頭份市中華路１０４５號,(037)598915,1,0,2020/03/30 22:08:36
5935051732,祐康藥局,苗栗縣頭份市自強路３７號,(037)663079,664,0,2020/03/30 22:08:36
5935051938,吉品藥局,苗栗縣頭份市中正路９號,(037)676898,102,0,2020/03/30 22:08:36
5935060053,鴻輝大藥局,苗栗縣後龍鎮北龍里中華路６４－１號,(037)721952,213,0,2020/03/30 22:08:36
5935061443,後龍藥局,苗栗縣後龍鎮中山路２０９號１，２樓,(037)723660,18,0,2020/03/30 22:08:36
5935070022,林大藥局,苗栗縣卓蘭鎮新榮里中正路３２號,(04)25891630,83,987,2020/03/30 22:08:36
5935071172,健安藥局,苗栗縣卓蘭鎮上新里上新七之１１號,(04)25899617,0,921,2020/03/30 22:08:36
5935071207,合杏藥局,苗栗縣卓蘭鎮中正路１２９號,(04)25896188,0,707,2020/03/30 22:08:36
5935071216,萊恩藥局,苗栗縣卓蘭鎮上新里上新7之1號,(04)25899369,202,712,2020/03/30 22:08:36
5935071234,國良藥局,苗栗縣卓蘭鎮中山路１１１號,(04)25899578,1203,593,2020/03/30 22:08:36
5935080055,臺健中西藥局,苗栗縣大湖鄉中正路１９號,(037)990638,258,463,2020/03/30 22:08:36
5935081123,景元藥局,苗栗縣大湖鄉中正路９７號,(037)996465,0,165,2020/03/30 22:08:36
5935090015,永信藥局,苗栗縣公館鄉館中村榮光街１６號,(037)223597,0,166,2020/03/30 22:08:36
5935091156,信安藥局,苗栗縣公館鄉大同路７８號,(037)237849,1,1513,2020/03/30 22:08:36
5935091254,上恩藥局,苗栗縣公館鄉大同路１８０號,(037)234008,0,81,2020/03/30 22:08:36
5935091263,懷慶中西藥局,苗栗縣公館鄉近光路９４號,(037)239234,84,0,2020/03/30 22:08:36
5935091272,杏中藥局,苗栗縣公館鄉館東村５鄰大同路１７４號,(037)232611,0,391,2020/03/30 22:08:36
5935101086,家嘉藥局,苗栗縣銅鑼鄉中正路128號,(037)986388,0,493,2020/03/30 22:08:36
5935120027,裕祥藥局,苗栗縣頭屋鄉頭屋村尖豐路８５號,(037)253553,2,0,2020/03/30 22:08:36
5935131075,安康藥局,苗栗縣三義鄉廣盛中正路114號,(037)875958,0,4,2020/03/30 22:08:36
5935141044,一心藥局,苗栗縣西湖鄉三湖村店仔街４２號,(037)920868,0,639,2020/03/30 22:08:36
5935160012,東南藥局,苗栗縣三灣鄉銅鏡村通過寮１５號,(037)834275,0,25,2020/03/30 22:08:36
5936010057,慈安藥局,臺中市豐原區西湳里豐北街４０３號,(04)25236680,0,3,2020/03/30 22:08:36
5936010155,春輝堂藥局,臺中市豐原區北陽里豐東路２２０巷１７號,(04)25280086,0,350,2020/03/30 22:08:36
5936010244,惠生藥局,臺中市豐原區社皮里中正路９１８號,(04)25225760,0,10,2020/03/30 22:08:36
5936010280,快安藥局,臺中市豐原區三豐路一段２０５號,(04)25228169,0,2,2020/03/30 22:08:36
5936010324,天一藥局,臺中市豐原區南陽里南陽路２７５號,(04)25232965,33,316,2020/03/30 22:08:36
5936010422,謝藥局,臺中市豐原區葫蘆里市前街２３號,(04)25221812,0,158,2020/03/30 22:08:36
5936010486,輝生藥局,臺中市豐原區鐮村路４１１號,(04)25379563,0,1180,2020/03/30 22:08:36
5936010628,協安大藥局,臺中市豐原區府前街６３號,(04)25200808,0,278,2020/03/30 22:08:36
5936010815,國安保健藥局,臺中市豐原區豐田里田心路二段２５８號,(04)25261726,0,79,2020/03/30 22:08:36
5936012088,安效藥局,臺中市豐原區西安里西勢路１１４巷３２號,(04)25269086,0,9,2020/03/30 22:08:36
5936012097,林芳泉藥局,臺中市豐原區中正路二二八號,(04)25222308,0,115,2020/03/30 22:08:36
5936012113,錦堂藥局,臺中市豐原區中正路１０６號,(04)25229969,0,233,2020/03/30 22:08:36
5936012131,聖得藥局,臺中市豐原區中正路７０號,(04)25158649,0,392,2020/03/30 22:08:36
5936012177,橘井藥局,臺中市豐原區中正路４２３號,(04)25285948,0,964,2020/03/30 22:08:36
5936012275,瑞康藥局,臺中市豐原區中正路２７４號,(04)25287368,0,171,2020/03/30 22:08:36
5936012337,恆安大藥局,臺中市豐原區忠孝街４６號,(04)25226700,64,101,2020/03/30 22:08:36
5936012435,臺安保健藥局,臺中市豐原區三民路３４號,(04)25280098,0,328,2020/03/30 22:08:36
5936012515,中正藥局,臺中市豐原區中正路１８６號,(04)25298379,0,370,2020/03/30 22:08:36
5936012551,豐原福倫藥局,臺中市豐原區中正路２９６號,(04)25276618,0,1511,2020/03/30 22:08:36
5936012588,富鈞藥師藥局,臺中市豐原區中正路４４３號１樓,(04)25245388,0,149,2020/03/30 22:08:36
5936012659,信安藥局,臺中市豐原區三豐路二段３７號,(04)25248736,0,3,2020/03/30 22:08:36
5936012677,誠品藥局,臺中市豐原區中山路３４９號,(04)25120495,84,86,2020/03/30 22:08:36
5936020017,郭藥局,臺中市東勢區南平里豐勢路３９４號,(04)25883382,0,360,2020/03/30 22:08:36
5936020053,生生藥局,臺中市東勢區延平里豊勢路２８２號,(04)25875187,0,852,2020/03/30 22:08:36
5936020080,仁生藥局,臺中市東勢區東安里豐勢路４２１號,(04)25872245,0,187,2020/03/30 22:08:36
5936020099,益春藥局,臺中市東勢區南平里三民路１３７號,(04)25878730,0,603,2020/03/30 22:08:36
5936020115,東生藥局,臺中市東勢區中寧里豐勢路４９１號,(04)25873647,0,625,2020/03/30 22:08:36
5936020133,永和藥局,臺中市東勢區本街275號,(04)25884023,0,520,2020/03/30 22:08:36
5936020142,新明通藥局,臺中市東勢區延平里豐勢路２３２號,(04)25873969,2,613,2020/03/30 22:08:36
5936020204,健生藥局,臺中市東勢區東崎路５段４０９號,(04)25871401,0,150,2020/03/30 22:08:36
5936021327,千百岳大藥局,臺中市東勢區豐勢路８５號１樓,(04)25887639,0,120,2020/03/30 22:08:36
5936030095,青三藥局,臺中市大甲區青三路１２巷３８號,(04)26817301,0,70,2020/03/30 22:08:36
5936030479,上慧藥局,臺中市大甲區順天路３４２號,(04)26873515,0,5,2020/03/30 22:08:36
5936031574,安新藥局,臺中市大甲區順天路３８５號,(04)26764686,0,1,2020/03/30 22:08:36
5936031609,金鼎藥局,臺中市大甲區文武路６７號,(04)26805312,0,1,2020/03/30 22:08:36
5936051450,慈愛藥師藥局,臺中市沙鹿區大同街３６－４號１樓,(04)26623360,0,1,2020/03/30 22:08:36
5936051478,佑安藥局,臺中市沙鹿區中山路３４６號,(04)26632798,66,0,2020/03/30 22:08:36
5936060137,南昌藥局,臺中市梧棲區中央路二段４６５號,(04)26565073,15,0,2020/03/30 22:08:36
5936070017,富大藥局,臺中市后里區甲后路１段４３８號,(04)25568578,0,10,2020/03/30 22:08:36
5936070053,則安藥局,臺中市后里區三豐路四段１８號,(04)25562835,0,425,2020/03/30 22:08:36
5936071158,保仁藥局,臺中市后里區甲后路一段５８５號,(04)25573342,78,20,2020/03/30 22:08:36
5936071185,后里東亞大藥局,臺中市后里區民生路１２３號,(04)25570225,1,3,2020/03/30 22:08:36
5936080068,德惠藥局,臺中市神岡區岸裡里豐社一街３０號,(04)25227548,1,133,2020/03/30 22:08:36
5936081252,壯元藥局,臺中市神岡區民生路２７號,(04)25632368,0,1,2020/03/30 22:08:36
5936090037,皇杰藥局,臺中市潭子區潭興路２段４２９號,(04)25367109,6,0,2020/03/30 22:08:36
5936090082,壽安藥局,臺中市潭子區東寶里雅潭路２段２５４號,(04)25336328,0,1126,2020/03/30 22:08:36
5936090126,頭張藥局,臺中市潭子區頭張路一段１０８號,(04)25334510,2,0,2020/03/30 22:08:36
5936090144,宏仁藥局,臺中市潭子區潭陽里潭子街２段８號,(04)25367266,0,2,2020/03/30 22:08:36
5936091427,久祥藥局,臺中市潭子區中山路二段３８４之７號,(04)25325519,0,1051,2020/03/30 22:08:36
5936091472,豐全藥局,臺中市潭子區甘蔗里雅潭路一段一六一號,(04)25322350,0,10,2020/03/30 22:08:36
5936091534,潭子福倫藥局,臺中市潭子區中山路１段１９之８號,(04)25350918,0,1,2020/03/30 22:08:36
5936091605,康霖中西藥局,臺中市潭子區大豐路３段７６號,(04)25351646,0,3,2020/03/30 22:08:36
5936100047,光田藥局,臺中市大雅區橫山里永和路４８號,(04)25663077,2,0,2020/03/30 22:08:36
5936102961,江內藥局,臺中市大雅區雅潭路三段５９６號,(04)25652671,0,3,2020/03/30 22:08:36
5936110016,景安藥局,臺中市新社區新社里中和街４段１９８號,(04)25811486,0,380,2020/03/30 22:08:36
5936111111,政雄藥局,臺中市新社區興社街四段七五號,(04)25811087,0,1377,2020/03/30 22:08:36
5936111120,新安藥局,臺中市新社區興安路４９之１號,(04)25820690,0,1266,2020/03/30 22:08:36
5936111148,荷仕康藥局,臺中市新社區興安路１８－３３號,(04)25826258,0,40,2020/03/30 22:08:36
5936150234,建仁藥局,臺中市烏日區湖日里中山路二段２９６號,(04)23375612,0,95,2020/03/30 22:08:36
5936150243,萬信藥局,臺中市烏日區前竹里中山路１段５號,(04)23372133,8,124,2020/03/30 22:08:36
5936150305,吳藥局,臺中市烏日區烏日里中山路二段２２４號,(04)23381148,0,202,2020/03/30 22:08:36
5936151393,辰采藥局,臺中市烏日區學田路５８８號,(04)23372207,205,0,2020/03/30 22:08:36
5936151419,烏日福倫藥局,臺中市烏日區中山路２段１１２號,(04)23360318,7,0,2020/03/30 22:08:36
5936151455,上齊健保藥局,臺中市烏日區三民街１５７號,(04)23380876,0,173,2020/03/30 22:08:36
5936160105,建昌藥局,臺中市大肚區蔗廓里遊園路二段１６８號,(04)26910357,0,9,2020/03/30 22:08:36
5936171331,澤士藤藥局,臺中市龍井區新東里新興路５３之９號１樓,(04)26523014,0,2,2020/03/30 22:08:36
5936171359,健安藥局,臺中市龍井區國際街１５３號,(04)26527296,306,1152,2020/03/30 22:08:36
5936171386,國際大藥局,臺中市龍井區藝術街６號,(04)26522118,0,309,2020/03/30 22:08:36
5936171402,上華藥局,臺中市龍井區新興路３７號,(04)26320433,0,1662,2020/03/30 22:08:36
5936171420,我家健康藥局,臺中市龍井區新興路４０之１１號１樓,(04)26317660,0,975,2020/03/30 22:08:36
5936171439,健康生活藥局,臺中市龍井區新興路９６之２５號,(04)26523949,0,15,2020/03/30 22:08:36
5936180296,浤泰大藥局,臺中市霧峰區中正路８８０號,(04)23328875,45,0,2020/03/30 22:08:36
5936181337,長弘藥局,臺中市霧峰區樹仁２街２－１號,(04)23334967,183,0,2020/03/30 22:08:36
5936181346,茗生藥局,臺中市霧峰區萊園路６－４號１樓,(04)23392277,18,0,2020/03/30 22:08:36
5936190078,愛心藥局,臺中市太平區光華里中山路二段４１２－７號,(04)23929396,0,268,2020/03/30 22:08:36
5936190158,榮祺藥局,臺中市太平區長億里太平路２５７號,(04)22783257,21,25,2020/03/30 22:08:36
5936190336,仁和藥局,臺中市太平區新仁路一段１６０號,(04)22783239,0,41,2020/03/30 22:08:36
5936190416,同安藥局,臺中市太平區新平路三段８７號,(04)23918391,44,310,2020/03/30 22:08:36
5936190505,明芳藥局,臺中市太平區光華里大興路１７１號,(04)23921778,24,0,2020/03/30 22:08:36
5936190649,杏原藥局,臺中市太平區新坪里樹孝路７７號,(04)23918768,15,0,2020/03/30 22:08:36
5936190676,中美藥師藥局,臺中市太平區中山路３段８５號,(04)22778238,13,2024,2020/03/30 22:08:36
5936191851,佑昇藥局,臺中市太平區中平路１６號１樓,(04)22783697,0,2,2020/03/30 22:08:36
5936191913,興明健保藥局,臺中市太平區樹德路９７－６號,(04)23955521,1,568,2020/03/30 22:08:36
5936192054,安欣藥師藥局,臺中市太平區新平路１段１１０號,(04)22780113,0,499,2020/03/30 22:08:36
5936192134,樹德大藥局,臺中市太平區樹德路１０２號１樓,(04)23981782,7,0,2020/03/30 22:08:36
5936192296,家嘉藥局,臺中市太平區中山路１段２３４號,(04)23934251,3,958,2020/03/30 22:08:36
5936200032,優美藥師藥局,臺中市大里區新仁路３段２２７號,(04)24872277,0,135,2020/03/30 22:08:36
5936200097,大里啄木鳥藥局,臺中市大里區中興路２段７２號,(04)24865725,0,2,2020/03/30 22:08:36
5936200113,日康藥局,臺中市大里區中興路２段１１１之１號,(04)24853368,3,454,2020/03/30 22:08:36
5936200168,英吉藥局,臺中市大里區金城里上興街二段４６號,(04)24925962,0,2,2020/03/30 22:08:36
5936200177,天霖藥局,臺中市大里區大里路３９之９號１樓,(04)24832481,0,1,2020/03/30 22:08:36
5936200257,裕祥藥局,臺中市大里區西榮里中興路二段３３２之７號,(04)24836389,0,140,2020/03/30 22:08:36
5936209349,添貴藥局,臺中市大里區西榮里益民路二段１１８號,(04)24819353,2,0,2020/03/30 22:08:36
5936209401,聯鎰藥局,臺中市大里區瑞城里塗城路５０３號,(04)24925531,18,0,2020/03/30 22:08:36
5936209796,永欣藥局,臺中市大里區新里里新興路２４號,(04)24077085,24,0,2020/03/30 22:08:36
593620A855,三德藥局,臺中市大里區瑞城里成功路４１９號,(04)24953856,0,8,2020/03/30 22:08:36
593620A891,御和藥局,臺中市大里區東興里益民路二段３２３號,(04)24821555,2,766,2020/03/30 22:08:36
593620B012,廣益藥局,臺中市大里區中興路２段１６７號,(04)24839630,1057,190,2020/03/30 22:08:36
593620B138,聯生中西健保藥局,臺中市大里區現岱路１５８巷１１號,(04)24834058,100,0,2020/03/30 22:08:36
593620B165,大仁祥藥局,臺中市大里區大德街８９號１樓,(04)24814349,0,3,2020/03/30 22:08:36
593620B316,華信藥局,臺中市大里區益民路２段１２號１樓,(04)24872992,0,1,2020/03/30 22:08:36
593620B325,福至藥局,臺中市大里區成功路３８５號,(04)24929116,2,0,2020/03/30 22:08:36
5936211054,和平藥局,臺中市和平區東關路３段１５１之１１號,(04)25941386,2743,1490,2020/03/30 22:08:36
5936211063,八醫健保藥局和平店,臺中市和平區東關路３段１３５號,(04)25941037,506,830,2020/03/30 22:08:36
5937010140,三立大藥局,彰化縣彰化市中華西路１１１號,(04)7635422,0,538,2020/03/30 22:08:36
5937010159,彰化明德藥局,彰化縣彰化市興北里三民路２０９號,(04)7299085,0,137,2020/03/30 22:08:36
5937010202,世和生西藥局,彰化縣彰化市一心東街４６號,(04)7384277,0,430,2020/03/30 22:08:36
5937010293,明功藥局,彰化縣彰化市中央里長安街１５５號,(04)7222362,0,1479,2020/03/30 22:08:36
5937010426,正忠藥局,彰化縣彰化市福安里福鎮街１６號,(04)7244669,0,793,2020/03/30 22:08:36
5937010462,杏全藥局,彰化縣彰化市忠權里彰美路一段１８５號,(04)7240547,0,460,2020/03/30 22:08:36
5937010533,范藥局,彰化縣彰化市東興里公園路１段２９２號,(04)7271540,0,51,2020/03/30 22:08:36
5937010551,長裕藥局,彰化縣彰化市中央里太平街１８０、１８２號,(04)7221299,0,1965,2020/03/30 22:08:36
5937010613,榮源藥局,彰化縣彰化市忠權里辭修路１２８巷９號,(04)7229432,1,640,2020/03/30 22:08:36
5937010668,祥全藥局,彰化縣彰化市永安街４４號,(04)7223078,0,742,2020/03/30 22:08:36
5937010775,全生藥局,彰化縣彰化市光復里和平路８８號,(04)7222086,1,2470,2020/03/30 22:08:36
5937010819,日榮堂藥局,彰化縣彰化市光華里和平路５０號,(04)7222396,0,381,2020/03/30 22:08:36
5937010882,茂新藥局,彰化縣彰化市牛埔里彰南路三段２００號,(04)7374546,0,485,2020/03/30 22:08:36
5937010908,日光堂藥局彰美分店,彰化縣彰化市彰美路１段２３５號,(04)7236611,0,2240,2020/03/30 22:08:36
5937010917,尚豪藥局,彰化縣彰化市大埔路６９５號,(04)7113332,0,33,2020/03/30 22:08:36
5937010999,全杏藥局,彰化縣彰化市茄苳路一段２９９號,(04)7363366,2,146,2020/03/30 22:08:36
5937011021,龍美藥局,彰化縣彰化市中山路三段２２８號,(04)7249816,0,590,2020/03/30 22:08:36
5937011058,大竹長生藥局,彰化縣彰化市彰南路二段８號,(04)7384176,0,117,2020/03/30 22:08:36
5937012117,媽咪藥局,彰化縣彰化市彰南路２段１１５號,(04)7321517,1,328,2020/03/30 22:08:36
5937012126,彰化福倫藥局,彰化縣彰化市中正路２段２２４號,(04)7233018,0,151,2020/03/30 22:08:36
5937012180,大新藥局,彰化縣彰化市福山里彰南路一段４３３號,(04)7383535,0,53,2020/03/30 22:08:36
5937012242,平成藥局,彰化縣彰化市福安里曉陽路３１號,(04)7258070,0,349,2020/03/30 22:08:36
5937012251,慶全藥局,彰化縣彰化市福山里福山街１８９號,(04)7386747,0,168,2020/03/30 22:08:36
5937012411,東東藥局,彰化縣彰化市大竹里彰南路２段２４７－８號,(04)7387407,0,598,2020/03/30 22:08:36
5937012448,瑞群藥局,彰化縣彰化市中正路２段４９５號,(04)7290896,0,521,2020/03/30 22:08:36
5937012546,頂好藥局,彰化縣彰化市成功路２５３號,(04)7271799,0,46,2020/03/30 22:08:36
5937012555,兆仁藥局,彰化縣彰化市民族路４２６號,(04)7278558,2,0,2020/03/30 22:08:36
5937012635,施文彬大藥局,彰化縣彰化市大埔路３４５號,(04)7111653,0,26,2020/03/30 22:08:36
5937012671,康好健保藥局,彰化縣彰化市光南里旭光路２９１號,(04)7234725,0,247,2020/03/30 22:08:36
5937012715,長聖樹藥局,彰化縣彰化市華山路１７３號,(04)7291519,0,30,2020/03/30 22:08:36
5937012751,福田藥局,彰化縣彰化市光復路２０號,(04)7296058,0,638,2020/03/30 22:08:36
5937012831,華恩健保藥局,彰化縣彰化市華山路２１０號,(04)7239977,0,1017,2020/03/30 22:08:36
5937012850,平安藥局,彰化縣彰化市信義里長發街７號１樓,(04)7269122,323,917,2020/03/30 22:08:36
5937012877,振安藥局,彰化縣彰化市民生里永安街７３號,(04)7261277,0,274,2020/03/30 22:08:36
5937012957,康好藥局南校店,彰化縣彰化市華北里南校街１０４號,(04)7283491,0,174,2020/03/30 22:08:36
5937013043,老資生藥局,彰化縣彰化市牛埔里彰南路３段１７５號,(04)7381128,0,289,2020/03/30 22:08:36
5937013052,尚豪藥師藥局旭光店,彰化縣彰化市華北里旭光路１７６號,(04)7280320,0,379,2020/03/30 22:08:36
5937013105,美得康藥局,彰化縣彰化市成功里民族路１８６號,(04)7280707,0,98,2020/03/30 22:08:36
5937013150,康橋藥局,彰化縣彰化市民族路４２９號,(04)7278288,0,130,2020/03/30 22:08:36
5937013196,彰化啄木鳥藥局,彰化縣彰化市茄南里金馬路２段２７號,(04)7330661,7,66,2020/03/30 22:08:36
5937013221,維康藥局,彰化縣彰化市光南里博愛街１３１、１３３號,(04)7279446,0,11,2020/03/30 22:08:36
5937013230,全成藥局,彰化縣彰化市民生里三民路３２０號,(047)263018,141,461,2020/03/30 22:08:36
5937013267,銅鐘藥局,彰化縣彰化市阿夷里泰和路２段３１５號,(04)7200606,0,27,2020/03/30 22:08:36
5937013285,大仁藥局,彰化縣彰化市忠孝里辭修路８０號１樓,(04)7282678,12,1429,2020/03/30 22:08:36
5937013301,大竹藥局,彰化縣彰化市彰南路２段１８９號,(04)7383720,0,130,2020/03/30 22:08:36
5937013310,彰化必安藥局,彰化縣彰化市莿桐里彰水路１４９號,(04)7619127,0,200,2020/03/30 22:08:36
5937013338,彰安藥局,彰化縣彰化市彰安里曉陽路２３５號,(04)7281095,0,25,2020/03/30 22:08:36
5937013347,康禾藥局,彰化縣彰化市崙平里建和街５２號,(04)7624077,0,105,2020/03/30 22:08:36
5937013365,正光藥局民族店,彰化縣彰化市彰安里民族路２１１號,(04)7234876,0,80,2020/03/30 22:08:36
5937013383,大心藥局,彰化縣彰化市中央里民族路５１７號,(04)7282797,0,1287,2020/03/30 22:08:36
5937013392,正欣藥局,彰化縣彰化市興北里長壽街２２０號,(04)7266279,15,586,2020/03/30 22:08:36
5937013418,曉陽藥局,彰化縣彰化市西安里曉陽路２０２號,(04)7270989,0,170,2020/03/30 22:08:36
5937013436,大埔藥局,彰化縣彰化市大埔路４０６、４０８、４１０、４１２號,(04)7117511,0,811,2020/03/30 22:08:36
5937013445,澄星中西藥局,彰化縣彰化市文化里中民街９１號１樓,(04)7236870,4,282,2020/03/30 22:08:36
5937013454,安新健保藥局,彰化縣彰化市自強路３６號１樓,(04)7233160,46,165,2020/03/30 22:08:36
5937013472,建國春生中西藥局,彰化縣彰化市建國北路１５０號,(04)7225047,0,5,2020/03/30 22:08:36
5937013481,美芙藥局,彰化縣彰化市三民路２７０號１樓,(04)7222980,0,640,2020/03/30 22:08:36
5937013507,原安大藥局,彰化縣彰化市南郭路一段１８０號,(04)7272817,46,274,2020/03/30 22:08:36
5937013543,康好藥局三民店,彰化縣彰化市三民路２０１號,(04)7281089,0,159,2020/03/30 22:08:36
5937013552,芳澤藥局,彰化縣彰化市中山路三段４３４號,(04)7380381,0,182,2020/03/30 22:08:36
5937013561,友誼藥局彰化店,彰化縣彰化市辭修路１９１－２號,(04)7288865,0,85,2020/03/30 22:08:36
5937013570,彰化藥局,彰化縣彰化市永安街２７８、２８０號,(04)7287877,66,1614,2020/03/30 22:08:36
5937013589,曜安藥局,彰化縣彰化市民生路１５３號１樓,(04)7280650,0,100,2020/03/30 22:08:36
5937013598,黎明藥局,彰化縣彰化市彰南路２段２１７號,(04)7320995,146,350,2020/03/30 22:08:36
5937021312,健康藥局,彰化縣鹿港鎮中興里民權路２３２號,(04)7764364,0,17,2020/03/30 22:08:36
5937021330,順安藥局,彰化縣鹿港鎮泰興里復興路１２５號,(04)7765510,0,58,2020/03/30 22:08:36
5937021401,展宏藥局,彰化縣鹿港鎮中山路５號,(04)7749001,0,27,2020/03/30 22:08:36
5937021447,永和藥局,彰化縣鹿港鎮中正路２４２之２號,(04)7754750,0,33,2020/03/30 22:08:36
5937021689,豐安藥局,彰化縣鹿港鎮玉順里復興路７２６號,(04)7746157,0,19,2020/03/30 22:08:36
5937021769,杏文藥局,彰化縣鹿港鎮順興里中山路３５４號１樓,(04)7766326,0,4,2020/03/30 22:08:36
5937021778,中山藥局,彰化縣鹿港鎮永安里復興路３６２號,(04)7750686,1,0,2020/03/30 22:08:36
5937021812,大樹鹿港藥局,彰化縣鹿港鎮中正路１９３號,(04)7772226,2,181,2020/03/30 22:08:36
5937021821,新永吉藥局,彰化縣鹿港鎮中山路１２７號,(04)7770940,0,14,2020/03/30 22:08:36
5937031194,三多藥局,彰化縣和美鎮糖友里糖友１街８８號,(04)7356969,0,251,2020/03/30 22:08:36
5937031381,春生藥局新庄店,彰化縣和美鎮彰新路二段５２７、５２９號,(04)7330458,0,35,2020/03/30 22:08:36
5937031416,萬國藥局,彰化縣和美鎮仁安路２３１號,(04)7553948,12,270,2020/03/30 22:08:36
5937031452,春生藥局愛民店,彰化縣和美鎮愛民路１０６號,(04)7566092,0,5,2020/03/30 22:08:36
5937031489,和恩藥局,彰化縣和美鎮和西里道周路７１８號,(04)7576566,1,349,2020/03/30 22:08:36
5937031541,友誼藥局和美店,彰化縣和美鎮和東里仁化路１４７、１４９號,(04)7550866,1,397,2020/03/30 22:08:36
5937031596,康佑藥局,彰化縣和美鎮和東里彰美路５段１７５號１樓,(04)7576816,0,255,2020/03/30 22:08:36
5937031676,博仕藥局,彰化縣和美鎮和線路４７、４９號,(04)7569102,0,3,2020/03/30 22:08:36
5937031710,永合藥局,彰化縣和美鎮彰美路６段１９７號１樓,(04)7557726,597,205,2020/03/30 22:08:36
5937031756,永元藥局,彰化縣和美鎮和線路９１號,(04)7550045,70,18,2020/03/30 22:08:36
5937040077,春安藥局,彰化縣北斗鎮五權里新市街４６號,(04)8882546,0,555,2020/03/30 22:08:36
5937040148,北斗仁和藥局,彰化縣北斗鎮光復里光復路１８２號,(04)8880163,0,154,2020/03/30 22:08:36
5937041172,九和藥局,彰化縣北斗鎮西德里斗苑路一段２９０號,(04)8875039,0,998,2020/03/30 22:08:36
5937041190,仁信藥局,彰化縣北斗鎮中正路137號,(04)8873357,0,431,2020/03/30 22:08:36
5937041207,合康藥局,彰化縣北斗鎮中山路２段３２、３４號,(04)8881669,1,136,2020/03/30 22:08:36
5937041225,宏藥局,彰化縣北斗鎮復興路６６號,(04)8882466,5,988,2020/03/30 22:08:36
5937041305,希賢藥局,彰化縣北斗鎮斗苑路一段３１號,(04)8781025,39,816,2020/03/30 22:08:36
5937041369,北斗福倫藥局,彰化縣北斗鎮西德里斗苑路１段４２５、４２７號,(04)8886618,0,332,2020/03/30 22:08:36
5937041421,惠生大藥局,彰化縣北斗鎮西德里中華路２９１號,(04)8874041,1,12,2020/03/30 22:08:36
