醫事機構代碼,醫事機構名稱,醫事機構地址,醫事機構電話,成人口罩剩餘數,兒童口罩剩餘數,來源資料時間
5932083330,健康中西藥師藥局,桃園市八德區桃鶯路４５號,(03)3638373,1375,0,2020/04/13 15:59:34
5932083394,信發藥局,桃園市八德區桃鶯路２４號,(03)3669276,336,3,2020/04/13 15:59:34
5932083456,瑞誠藥局,桃園市八德區介壽路一段八九八之一號,(03)3669840,29,4,2020/04/13 15:59:34
5932083509,上方藥局,桃園市八德區廣褔路一八八號,(03)3635902,930,5,2020/04/13 15:59:34
5932083527,新大明藥局,桃園市八德區大明街二一號一樓,(03)3618284,9,0,2020/04/13 15:59:34
5932083670,保健藥局,桃園市八德區介壽路一段８３３號２樓,(03)3669486,302,0,2020/04/13 15:59:34
5932083812,家恩藥局,桃園市八德區陸光街４５－１號,(03)3740554,531,0,2020/04/13 15:59:34
5932083974,晨鴻藥師藥局,桃園市八德區桃鶯路７號１樓,(03)3764299,3122,0,2020/04/13 15:59:34
5932084113,我家藥局,桃園市八德區興豐路８３７號,(03)3732736,4,7,2020/04/13 15:59:34
5932084248,佑兒康藥局,桃園市八德區永豐路５７０號,(03)3709680,4,0,2020/04/13 15:59:34
5932084257,成發藥局,桃園市八德區和平路２５０號,(03)3751696,5,0,2020/04/13 15:59:34
5932084300,博泰藥局,桃園市八德區介壽路二段９８２號,(03)3731010,9,0,2020/04/13 15:59:34
5932084319,新寶樹藥局,桃園市八德區介壽路一段９７４號,(03)3770000,9,0,2020/04/13 15:59:34
5932084373,悅康藥局,桃園市八德區介壽路一段９１６號,(03)3662930,9,0,2020/04/13 15:59:34
5932084462,興豐丁丁藥局,桃園市八德區興豐路４３５號,(03)3689287,813,20,2020/04/13 15:59:34
5932084480,大躍藥局,桃園市八德區高城里高城路４８號１樓,(03)3786958,3,1,2020/04/13 15:59:34
5932084499,誠泰藥局,桃園市八德區大千里東勇街５１－２號,(03)3649340,84,0,2020/04/13 15:59:34
5932084533,柚兒藥局,桃園市八德區興仁里豐田三路７９號,(03)3652002,28,0,2020/04/13 15:59:34
5932084560,慈幼藥局,桃園市八德區忠勇六街７號,(03)3749915,0,1,2020/04/13 15:59:34
5932084613,健民大藥局,桃園市八德區介壽路２段２８２號,(03)3666639,0,10,2020/04/13 15:59:34
5932084631,崇明藥局,桃園市八德區介壽路二段１１７１號,(03)3732095,1196,0,2020/04/13 15:59:34
5932084659,美康健保藥局,桃園市八德區桃鶯路９５號,(03)3613624,81,0,2020/04/13 15:59:34
5932084668,奕成健保大藥局,桃園市八德區興豐路６７３號１樓,(03)3732113,93,0,2020/04/13 15:59:34
5932084677,杏一八德介壽藥局,桃園市八德區介壽路一段７７１號１樓,(03)3665542,1686,484,2020/04/13 15:59:34
5932084695,康馥藥局,桃園市八德區金和路５３號１樓,(03)3749620,522,0,2020/04/13 15:59:34
5932090148,關西第一藥局,桃園市龍潭區中山里東龍路３０３巷２號,(03)4096375,6,4,2020/04/13 15:59:34
5932098091,悅發藥局,桃園市龍潭區龍元路８６號,(03)4705098,252,45,2020/04/13 15:59:34
5932099150,繕葆藥局,桃園市龍潭區中興路３０９號,(03)4803831,5,1,2020/04/13 15:59:34
5932099481,弘安育藥局,桃園市龍潭區北龍路一四四號,(03)4808824,3,0,2020/04/13 15:59:34
5932099516,１Ｏ１藥師聯合藥局,桃園市龍潭區中正路４４號,(03)4708593,6,0,2020/04/13 15:59:34
5932099847,龍青藥局,桃園市龍潭區龍青路７２號,(03)4890211,1120,0,2020/04/13 15:59:34
5932099856,佳欣社區藥局,桃園市龍潭區中正路２６２號１樓,(03)4808717,78,0,2020/04/13 15:59:34
5932099874,龍潭北龍藥局,桃園市龍潭區北龍路２７５號,(03)4893123,20,0,2020/04/13 15:59:34
5932099883,美和健保藥局,桃園市龍潭區中興路２０７號,(03)4790639,4,0,2020/04/13 15:59:34
5932099892,百年聯和藥局,桃園市龍潭區中豐路３００號,(03)4895268,2,54,2020/04/13 15:59:34
5932100185,德聯藥師藥局,桃園市平鎮區龍南路３１號,(03)4603613,72,4,2020/04/13 15:59:34
5932100354,世新藥局,桃園市平鎮區廣泰路７５之２號,(03)4941234,2,0,2020/04/13 15:59:34
5932100390,現代藥局,桃園市平鎮區育達路９６、９８號１樓,(03)4922716,0,3,2020/04/13 15:59:34
5932100685,閤家康聯合藥局,桃園市平鎮區中豐路山頂段２５６號,(03)4194550,27,0,2020/04/13 15:59:34
5932100701,壢新藥局,桃園市平鎮區廣泰路１２６號,(03)4950785,2,6,2020/04/13 15:59:34
5932100765,親親大藥局,桃園市平鎮區復旦路二段２１１巷７號,(03)4939368,0,2,2020/04/13 15:59:34
5932100774,龍南藥局,桃園市平鎮區龍南路２００號１樓,(03)4609196,6,6,2020/04/13 15:59:34
5932100792,德韻藥局,桃園市平鎮區延平路三段２號,(03)4013007,9,0,2020/04/13 15:59:34
5932100809,愛國藥師藥局,桃園市平鎮區民族路二段１３９號１樓,(03)4014747,9,20,2020/04/13 15:59:34
5932100863,新昕藥局,桃園市平鎮區東社里龍南路９２號１樓,(03)4509616,1,0,2020/04/13 15:59:34
5932101011,天晴藥局,桃園市平鎮區和平路１２５號３樓,(03)4596503,1619,0,2020/04/13 15:59:34
5932101075,杏一平鎮環南藥局,桃園市平鎮區環南路２號,(03)4951758,9,60,2020/04/13 15:59:34
5932108387,正豐藥局,桃園市平鎮區新勢里新榮路２５０號,(03)4937259,3,0,2020/04/13 15:59:34
5932108430,建德藥局,桃園市平鎮區北勢里金陵路１０３號,(03)4686662,1,4,2020/04/13 15:59:34
5932109955,優達藥局,桃園市平鎮區廣明路六六號,(03)4943488,1,0,2020/04/13 15:59:34
5932109973,新英藥局,桃園市平鎮區中豐路208號1樓,(03)4687729,6,0,2020/04/13 15:59:34
5932110092,宏興藥局,桃園市新屋區新生里中山路４０８號,(03)4773181,0,5,2020/04/13 15:59:34
5932120016,吉利藥師藥局,桃園市觀音區富源里新富路１７０５號,(03)4901701,12,0,2020/04/13 15:59:34
5932120098,金永生藥局,桃園市觀音區觀音里甘泉街７號,(03)4732072,1,2,2020/04/13 15:59:34
5932123008,立明藥局,桃園市觀音區草漯里大觀路二段３３－１號１樓,(03)4838292,6,0,2020/04/13 15:59:34
5932124185,德洋藥局,桃園市觀音區中山路二段九三九號,(03)4980527,8,3,2020/04/13 15:59:34
5932124265,弘宗藥局,桃園市觀音區中山路１５號,(03)4735659,3,0,2020/04/13 15:59:34
5932124354,健康藥局,桃園市觀音區新坡里中山路二段６２５號１樓,(03)4989952,567,6,2020/04/13 15:59:34
5932124372,福星藥局,桃園市觀音區大觀路二段２１３號１樓,(03)4389138,8,2,2020/04/13 15:59:34
5932130049,德怡藥局,桃園市復興區澤仁里忠孝路３４號,(03)3821686,2,0,2020/04/13 15:59:34
5933010091,進安藥局,新竹縣關西鎮正義路１５號,(03)5872153,2,2,2020/04/13 15:59:34
5933010144,佳仁藥局,新竹縣關西鎮中興路１２號,(035)872298,18,0,2020/04/13 15:59:34
5933011178,康和藥局,新竹縣關西鎮正義路７９號,(03)5870068,9,260,2020/04/13 15:59:34
5933011196,高平堂藥局,新竹縣關西鎮正義路66號,(03)5872263,606,5,2020/04/13 15:59:34
5933011258,安東藥師藥局,新竹縣關西鎮中山路６２號,(03)5872385,1,0,2020/04/13 15:59:34
5933020104,廣和藥局,新竹縣新埔鎮中正路２９２號,(035)885959,144,0,2020/04/13 15:59:34
5933030324,健通藥局,新竹縣竹東鎮東寧路三段１０１號一樓,(03)5947630,6,1,2020/04/13 15:59:34
5933031456,永康藥局,新竹縣竹東鎮長春路３段５號２樓,(03)5954706,591,0,2020/04/13 15:59:34
5933031554,鴻達藥局,新竹縣竹東鎮中興路三段１７４號,(03)5835237,72,0,2020/04/13 15:59:34
5933031689,平安佳藥局,新竹縣竹東鎮東寧路３段２１號,(03)5963138,27,0,2020/04/13 15:59:34
5933031723,日榮堂藥局,新竹縣竹東鎮長春路一段２８１號,(03)5962335,270,30,2020/04/13 15:59:34
5933031796,春天藥局,新竹縣竹東鎮長春路二段９５號,(03)5967995,54,20,2020/04/13 15:59:34
5933031821,新月藥局,新竹縣竹東鎮永康街８１號１樓,(03)5960501,900,100,2020/04/13 15:59:34
5933050059,康立藥局,新竹縣竹北市竹仁里中正東路２８８號,(03)5518093,126,0,2020/04/13 15:59:34
5933050317,林保郎藥師藥局,新竹縣竹北市光明一路３９２號,(03)5586879,216,0,2020/04/13 15:59:34
5933052053,真善美藥局,新竹縣竹北市勝利五路１７６號,(03)6589478,5,8,2020/04/13 15:59:34
5933052099,無尾熊藥師藥局,新竹縣竹北市莊敬五街６號,(03)6577535,4,0,2020/04/13 15:59:34
5933052133,波士頓藥局,新竹縣竹北市民權街６７號,(03)6560060,0,3,2020/04/13 15:59:34
5933052393,立康藥局,新竹縣竹北市華興街２２０號,(03)5527730,189,10,2020/04/13 15:59:34
5933052446,佑安藥局,新竹縣竹北市中正西路31號1樓,(03)6563386,3,0,2020/04/13 15:59:34
5933052535,嘉岳藥局,新竹縣竹北市勝利三街３８號,(03)6585707,2238,320,2020/04/13 15:59:34
5933052731,欣欣藥局,新竹縣竹北市成功八路１００號,(03)6676287,1098,100,2020/04/13 15:59:34
5933052777,竹仁藥師藥局,新竹縣竹北市仁和街６號１樓,(03)5528947,36,0,2020/04/13 15:59:34
5933052811,仁康藥局,新竹縣竹北市縣政九路１７６號２樓,(03)5518777,7,5,2020/04/13 15:59:34
5933052875,健樹藥局,新竹縣竹北市莊敬三路３９號１樓,(03)5505262,522,20,2020/04/13 15:59:34
5933052955,仁里藥局,新竹縣竹北市勝利二路１２５號,(03)6673878,216,0,2020/04/13 15:59:34
5933052973,芳鄰藥局,新竹縣竹北市三民路２６１號之１號,(03)6213887,0,45,2020/04/13 15:59:34
5933052982,如佳藥局,新竹縣竹北市中正西路１８９號,(03)5533161,0,3,2020/04/13 15:59:34
5933053041,中一藥局,新竹縣竹北市文興路一段２４２號１樓,(03)6670827,495,0,2020/04/13 15:59:34
5933053050,祐祐藥局,新竹縣竹北市中正西路１０３號,(03)5552969,3,0,2020/04/13 15:59:34
5933053158,竹北啄木鳥藥局,新竹縣竹北市博愛街１８３號,(03)5539420,27,0,2020/04/13 15:59:34
5933053185,新瓦屋藥局,新竹縣竹北市文興路一段１５０號１樓,(03)6585996,1017,0,2020/04/13 15:59:34
5933053194,仁信藥局,新竹縣竹北市嘉豐南路二段５１號,(03)6676218,0,18,2020/04/13 15:59:34
5933053247,竹北光明藥局,新竹縣竹北市光明一路１３７號,(03)5584545,198,0,2020/04/13 15:59:34
5933053265,金慧藥局,新竹縣竹北市科大二街１８５號一樓,(03)5586687,6,0,2020/04/13 15:59:34
5933053283,艾美藥局,新竹縣竹北市中正西路８２號１樓,(03)5557760,1,0,2020/04/13 15:59:34
5933060162,黃藥師中西藥局,新竹縣湖口鄉仁勢村民族街９８號,(03)5996388,0,7,2020/04/13 15:59:34
5933061276,中心藥局,新竹縣湖口鄉中正路一段１１５號２樓,(03)5904636,9,0,2020/04/13 15:59:34
5933061552,信福藥局,新竹縣湖口鄉民權街３３號,(03)5903618,3,0,2020/04/13 15:59:34
5933061570,湖口藥局,新竹縣湖口鄉民族路４５號,(03)5991842,135,2,2020/04/13 15:59:34
5933061632,宏安藥局,新竹縣湖口鄉中山路二段１１０號,(035)996335,5,0,2020/04/13 15:59:34
5933061696,育祥藥局,新竹縣湖口鄉安宅九街８３號１樓,(03)5977271,6,0,2020/04/13 15:59:34
5933061712,湖山藥局,新竹縣湖口鄉中山路二段１２７號,(03)5904999,351,0,2020/04/13 15:59:34
5933081474,立人藥局,新竹縣新豐鄉建興路一段５７號,(03)5578217,405,0,2020/04/13 15:59:34
5933081536,昌昌藥局,新竹縣新豐鄉新市路１９３號,(03)5598077,99,20,2020/04/13 15:59:34
5933081545,立果藥師藥局,新竹縣新豐鄉新興路５６－１號,(03)5575023,0,1,2020/04/13 15:59:34
5933130529,家佳福藥局,新竹縣尖石鄉嘉樂村2鄰麥樹仁59號,(03)5842808,11,2,2020/04/13 15:59:34
5934010022,振芳藥局,宜蘭縣宜蘭市中山路３段１７９號,(03)9322369,36,2,2020/04/13 15:59:34
5934010086,圓滿堂藥局,宜蘭縣宜蘭市中山路３段４８號,(03)9323413,3,0,2020/04/13 15:59:34
5934010193,文化藥師藥局,宜蘭縣宜蘭市復興路１段１３１號,(03)9332415,864,4,2020/04/13 15:59:34
5934011510,李藥局,宜蘭縣宜蘭市中山路２段２１１號,(03)9362234,927,0,2020/04/13 15:59:34
5934011529,宜生藥局,宜蘭縣宜蘭市新民路１１１號,(03)9327893,0,4,2020/04/13 15:59:34
5934011636,興南藥局,宜蘭縣宜蘭市中山路３段１７８號,(03)9310984,0,2,2020/04/13 15:59:34
5934011770,日興健保藥局,宜蘭縣宜蘭市舊城西路７７號,(03)9367777,5,3,2020/04/13 15:59:34
5934011887,吉祥大藥局,宜蘭縣宜蘭市中山路２段３１１號１樓,(03)9327811,5,8,2020/04/13 15:59:34
5934012008,欣悅藥局,宜蘭縣宜蘭市中山路２段３０３號,(03)9321002,225,0,2020/04/13 15:59:34
5934012044,富康新民藥局,宜蘭縣宜蘭市新民路１１３號,(03)9366060,0,5,2020/04/13 15:59:34
5934012197,佳音藥局,宜蘭縣宜蘭市中山路２段５９號１樓,(03)9362869,5,3,2020/04/13 15:59:34
5934012204,順利藥局,宜蘭縣宜蘭市民族里民族路２９０號２樓,(03)9333060,1,0,2020/04/13 15:59:34
5934012222,康泰藥局,宜蘭縣宜蘭市聖後街１７７號,(03)9358715,0,7,2020/04/13 15:59:34
5934012231,黎明健康藥局,宜蘭縣宜蘭市光復路３０號２樓,(03)9312301,5,4,2020/04/13 15:59:34
5934012295,神農養生藥局,宜蘭縣宜蘭市神農路１段９１號１樓,(03)9327089,5,0,2020/04/13 15:59:34
5934012320,緣心健保藥局,宜蘭縣宜蘭市同興街１０１號,(03)9366326,6,3,2020/04/13 15:59:34
5934012339,禮仁藥局,宜蘭縣宜蘭市中山路５段３１號,(03)9288884,0,9,2020/04/13 15:59:34
5934012348,聖心藥局,宜蘭縣宜蘭市復興路３１號,(03)9357099,3,8,2020/04/13 15:59:34
5934020073,長生藥局,宜蘭縣羅東鎮復興路１段１號,(03)9553222,0,3,2020/04/13 15:59:34
5934020251,黃藥局,宜蘭縣羅東鎮公正路３７４號,(03)9545857,0,2,2020/04/13 15:59:34
5934021374,博雅藥師藥局,宜蘭縣羅東鎮維揚路２８號,(03)9519007,0,4,2020/04/13 15:59:34
5934021409,德芳藥局,宜蘭縣羅東鎮公正路２５６號,(03)9557166,3,6,2020/04/13 15:59:34
5934021418,民生健保藥局,宜蘭縣羅東鎮中正南路５３號１樓,(03)9562354,1,0,2020/04/13 15:59:34
5934021481,怡林藥局,宜蘭縣羅東鎮興東南路１７４號,(03)9541926,216,3,2020/04/13 15:59:34
5934021516,興東藥局,宜蘭縣羅東鎮興東路１號１樓,(03)9569621,3,9,2020/04/13 15:59:34
5934021525,喜樂藥師藥局,宜蘭縣羅東鎮中山路３段１７１號,(03)9547113,246,3,2020/04/13 15:59:34
5934021534,佳和藥局,宜蘭縣羅東鎮興東路１２０號２樓,(03)9577734,0,1,2020/04/13 15:59:34
5934021543,宏恩藥局,宜蘭縣羅東鎮和平路１３０－２號,(03)9569906,5,5,2020/04/13 15:59:34
5934021598,康馥藥局,宜蘭縣羅東鎮民生東路６６號２樓,(03)9573128,1,0,2020/04/13 15:59:34
5934021632,上華藥局,宜蘭縣羅東鎮復興路２段１５９號,(03)9557655,1,0,2020/04/13 15:59:34
5934021641,同興藥局,宜蘭縣羅東鎮林場路１３號１樓,(03)9565585,0,7,2020/04/13 15:59:34
5934021776,一生藥師藥局,宜蘭縣羅東鎮中正南路１２７號,(03)9542620,9,0,2020/04/13 15:59:34
5934021794,倉前藥局,宜蘭縣羅東鎮公正里倉前路５７號１樓,(03)9571336,1,1,2020/04/13 15:59:34
5934021801,康健藥局,宜蘭縣羅東鎮中山路四段２４８號,(03)9512959,1,4,2020/04/13 15:59:34
5934021847,集祥藥局,宜蘭縣羅東鎮天津路２－４號,(03)9577231,6,5,2020/04/13 15:59:34
5934021883,潤康社區健保藥局,宜蘭縣羅東鎮公正路１６７之２號１樓,(03)9576271,0,2,2020/04/13 15:59:34
5934021954,家安藥局,宜蘭縣羅東鎮中正北路１７號,(03)9550295,0,4,2020/04/13 15:59:34
5934021972,晨安藥局,宜蘭縣羅東鎮倉前路４０號,(03)9540633,3,1,2020/04/13 15:59:34
5934021990,成功藥局,宜蘭縣羅東鎮興東南路２３５號,(03)9577550,6,8,2020/04/13 15:59:34
5934022022,光澤醫美藥局,宜蘭縣羅東鎮興東路９９之１號,(03)9566961,64,0,2020/04/13 15:59:34
5934022068,宜寧藥局,宜蘭縣羅東鎮公正路９８號１樓,(03)9555051,8,1066,2020/04/13 15:59:34
5934030015,南陽藥局,宜蘭縣蘇澳鎮中山路１段１２０號,(03)9965076,3,0,2020/04/13 15:59:34
5934030051,正蘇西西藥局,宜蘭縣蘇澳鎮中山路一段４７號,(03)9965380,3,6,2020/04/13 15:59:34
5934031110,宜家藥師藥局,宜蘭縣蘇澳鎮中山路１段１１６號,(03)9955727,0,3,2020/04/13 15:59:34
5934031138,新豐藥局,宜蘭縣蘇澳鎮江夏路２６號,(03)9962869,99,38,2020/04/13 15:59:34
5934031218,熊野藥局,宜蘭縣蘇澳鎮龍德里福德路418號,(03)9903367,805,4,2020/04/13 15:59:34
5934031245,熊本健保藥局,宜蘭縣蘇澳鎮大同路６２號,(03)9902758,0,3,2020/04/13 15:59:34
5934040039,仁康藥局,宜蘭縣頭城鎮纘祥路７９之１號,(03)9776651,8,1,2020/04/13 15:59:34
5934040093,元生藥師藥局,宜蘭縣頭城鎮沙成路３０號,(03)9770795,0,8,2020/04/13 15:59:34
5934041143,群英藥局,宜蘭縣頭城鎮開蘭路４７號,(03)9780500,166,30,2020/04/13 15:59:34
5934041161,頭城藥局,宜蘭縣頭城鎮開蘭路１３４號,(03)9770618,7,7,2020/04/13 15:59:34
5934041170,永仁藥局,宜蘭縣頭城鎮吉祥路８８巷２５號１樓,(03)9789788,0,5,2020/04/13 15:59:34
5934041205,晴天藥局,宜蘭縣頭城鎮開蘭路１８１號,(03)9789121,0,7,2020/04/13 15:59:34
5934051149,和風藥局,宜蘭縣礁溪鄉中山路１段６９號,(03)9883511,8,0,2020/04/13 15:59:34
5934051167,岩峰藥局,宜蘭縣礁溪鄉中山路２段２１號２樓,(03)9887542,8,1,2020/04/13 15:59:34
5934051265,恩好藥局,宜蘭縣礁溪鄉中山路１段９５號,(03)9889256,765,30,2020/04/13 15:59:34
5934061047,壯圍藥局,宜蘭縣壯圍鄉吉祥村壯五路２７９號,(03)9388948,12,0,2020/04/13 15:59:34
5934070037,上新藥局,宜蘭縣員山鄉員山路１段２９６號,(03)9220086,97,0,2020/04/13 15:59:34
5934071034,信毅藥師藥局,宜蘭縣員山鄉員山路１段１８２號,(03)9230815,0,9,2020/04/13 15:59:34
5934071052,喜樂心藥局,宜蘭縣員山鄉復興路６號,(03)9230523,374,0,2020/04/13 15:59:34
5934080015,佳恩藥局,宜蘭縣冬山鄉義成路３段４０１號,(03)9586065,6,2,2020/04/13 15:59:34
5934081049,德鑫藥局,宜蘭縣冬山鄉義成路３段４７５號１樓,(03)9559868,0,45,2020/04/13 15:59:34
5934081058,華康藥局,宜蘭縣冬山鄉冬山路５段２０２號１樓,(03)9532942,3,3,2020/04/13 15:59:34
5934081067,威仁藥局,宜蘭縣冬山鄉冬山路２１９號,(03)9595351,45,36,2020/04/13 15:59:34
5934081165,合康藥局,宜蘭縣冬山鄉廣興路２１３號,(03)9616457,0,1,2020/04/13 15:59:34
5934081174,和康藥局,宜蘭縣冬山鄉義成路３段３５１號１樓,(03)9680650,0,2,2020/04/13 15:59:34
5934091125,安心藥局,宜蘭縣五結鄉禮運路３８－１號,(03)9551670,6,7,2020/04/13 15:59:34
5935010017,永佳藥局,苗栗縣苗栗市玉苗里光復路１５６號,(037)331860,6,0,2020/04/13 15:59:34
5935010035,大仁藥局,苗栗縣苗栗市北苗里中華路８６號,(037)262558,0,1,2020/04/13 15:59:34
5935010044,贈光藥局,苗栗縣苗栗市清華里為公路１３３號之１,(037)266786,0,850,2020/04/13 15:59:34
5935010124,富安藥局,苗栗縣苗栗市上苗里中正路５３號,(037)262337,4,6,2020/04/13 15:59:34
5935010259,德鑫藥局,苗栗縣苗栗市清華里為公路３４８號,(037)261698,65,0,2020/04/13 15:59:34
5935011523,天恩藥局,苗栗縣苗栗市中正路49號,(037)277285,0,5,2020/04/13 15:59:34
5935011710,維新藥局,苗栗縣苗栗市中正路632號1樓,(037)320698,0,6,2020/04/13 15:59:34
5935011738,佳禾藥局,苗栗縣苗栗市青苗里建台街7號,(037)373041,252,30,2020/04/13 15:59:34
5935011783,芳鄰國際連鎖藥局,苗栗縣苗栗市中山路５６７號,(037)330580,14,0,2020/04/13 15:59:34
5935011818,博大藥局,苗栗縣苗栗市至公路64號,(037)363751,6,2,2020/04/13 15:59:34
5935011916,吉利康藥局,苗栗縣苗栗市中正路340號,(037)370529,8,9,2020/04/13 15:59:34
5935011925,廷安藥局,苗栗縣苗栗市府前路133號,(037)356839,0,5,2020/04/13 15:59:34
5935011952,千百岳大藥局,苗栗縣苗栗市上苗里中山路70號,(037)271335,243,10,2020/04/13 15:59:34
5935012002,好鄰居藥局,苗栗縣苗栗市建功里中正路222號,(037)350395,0,1,2020/04/13 15:59:34
5935012084,苗栗安德藥局,苗栗縣苗栗市高苗里信義街１０號,(037)350420,27,0,2020/04/13 15:59:34
5935012146,聯合藥師藥局,苗栗縣苗栗市社寮街１４５號,(037)264425,813,0,2020/04/13 15:59:34
5935012182,陽光藥局,苗栗縣苗栗市中山路４７８號,(037)355718,0,1,2020/04/13 15:59:34
5935012191,元品藥局,苗栗縣苗栗市至公路４４５號１樓,(037)377935,3,6,2020/04/13 15:59:34
5935012299,瑞展藥局,苗栗縣苗栗市中正路７３號,(037)271658,7,0,2020/04/13 15:59:34
5935012315,良品藥局,苗栗縣苗栗市中正路４６８號,(037)366837,117,18,2020/04/13 15:59:34
5935012333,苗安藥局,苗栗縣苗栗市恭敬里信義街３１號,(037)356388,3,5,2020/04/13 15:59:34
5935012342,杏一苗栗中山藥局,苗栗縣苗栗市至公路３８號,(037)354552,71,5,2020/04/13 15:59:34
5935012360,心惠聯合藥局,苗栗縣苗栗市中山路１８８號１樓,(037)377389,166,0,2020/04/13 15:59:34
5935012379,橙易藥局,苗栗縣苗栗市中正路２９１號１樓,(037)376608,0,5,2020/04/13 15:59:34
5935020148,泰元藥局,苗栗縣苑裡鎮苑南里為公路６８號,(037)863668,1,0,2020/04/13 15:59:34
5935021261,永信藥師藥局,苗栗縣苑裡鎮新生路３５號,(037)857069,655,80,2020/04/13 15:59:34
5935021270,全家藥局,苗栗縣苑裡鎮信義路２３之１號１樓,(037)861997,6,5,2020/04/13 15:59:34
5935021323,國豐藥師藥局,苗栗縣苑裡鎮苑北里２鄰天下路１８６號,(037)866516,0,5,2020/04/13 15:59:34
5935030091,惠生藥局,苗栗縣通霄鎮通東里信義路１２２號,(037)752773,1185,168,2020/04/13 15:59:34
5935040266,鴻仁大藥局,苗栗縣竹南鎮竹南里博愛街１８１號,(037)462396,35,0,2020/04/13 15:59:34
5935040328,明志藥局,苗栗縣竹南鎮照南里博愛街４號,(037)472341,315,0,2020/04/13 15:59:34
5935041469,順春藥局,苗栗縣竹南鎮延平路２７號之１２,(037)552068,17,0,2020/04/13 15:59:34
5935041567,京典藥局,苗栗縣竹南鎮博愛街300-2號,(037)550661,3,8,2020/04/13 15:59:34
5935041629,悅昌藥局,苗栗縣竹南鎮中正路２８號一樓,(037)477195,0,5,2020/04/13 15:59:34
5935041781,惠家藥局,苗栗縣竹南鎮自強街４２號,(037)463635,108,0,2020/04/13 15:59:34
5935041905,米樂中西健保藥局,苗栗縣竹南鎮大營路２０７號,(037)552116,9,0,2020/04/13 15:59:34
5935041950,建康藥局,苗栗縣竹南鎮民治街６號,(037)483293,8,0,2020/04/13 15:59:34
5935050066,義春藥局,苗栗縣頭份市珊湖里中正三路７２號,(037)601433,1,0,2020/04/13 15:59:34
5935050164,辰安藥局,苗栗縣頭份市尖豐路３２號,(037)633632,2,8,2020/04/13 15:59:34
5935050306,康利藥局,苗栗縣頭份市忠孝里仁愛路８６號,(037)666101,3,0,2020/04/13 15:59:34
5935051545,富優藥局,苗栗縣頭份市中華路９３０號,(037)681635,18,0,2020/04/13 15:59:34
5935051572,信義藥局,苗栗縣頭份市中華路９３８號（後段）,(037)683351,0,5,2020/04/13 15:59:34
5935051698,信源藥局,苗栗縣頭份市仁愛里信東路３９號,(037)663580,2,0,2020/04/13 15:59:34
5935051849,懷生中西藥局,苗栗縣頭份市中正路１９號,(037)672357,9,0,2020/04/13 15:59:34
5935070022,林大藥局,苗栗縣卓蘭鎮新榮里中正路３２號,(04)25891630,3,0,2020/04/13 15:59:34
5935071216,萊恩藥局,苗栗縣卓蘭鎮上新里上新7之1號,(04)25899369,778,0,2020/04/13 15:59:34
5935071234,國良藥局,苗栗縣卓蘭鎮中山路１１１號,(04)25899578,0,8,2020/04/13 15:59:34
5935071243,卓蘭千百岳大藥局,苗栗縣卓蘭鎮中山路８２號,(04)25895473,14,0,2020/04/13 15:59:34
5935081132,康城藥局,苗栗縣大湖鄉民生路６９號,(037)995188,216,0,2020/04/13 15:59:34
5935091156,信安藥局,苗栗縣公館鄉大同路７８號,(037)237849,5,3,2020/04/13 15:59:34
5935091245,芳鄰藥局,苗栗縣公館鄉玉泉村玉泉３６８之１１號,(037)223727,19,0,2020/04/13 15:59:34
5935091254,上恩藥局,苗栗縣公館鄉大同路１８０號,(037)234008,0,25,2020/04/13 15:59:34
5935091263,懷慶中西藥局,苗栗縣公館鄉近光路９４號,(037)239234,4,0,2020/04/13 15:59:34
5935091272,杏中藥局,苗栗縣公館鄉館東村５鄰大同路１７４號,(037)232611,0,10,2020/04/13 15:59:34
5935100034,銅鑼藥局,苗栗縣銅鑼鄉銅鑼村中正路１８８號,(037)981511,0,4,2020/04/13 15:59:34
5935101086,家嘉藥局,苗栗縣銅鑼鄉中正路128號,(037)986388,3,8,2020/04/13 15:59:34
5935120027,裕祥藥局,苗栗縣頭屋鄉頭屋村尖豐路８５號,(037)253553,15,1,2020/04/13 15:59:34
5935130023,民享藥局,苗栗縣三義鄉廣盛村中正路１４７之３號,(037)871498,0,36,2020/04/13 15:59:34
5935131075,安康藥局,苗栗縣三義鄉廣盛中正路114號,(037)875958,6,1,2020/04/13 15:59:34
5935141044,一心藥局,苗栗縣西湖鄉三湖村店仔街４２號,(037)920868,10,0,2020/04/13 15:59:34
5936010244,惠生藥局,臺中市豐原區社皮里中正路９１８號,(04)25225760,8,0,2020/04/13 15:59:34
5936010324,天一藥局,臺中市豐原區南陽里南陽路２７５號,(04)25232965,1910,0,2020/04/13 15:59:34
5936012088,安效藥局,臺中市豐原區西安里西勢路１１４巷３２號,(04)25269086,0,7,2020/04/13 15:59:34
5936012097,林芳泉藥局,臺中市豐原區中正路二二八號,(04)25222308,5,0,2020/04/13 15:59:34
5936012131,聖得藥局,臺中市豐原區中正路７０號,(04)25158649,429,7,2020/04/13 15:59:34
5936012337,恆安大藥局,臺中市豐原區忠孝街４６號,(04)25226700,2,0,2020/04/13 15:59:34
