醫事機構代碼,醫事機構名稱,醫事機構地址,醫事機構電話,成人口罩剩餘數,兒童口罩剩餘數,來源資料時間
5901011751,德恩藥師藥局,臺北市松山區八德路２段３７８號１樓,(02)27782829,4634,618,2020/08/16 17:23:31
5901012650,銘德藥局,臺北市松山區八德路２段３６６巷２８號,(02)27511833,2952,420,2020/08/16 17:23:31
5901013371,玖田藥局,臺北市松山區八德路４段６５５號,(02)27666578,5229,790,2020/08/16 17:23:31
5901020376,靜園藥局,臺北市大安區和平東路２段１１８巷５７之１號,(02)27336390,2253,839,2020/08/16 17:23:31
5901023653,信安健康藥局,臺北市大安區仁愛路４段１２２巷５８號,(02)27084858,4148,0,2020/08/16 17:23:31
5901092087,躍獅文昌藥局,臺北市大同區民生西路１０８號（實際營業：一層）,(02)25586189,2566,2048,2020/08/16 17:23:31
5901102408,康林藥局,臺北市中山區興安街１０５號,(02)25171867,1377,130,2020/08/16 17:23:31
5901103110,大直健康藥局,臺北市中山區北安路５９１號,(02)25323310,5220,970,2020/08/16 17:23:31
5901110393,明湖藥局,臺北市內湖區東湖路７巷２７號１Ｆ,(02)26313515,31338,1040,2020/08/16 17:23:31
5901121985,勝安藥局,臺北市南港區舊莊街１段１６５號,(02)27828450,3477,1268,2020/08/16 17:23:31
5901162173,小明藥局,臺北市北投區中央南路１段６９號２樓,(02)28928950,0,150,2020/08/16 17:23:31
5901162477,長宜藥局,臺北市北投區自強街１１２號,(02)28216605,936,350,2020/08/16 17:23:31
5901163527,理得藥局,臺北市北投區石牌路１段１５０號,(02)28289680,2745,140,2020/08/16 17:23:31
5902040087,世詠藥局,高雄市楠梓區楠都東街１３８號,(07)3539869,4942,233,2020/08/16 17:23:31
5902050154,杏安藥局,高雄市三民區十全一路91 號,(07)3111606,2817,990,2020/08/16 17:23:31
5902050298,瑞鶴藥局,高雄市三民區寶德里義德路２５號,(07)3862757,4113,540,2020/08/16 17:23:31
5902050565,澄和藥局,高雄市三民區澄和路６６號,(07)3923111,3648,496,2020/08/16 17:23:31
5902051240,明皇藥局,高雄市三民區寶國里義華路１８１號,(07)3860121,3438,330,2020/08/16 17:23:31
5902053833,建銘藥局,高雄市三民區吉林街２６２號,(07)3133460,2592,0,2020/08/16 17:23:31
5902056807,長慶藥局,高雄市三民區金鼎路３１０號,(07)3105835,1476,4,2020/08/16 17:23:31
5902057822,建工丁丁藥局,高雄市三民區建工路５６８號,(07)3830841,679,2,2020/08/16 17:23:31
5902080376,政德藥局,高雄市苓雅區正大里武廟路２９號,(07)7114371,3636,0,2020/08/16 17:23:31
5902080616,一加藥局,高雄市苓雅區和平一路四二號,(07)7212748,3404,308,2020/08/16 17:23:31
5902090032,全國大藥局,高雄市前鎮區三多二路４０３號１樓,(07)3345775,3304,239,2020/08/16 17:23:31
5902111670,桂林活力藥師藥局,高雄市小港區桂陽路４０號,(07)7931248,5670,0,2020/08/16 17:23:31
5903030174,慶安藥局,臺中市大甲區文武路１７８之３號,(04)26802933,4510,373,2020/08/16 17:23:31
5903090116,上宇藥局,臺中市潭子區中山路２段３８１號１樓,(04)25321258,1899,325,2020/08/16 17:23:31
5903090143,佳福藥局,臺中市潭子區中山路１段４３－１號,(04)25332982,5545,168,2020/08/16 17:23:31
5903090367,成記藥局,臺中市潭子區潭興路三段９３號１樓,(04)25358076,2880,90,2020/08/16 17:23:31
5903190335,育賢德侑藥局,臺中市太平區育賢路１０７號、１０９號,(04)23920696,3420,0,2020/08/16 17:23:31
5903190442,天慈大藥局,臺中市太平區太平路５４０號,(04)22785052,972,0,2020/08/16 17:23:31
5903200194,博德藥局,臺中市大里區成功２路１０４號１樓,(04)24968642,5274,0,2020/08/16 17:23:31
5903220114,鄧博士藥局,臺中市中區中山路３２５號１樓,(04)22256851,2817,1064,2020/08/16 17:23:31
5903270347,甘肅安德藥局,臺中市西屯區甘肅路２０２－３號,(04)23165935,3555,70,2020/08/16 17:23:31
5903270570,百富藥局,臺中市西屯區福上巷１６號,(04)22970708,2732,0,2020/08/16 17:23:31
5903280165,南屯福倫藥局,臺中市南屯區南屯路２段３１７號,(04)24758018,5535,0,2020/08/16 17:23:31
5905010143,啄木鳥藥師藥局,臺南市新營區新南里民治路２４２號,(06)6590248,2889,0,2020/08/16 17:23:31
5905270041,仁德市安藥師藥局,臺南市仁德區中正西路２５號,(06)2661933,4506,120,2020/08/16 17:23:31
5905280047,獅甲藥局,臺南市歸仁區六甲里六甲路２０３號,(06)3388387,5112,476,2020/08/16 17:23:31
5905320135,安麗兒藥局裕農店,臺南市東區裕農路１００號１樓,(06)2377378,78,0,2020/08/16 17:23:31
5905340253,永華台安藥局,臺南市中西區永華路一段１８４、１８４－１號１、２、３樓,(06)2225531,3168,798,2020/08/16 17:23:31
5907010203,新富丁丁藥局,高雄市鳳山區新富路９５號,(07)7156198,4041,0,2020/08/16 17:23:31
5907080125,仁武丁丁藥局,高雄市仁武區仁和里鳳仁路２１之８號,(07)3721896,2196,554,2020/08/16 17:23:31
5907200047,永恒健康生活藥局,高雄市梓官區智蚵里通安路１７６號１樓,(07)6102755,2785,283,2020/08/16 17:23:31
5907290050,新高橋藥局裕明店,高雄市鼓山區裕誠路１６８０號,(07)5224680,1718,0,2020/08/16 17:23:31
5907340046,銘益藥局,高雄市前金區七賢二路２０８、２１０號１樓,(07)2853107,4680,991,2020/08/16 17:23:31
5907350499,鑫美健保特約藥局,高雄市苓雅區光華一路１４８－５８號１樓,(07)7715088,1211,37,2020/08/16 17:23:31
5907360146,好芳鄰藥局,高雄市前鎮區光華二路２５７號,(07)3318657,5696,363,2020/08/16 17:23:31
5907360226,順康健保藥局,高雄市前鎮區一心二路６７號,(07)5364438,24,17,2020/08/16 17:23:31
5907360459,聯合藥局,高雄市前鎮區一心一路２８１號１樓,(07)3391535,3798,312,2020/08/16 17:23:31
5907360584,聖名健保藥局,高雄市前鎮區復興三路２４６號１樓,(07)3319431,6083,354,2020/08/16 17:23:31
5911010168,承泰藥局,基隆市中正區新豐街４４２號,(02)24601316,409,1,2020/08/16 17:23:31
5911031096,東方藥局,基隆市暖暖區暖暖街１５３號１樓,(02)24574171,4139,1480,2020/08/16 17:23:31
5911040175,回春藥局,基隆市仁愛區仁五路４３號,(02)24224728,5346,1253,2020/08/16 17:23:31
5911050153,隆泰藥局,基隆市中山區西定路１２號,(02)24225889,0,420,2020/08/16 17:23:31
5911051409,順豐藥局,基隆市中山區中華路４號,(02)24369176,3322,387,2020/08/16 17:23:31
5911051490,大哈密藥局,基隆市中山區中山二路５號,(02)24285368,5815,1775,2020/08/16 17:23:31
5912010206,康寧藥局,新竹市東區親仁里東大路１段１７９號,(03)5321797,2563,423,2020/08/16 17:23:31
5917010082,仁壽藥局,臺中市中區東墩里三民路三段１號,(04)22228058,4054,1330,2020/08/16 17:23:31
5917011934,一安堂藥局,臺中市中區臺灣大道一段２０號１樓,(04)22259616,2848,682,2020/08/16 17:23:31
5917030128,太信藥局,臺中市西區三民路一段９５－１號１樓,(04)23718318,5228,1319,2020/08/16 17:23:31
5917030520,林西藥局,臺中市西區永龍里向上路一段４６－１號,(04)23014023,1822,830,2020/08/16 17:23:31
5917030646,華隆藥局,臺中市西區樂群街６之２號,(04)22243785,4806,1310,2020/08/16 17:23:31
5917030995,麗新健保大藥局,臺中市西區向上路一段１６２號,(04)23017100,3366,970,2020/08/16 17:23:31
5917032800,壹藥局,臺中市西區美村路１段７７５號１樓,(04)23721998,2142,200,2020/08/16 17:23:31
5917040302,元聖藥局,臺中市南區積善里五權南路６５０號１樓,(04)22627468,6898,428,2020/08/16 17:23:31
5917060331,宏吉藥局,臺中市西屯區大福里長安路二段３１６號１樓,(04)22910825,4104,0,2020/08/16 17:23:31
5917063921,東京藥師藥局,臺中市西屯區太原一段７７號,(04)23165378,5850,870,2020/08/16 17:23:31
5917070462,長映藥局,臺中市南屯區黎明路二段４３２號１樓,(04)22510951,555,14,2020/08/16 17:23:31
5917070677,康得美專業藥局,臺中市南屯區忠勇路１２之２６號,(04)23801185,1533,6,2020/08/16 17:23:31
5917080771,大生大藥局,臺中市北屯區三光里北屯路３３７號,(04)22337059,4167,540,2020/08/16 17:23:31
5917081170,順天大藥局,臺中市北屯區中清路二段２３２號１樓,(04)22918847,3131,513,2020/08/16 17:23:31
5917083316,春元藥局,臺中市北屯區東山路１段２８７號,(04)24361008,2594,198,2020/08/16 17:23:31
5917083334,瑞東大藥局,臺中市北屯區東山路一段２４６之３號,(04)24373799,5247,1390,2020/08/16 17:23:31
5917083343,豋盛藥局,臺中市北屯區北平路三段１０７號,(04)22373863,4944,586,2020/08/16 17:23:31
5921040212,真安藥局,臺南市北區公園路６９８號,(06)2819836,5023,1200,2020/08/16 17:23:31
5921041826,佳家藥局,臺南市北區大公里忠義路三段２２號１樓,(06)2252165,4149,10,2020/08/16 17:23:31
5921042289,公園店菁安藥局,臺南市北區公園路６１１號,(06)2834488,1305,150,2020/08/16 17:23:31
5921051537,大全藥局,臺南市中西區府連路３９號,(06)2145007,2863,340,2020/08/16 17:23:31
5921060394,土城藥師藥局,臺南市安南區城北路７５號,(06)2571872,1715,0,2020/08/16 17:23:31
5922010441,穎川保健藥局,嘉義市東區仁武里中山路２０４號,(05)2223609,5174,924,2020/08/16 17:23:31
5922020063,弘安藥局,嘉義市西區文化路２７７號,(05)2259000,2619,0,2020/08/16 17:23:31
5922020661,大正藥局,嘉義市西區書院里民族路７０２號,(05)2285812,981,0,2020/08/16 17:23:31
5922028863,益生堂藥局,嘉義市西區杭州三街３０號,(05)2861415,6522,0,2020/08/16 17:23:31
592202A296,秉原藥局,嘉義市西區書院里民族路７００號,(05)2285811,1179,0,2020/08/16 17:23:31
5931010459,欣民藥局,新北市板橋區雙十路３段３９號,(02)22545938,0,60,2020/08/16 17:23:31
5931012060,溪北藥局,新北市板橋區溪北路７８號１樓,(02)26866528,566,0,2020/08/16 17:23:31
5931017396,美康四維藥局,新北市板橋區四維路１２２號１樓,(02)22506616,3718,555,2020/08/16 17:23:31
5931020795,杜廣德藥師藥局,新北市三重區大智街５３號,(02)29843152,12750,3227,2020/08/16 17:23:31
5931021167,禮隆藥局,新北市三重區自強路４段６４號,(02)29894735,963,10,2020/08/16 17:23:31
5931021372,福昌大藥局,新北市三重區溪尾街２０５號,(02)29714069,4784,315,2020/08/16 17:23:31
5931023036,華泰藥師藥局,新北市三重區五華街６６號１樓,(02)29866009,2309,75,2020/08/16 17:23:31
5931024622,萊康健保藥局,新北市三重區溪尾街１７６號１樓,(02)82871076,4748,500,2020/08/16 17:23:31
5931024631,德榮藥局,新北市三重區中華路９１號１樓,(02)29717291,3798,570,2020/08/16 17:23:31
5931024935,健康藥局,新北市三重區安樂街５８號１樓,(02)29841882,5890,487,2020/08/16 17:23:31
5931025236,祐銘藥局,新北市三重區龍門路２２號１樓,(02)29769001,4340,266,2020/08/16 17:23:31
5931025290,康新藥局,新北市三重區正義北路１８５號２樓,(02)29865982,4890,2181,2020/08/16 17:23:31
5931044820,禾心藥局,新北市中和區秀朗路３段６４號１樓,(02)86688922,1342,267,2020/08/16 17:23:31
5931044875,誼安健業藥局,新北市中和區宜安路１１８巷２０號１樓,(02)86600058,1572,445,2020/08/16 17:23:31
5931052251,昇育健康藥局,新北市新店區中央三街１１５號１樓,(02)86679631,2268,0,2020/08/16 17:23:31
5931068302,宏發藥局,新北市新莊區民安西路２６３號１樓,(02)22048303,2709,130,2020/08/16 17:23:31
5931071774,澤安藥師藥局,新北市樹林區保安二街２６號１樓,(02)26872764,6,0,2020/08/16 17:23:31
5931071934,樹新藥局,新北市樹林區樹新路３０－３號１樓,(02)26821080,1899,0,2020/08/16 17:23:31
5931101955,伯宇藥局,新北市淡水區新春街１０３號－８,(02)26236006,1808,0,2020/08/16 17:23:31
5931112976,永康中西綜合藥局,新北市汐止區龍安路１７５號１樓,(02)86915580,2642,0,2020/08/16 17:23:31
5931130394,一和藥局,新北市土城區中央路１段６７之３號,(02)22631378,6013,554,2020/08/16 17:23:31
5931142447,三鐵藥局,新北市蘆洲區信義路２２６號１樓,(02)82822729,3145,1276,2020/08/16 17:23:31
5931143104,新信義藥局,新北市蘆洲區信義路２６０號１樓,(02)22885256,2676,96,2020/08/16 17:23:31
5931150056,常安藥局,新北市五股區工商路７１號,(02)22917912,3305,195,2020/08/16 17:23:31
5931151302,宏安藥局,新北市五股區成泰路２段１３６號,(02)22915932,90,180,2020/08/16 17:23:31
5931151473,百成中西藥師藥局,新北市五股區五福里五福路２０號１樓,(02)22915531,1045,660,2020/08/16 17:23:31
5931170165,龍點藥局,新北市林口區民族路６７號１樓,(02)26080636,1664,0,2020/08/16 17:23:31
5931171537,茂晟藥局,新北市林口區文化三路２段３２８號１樓,(02)26020593,3114,0,2020/08/16 17:23:31
5931231289,天康八里藥局,新北市八里區中山路２段３６７號（１樓）,(02)26101569,2340,760,2020/08/16 17:23:31
5932013007,南門藥局,桃園市桃園區南華街５３號,(03)3335395,513,0,2020/08/16 17:23:31
5932013909,莊敬長青藥師藥局,桃園市桃園區莊敬路一段３２３號１樓,(03)3587676,4428,0,2020/08/16 17:23:31
5932018539,新永安藥師藥局,桃園市桃園區永安路４６６號,(03)3471180,4804,178,2020/08/16 17:23:31
5932018548,五代全民藥局,桃園市桃園區中山路九十七號,(03)3355001,4068,0,2020/08/16 17:23:31
5932021090,新生藥師藥局,桃園市中壢區民權路５２號,(03)4919796,1818,370,2020/08/16 17:23:31
5932022300,育康藥局,桃園市中壢區中正路３６６號,(03)4278266,3142,488,2020/08/16 17:23:31
5932023432,敏康藥局,桃園市中壢區福德路３４號之１樓,(03)4611961,1917,80,2020/08/16 17:23:31
5932023450,環中藥局,桃園市中壢區環中東路１８１號,(03)4618873,4595,369,2020/08/16 17:23:31
5932023656,思琁藥師藥局,桃園市中壢區中北路二段４３０號,(03)4162189,4454,0,2020/08/16 17:23:31
5932029934,康和藥局,桃園市中壢區中光路５３號一樓,(03)4253281,3205,1450,2020/08/16 17:23:31
593202B732,愛康藥師藥局,桃園市中壢區龍岡路一段２３０號１樓,(03)4285907,7096,1625,2020/08/16 17:23:31
5932060088,銘方大藥局,桃園市大園區大園里中華路３２號,(03)3865077,1863,150,2020/08/16 17:23:31
5932060168,永固安藥局,桃園市大園區中山南路五六號,(03)3867233,2673,0,2020/08/16 17:23:31
5932077154,博爾康生活藥局,桃園市龜山區大同路２５０號１樓,(03)3506588,0,635,2020/08/16 17:23:31
5932077476,安寶親子藥局,桃園市龜山區文化二路５１號,(03)3281688,2657,0,2020/08/16 17:23:31
5932077510,左外野藥局,桃園市龜山區文光街６號１樓,(03)3271503,3968,253,2020/08/16 17:23:31
5932099285,達仁藥局,桃園市龍潭區北龍路２７０號,(03)4095166,4617,300,2020/08/16 17:23:31
5933031723,日榮堂藥局,新竹縣竹東鎮長春路一段２８１號,(03)5962335,1338,0,2020/08/16 17:23:31
5933081536,昌昌藥局,新竹縣新豐鄉新市路１９３號,(03)5598077,1470,143,2020/08/16 17:23:31
5934010086,圓滿堂藥局,宜蘭縣宜蘭市中山路３段４８號,(03)9323413,2229,0,2020/08/16 17:23:31
5934010282,厚生藥局,宜蘭縣宜蘭市復興路２２號,(03)9322166,5364,1136,2020/08/16 17:23:31
5934012240,東成藥局,宜蘭縣宜蘭市東港路２段３０６號１樓,(03)9380353,5265,0,2020/08/16 17:23:31
5934020073,長生藥局,宜蘭縣羅東鎮復興路１段１號,(03)9553222,1881,275,2020/08/16 17:23:31
5934020251,黃藥局,宜蘭縣羅東鎮公正路３７４號,(03)9545857,4131,672,2020/08/16 17:23:31
5934022013,康莊藥局,宜蘭縣羅東鎮康樂巷１號,(03)9553168,5049,0,2020/08/16 17:23:31
5934081165,合康藥局,宜蘭縣冬山鄉廣興路２１３號,(03)9616457,4887,503,2020/08/16 17:23:31
5934091072,新安藥局,宜蘭縣五結鄉中正路１段１７０號１樓,(03)9566377,4122,90,2020/08/16 17:23:31
5936020080,仁生藥局,臺中市東勢區東安里豐勢路４２１號,(04)25872245,2709,180,2020/08/16 17:23:31
5936021363,小太陽藥局,臺中市東勢區豐勢路４１２之１、４１６號１樓,(04)25773481,4185,270,2020/08/16 17:23:31
5936031707,大甲福倫藥局,臺中市大甲區蔣公路２０２號,(04)26765518,1881,30,2020/08/16 17:23:31
5936050060,大原藥局,臺中市沙鹿區洛泉里四平街１４２號,(04)26626572,1573,154,2020/08/16 17:23:31
5936090171,信源藥局,臺中市潭子區潭北里潭子街三段３９號,(04)25367233,684,0,2020/08/16 17:23:31
5936192198,德侑健保藥局,臺中市太平區中山路４段８６之１號,(04)23959617,2752,117,2020/08/16 17:23:31
593620A891,御和藥局,臺中市大里區東興里益民路二段３２３號,(04)24821555,1631,540,2020/08/16 17:23:31
5937031596,康佑藥局,彰化縣和美鎮和東里彰美路５段１７５號１樓,(04)7576816,303,1,2020/08/16 17:23:31
5937050395,裕良大藥局,彰化縣員林市莒光路３號,(04)8360388,5766,1391,2020/08/16 17:23:31
5937052246,新義藥局,彰化縣員林市南平里新義街２８８號,(04)8396788,4598,60,2020/08/16 17:23:31
5937060060,慶華藥局,彰化縣溪湖鎮光華里二溪路一段１４號,(04)8852441,783,90,2020/08/16 17:23:31
5937061638,志成藥局,彰化縣溪湖鎮平和里彰水路３段２４３號,(04)8853528,5503,60,2020/08/16 17:23:31
5937071385,正益藥局,彰化縣田中鎮北路里新福路５３巷１３號１樓,(04)8761001,8325,741,2020/08/16 17:23:31
5937121237,福慧藥局,彰化縣秀水鄉彰水路２段２０３號,(04)7689180,5040,1333,2020/08/16 17:23:31
5937140018,民生藥局,彰化縣芬園鄉社口村彰南路４段１１３號,(049)2522595,1275,79,2020/08/16 17:23:31
5937140054,正明藥局,彰化縣芬園鄉茄荖村芬草路一段２７３號,(049)2523918,6949,861,2020/08/16 17:23:31
5937141104,啟安大藥局,彰化縣芬園鄉芬草路２段２３０號,(049)2522858,901,2,2020/08/16 17:23:31
5937201061,長春藥局,彰化縣二水鄉文化村光文路１０３號,(04)8795289,2337,112,2020/08/16 17:23:31
5937201085,豐源藥局,彰化縣二水鄉光化村光化２巷１２號１樓,(04)8796832,5341,1109,2020/08/16 17:23:31
5938020104,新仁壽藥局,南投縣埔里鎮南門里南榮路１３號１樓,(049)2983210,2458,466,2020/08/16 17:23:31
5938040277,潘藥局,南投縣竹山鎮竹山里下橫街２６－１１號,(049)2645613,0,560,2020/08/16 17:23:31
5938041569,竹山福倫藥局,南投縣竹山鎮竹山里集山路三段858號,(049)2658518,1042,72,2020/08/16 17:23:31
5938041729,早安藥局,南投縣竹山鎮雲林路４１號,(049)2651032,2659,530,2020/08/16 17:23:31
5938041872,優適藥局,南投縣竹山鎮大明路１４９－５號,(049)2630355,883,1280,2020/08/16 17:23:31
5938090026,源和藥局,南投縣魚池鄉魚池村魚池街２７８號,(049)2897666,3899,447,2020/08/16 17:23:31
5939012133,鎮東藥局,雲林縣斗六市中華路４６０號,(05)5332449,3996,40,2020/08/16 17:23:31
5939020055,民欣藥局,雲林縣斗南鎮明昌里長安路二段１９１號,(05)5973913,3939,190,2020/08/16 17:23:31
5939020224,菩提大藥局,雲林縣斗南鎮延平路二段４１２號,(05)5951539,4194,30,2020/08/16 17:23:31
5939021392,南安藥局,雲林縣斗南鎮南昌路１３７號１樓,(05)5952777,5412,89,2020/08/16 17:23:31
5939031585,利芳藥局,雲林縣虎尾鎮光復路３１０號,(05)6311016,4116,344,2020/08/16 17:23:31
5939032224,文心藥局,雲林縣虎尾鎮信義路６號,(05)6362365,4991,652,2020/08/16 17:23:31
5939032573,林森啄木鳥藥局,雲林縣虎尾鎮明正東路８號,(05)6320417,3799,14,2020/08/16 17:23:31
5939032617,永德健保藥局,雲林縣虎尾鎮德興路８３號,(05)6322802,4937,0,2020/08/16 17:23:31
5939032626,林藥師藥局,雲林縣虎尾鎮中正路２０７號,(05)6334135,4764,240,2020/08/16 17:23:31
5939051247,祐安藥局,雲林縣土庫鎮馬光路３９－１號,(05)6655938,1548,0,2020/08/16 17:23:31
5939071285,振明藥局,雲林縣古坑鄉中山路１７０號,(05)5821229,5418,431,2020/08/16 17:23:31
5939091170,西河藥局,雲林縣莿桐鄉饒平村饒平路１０２號,(05)5842950,4034,66,2020/08/16 17:23:31
5939121208,詠大藥局,雲林縣崙背鄉南陽村中山路１０９－２號,(05)6967990,5312,1166,2020/08/16 17:23:31
5939130010,瀧升藥局,雲林縣麥寮鄉麥豐村中正路１０３號,(05)6933880,1494,20,2020/08/16 17:23:31
5939130029,見春藥局,雲林縣麥寮鄉橋頭村仁德路７４號,(05)6912265,2932,915,2020/08/16 17:23:31
5939131151,三芳藥局,雲林縣麥寮鄉橋頭村仁德路１７６號,(05)6911053,5762,479,2020/08/16 17:23:31
5939191139,寶健藥局,雲林縣口湖鄉梧南村光明路１７２號,(05)7907453,4846,1483,2020/08/16 17:23:31
5939191326,順生藥局,雲林縣口湖鄉口湖村口湖路３２４號,(05)7895799,5661,430,2020/08/16 17:23:31
5939201283,義生藥局,雲林縣水林鄉水林路１９７號,(05)7853701,2797,1181,2020/08/16 17:23:31
5940021139,王藥師健保藥局,嘉義縣布袋鎮興中里上海路１６１號,(05)3470703,855,480,2020/08/16 17:23:31
5940111469,嘉安藥局,嘉義縣太保市麻寮里中山路２段４６號,(05)2387670,0,2,2020/08/16 17:23:31
5940111549,嘉康中西藥局,嘉義縣太保市南新里中山路一段２９５之２號,(05)2376200,540,0,2020/08/16 17:23:31
5940121349,照安藥局,嘉義縣水上鄉水頭村中興路４０８號,(05)2687897,4653,440,2020/08/16 17:23:31
5941040012,杏林藥局,臺南市麻豆區晉江里興中路１３６號,(06)5722692,5661,880,2020/08/16 17:23:31
5941041297,台灣藥局,臺南市麻豆區信義路１１之１３號,(06)5726126,3276,110,2020/08/16 17:23:31
5941051453,佳佳藥局,臺南市佳里區中山路３８６號,(06)7227639,4994,30,2020/08/16 17:23:31
5941061342,安麗兒藥局新化店,臺南市新化區忠孝路１１６之３號,(06)5986029,1859,0,2020/08/16 17:23:31
5941161070,厚真藥局,臺南市西港區營西里２鄰後營１７號,(06)7962628,6003,188,2020/08/16 17:23:31
5941270109,振裕藥局,臺南市仁德區二行里二行一路１６５號,(06)2661478,3109,320,2020/08/16 17:23:31
5941280141,歐美藥師藥局,臺南市歸仁區後市里民權北路６８號,(06)3308010,2471,240,2020/08/16 17:23:31
5941310064,鐘藥局,臺南市永康區崑山里大灣路１０１２號,(06)2726635,3218,1289,2020/08/16 17:23:31
5941310715,都都藥局,臺南市永康區中山南路１２８號,(06)2314815,3072,590,2020/08/16 17:23:31
5941312184,大灣藥局,臺南市永康區大灣里民族路２９８號,(06)2728774,2412,150,2020/08/16 17:23:31
5942013260,辰好藥局,高雄市鳳山區中山東路２８１號,(07)7027064,2128,73,2020/08/16 17:23:31
5942013797,北京藥局,高雄市鳳山區一甲里五甲二路３４２號１樓,(07)7117100,762,0,2020/08/16 17:23:31
5942061828,日大藥局,高雄市大寮區會社里正氣路２９巷４號,(07)7836114,687,0,2020/08/16 17:23:31
5942220032,文殊堂藥局,高雄市甲仙區西安里文化路２２號,(07)6752176,5868,940,2020/08/16 17:23:31
5943010665,中美藥局,屏東縣屏東市扶風里林森路４５號,(08)7348697,4122,1220,2020/08/16 17:23:31
5943013068,陽生藥局,屏東縣屏東市逢甲路２６號,(08)7322413,1133,0,2020/08/16 17:23:31
5943013648,信安藥局,屏東縣屏東市金泉里漢口街１１號,(08)7322332,630,391,2020/08/16 17:23:31
5943020134,東隆藥局,屏東縣潮州鎮同榮里建基路１１７號,(08)7882810,7668,1170,2020/08/16 17:23:31
5943020232,健惠藥局,屏東縣潮州鎮大同路４９號,(08)7894797,3841,170,2020/08/16 17:23:31
5943021695,立康藥局,屏東縣潮州鎮介壽路７７號１樓,(08)7800995,8778,1725,2020/08/16 17:23:31
5943051326,進德藥局,屏東縣萬丹鄉萬安村萬丹路１段１５８號,(08)7772046,3672,120,2020/08/16 17:23:31
5943120022,何藥局,屏東縣萬巒鄉佳佐村民生路１２９號,(08)7836888,0,360,2020/08/16 17:23:31
5943131552,富田藥局,屏東縣內埔鄉永光路２１號,7785166,4927,1334,2020/08/16 17:23:31
5943161121,永明藥局,屏東縣枋寮鄉安樂村中山路１１９－１號,(08)8781481,3311,700,2020/08/16 17:23:31
5944010089,宏安藥局,澎湖縣馬公市中華路５４號,(06)9273048,1406,0,2020/08/16 17:23:31
5945010289,易生藥局,花蓮縣花蓮市中正路４４３號,(03)8322927,5236,250,2020/08/16 17:23:31
5945051664,吉安丁丁藥局,花蓮縣吉安鄉中華路二段１１號,(03)8536772,3321,2,2020/08/16 17:23:31
