醫事機構代碼,醫事機構名稱,醫事機構地址,醫事機構電話,成人口罩剩餘數,兒童口罩剩餘數,來源資料時間
5933053265,金慧藥局,新竹縣竹北市科大二街１８５號一樓,(03)5586687,6,0,2020/04/12 15:59:37
5933053283,艾美藥局,新竹縣竹北市中正西路８２號１樓,(03)5557760,1,0,2020/04/12 15:59:37
5933060162,黃藥師中西藥局,新竹縣湖口鄉仁勢村民族街９８號,(03)5996388,0,7,2020/04/12 15:59:37
5933061276,中心藥局,新竹縣湖口鄉中正路一段１１５號２樓,(03)5904636,9,0,2020/04/12 15:59:37
5933061463,如家藥師藥局,新竹縣湖口鄉工業區光復東路２４９號,(03)5972606,9,10,2020/04/12 15:59:37
5933061552,信福藥局,新竹縣湖口鄉民權街３３號,(03)5903618,3,0,2020/04/12 15:59:37
5933061570,湖口藥局,新竹縣湖口鄉民族路４５號,(03)5991842,171,2,2020/04/12 15:59:37
5933061632,宏安藥局,新竹縣湖口鄉中山路二段１１０號,(035)996335,5,0,2020/04/12 15:59:37
5933061696,育祥藥局,新竹縣湖口鄉安宅九街８３號１樓,(03)5977271,6,0,2020/04/12 15:59:37
5933081474,立人藥局,新竹縣新豐鄉建興路一段５７號,(03)5578217,234,0,2020/04/12 15:59:37
5933081536,昌昌藥局,新竹縣新豐鄉新市路１９３號,(03)5598077,54,10,2020/04/12 15:59:37
5933081545,立果藥師藥局,新竹縣新豐鄉新興路５６－１號,(03)5575023,2025,201,2020/04/12 15:59:37
5933081554,新豐藥局,新竹縣新豐鄉中興路２０８、２１０號,(03)5575005,9,0,2020/04/12 15:59:37
5933130529,家佳福藥局,新竹縣尖石鄉嘉樂村2鄰麥樹仁59號,(03)5842808,5,12,2020/04/12 15:59:37
5934010022,振芳藥局,宜蘭縣宜蘭市中山路３段１７９號,(03)9322369,0,2,2020/04/12 15:59:37
5934010068,志成藥局,宜蘭縣宜蘭市東港路２段４５２號,(03)9385769,1,0,2020/04/12 15:59:37
5934010193,文化藥師藥局,宜蘭縣宜蘭市復興路１段１３１號,(03)9332415,0,9,2020/04/12 15:59:37
5934011403,中興藥局,宜蘭縣宜蘭市中山路３段２０９號,(03)9369769,10,0,2020/04/12 15:59:37
5934011529,宜生藥局,宜蘭縣宜蘭市新民路１１１號,(03)9327893,40,0,2020/04/12 15:59:37
5934011636,興南藥局,宜蘭縣宜蘭市中山路３段１７８號,(03)9310984,0,2,2020/04/12 15:59:37
5934011725,如康藥局,宜蘭縣宜蘭市中山路２段２２３號１樓,(03)9358647,1,0,2020/04/12 15:59:37
5934011770,日興健保藥局,宜蘭縣宜蘭市舊城西路７７號,(03)9367777,5,3,2020/04/12 15:59:37
5934011887,吉祥大藥局,宜蘭縣宜蘭市中山路２段３１１號１樓,(03)9327811,5,8,2020/04/12 15:59:37
5934012044,富康新民藥局,宜蘭縣宜蘭市新民路１１３號,(03)9366060,0,5,2020/04/12 15:59:37
5934012197,佳音藥局,宜蘭縣宜蘭市中山路２段５９號１樓,(03)9362869,5,3,2020/04/12 15:59:37
5934012222,康泰藥局,宜蘭縣宜蘭市聖後街１７７號,(03)9358715,0,7,2020/04/12 15:59:37
5934012231,黎明健康藥局,宜蘭縣宜蘭市光復路３０號２樓,(03)9312301,5,4,2020/04/12 15:59:37
5934012295,神農養生藥局,宜蘭縣宜蘭市神農路１段９１號１樓,(03)9327089,5,0,2020/04/12 15:59:37
5934012320,緣心健保藥局,宜蘭縣宜蘭市同興街１０１號,(03)9366326,6,3,2020/04/12 15:59:37
5934012339,禮仁藥局,宜蘭縣宜蘭市中山路５段３１號,(03)9288884,0,9,2020/04/12 15:59:37
5934012348,聖心藥局,宜蘭縣宜蘭市復興路３１號,(03)9357099,3,8,2020/04/12 15:59:37
5934020073,長生藥局,宜蘭縣羅東鎮復興路１段１號,(03)9553222,0,3,2020/04/12 15:59:37
5934020153,信隆藥局,宜蘭縣羅東鎮南門路５號,(03)9544697,6,0,2020/04/12 15:59:37
5934020251,黃藥局,宜蘭縣羅東鎮公正路３７４號,(03)9545857,0,2,2020/04/12 15:59:37
5934021383,東安藥局,宜蘭縣羅東鎮光榮路４８７號,(03)9532277,0,2,2020/04/12 15:59:37
5934021409,德芳藥局,宜蘭縣羅東鎮公正路２５６號,(03)9557166,3,6,2020/04/12 15:59:37
5934021418,民生健保藥局,宜蘭縣羅東鎮中正南路５３號１樓,(03)9562354,1,8,2020/04/12 15:59:37
5934021516,興東藥局,宜蘭縣羅東鎮興東路１號１樓,(03)9569621,9,0,2020/04/12 15:59:37
5934021525,喜樂藥師藥局,宜蘭縣羅東鎮中山路３段１７１號,(03)9547113,7,2,2020/04/12 15:59:37
5934021534,佳和藥局,宜蘭縣羅東鎮興東路１２０號２樓,(03)9577734,0,1,2020/04/12 15:59:37
5934021543,宏恩藥局,宜蘭縣羅東鎮和平路１３０－２號,(03)9569906,5,7,2020/04/12 15:59:37
5934021632,上華藥局,宜蘭縣羅東鎮復興路２段１５９號,(03)9557655,1,7,2020/04/12 15:59:37
5934021641,同興藥局,宜蘭縣羅東鎮林場路１３號１樓,(03)9565585,0,7,2020/04/12 15:59:37
5934021794,倉前藥局,宜蘭縣羅東鎮公正里倉前路５７號１樓,(03)9571336,7,1,2020/04/12 15:59:37
5934021801,康健藥局,宜蘭縣羅東鎮中山路四段２４８號,(03)9512959,1,4,2020/04/12 15:59:37
5934021847,集祥藥局,宜蘭縣羅東鎮天津路２－４號,(03)9577231,6,5,2020/04/12 15:59:37
5934021883,潤康社區健保藥局,宜蘭縣羅東鎮公正路１６７之２號１樓,(03)9576271,0,5,2020/04/12 15:59:37
5934021954,家安藥局,宜蘭縣羅東鎮中正北路１７號,(03)9550295,0,4,2020/04/12 15:59:37
5934021972,晨安藥局,宜蘭縣羅東鎮倉前路４０號,(03)9540633,3,1,2020/04/12 15:59:37
5934021990,成功藥局,宜蘭縣羅東鎮興東南路２３５號,(03)9577550,6,8,2020/04/12 15:59:37
5934022022,光澤醫美藥局,宜蘭縣羅東鎮興東路９９之１號,(03)9566961,0,365,2020/04/12 15:59:37
5934022031,大菖藥局,宜蘭縣羅東鎮公正路８８號１樓,(03)9559898,6,4,2020/04/12 15:59:37
5934022059,宏安藥局,宜蘭縣羅東鎮賢文里純精路２段２２５巷１０號１樓,(03)9518696,3,3,2020/04/12 15:59:37
5934022068,宜寧藥局,宜蘭縣羅東鎮公正路９８號１樓,(03)9555051,8,1096,2020/04/12 15:59:37
5934030015,南陽藥局,宜蘭縣蘇澳鎮中山路１段１２０號,(03)9965076,1,0,2020/04/12 15:59:37
5934030051,正蘇西西藥局,宜蘭縣蘇澳鎮中山路一段４７號,(03)9965380,3,6,2020/04/12 15:59:37
5934031110,宜家藥師藥局,宜蘭縣蘇澳鎮中山路１段１１６號,(03)9955727,0,3,2020/04/12 15:59:37
5934031138,新豐藥局,宜蘭縣蘇澳鎮江夏路２６號,(03)9962869,0,8,2020/04/12 15:59:37
5934031165,宏一藥局,宜蘭縣蘇澳鎮中山路１段２９號,(03)9962125,242,0,2020/04/12 15:59:37
5934031218,熊野藥局,宜蘭縣蘇澳鎮龍德里福德路418號,(03)9903367,94,4,2020/04/12 15:59:37
5934031245,熊本健保藥局,宜蘭縣蘇澳鎮大同路６２號,(03)9902758,0,3,2020/04/12 15:59:37
5934040039,仁康藥局,宜蘭縣頭城鎮纘祥路７９之１號,(03)9776651,2,3,2020/04/12 15:59:37
5934040093,元生藥師藥局,宜蘭縣頭城鎮沙成路３０號,(03)9770795,0,8,2020/04/12 15:59:37
5934041143,群英藥局,宜蘭縣頭城鎮開蘭路４７號,(03)9780500,166,30,2020/04/12 15:59:37
5934041161,頭城藥局,宜蘭縣頭城鎮開蘭路１３４號,(03)9770618,7,7,2020/04/12 15:59:37
5934041205,晴天藥局,宜蘭縣頭城鎮開蘭路１８１號,(03)9789121,0,7,2020/04/12 15:59:37
5934051149,和風藥局,宜蘭縣礁溪鄉中山路１段６９號,(03)9883511,1331,60,2020/04/12 15:59:37
5934051167,岩峰藥局,宜蘭縣礁溪鄉中山路２段２１號２樓,(03)9887542,8,1,2020/04/12 15:59:37
5934061047,壯圍藥局,宜蘭縣壯圍鄉吉祥村壯五路２７９號,(03)9388948,3,0,2020/04/12 15:59:37
5934070037,上新藥局,宜蘭縣員山鄉員山路１段２９６號,(03)9220086,1,0,2020/04/12 15:59:37
5934071034,信毅藥師藥局,宜蘭縣員山鄉員山路１段１８２號,(03)9230815,0,9,2020/04/12 15:59:37
5934080015,佳恩藥局,宜蘭縣冬山鄉義成路３段４０１號,(03)9586065,6,2,2020/04/12 15:59:37
5934081049,德鑫藥局,宜蘭縣冬山鄉義成路３段４７５號１樓,(03)9559868,0,55,2020/04/12 15:59:37
5934081058,華康藥局,宜蘭縣冬山鄉冬山路５段２０２號１樓,(03)9532942,3,0,2020/04/12 15:59:37
5934081067,威仁藥局,宜蘭縣冬山鄉冬山路２１９號,(03)9595351,0,36,2020/04/12 15:59:37
5934081165,合康藥局,宜蘭縣冬山鄉廣興路２１３號,(03)9616457,0,1,2020/04/12 15:59:37
5934081174,和康藥局,宜蘭縣冬山鄉義成路３段３５１號１樓,(03)9680650,0,2,2020/04/12 15:59:37
5934091054,日昇藥局,宜蘭縣五結鄉中正路２段５９號,(03)9656584,4,0,2020/04/12 15:59:37
5934091072,新安藥局,宜蘭縣五結鄉中正路１段１７０號１樓,(03)9566377,1800,200,2020/04/12 15:59:37
5934091125,安心藥局,宜蘭縣五結鄉禮運路３８－１號,(03)9551670,6,7,2020/04/12 15:59:37
5935010035,大仁藥局,苗栗縣苗栗市北苗里中華路８６號,(037)262558,0,1,2020/04/12 15:59:37
5935010044,贈光藥局,苗栗縣苗栗市清華里為公路１３３號之１,(037)266786,0,850,2020/04/12 15:59:37
5935010124,富安藥局,苗栗縣苗栗市上苗里中正路５３號,(037)262337,6,6,2020/04/12 15:59:37
5935010259,德鑫藥局,苗栗縣苗栗市清華里為公路３４８號,(037)261698,2,0,2020/04/12 15:59:37
5935011523,天恩藥局,苗栗縣苗栗市中正路49號,(037)277285,0,5,2020/04/12 15:59:37
5935011710,維新藥局,苗栗縣苗栗市中正路632號1樓,(037)320698,18,6,2020/04/12 15:59:37
5935011738,佳禾藥局,苗栗縣苗栗市青苗里建台街7號,(037)373041,42,1,2020/04/12 15:59:37
5935011783,芳鄰國際連鎖藥局,苗栗縣苗栗市中山路５６７號,(037)330580,45,0,2020/04/12 15:59:37
5935011818,博大藥局,苗栗縣苗栗市至公路64號,(037)363751,6,2,2020/04/12 15:59:37
5935011916,吉利康藥局,苗栗縣苗栗市中正路340號,(037)370529,8,9,2020/04/12 15:59:37
5935011925,廷安藥局,苗栗縣苗栗市府前路133號,(037)356839,1,5,2020/04/12 15:59:37
5935012002,好鄰居藥局,苗栗縣苗栗市建功里中正路222號,(037)350395,1400,101,2020/04/12 15:59:37
5935012084,苗栗安德藥局,苗栗縣苗栗市高苗里信義街１０號,(037)350420,18,0,2020/04/12 15:59:37
5935012146,聯合藥師藥局,苗栗縣苗栗市社寮街１４５號,(037)264425,3,0,2020/04/12 15:59:37
5935012182,陽光藥局,苗栗縣苗栗市中山路４７８號,(037)355718,0,1,2020/04/12 15:59:37
5935012191,元品藥局,苗栗縣苗栗市至公路４４５號１樓,(037)377935,3,6,2020/04/12 15:59:37
5935012271,上品藥局,苗栗縣苗栗市中正路４３２號,(037)360060,9,0,2020/04/12 15:59:37
5935012299,瑞展藥局,苗栗縣苗栗市中正路７３號,(037)271658,7,0,2020/04/12 15:59:37
5935012315,良品藥局,苗栗縣苗栗市中正路４６８號,(037)366837,0,138,2020/04/12 15:59:37
5935012324,上林藥局,苗栗縣苗栗市建功里２４鄰府前路９１號,(037)320685,6,0,2020/04/12 15:59:37
5935012333,苗安藥局,苗栗縣苗栗市恭敬里信義街３１號,(037)356388,3,5,2020/04/12 15:59:37
5935012342,杏一苗栗中山藥局,苗栗縣苗栗市至公路３８號,(037)354552,8,7,2020/04/12 15:59:37
5935012351,錦岳大藥局,苗栗縣苗栗市民族路１４０號１樓,(037)353046,0,10,2020/04/12 15:59:37
5935012360,心惠聯合藥局,苗栗縣苗栗市中山路１８８號１樓,(037)377389,166,6,2020/04/12 15:59:37
5935012379,橙易藥局,苗栗縣苗栗市中正路２９１號１樓,(037)376608,0,5,2020/04/12 15:59:37
5935020148,泰元藥局,苗栗縣苑裡鎮苑南里為公路６８號,(037)863668,1,0,2020/04/12 15:59:37
5935021261,永信藥師藥局,苗栗縣苑裡鎮新生路３５號,(037)857069,763,80,2020/04/12 15:59:37
5935021270,全家藥局,苗栗縣苑裡鎮信義路２３之１號１樓,(037)861997,6,5,2020/04/12 15:59:37
5935021323,國豐藥師藥局,苗栗縣苑裡鎮苑北里２鄰天下路１８６號,(037)866516,29,5,2020/04/12 15:59:37
5935030091,惠生藥局,苗栗縣通霄鎮通東里信義路１２２號,(037)752773,1257,78,2020/04/12 15:59:37
5935040266,鴻仁大藥局,苗栗縣竹南鎮竹南里博愛街１８１號,(037)462396,0,1,2020/04/12 15:59:37
5935041450,昇暉藥局,苗栗縣竹南鎮民治街１８號,(037)464347,5,9,2020/04/12 15:59:37
5935041469,順春藥局,苗栗縣竹南鎮延平路２７號之１２,(037)552068,8,0,2020/04/12 15:59:37
5935041567,京典藥局,苗栗縣竹南鎮博愛街300-2號,(037)550661,3,8,2020/04/12 15:59:37
5935041629,悅昌藥局,苗栗縣竹南鎮中正路２８號一樓,(037)477195,36,5,2020/04/12 15:59:37
5935041950,建康藥局,苗栗縣竹南鎮民治街６號,(037)483293,18,0,2020/04/12 15:59:37
5935050164,辰安藥局,苗栗縣頭份市尖豐路３２號,(037)633632,0,8,2020/04/12 15:59:37
5935050306,康利藥局,苗栗縣頭份市忠孝里仁愛路８６號,(037)666101,3,0,2020/04/12 15:59:37
5935051572,信義藥局,苗栗縣頭份市中華路９３８號（後段）,(037)683351,2,0,2020/04/12 15:59:37
5935051698,信源藥局,苗栗縣頭份市仁愛里信東路３９號,(037)663580,3,0,2020/04/12 15:59:37
5935071216,萊恩藥局,苗栗縣卓蘭鎮上新里上新7之1號,(04)25899369,2,0,2020/04/12 15:59:37
5935071234,國良藥局,苗栗縣卓蘭鎮中山路１１１號,(04)25899578,1,8,2020/04/12 15:59:37
5935071243,卓蘭千百岳大藥局,苗栗縣卓蘭鎮中山路８２號,(04)25895473,68,70,2020/04/12 15:59:37
5935091156,信安藥局,苗栗縣公館鄉大同路７８號,(037)237849,1,3,2020/04/12 15:59:37
5935091245,芳鄰藥局,苗栗縣公館鄉玉泉村玉泉３６８之１１號,(037)223727,37,0,2020/04/12 15:59:37
5935091254,上恩藥局,苗栗縣公館鄉大同路１８０號,(037)234008,0,25,2020/04/12 15:59:37
5935091263,懷慶中西藥局,苗栗縣公館鄉近光路９４號,(037)239234,328,0,2020/04/12 15:59:37
5935100034,銅鑼藥局,苗栗縣銅鑼鄉銅鑼村中正路１８８號,(037)981511,0,4,2020/04/12 15:59:37
5935101086,家嘉藥局,苗栗縣銅鑼鄉中正路128號,(037)986388,3,8,2020/04/12 15:59:37
5935120027,裕祥藥局,苗栗縣頭屋鄉頭屋村尖豐路８５號,(037)253553,5,1,2020/04/12 15:59:37
5935131075,安康藥局,苗栗縣三義鄉廣盛中正路114號,(037)875958,6,11,2020/04/12 15:59:37
5935141044,一心藥局,苗栗縣西湖鄉三湖村店仔街４２號,(037)920868,2,0,2020/04/12 15:59:37
5936010628,協安大藥局,臺中市豐原區府前街６３號,(04)25200808,3,0,2020/04/12 15:59:37
5936012097,林芳泉藥局,臺中市豐原區中正路二二八號,(04)25222308,5,0,2020/04/12 15:59:37
5936012113,錦堂藥局,臺中市豐原區中正路１０６號,(04)25229969,0,5,2020/04/12 15:59:37
5936012131,聖得藥局,臺中市豐原區中正路７０號,(04)25158649,6,7,2020/04/12 15:59:37
5936012337,恆安大藥局,臺中市豐原區忠孝街４６號,(04)25226700,2,0,2020/04/12 15:59:37
5936012435,臺安保健藥局,臺中市豐原區三民路３４號,(04)25280098,0,328,2020/04/12 15:59:37
5936012588,富鈞藥師藥局,臺中市豐原區中正路４４３號１樓,(04)25245388,0,4,2020/04/12 15:59:37
5936012677,誠品藥局,臺中市豐原區中山路３４９號,(04)25120495,6,0,2020/04/12 15:59:37
5936020080,仁生藥局,臺中市東勢區東安里豐勢路４２１號,(04)25872245,0,2,2020/04/12 15:59:37
5936020142,新明通藥局,臺中市東勢區延平里豐勢路２３２號,(04)25873969,0,2,2020/04/12 15:59:37
5936030479,上慧藥局,臺中市大甲區順天路３４２號,(04)26873515,3,0,2020/04/12 15:59:37
5936031574,安新藥局,臺中市大甲區順天路３８５號,(04)26764686,5,6,2020/04/12 15:59:37
5936031609,金鼎藥局,臺中市大甲區文武路６７號,(04)26805312,0,6,2020/04/12 15:59:37
5936040135,德厚藥局,臺中市清水區慷榔里慷榔２街５０號,(04)26560733,1,0,2020/04/12 15:59:37
5936050060,大原藥局,臺中市沙鹿區洛泉里四平街１４２號,(04)26626572,4,5,2020/04/12 15:59:37
5936051432,日新藥局,臺中市沙鹿區日新街１１７號,(04)26633100,1494,0,2020/04/12 15:59:37
5936051478,佑安藥局,臺中市沙鹿區中山路３４６號,(04)26632798,6,5,2020/04/12 15:59:37
5936061269,友達藥局,臺中市梧棲區中央路１段８５９號,(04)26567871,269,0,2020/04/12 15:59:37
5936071185,后里東亞大藥局,臺中市后里區民生路１２３號,(04)25570225,1,1,2020/04/12 15:59:37
5936080068,德惠藥局,臺中市神岡區岸裡里豐社一街３０號,(04)25227548,8,0,2020/04/12 15:59:37
5936081252,壯元藥局,臺中市神岡區民生路２７號,(04)25632368,3,1,2020/04/12 15:59:37
5936090082,壽安藥局,臺中市潭子區東寶里雅潭路２段２５４號,(04)25336328,174,1126,2020/04/12 15:59:37
5936090144,宏仁藥局,臺中市潭子區潭陽里潭子街２段８號,(04)25367266,0,2,2020/04/12 15:59:37
5936090224,海源大藥局,臺中市潭子區潭秀里中山路２段４８７號,(04)25312187,1175,0,2020/04/12 15:59:37
5936091534,潭子福倫藥局,臺中市潭子區中山路１段１９之８號,(04)25350918,4,1,2020/04/12 15:59:37
5936091605,康霖中西藥局,臺中市潭子區大豐路３段７６號,(04)25351646,0,2,2020/04/12 15:59:37
5936100047,光田藥局,臺中市大雅區橫山里永和路４８號,(04)25663077,2,0,2020/04/12 15:59:37
5936103002,學府藥局,臺中市大雅區學府路２２５號１樓,(04)25609333,0,9,2020/04/12 15:59:37
5936103066,大雅福倫藥局,臺中市大雅區學府路３５８號１樓,(04)25694218,15,9,2020/04/12 15:59:37
5936110016,景安藥局,臺中市新社區新社里中和街４段１９８號,(04)25811486,36,0,2020/04/12 15:59:37
5936111120,新安藥局,臺中市新社區興安路４９之１號,(04)25820690,9,1,2020/04/12 15:59:37
5936120049,原隆安藥局,臺中市石岡區萬安里石岡街５３號,(04)25722833,6,5,2020/04/12 15:59:37
5936150243,萬信藥局,臺中市烏日區前竹里中山路１段５號,(04)23372133,8,3,2020/04/12 15:59:37
5936150305,吳藥局,臺中市烏日區烏日里中山路二段２２４號,(04)23381148,44,20,2020/04/12 15:59:37
5936151455,上齊健保藥局,臺中市烏日區三民街１５７號,(04)23380876,6,8,2020/04/12 15:59:37
5936160105,建昌藥局,臺中市大肚區蔗廓里遊園路二段１６８號,(04)26910357,0,9,2020/04/12 15:59:37
5936171331,澤士藤藥局,臺中市龍井區新東里新興路５３之９號１樓,(04)26523014,197,0,2020/04/12 15:59:37
5936171359,健安藥局,臺中市龍井區國際街１５３號,(04)26527296,208,0,2020/04/12 15:59:37
5936171386,國際大藥局,臺中市龍井區藝術街６號,(04)26522118,3,4,2020/04/12 15:59:37
5936171402,上華藥局,臺中市龍井區新興路３７號,(04)26320433,7,0,2020/04/12 15:59:37
5936171439,健康生活藥局,臺中市龍井區新興路９６之２５號,(04)26523949,27,10,2020/04/12 15:59:37
5936171457,德康藥局,臺中市龍井區新興路１３７號,(04)26320137,654,0,2020/04/12 15:59:37
5936181373,霧峰福倫藥局,臺中市霧峰區中正路９３６之１號,(04)23318818,6,3,2020/04/12 15:59:37
5936190078,愛心藥局,臺中市太平區光華里中山路二段４１２－７號,(04)23929396,6,4,2020/04/12 15:59:37
5936190505,明芳藥局,臺中市太平區光華里大興路１７１號,(04)23921778,1509,111,2020/04/12 15:59:37
5936190676,中美藥師藥局,臺中市太平區中山路３段８５號,(04)22778238,16,4,2020/04/12 15:59:37
5936191879,玖裕藥局,臺中市太平區樹孝路４５號１樓,(04)23917005,6,0,2020/04/12 15:59:37
5936191913,興明健保藥局,臺中市太平區樹德路９７－６號,(04)23955521,0,3,2020/04/12 15:59:37
5936191922,禾豐藥局,臺中市太平區樹孝路３１號,(04)23915599,4,0,2020/04/12 15:59:37
5936192296,家嘉藥局,臺中市太平區中山路１段２３４號,(04)23934251,82,52,2020/04/12 15:59:37
5936200032,優美藥師藥局,臺中市大里區新仁路３段２２７號,(04)24872277,0,3,2020/04/12 15:59:37
5936200097,大里啄木鳥藥局,臺中市大里區中興路２段７２號,(04)24865725,3,0,2020/04/12 15:59:37
5936200113,日康藥局,臺中市大里區中興路２段１１１之１號,(04)24853368,2,0,2020/04/12 15:59:37
5936200168,英吉藥局,臺中市大里區金城里上興街二段４６號,(04)24925962,3,2,2020/04/12 15:59:37
5936200177,天霖藥局,臺中市大里區大里路３９之９號１樓,(04)24832481,0,1,2020/04/12 15:59:37
5936209287,德芳大藥局,臺中市大里區西榮里益民路二段３０４號,(04)24815932,0,9,2020/04/12 15:59:37
5936209349,添貴藥局,臺中市大里區西榮里益民路二段１１８號,(04)24819353,1539,187,2020/04/12 15:59:37
5936209401,聯鎰藥局,臺中市大里區瑞城里塗城路５０３號,(04)24925531,18,0,2020/04/12 15:59:37
5936209572,樺生藥局,臺中市大里區新里里新興路５５號,(04)24061162,4,0,2020/04/12 15:59:37
593620A855,三德藥局,臺中市大里區瑞城里成功路４１９號,(04)24953856,6,0,2020/04/12 15:59:37
593620A891,御和藥局,臺中市大里區東興里益民路二段３２３號,(04)24821555,5,1,2020/04/12 15:59:37
593620A917,三商藥局,臺中市大里區中興路２段３３３、３３５號１、２樓,(04)24852072,63,5,2020/04/12 15:59:37
593620B012,廣益藥局,臺中市大里區中興路２段１６７號,(04)24839630,50,0,2020/04/12 15:59:37
593620B183,綠洲藥局,臺中市大里區塗城路６０３號,(04)24932626,45,0,2020/04/12 15:59:37
593620B316,華信藥局,臺中市大里區益民路２段１２號１樓,(04)24872992,0,1,2020/04/12 15:59:37
593620B325,福至藥局,臺中市大里區成功路３８５號,(04)24929116,4,0,2020/04/12 15:59:37
593620B334,健民藥局,臺中市大里區健民路８３－８號,(04)24927748,0,5,2020/04/12 15:59:37
5936211054,和平藥局,臺中市和平區東關路３段１５１之１１號,(04)25941386,4108,175,2020/04/12 15:59:37
5937010140,三立大藥局,彰化縣彰化市中華西路１１１號,(04)7635422,1,0,2020/04/12 15:59:37
5937010159,彰化明德藥局,彰化縣彰化市興北里三民路２０９號,(04)7299085,380,2,2020/04/12 15:59:37
5937010202,世和生西藥局,彰化縣彰化市一心東街４６號,(04)7384277,0,29,2020/04/12 15:59:37
5937010533,范藥局,彰化縣彰化市東興里公園路１段２９２號,(04)7271540,6,0,2020/04/12 15:59:37
5937010613,榮源藥局,彰化縣彰化市忠權里辭修路１２８巷９號,(04)7229432,0,7,2020/04/12 15:59:37
5937010775,全生藥局,彰化縣彰化市光復里和平路８８號,(04)7222086,5,0,2020/04/12 15:59:37
5937010908,日光堂藥局彰美分店,彰化縣彰化市彰美路１段２３５號,(04)7236611,202,0,2020/04/12 15:59:37
5937010999,全杏藥局,彰化縣彰化市茄苳路一段２９９號,(04)7363366,2,0,2020/04/12 15:59:37
5937011021,龍美藥局,彰化縣彰化市中山路三段２２８號,(04)7249816,4,0,2020/04/12 15:59:37
5937012117,媽咪藥局,彰化縣彰化市彰南路２段１１５號,(04)7321517,5,0,2020/04/12 15:59:37
5937012411,東東藥局,彰化縣彰化市大竹里彰南路２段２４７－８號,(04)7387407,3,0,2020/04/12 15:59:37
5937012546,頂好藥局,彰化縣彰化市成功路２５３號,(04)7271799,0,6,2020/04/12 15:59:37
5937012555,兆仁藥局,彰化縣彰化市民族路４２６號,(04)7278558,2,0,2020/04/12 15:59:37
5937012751,福田藥局,彰化縣彰化市光復路２０號,(04)7296058,55,0,2020/04/12 15:59:37
5937012975,龍泰藥局,彰化縣彰化市信義里中正路１段４５０號１樓,(04)7254720,3,0,2020/04/12 15:59:37
5937013105,美得康藥局,彰化縣彰化市成功里民族路１８６號,(04)7280707,432,113,2020/04/12 15:59:37
5937013196,彰化啄木鳥藥局,彰化縣彰化市茄南里金馬路２段２７號,(04)7330661,0,4,2020/04/12 15:59:37
5937013221,維康藥局,彰化縣彰化市光南里博愛街１３１、１３３號,(04)7279446,11,0,2020/04/12 15:59:37
5937013267,銅鐘藥局,彰化縣彰化市阿夷里泰和路２段３１５號,(04)7200606,3,0,2020/04/12 15:59:37
5937013285,大仁藥局,彰化縣彰化市忠孝里辭修路８０號１樓,(04)7282678,4,29,2020/04/12 15:59:37
5937013301,大竹藥局,彰化縣彰化市彰南路２段１８９號,(04)7383720,3,0,2020/04/12 15:59:37
5937013383,大心藥局,彰化縣彰化市中央里民族路５１７號,(04)7282797,2,1,2020/04/12 15:59:37
5937013392,正欣藥局,彰化縣彰化市興北里長壽街２２０號,(04)7266279,4,0,2020/04/12 15:59:37
5937013418,曉陽藥局,彰化縣彰化市西安里曉陽路２０２號,(04)7270989,6,0,2020/04/12 15:59:37
5937013436,大埔藥局,彰化縣彰化市大埔路４０６、４０８、４１０、４１２號,(04)7117511,238,0,2020/04/12 15:59:37
5937013481,美芙藥局,彰化縣彰化市三民路２７０號１樓,(04)7222980,0,5,2020/04/12 15:59:37
5937013598,黎明藥局,彰化縣彰化市彰南路２段２１７號,(04)7320995,7,0,2020/04/12 15:59:37
5937020119,永吉藥局,彰化縣鹿港鎮大有里大明路４８號,(04)7772391,3,5,2020/04/12 15:59:37
5937021312,健康藥局,彰化縣鹿港鎮中興里民權路２３２號,(04)7764364,2,0,2020/04/12 15:59:37
5937021330,順安藥局,彰化縣鹿港鎮泰興里復興路１２５號,(04)7765510,360,116,2020/04/12 15:59:37
5937021376,民權藥局,彰化縣鹿港鎮民權路５９號,(04)7745562,12,0,2020/04/12 15:59:37
5937021385,忠民藥局,彰化縣鹿港鎮民族路１０８巷３號,(04)7760368,20,0,2020/04/12 15:59:37
5937021401,展宏藥局,彰化縣鹿港鎮中山路５號,(04)7749001,90,17,2020/04/12 15:59:37
5937021447,永和藥局,彰化縣鹿港鎮中正路２４２之２號,(04)7754750,0,3,2020/04/12 15:59:37
5937021689,豐安藥局,彰化縣鹿港鎮玉順里復興路７２６號,(04)7746157,5,0,2020/04/12 15:59:37
5937021750,正光藥局鹿港店,彰化縣鹿港鎮永安里復興路２５１號,(04)7775769,15,0,2020/04/12 15:59:37
5937021769,杏文藥局,彰化縣鹿港鎮順興里中山路３５４號１樓,(04)7766326,0,4,2020/04/12 15:59:37
5937021821,新永吉藥局,彰化縣鹿港鎮中山路１２７號,(04)7770940,1,9,2020/04/12 15:59:37
