醫事機構代碼,醫事機構名稱,醫事機構地址,醫事機構電話,成人口罩剩餘數,兒童口罩剩餘數,來源資料時間
5902080376,政德藥局,高雄市苓雅區正大里武廟路２９號,(07)7114371,1962,1040,2020/11/08 07:29:44
5917060331,宏吉藥局,臺中市西屯區大福里長安路二段３１６號１樓,(04)22910825,3006,480,2020/11/08 07:29:44
5931170165,龍點藥局,新北市林口區民族路６７號１樓,(02)26080636,1683,756,2020/11/08 07:29:44
5936090171,信源藥局,臺中市潭子區潭北里潭子街三段３９號,(04)25367233,1503,580,2020/11/08 07:29:44
5937140018,民生藥局,彰化縣芬園鄉社口村彰南路４段１１３號,(049)2522595,2157,739,2020/11/08 07:29:44
5940111469,嘉安藥局,嘉義縣太保市麻寮里中山路２段４６號,(05)2387670,2637,430,2020/11/08 07:29:44
5941040012,杏林藥局,臺南市麻豆區晉江里興中路１３６號,(06)5722692,2447,802,2020/11/08 07:29:44
5941200045,慶豐綜合藥局,臺南市新市區新和里民生路５７號,(06)5014888,3179,783,2020/11/08 07:29:44
