醫事機構代碼,醫事機構名稱,醫事機構地址,醫事機構電話,成人口罩剩餘數,兒童口罩剩餘數,來源資料時間
5901090074,慈仁藥局,臺北市大同區歸綏街２６１號１樓,(02)25572733,738,657,2020/07/05 09:53:33
5901103110,大直健康藥局,臺北市中山區北安路５９１號,(02)25323310,1611,1630,2020/07/05 09:53:33
5901110393,明湖藥局,臺北市內湖區東湖路７巷２７號１Ｆ,(02)26313515,702,220,2020/07/05 09:53:33
5901113312,江南大藥局,臺北市內湖區文德路２２巷９弄５６號,(02)26595430,1116,730,2020/07/05 09:53:33
5901121823,儀安健保藥局,臺北市南港區同德路７４號,(02)27859893,2880,191,2020/07/05 09:53:33
5901153272,光榮藥局,臺北市士林區社中街１１８號,(02)28136060,1316,338,2020/07/05 09:53:33
5901162173,小明藥局,臺北市北投區中央南路１段６９號２樓,(02)28928950,0,460,2020/07/05 09:53:33
5901163527,理得藥局,臺北市北投區石牌路１段１５０號,(02)28289680,3690,310,2020/07/05 09:53:33
5901180055,日生大藥局,臺北市中正區汀州路１段５３號１樓,(02)23031393,2281,0,2020/07/05 09:53:33
5902040087,世詠藥局,高雄市楠梓區楠都東街１３８號,(07)3539869,886,707,2020/07/05 09:53:33
5902040112,丁丁楠梓藥局,高雄市楠梓區建楠路１３０、１３２、１３４號,(07)3533743,859,340,2020/07/05 09:53:33
5902050298,瑞鶴藥局,高雄市三民區寶德里義德路２５號,(07)3862757,531,590,2020/07/05 09:53:33
5902051240,明皇藥局,高雄市三民區寶國里義華路１８１號,(07)3860121,3132,430,2020/07/05 09:53:33
5902053833,建銘藥局,高雄市三民區吉林街２６２號,(07)3133460,0,402,2020/07/05 09:53:33
5902056807,長慶藥局,高雄市三民區金鼎路３１０號,(07)3105835,305,334,2020/07/05 09:53:33
5902080376,政德藥局,高雄市苓雅區正大里武廟路２９號,(07)7114371,3546,400,2020/07/05 09:53:33
5902080616,一加藥局,高雄市苓雅區和平一路四二號,(07)7212748,879,0,2020/07/05 09:53:33
5902090032,全國大藥局,高雄市前鎮區三多二路４０３號１樓,(07)3345775,949,672,2020/07/05 09:53:33
5902092358,惠芳藥局,高雄市前鎮區一心一路４８６號,(07)5370650,882,540,2020/07/05 09:53:33
5903010494,百宏大藥局,臺中市豐原區中正路８６０號１樓,(04)25131538,1171,410,2020/07/05 09:53:33
5903090116,上宇藥局,臺中市潭子區中山路２段３８１號１樓,(04)25321258,1539,505,2020/07/05 09:53:33
5903090367,成記藥局,臺中市潭子區潭興路三段９３號１樓,(04)25358076,1510,800,2020/07/05 09:53:33
5903190228,中山德侑藥局,臺中市太平區中山路３段２之２號１樓,(04)23920682,6299,804,2020/07/05 09:53:33
5903190335,育賢德侑藥局,臺中市太平區育賢路１０７號、１０９號,(04)23920696,2872,288,2020/07/05 09:53:33
5903190442,天慈大藥局,臺中市太平區太平路５４０號,(04)22785052,657,150,2020/07/05 09:53:33
5903190531,承泓藥局,臺中市太平區育賢路３６３號１樓,(04)23935148,1584,120,2020/07/05 09:53:33
5903190595,布拉格藥局,臺中市太平區東平路６１５號１樓,22786580,3870,1170,2020/07/05 09:53:33
5903200194,博德藥局,臺中市大里區成功２路１０４號１樓,(04)24968642,2970,90,2020/07/05 09:53:33
5903260592,台中丁丁藥局,臺中市北區漢口路４段２５５號,(04)22374596,1926,930,2020/07/05 09:53:33
5903270347,甘肅安德藥局,臺中市西屯區甘肅路２０２－３號,(04)23165935,1908,140,2020/07/05 09:53:33
5903270570,百富藥局,臺中市西屯區福上巷１６號,(04)22970708,1405,1150,2020/07/05 09:53:33
5903270847,分子藥局,臺中市西屯區惠來路二段２３６－１號,(04)22513080,4824,1160,2020/07/05 09:53:33
5903280165,南屯福倫藥局,臺中市南屯區南屯路２段３１７號,(04)24758018,3996,1070,2020/07/05 09:53:33
5903280754,弘泰藥師藥局,臺中市南屯區向心南路９４８號１樓,(04)24750790,684,0,2020/07/05 09:53:33
5905030047,大源醫藥局,臺南市白河區中山路１７２之２號,(06)6852306,1901,507,2020/07/05 09:53:33
5905050192,復佑藥局,臺南市佳里區光復路３１５號１樓,(06)7222771,2628,230,2020/07/05 09:53:33
5905270041,仁德市安藥師藥局,臺南市仁德區中正西路２５號,(06)2661933,847,50,2020/07/05 09:53:33
5905280047,獅甲藥局,臺南市歸仁區六甲里六甲路２０３號,(06)3388387,1723,613,2020/07/05 09:53:33
5905340262,瑞城藥局,臺南市中西區赤嵌里忠義路二段１７６號１樓,(06)2215810,834,534,2020/07/05 09:53:33
5905370331,草湖寮王藥局,臺南市安南區梅花里安中路一段６３３號１樓,(06)2465859,1355,0,2020/07/05 09:53:33
5907010276,愛家社區藥局,高雄市鳳山區福德街１４１號,(07)8123698,325,609,2020/07/05 09:53:33
5907060043,永成專業藥師藥局,高雄市大寮區中興里鳳林四路６２號,(07)7816221,4509,110,2020/07/05 09:53:33
5907060178,鴻安藥局,高雄市大寮區鳳林三路３９１、３９３號１樓,(07)7835956,2232,0,2020/07/05 09:53:33
5907080125,仁武丁丁藥局,高雄市仁武區仁和里鳳仁路２１之８號,(07)3721896,999,934,2020/07/05 09:53:33
5907080250,仁同藥局,高雄市仁武區八卦里永仁街７０６號１樓,(07)3736142,3449,207,2020/07/05 09:53:33
5907110084,昱佳藥局,高雄市橋頭區仕豐南路６６號,(07)6110302,0,550,2020/07/05 09:53:33
5907110155,丁丁藥局橋頭店,高雄市橋頭區成功南路１４８巷３號,(07)6113633,221,589,2020/07/05 09:53:33
5907290050,新高橋藥局裕明店,高雄市鼓山區裕誠路１６８０號,(07)5224680,403,0,2020/07/05 09:53:33
5907340046,銘益藥局,高雄市前金區七賢二路２０８、２１０號１樓,(07)2853107,3158,1232,2020/07/05 09:53:33
5907350499,鑫美健保特約藥局,高雄市苓雅區光華一路１４８－５８號１樓,(07)7715088,1794,368,2020/07/05 09:53:33
5907360146,好芳鄰藥局,高雄市前鎮區光華二路２５７號,(07)3318657,2747,996,2020/07/05 09:53:33
5907360226,順康健保藥局,高雄市前鎮區一心二路６７號,(07)5364438,0,480,2020/07/05 09:53:33
5907360459,聯合藥局,高雄市前鎮區一心一路２８１號１樓,(07)3391535,443,30,2020/07/05 09:53:33
5911010097,俊德藥局,基隆市中正區中船路２０號１樓,(02)24281398,2042,782,2020/07/05 09:53:33
5911011610,躍獅大藥局,基隆市中正區義二路３５號,(02)24286960,3762,630,2020/07/05 09:53:33
5911020084,北安藥局,基隆市七堵區福二街１３５號,(02)24514008,3042,160,2020/07/05 09:53:33
5911030053,杏福藥局,基隆市暖暖區暖暖街１７８號,(02)24572427,1715,756,2020/07/05 09:53:33
5911031176,家宏藥局,基隆市暖暖區源遠路２８１之２號１樓,(02)24595982,327,1051,2020/07/05 09:53:33
5911051490,大哈密藥局,基隆市中山區中山二路５號,(02)24285368,4160,1366,2020/07/05 09:53:33
5912012139,康博中西藥局,新竹市東區明湖里明湖路四四六之四號,(03)5191010,4665,0,2020/07/05 09:53:33
5912051216,健安藥局,新竹市香山區內湖路六十號,(03)5370111,994,88,2020/07/05 09:53:33
5917010082,仁壽藥局,臺中市中區東墩里三民路三段１號,(04)22228058,2064,750,2020/07/05 09:53:33
5917011934,一安堂藥局,臺中市中區臺灣大道一段２０號１樓,(04)22259616,3460,1102,2020/07/05 09:53:33
5917030128,太信藥局,臺中市西區三民路一段９５－１號１樓,(04)23718318,5030,1519,2020/07/05 09:53:33
5917030388,富永藥局,臺中市西區三民西路１６１號,(04)23714681,1917,510,2020/07/05 09:53:33
5917030520,林西藥局,臺中市西區永龍里向上路一段４６－１號,(04)23014023,900,1314,2020/07/05 09:53:33
5917030646,華隆藥局,臺中市西區樂群街６之２號,(04)22243785,2835,510,2020/07/05 09:53:33
5917030995,麗新健保大藥局,臺中市西區向上路一段１６２號,(04)23017100,1944,1180,2020/07/05 09:53:33
5917040302,元聖藥局,臺中市南區積善里五權南路６５０號１樓,(04)22627468,3049,708,2020/07/05 09:53:33
5917060331,宏吉藥局,臺中市西屯區大福里長安路二段３１６號１樓,(04)22910825,3852,500,2020/07/05 09:53:33
5917063921,東京藥師藥局,臺中市西屯區太原一段７７號,(04)23165378,1980,1070,2020/07/05 09:53:33
5917080771,大生大藥局,臺中市北屯區三光里北屯路３３７號,(04)22337059,2979,350,2020/07/05 09:53:33
5917081170,順天大藥局,臺中市北屯區中清路二段２３２號１樓,(04)22918847,3965,690,2020/07/05 09:53:33
5917083316,春元藥局,臺中市北屯區東山路１段２８７號,(04)24361008,1921,595,2020/07/05 09:53:33
5917083334,瑞東大藥局,臺中市北屯區東山路一段２４６之３號,(04)24373799,2097,1860,2020/07/05 09:53:33
5917083343,豋盛藥局,臺中市北屯區北平路三段１０７號,(04)22373863,3740,583,2020/07/05 09:53:33
5921010689,億安大藥局,臺南市東區大福里大同路２段２６５號,(06)2159881,3060,620,2020/07/05 09:53:33
5921040212,真安藥局,臺南市北區公園路６９８號,(06)2819836,1191,1132,2020/07/05 09:53:33
5921042289,公園店菁安藥局,臺南市北區公園路６１１號,(06)2834488,1017,350,2020/07/05 09:53:33
5921051537,大全藥局,臺南市中西區府連路３９號,(06)2145007,521,1060,2020/07/05 09:53:33
5921060394,土城藥師藥局,臺南市安南區城北路７５號,(06)2571872,402,833,2020/07/05 09:53:33
5922010263,秉榮藥局,嘉義市東區東仁里中山路１８９號,(05)2224320,342,210,2020/07/05 09:53:33
5922010441,穎川保健藥局,嘉義市東區仁武里中山路２０４號,(05)2223609,4034,1384,2020/07/05 09:53:33
5922013022,忠孝啄木鳥藥局,嘉義市東區荖藤里忠孝北街１８５號,(05)2204948,1,680,2020/07/05 09:53:33
5922013031,德昌藥局,嘉義市東區中央里吳鳳北路２１１號,(05)2280306,565,1737,2020/07/05 09:53:33
5922020661,大正藥局,嘉義市西區書院里民族路７０２號,(05)2285812,3393,0,2020/07/05 09:53:33
5922028925,健安藥局,嘉義市西區民族路６２６號,(05)2281219,2709,1490,2020/07/05 09:53:33
592202A296,秉原藥局,嘉義市西區書院里民族路７００號,(05)2285811,3510,0,2020/07/05 09:53:33
5931012060,溪北藥局,新北市板橋區溪北路７８號１樓,(02)26866528,823,130,2020/07/05 09:53:33
5931020795,杜廣德藥師藥局,新北市三重區大智街５３號,(02)29843152,2283,227,2020/07/05 09:53:33
5931021167,禮隆藥局,新北市三重區自強路４段６４號,(02)29894735,513,730,2020/07/05 09:53:33
5931023036,華泰藥師藥局,新北市三重區五華街６６號１樓,(02)29866009,1926,945,2020/07/05 09:53:33
5931024622,萊康健保藥局,新北市三重區溪尾街１７６號１樓,(02)82871076,2664,580,2020/07/05 09:53:33
5931024935,健康藥局,新北市三重區安樂街５８號１樓,(02)29841882,3428,765,2020/07/05 09:53:33
5931025236,祐銘藥局,新北市三重區龍門路２２號１樓,(02)29769001,1775,1117,2020/07/05 09:53:33
5931040742,開發大藥局,新北市中和區興南路１段６號,(02)29412279,1890,1110,2020/07/05 09:53:33
5931044599,成合藥局,新北市中和區景平路４２９之２號１樓,(02)22483605,3150,250,2020/07/05 09:53:33
5931068302,宏發藥局,新北市新莊區民安西路２６３號１樓,(02)22048303,3888,860,2020/07/05 09:53:33
5931068875,旭生藥局,新北市新莊區裕民街４２號１樓,(02)29021289,616,773,2020/07/05 09:53:33
593106A646,薇妮雙鳳藥局,新北市新莊區雙鳳路２１號１樓,(02)29076993,0,470,2020/07/05 09:53:33
5931070213,明川藥師藥局,新北市樹林區三福街１號,(02)26894728,2729,1490,2020/07/05 09:53:33
5931071934,樹新藥局,新北市樹林區樹新路３０－３號１樓,(02)26821080,1242,1020,2020/07/05 09:53:33
5931130394,一和藥局,新北市土城區中央路１段６７之３號,(02)22631378,1809,806,2020/07/05 09:53:33
5931151302,宏安藥局,新北市五股區成泰路２段１３６號,(02)22915932,669,140,2020/07/05 09:53:33
5931170165,龍點藥局,新北市林口區民族路６７號１樓,(02)26080636,2204,0,2020/07/05 09:53:33
5932018548,五代全民藥局,桃園市桃園區中山路九十七號,(03)3355001,1323,460,2020/07/05 09:53:33
5932019929,元氣藥局,桃園市桃園區民光東路一Ｏ九號,(03)3332201,3672,250,2020/07/05 09:53:33
5932023432,敏康藥局,桃園市中壢區福德路３４號之１樓,(03)4611961,2403,560,2020/07/05 09:53:33
5932023450,環中藥局,桃園市中壢區環中東路１８１號,(03)4618873,1730,205,2020/07/05 09:53:33
5932023825,內壢丁丁藥局,桃園市中壢區環中東路３２５號１樓,4535351,2151,650,2020/07/05 09:53:33
5932042124,佑健藥師藥局,桃園市楊梅區中山北路二段一Ｏ八號一樓,(03)4315478,3627,20,2020/07/05 09:53:33
5932060088,銘方大藥局,桃園市大園區大園里中華路３２號,(03)3865077,1323,1130,2020/07/05 09:53:33
5932062215,快安藥師藥局,桃園市大園區新生北路４１號,(03)3856896,1431,270,2020/07/05 09:53:33
5932077154,博爾康生活藥局,桃園市龜山區大同路２５０號１樓,(03)3506588,0,357,2020/07/05 09:53:33
5932090273,博信藥師藥局,桃園市龍潭區中正路１３３號,(03)4895069,927,0,2020/07/05 09:53:33
5932099285,達仁藥局,桃園市龍潭區北龍路２７０號,(03)4095166,2727,490,2020/07/05 09:53:33
5932101066,日安藥局,桃園市平鎮區復興街１０８號,(03)4916178,396,160,2020/07/05 09:53:33
5933080119,建仁藥局,新竹縣新豐鄉建興路一段１２２號,(03)5595850,1035,110,2020/07/05 09:53:33
5933081536,昌昌藥局,新竹縣新豐鄉新市路１９３號,(03)5598077,2950,1379,2020/07/05 09:53:33
5934010086,圓滿堂藥局,宜蘭縣宜蘭市中山路３段４８號,(03)9323413,4706,837,2020/07/05 09:53:33
5934012179,宜蘭和睦藥局,宜蘭縣宜蘭市大新里和睦路４７號１、２樓,(03)9313622,5400,885,2020/07/05 09:53:33
5934012240,東成藥局,宜蘭縣宜蘭市東港路２段３０６號１樓,(03)9380353,1584,730,2020/07/05 09:53:33
5934012366,熊賀大藥局,宜蘭縣宜蘭市女中路３段２６號,(03)9352950,1062,0,2020/07/05 09:53:33
5934020073,長生藥局,宜蘭縣羅東鎮復興路１段１號,(03)9553222,3618,1206,2020/07/05 09:53:33
5934022013,康莊藥局,宜蘭縣羅東鎮康樂巷１號,(03)9553168,2808,220,2020/07/05 09:53:33
5934030015,南陽藥局,宜蘭縣蘇澳鎮中山路１段１２０號,(03)9965076,1314,0,2020/07/05 09:53:33
5934081165,合康藥局,宜蘭縣冬山鄉廣興路２１３號,(03)9616457,2538,1727,2020/07/05 09:53:33
5935051867,惠祐藥局,苗栗縣頭份市中正路１６５號,(037)668933,468,550,2020/07/05 09:53:33
5936010280,快安藥局,臺中市豐原區三豐路一段２０５號,(04)25228169,927,0,2020/07/05 09:53:33
5936010888,惠笙大藥局,臺中市豐原區三民路１８０號,(04)25279912,964,550,2020/07/05 09:53:33
5936020080,仁生藥局,臺中市東勢區東安里豐勢路４２１號,(04)25872245,441,940,2020/07/05 09:53:33
5936020133,永和藥局,臺中市東勢區本街275號,(04)25884023,2099,1140,2020/07/05 09:53:33
5936020204,健生藥局,臺中市東勢區東崎路５段４０９號,(04)25871401,4635,480,2020/07/05 09:53:33
5936021363,小太陽藥局,臺中市東勢區豐勢路４１２之１、４１６號１樓,(04)25773481,7380,530,2020/07/05 09:53:33
5936090171,信源藥局,臺中市潭子區潭北里潭子街三段３９號,(04)25367233,603,370,2020/07/05 09:53:33
5936192198,德侑健保藥局,臺中市太平區中山路４段８６之１號,(04)23959617,3058,1130,2020/07/05 09:53:33
593620A891,御和藥局,臺中市大里區東興里益民路二段３２３號,(04)24821555,2900,240,2020/07/05 09:53:33
593620B307,仁一藥局,臺中市大里區仁化路４９７號,(04)24913610,2330,860,2020/07/05 09:53:33
5937013105,美得康藥局,彰化縣彰化市成功里民族路１８６號,(04)7280707,4959,310,2020/07/05 09:53:33
5937031596,康佑藥局,彰化縣和美鎮和東里彰美路５段１７５號１樓,(04)7576816,1065,129,2020/07/05 09:53:33
5937050395,裕良大藥局,彰化縣員林市莒光路３號,(04)8360388,5594,1403,2020/07/05 09:53:33
5937051794,愛康生活保健中西藥局,彰化縣員林市靜修東路３４號,(04)8328826,3456,701,2020/07/05 09:53:33
5937060060,慶華藥局,彰化縣溪湖鎮光華里二溪路一段１４號,(04)8852441,351,600,2020/07/05 09:53:33
5937071385,正益藥局,彰化縣田中鎮北路里新福路５３巷１３號１樓,(04)8761001,1719,751,2020/07/05 09:53:33
5937140054,正明藥局,彰化縣芬園鄉茄荖村芬草路一段２７３號,(049)2523918,1877,1039,2020/07/05 09:53:33
5937201061,長春藥局,彰化縣二水鄉文化村光文路１０３號,(04)8795289,4653,62,2020/07/05 09:53:33
5938020104,新仁壽藥局,南投縣埔里鎮南門里南榮路１３號１樓,(049)2983210,4825,240,2020/07/05 09:53:33
5938020257,德林藥局,南投縣埔里鎮大城路２０６號,(049)2915293,3214,1289,2020/07/05 09:53:33
5938030100,環球大藥局,南投縣草屯鎮中正路７５３號,(049)2356485,3024,0,2020/07/05 09:53:33
5938040277,潘藥局,南投縣竹山鎮竹山里下橫街２６－１１號,(049)2645613,1628,325,2020/07/05 09:53:33
5938040437,宏明堂藥局,南投縣竹山鎮竹山里橫街８８號,(049)2642202,855,567,2020/07/05 09:53:33
5938041569,竹山福倫藥局,南投縣竹山鎮竹山里集山路三段858號,(049)2658518,2270,1010,2020/07/05 09:53:33
5938041729,早安藥局,南投縣竹山鎮雲林路４１號,(049)2651032,2736,920,2020/07/05 09:53:33
5938041872,優適藥局,南投縣竹山鎮大明路１４９－５號,(049)2630355,1697,1042,2020/07/05 09:53:33
5938111271,柔欣藥局,南投縣水里鄉中山路１段５０８號,(049)2770199,1251,340,2020/07/05 09:53:33
5939012133,鎮東藥局,雲林縣斗六市中華路４６０號,(05)5332449,1917,580,2020/07/05 09:53:33
5939012428,德昌藥局,雲林縣斗六市明德路１０１號,(05)5340870,2243,313,2020/07/05 09:53:33
5939020055,民欣藥局,雲林縣斗南鎮明昌里長安路二段１９１號,(05)5973913,3361,1085,2020/07/05 09:53:33
5939021552,民安藥局,雲林縣斗南鎮中山路８９號,(05)5972076,2733,750,2020/07/05 09:53:33
5939031585,利芳藥局,雲林縣虎尾鎮光復路３１０號,(05)6311016,1572,1720,2020/07/05 09:53:33
5939032224,文心藥局,雲林縣虎尾鎮信義路６號,(05)6362365,6181,1107,2020/07/05 09:53:33
5939032617,永德健保藥局,雲林縣虎尾鎮德興路８３號,(05)6322802,3338,935,2020/07/05 09:53:33
5939032626,林藥師藥局,雲林縣虎尾鎮中正路２０７號,(05)6334135,439,680,2020/07/05 09:53:33
5939051247,祐安藥局,雲林縣土庫鎮馬光路３９－１號,(05)6655938,4248,0,2020/07/05 09:53:33
5939070162,廣醫藥局,雲林縣古坑鄉西平村中山路２１９號,(05)5829703,2318,1207,2020/07/05 09:53:33
5939071276,慈生藥局,雲林縣古坑鄉麻園村平和２２號,(05)5828222,66,1270,2020/07/05 09:53:33
5939071285,振明藥局,雲林縣古坑鄉中山路１７０號,(05)5821229,2943,904,2020/07/05 09:53:33
5939071310,禾安藥局,雲林縣古坑鄉中正路９６號,(05)5828318,4347,82,2020/07/05 09:53:33
5939091170,西河藥局,雲林縣莿桐鄉饒平村饒平路１０２號,(05)5842950,1108,607,2020/07/05 09:53:33
5939110027,清華藥局,雲林縣二崙鄉崙東村中山路一段２８４號,(05)5982438,3549,1688,2020/07/05 09:53:33
5939130010,瀧升藥局,雲林縣麥寮鄉麥豐村中正路１０３號,(05)6933880,1548,820,2020/07/05 09:53:33
5939130029,見春藥局,雲林縣麥寮鄉橋頭村仁德路７４號,(05)6912265,4779,380,2020/07/05 09:53:33
5939131151,三芳藥局,雲林縣麥寮鄉橋頭村仁德路１７６號,(05)6911053,2026,510,2020/07/05 09:53:33
5939191175,安泰藥局,雲林縣口湖鄉湖東村文安街３４號,(05)7893589,5226,1131,2020/07/05 09:53:33
5939191326,順生藥局,雲林縣口湖鄉口湖村口湖路３２４號,(05)7895799,1771,1530,2020/07/05 09:53:33
5939201283,義生藥局,雲林縣水林鄉水林路１９７號,(05)7853701,3202,1051,2020/07/05 09:53:33
5940011839,信男藥局,嘉義縣朴子市開元里開元路１７４號,(05)3790099,435,0,2020/07/05 09:53:33
5940041435,嘉方藥局,嘉義縣民雄鄉中樂村昇平路５８號,(05)2066747,4412,530,2020/07/05 09:53:33
5940041668,民雄照安藥局,嘉義縣民雄鄉中樂路２５號１樓,(05)2060368,2142,590,2020/07/05 09:53:33
5940080058,長生健保藥局,嘉義縣東石鄉東石村東石村２６０號,(05)3732557,3816,631,2020/07/05 09:53:33
5940111469,嘉安藥局,嘉義縣太保市麻寮里中山路２段４６號,(05)2387670,586,502,2020/07/05 09:53:33
5940111549,嘉康中西藥局,嘉義縣太保市南新里中山路一段２９５之２號,(05)2376200,819,0,2020/07/05 09:53:33
5940121205,楊藥局,嘉義縣水上鄉忠和村６８之５號,(05)2890687,1342,879,2020/07/05 09:53:33
5940121303,宏益藥局,嘉義縣水上鄉正義路５１號,(05)2601714,2646,356,2020/07/05 09:53:33
5940121349,照安藥局,嘉義縣水上鄉水頭村中興路４０８號,(05)2687897,945,610,2020/07/05 09:53:33
5941041297,台灣藥局,臺南市麻豆區信義路１１之１３號,(06)5726126,306,1290,2020/07/05 09:53:33
5941051453,佳佳藥局,臺南市佳里區中山路３８６號,(06)7227639,3032,800,2020/07/05 09:53:33
5941061342,安麗兒藥局新化店,臺南市新化區忠孝路１１６之３號,(06)5986029,705,750,2020/07/05 09:53:33
5941200045,慶豐綜合藥局,臺南市新市區新和里民生路５７號,(06)5014888,2235,0,2020/07/05 09:53:33
5941270109,振裕藥局,臺南市仁德區二行里二行一路１６５號,(06)2661478,1631,390,2020/07/05 09:53:33
5941310064,鐘藥局,臺南市永康區崑山里大灣路１０１２號,(06)2726635,3142,640,2020/07/05 09:53:33
5941310715,都都藥局,臺南市永康區中山南路１２８號,(06)2314815,2118,599,2020/07/05 09:53:33
5941310966,永康藥局,臺南市永康區尚頂里中華路９８８號之１,(06)2548606,3717,1680,2020/07/05 09:53:33
5942010643,王藥局,高雄市鳳山區一甲里南江街１２９號,(07)7716581,4572,23,2020/07/05 09:53:33
5942011819,鳳山丁丁藥局,高雄市鳳山區協和里自由路１５１號１樓,(07)7101080,852,203,2020/07/05 09:53:33
5942013260,辰好藥局,高雄市鳳山區中山東路２８１號,(07)7027064,1254,0,2020/07/05 09:53:33
5942014212,菩提大藥局,高雄市鳳山區新興里維新路１２１號１樓,(07)7903323,3591,280,2020/07/05 09:53:33
5942220023,維康藥局,高雄市甲仙區西安里中正路２２號,(07)6752585,2066,1116,2020/07/05 09:53:33
5942220032,文殊堂藥局,高雄市甲仙區西安里文化路２２號,(07)6752176,3038,1040,2020/07/05 09:53:33
5943010156,新東洋藥局,屏東縣屏東市民生路２３８號,(08)7323388,4489,589,2020/07/05 09:53:33
5943010665,中美藥局,屏東縣屏東市扶風里林森路４５號,(08)7348697,1449,1390,2020/07/05 09:53:33
5943013648,信安藥局,屏東縣屏東市金泉里漢口街１１號,(08)7322332,4684,386,2020/07/05 09:53:33
5943013746,柏吉藥師藥局,屏東縣屏東市勝利路３２２巷１３號,(08)7668255,882,432,2020/07/05 09:53:33
5943021426,日得藥局,屏東縣潮州鎮延平路１７６號,(08)7885685,3201,1170,2020/07/05 09:53:33
5943051282,建霖藥局,屏東縣萬丹鄉萬惠村萬丹路一段６號１F,(08)7777299,4688,540,2020/07/05 09:53:33
5943051326,進德藥局,屏東縣萬丹鄉萬安村萬丹路１段１５８號,(08)7772046,963,360,2020/07/05 09:53:33
5943120022,何藥局,屏東縣萬巒鄉佳佐村民生路１２９號,(08)7836888,1413,630,2020/07/05 09:53:33
5943161121,永明藥局,屏東縣枋寮鄉安樂村中山路１１９－１號,(08)8781481,3313,670,2020/07/05 09:53:33
5944010089,宏安藥局,澎湖縣馬公市中華路５４號,(06)9273048,668,841,2020/07/05 09:53:33
5945010289,易生藥局,花蓮縣花蓮市中正路４４３號,(03)8322927,2718,920,2020/07/05 09:53:33
5945011795,晉嘉藥局,花蓮縣花蓮市明禮路７１之８號,(03)8347329,2147,806,2020/07/05 09:53:33
5945013039,金喜藥局,花蓮縣花蓮市中山路７３３號,(03)8466829,2943,400,2020/07/05 09:53:33
5945051664,吉安丁丁藥局,花蓮縣吉安鄉中華路二段１１號,(03)8536772,3843,322,2020/07/05 09:53:33
5990010515,大賀藥局,金門縣金城鎮北門里民生路３號,(082)327678,369,0,2020/07/05 09:53:33
