醫事機構代碼,醫事機構名稱,醫事機構地址,醫事機構電話,成人口罩剩餘數,兒童口罩剩餘數,來源資料時間
5901092087,躍獅文昌藥局,臺北市大同區民生西路１０８號（實際營業：一層）,(02)25586189,1582,667,2020/09/06 09:44:36
5901102971,保德明水藥局,臺北市中山區北安路６０８巷４弄１號,(02)85097769,666,20,2020/09/06 09:44:36
5901110393,明湖藥局,臺北市內湖區東湖路７巷２７號１Ｆ,(02)26313515,8343,0,2020/09/06 09:44:36
5901121725,佳龍藥局,臺北市南港區研究院路２段８０號,(02)27885951,1638,30,2020/09/06 09:44:36
5901162173,小明藥局,臺北市北投區中央南路１段６９號２樓,(02)28928950,2493,170,2020/09/06 09:44:36
5901163527,理得藥局,臺北市北投區石牌路１段１５０號,(02)28289680,2646,340,2020/09/06 09:44:36
5901180055,日生大藥局,臺北市中正區汀州路１段５３號１樓,(02)23031393,2014,100,2020/09/06 09:44:36
5902040087,世詠藥局,高雄市楠梓區楠都東街１３８號,(07)3539869,1522,651,2020/09/06 09:44:36
5902040498,順明藥局,高雄市楠梓區和光街６５號,(07)3615574,955,1156,2020/09/06 09:44:36
5902050154,杏安藥局,高雄市三民區十全一路91 號,(07)3111606,2538,970,2020/09/06 09:44:36
5902050298,瑞鶴藥局,高雄市三民區寶德里義德路２５號,(07)3862757,3789,590,2020/09/06 09:44:36
5902051240,明皇藥局,高雄市三民區寶國里義華路１８１號,(07)3860121,1494,1530,2020/09/06 09:44:36
5902053833,建銘藥局,高雄市三民區吉林街２６２號,(07)3133460,1521,872,2020/09/06 09:44:36
5902057144,欣仁惠藥局,高雄市三民區大昌二路２４８號,(07)3837833,1865,252,2020/09/06 09:44:36
5902080376,政德藥局,高雄市苓雅區正大里武廟路２９號,(07)7114371,666,690,2020/09/06 09:44:36
5902080616,一加藥局,高雄市苓雅區和平一路四二號,(07)7212748,1557,0,2020/09/06 09:44:36
5903010494,百宏大藥局,臺中市豐原區中正路８６０號１樓,(04)25131538,3444,270,2020/09/06 09:44:36
5903090116,上宇藥局,臺中市潭子區中山路２段３８１號１樓,(04)25321258,927,635,2020/09/06 09:44:36
5903190335,育賢德侑藥局,臺中市太平區育賢路１０７號、１０９號,(04)23920696,3204,76,2020/09/06 09:44:36
5903260592,台中丁丁藥局,臺中市北區漢口路４段２５５號,(04)22374596,2769,1070,2020/09/06 09:44:36
5903270570,百富藥局,臺中市西屯區福上巷１６號,(04)22970708,89,557,2020/09/06 09:44:36
5905270041,仁德市安藥師藥局,臺南市仁德區中正西路２５號,(06)2661933,1769,640,2020/09/06 09:44:36
5905280047,獅甲藥局,臺南市歸仁區六甲里六甲路２０３號,(06)3388387,1541,1656,2020/09/06 09:44:36
5907060178,鴻安藥局,高雄市大寮區鳳林三路３９１、３９３號１樓,(07)7835956,1584,0,2020/09/06 09:44:36
5907080125,仁武丁丁藥局,高雄市仁武區仁和里鳳仁路２１之８號,(07)3721896,2376,594,2020/09/06 09:44:36
5907110155,丁丁藥局橋頭店,高雄市橋頭區成功南路１４８巷３號,(07)6113633,2219,0,2020/09/06 09:44:36
5907290050,新高橋藥局裕明店,高雄市鼓山區裕誠路１６８０號,(07)5224680,1359,0,2020/09/06 09:44:36
5907310173,安健藥局,高雄市楠梓區鳳楠路２５０號,(07)3520167,1389,1165,2020/09/06 09:44:36
5907350499,鑫美健保特約藥局,高雄市苓雅區光華一路１４８－５８號１樓,(07)7715088,2766,75,2020/09/06 09:44:36
5907360146,好芳鄰藥局,高雄市前鎮區光華二路２５７號,(07)3318657,1039,543,2020/09/06 09:44:36
5907360226,順康健保藥局,高雄市前鎮區一心二路６７號,(07)5364438,0,59,2020/09/06 09:44:36
5911011629,百福新豐活力藥局,基隆市中正區新豐街４０５號,24699990,2256,1008,2020/09/06 09:44:36
5911031176,家宏藥局,基隆市暖暖區源遠路２８１之２號１樓,(02)24595982,2539,1314,2020/09/06 09:44:36
5911050153,隆泰藥局,基隆市中山區西定路１２號,(02)24225889,3383,1290,2020/09/06 09:44:36
5911051490,大哈密藥局,基隆市中山區中山二路５號,(02)24285368,915,2196,2020/09/06 09:44:36
5912012139,康博中西藥局,新竹市東區明湖里明湖路四四六之四號,(03)5191010,2050,10,2020/09/06 09:44:36
5912012933,新芳鄰藥局,新竹市東區南大路４０２號,(03)5622183,306,90,2020/09/06 09:44:36
5912051216,健安藥局,新竹市香山區內湖路六十號,(03)5370111,1417,0,2020/09/06 09:44:36
5917030520,林西藥局,臺中市西區永龍里向上路一段４６－１號,(04)23014023,2443,1120,2020/09/06 09:44:36
5917030646,華隆藥局,臺中市西區樂群街６之２號,(04)22243785,900,1030,2020/09/06 09:44:36
5917040302,元聖藥局,臺中市南區積善里五權南路６５０號１樓,(04)22627468,1516,631,2020/09/06 09:44:36
5917060331,宏吉藥局,臺中市西屯區大福里長安路二段３１６號１樓,(04)22910825,1602,730,2020/09/06 09:44:36
5917080771,大生大藥局,臺中市北屯區三光里北屯路３３７號,(04)22337059,1494,1300,2020/09/06 09:44:36
5917081170,順天大藥局,臺中市北屯區中清路二段２３２號１樓,(04)22918847,1386,310,2020/09/06 09:44:36
5917083316,春元藥局,臺中市北屯區東山路１段２８７號,(04)24361008,3164,161,2020/09/06 09:44:36
5921051537,大全藥局,臺南市中西區府連路３９號,(06)2145007,1440,1160,2020/09/06 09:44:36
5921060394,土城藥師藥局,臺南市安南區城北路７５號,(06)2571872,2874,0,2020/09/06 09:44:36
5922010441,穎川保健藥局,嘉義市東區仁武里中山路２０４號,(05)2223609,2194,1154,2020/09/06 09:44:36
5931021167,禮隆藥局,新北市三重區自強路４段６４號,(02)29894735,0,218,2020/09/06 09:44:36
5931025236,祐銘藥局,新北市三重區龍門路２２號１樓,(02)29769001,1020,783,2020/09/06 09:44:36
5931068302,宏發藥局,新北市新莊區民安西路２６３號１樓,(02)22048303,2435,390,2020/09/06 09:44:36
5931071934,樹新藥局,新北市樹林區樹新路３０－３號１樓,(02)26821080,2187,0,2020/09/06 09:44:36
5931072066,琉璃水藥師藥局,新北市樹林區龍興街２１號１樓,(02)26764262,1212,1240,2020/09/06 09:44:36
5931130241,協成藥局,新北市土城區延吉街３３３號,(02)22653212,777,12,2020/09/06 09:44:36
5931151302,宏安藥局,新北市五股區成泰路２段１３６號,(02)22915932,0,6,2020/09/06 09:44:36
5932021090,新生藥師藥局,桃園市中壢區民權路５２號,(03)4919796,2763,920,2020/09/06 09:44:36
5932023432,敏康藥局,桃園市中壢區福德路３４號之１樓,(03)4611961,3618,760,2020/09/06 09:44:36
5932023450,環中藥局,桃園市中壢區環中東路１８１號,(03)4618873,1696,1329,2020/09/06 09:44:36
5932060088,銘方大藥局,桃園市大園區大園里中華路３２號,(03)3865077,945,970,2020/09/06 09:44:36
5932060168,永固安藥局,桃園市大園區中山南路五六號,(03)3867233,3240,20,2020/09/06 09:44:36
5932062215,快安藥師藥局,桃園市大園區新生北路４１號,(03)3856896,1071,0,2020/09/06 09:44:36
5932077154,博爾康生活藥局,桃園市龜山區大同路２５０號１樓,(03)3506588,1991,283,2020/09/06 09:44:36
5932099285,達仁藥局,桃園市龍潭區北龍路２７０號,(03)4095166,2412,680,2020/09/06 09:44:36
5933081536,昌昌藥局,新竹縣新豐鄉新市路１９３號,(03)5598077,2314,181,2020/09/06 09:44:36
5934010086,圓滿堂藥局,宜蘭縣宜蘭市中山路３段４８號,(03)9323413,2603,0,2020/09/06 09:44:36
5934012240,東成藥局,宜蘭縣宜蘭市東港路２段３０６號１樓,(03)9380353,4222,170,2020/09/06 09:44:36
5934012366,熊賀大藥局,宜蘭縣宜蘭市女中路３段２６號,(03)9352950,2807,0,2020/09/06 09:44:36
5934022013,康莊藥局,宜蘭縣羅東鎮康樂巷１號,(03)9553168,5202,0,2020/09/06 09:44:36
5935041629,悅昌藥局,苗栗縣竹南鎮中正路２８號一樓,(037)477195,2070,0,2020/09/06 09:44:36
5935050253,泉興藥局,苗栗縣頭份市仁愛里民族路２８號,(037)664367,2367,0,2020/09/06 09:44:36
5936010888,惠笙大藥局,臺中市豐原區三民路１８０號,(04)25279912,1242,0,2020/09/06 09:44:36
5936020080,仁生藥局,臺中市東勢區東安里豐勢路４２１號,(04)25872245,3046,0,2020/09/06 09:44:36
5936021363,小太陽藥局,臺中市東勢區豐勢路４１２之１、４１６號１樓,(04)25773481,2430,230,2020/09/06 09:44:36
5936192198,德侑健保藥局,臺中市太平區中山路４段８６之１號,(04)23959617,2497,1273,2020/09/06 09:44:36
593620A891,御和藥局,臺中市大里區東興里益民路二段３２３號,(04)24821555,1656,0,2020/09/06 09:44:36
5937060060,慶華藥局,彰化縣溪湖鎮光華里二溪路一段１４號,(04)8852441,2619,1150,2020/09/06 09:44:36
5937071385,正益藥局,彰化縣田中鎮北路里新福路５３巷１３號１樓,(04)8761001,3078,1941,2020/09/06 09:44:36
5937140018,民生藥局,彰化縣芬園鄉社口村彰南路４段１１３號,(049)2522595,2208,1302,2020/09/06 09:44:36
5937140054,正明藥局,彰化縣芬園鄉茄荖村芬草路一段２７３號,(049)2523918,2105,1616,2020/09/06 09:44:36
5937201061,長春藥局,彰化縣二水鄉文化村光文路１０３號,(04)8795289,2361,721,2020/09/06 09:44:36
5938020104,新仁壽藥局,南投縣埔里鎮南門里南榮路１３號１樓,(049)2983210,2759,1646,2020/09/06 09:44:36
5938030057,萬壽堂藥局,南投縣草屯鎮中山街２１１號,(049)2333570,443,23,2020/09/06 09:44:36
5938041872,優適藥局,南投縣竹山鎮大明路１４９－５號,(049)2630355,1383,1090,2020/09/06 09:44:36
5939012133,鎮東藥局,雲林縣斗六市中華路４６０號,(05)5332449,1017,0,2020/09/06 09:44:36
5939020055,民欣藥局,雲林縣斗南鎮明昌里長安路二段１９１號,(05)5973913,1050,460,2020/09/06 09:44:36
5939021392,南安藥局,雲林縣斗南鎮南昌路１３７號１樓,(05)5952777,0,569,2020/09/06 09:44:36
5939031585,利芳藥局,雲林縣虎尾鎮光復路３１０號,(05)6311016,4195,1223,2020/09/06 09:44:36
5939032626,林藥師藥局,雲林縣虎尾鎮中正路２０７號,(05)6334135,1680,1420,2020/09/06 09:44:36
5939051247,祐安藥局,雲林縣土庫鎮馬光路３９－１號,(05)6655938,2223,0,2020/09/06 09:44:36
5939091170,西河藥局,雲林縣莿桐鄉饒平村饒平路１０２號,(05)5842950,1109,223,2020/09/06 09:44:36
5939110027,清華藥局,雲林縣二崙鄉崙東村中山路一段２８４號,(05)5982438,1785,978,2020/09/06 09:44:36
5939130010,瀧升藥局,雲林縣麥寮鄉麥豐村中正路１０３號,(05)6933880,2284,960,2020/09/06 09:44:36
5939130029,見春藥局,雲林縣麥寮鄉橋頭村仁德路７４號,(05)6912265,979,1029,2020/09/06 09:44:36
5939131151,三芳藥局,雲林縣麥寮鄉橋頭村仁德路１７６號,(05)6911053,1029,697,2020/09/06 09:44:36
5939191175,安泰藥局,雲林縣口湖鄉湖東村文安街３４號,(05)7893589,2661,1051,2020/09/06 09:44:36
5939191326,順生藥局,雲林縣口湖鄉口湖村口湖路３２４號,(05)7895799,459,1040,2020/09/06 09:44:36
5940041435,嘉方藥局,嘉義縣民雄鄉中樂村昇平路５８號,(05)2066747,2446,1830,2020/09/06 09:44:36
5940111549,嘉康中西藥局,嘉義縣太保市南新里中山路一段２９５之２號,(05)2376200,1745,0,2020/09/06 09:44:36
5941040012,杏林藥局,臺南市麻豆區晉江里興中路１３６號,(06)5722692,1549,1075,2020/09/06 09:44:36
5941041297,台灣藥局,臺南市麻豆區信義路１１之１３號,(06)5726126,3096,1110,2020/09/06 09:44:36
5941051453,佳佳藥局,臺南市佳里區中山路３８６號,(06)7227639,710,1150,2020/09/06 09:44:36
5941200045,慶豐綜合藥局,臺南市新市區新和里民生路５７號,(06)5014888,408,590,2020/09/06 09:44:36
5941270109,振裕藥局,臺南市仁德區二行里二行一路１６５號,(06)2661478,1729,1948,2020/09/06 09:44:36
5941291180,安麗兒藥局關廟店,臺南市關廟區中山路２段５０號,(06)5951952,0,180,2020/09/06 09:44:36
5941310064,鐘藥局,臺南市永康區崑山里大灣路１０１２號,(06)2726635,2546,1162,2020/09/06 09:44:36
5941310715,都都藥局,臺南市永康區中山南路１２８號,(06)2314815,2537,999,2020/09/06 09:44:36
5941312184,大灣藥局,臺南市永康區大灣里民族路２９８號,(06)2728774,2268,990,2020/09/06 09:44:36
5942014212,菩提大藥局,高雄市鳳山區新興里維新路１２１號１樓,(07)7903323,1872,0,2020/09/06 09:44:36
5943010156,新東洋藥局,屏東縣屏東市民生路２３８號,(08)7323388,1588,911,2020/09/06 09:44:36
5943010665,中美藥局,屏東縣屏東市扶風里林森路４５號,(08)7348697,1377,1050,2020/09/06 09:44:36
5943013166,名正生活美藥局,屏東縣屏東市復興南路１段９９號,(08)7524395,1692,1139,2020/09/06 09:44:36
5943013746,柏吉藥師藥局,屏東縣屏東市勝利路３２２巷１３號,(08)7668255,5,95,2020/09/06 09:44:36
5943013979,彥芳藥局,屏東縣屏東市自由路３６４－３號,(08)7385559,1134,1149,2020/09/06 09:44:36
5943021444,泰和藥局,屏東縣潮州鎮四維路２９５．２９５－１號,(08)7861278,1350,1240,2020/09/06 09:44:36
5943051326,進德藥局,屏東縣萬丹鄉萬安村萬丹路１段１５８號,(08)7772046,2718,740,2020/09/06 09:44:36
5943161121,永明藥局,屏東縣枋寮鄉安樂村中山路１１９－１號,(08)8781481,1096,1548,2020/09/06 09:44:36
5945010289,易生藥局,花蓮縣花蓮市中正路４４３號,(03)8322927,3211,1160,2020/09/06 09:44:36
5945011795,晉嘉藥局,花蓮縣花蓮市明禮路７１之８號,(03)8347329,2315,224,2020/09/06 09:44:36
5990030044,仁愛復興藥局,金門縣金湖鎮新市里復興路４０號,(082)332368,2163,157,2020/09/06 09:44:36
