醫事機構代碼,醫事機構名稱,醫事機構地址,醫事機構電話,成人口罩剩餘數,兒童口罩剩餘數,來源資料時間
5902050298,瑞鶴藥局,高雄市三民區寶德里義德路２５號,(07)3862757,531,585,2020/06/14 07:08:35
5917060331,宏吉藥局,臺中市西屯區大福里長安路二段３１６號１樓,(04)22910825,2205,470,2020/06/14 07:08:35
5933080119,建仁藥局,新竹縣新豐鄉建興路一段１２２號,(03)5595850,1773,200,2020/06/14 07:08:35
5936090171,信源藥局,臺中市潭子區潭北里潭子街三段３９號,(04)25367233,3852,230,2020/06/14 07:08:35
5937140018,民生藥局,彰化縣芬園鄉社口村彰南路４段１１３號,(049)2522595,989,106,2020/06/14 07:08:35
5938090026,源和藥局,南投縣魚池鄉魚池村魚池街２７８號,(049)2897666,3062,310,2020/06/14 07:08:35
5940111469,嘉安藥局,嘉義縣太保市麻寮里中山路２段４６號,(05)2387670,892,762,2020/06/14 07:08:35
