5901163376,北投春天藥局,台北市北投區中央南路１段７６號,(02)28916668,200,50,2020/02/07 10:11:34
5901163394,致遠春天藥局,臺北市北投區致遠一路１段１３２號１、２樓,(02)28253258,200,52,2020/02/07 10:11:34
5901163410,尊賢藥局,台北市北投區尊賢街２１２號,(02)28270505,0,34,2020/02/07 10:11:34
5901163438,漢藥局,台北市北投區吉利街１４６號,(02)28236598,0,22,2020/02/07 10:11:34
5901163465,振生大藥局,台北市北投區中央北路３段６１號,(02)28977292,24,24,2020/02/07 10:11:34
5901163474,怡人藥局,台北市北投區自強街１６８號,(02)28211598,0,50,2020/02/07 10:11:34
5901163483,天富大藥局,台北市北投區石牌路２段１７１號１、２樓,(02)28225812,198,50,2020/02/07 10:11:34
5901163492,全家藥粧藥局,台北市北投區光明路１６６－２號,(02)28988685,102,20,2020/02/07 10:11:34
5901163509,吉利春天生活藥局,台北市北投區吉利街１２０號,(02)28253256,200,62,2020/02/07 10:11:34
5901170022,良美藥局,台北市信義區福德街２６８巷３７號,(02)27593659,138,58,2020/02/07 10:11:34
5901170040,惠群藥局,台北市信義區忠孝東路４段５５９巷３８號,(02)27679234,0,2,2020/02/07 10:11:34
5901170059,必欣藥局,台北市信義區松仁路２６４號,(02)27225060,142,34,2020/02/07 10:11:34
5901170184,臺陽藥局,台北市信義區大道路６１號,(02)27283403,130,18,2020/02/07 10:11:34
5901170255,松隆藥局,台北市信義區虎林街６５號,(02)27684033,202,44,2020/02/07 10:11:34
5901170264,杏康藥局,台北市信義區忠孝東路５段３７２巷２７弄６８－２號１Ｆ,(02)23457422,160,77,2020/02/07 10:11:34
5901170335,慧生藥局,台北市信義區松山路３１０號,(02)27647138,46,76,2020/02/07 10:11:34
5901170399,文豐藥局,台北市信義區松山路５４３號－１,(02)27272709,210,56,2020/02/07 10:11:34
5901170406,鼎泰藥局,台北市信義區基隆路１段１５５號１樓,(02)27620617,26,16,2020/02/07 10:11:34
5901170433,松山大藥局,台北市信義區永吉路４３６號,(02)27620624,24,43,2020/02/07 10:11:34
5901170442,大順安藥局,台北市信義區吳興街８４號,(02)27360639,18,4,2020/02/07 10:11:34
5901170648,立信藥局,台北市信義區松山路４０３號,(02)27687754,72,44,2020/02/07 10:11:34
5901170906,吳興藥局,台北市信義區吳興街２７９號１樓,(02)27208328,0,10,2020/02/07 10:11:34
5901170915,杏仁藥局,台北市信義區大道路１３５號,(02)27262541,0,2,2020/02/07 10:11:34
5901172071,百康藥局,台北市信義區基隆路２段１３１之２０號,(02)27364377,2,14,2020/02/07 10:11:34
5901172160,佑華藥局,台北市信義區忠孝東路５段５０８－４號１樓,(02)27595719,2,16,2020/02/07 10:11:34
5901172197,得揚藥局,台北市信義區忠孝東路５段４５２號１樓,(02)87884667,0,6,2020/02/07 10:11:34
5901172213,華泰藥局,台北市信義區虎林街８２巷５號,(02)27601992,0,12,2020/02/07 10:11:34
5901172240,德康大藥局,台北市信義區松山路５４１巷２１號,(02)27272502,184,48,2020/02/07 10:11:34
5901172268,皇佳大藥局,台北市信義區松山路５４１巷１９號,(02)27269868,66,38,2020/02/07 10:11:34
5901172544,麗中藥局,台北市信義區福德街２１７號,(02)27594416,78,44,2020/02/07 10:11:34
5901172651,康杏藥局,台北市信義區福德街３０６號１樓,(02)27591510,44,32,2020/02/07 10:11:34
5901172688,昆陽藥局,台北市信義區林口街２３０號,(02)27274814,0,40,2020/02/07 10:11:34
5901172697,綠杏大藥局,台北市信義區吳興街２４１號,(02)27582378,0,2,2020/02/07 10:11:34
5901172839,九州藥局,台北市信義區和平東路３段２３９號,(02)87323331,0,28,2020/02/07 10:11:34
5901172924,松仁藥局,台北市信義區松仁路２３３號,(02)27238626,32,34,2020/02/07 10:11:34
5901172933,喜樂藥局,台北市信義區松德路１２５號,(02)27275797,56,20,2020/02/07 10:11:34
5901173041,皇昇大藥局,台北市信義區松山路２１０號１樓,(02)27663488,4,0,2020/02/07 10:11:34
5901173050,貴臨藥局,台北市信義區永吉路３２６巷１９號,(02)27493768,116,40,2020/02/07 10:11:34
5901173201,大鳥藥局,台北市信義區莊敬路３５４號,(02)23455025,2,34,2020/02/07 10:11:34
5901173210,濟生中西藥局,台北市信義區崇德街４１號,(02)27358452,100,18,2020/02/07 10:11:34
5901173238,正和藥局,台北市信義區吳興街２２５巷６號,(02)23455186,0,8,2020/02/07 10:11:34
5901173283,上禾藥師藥局,台北市信義區林口街２７號,(02)27592686,0,14,2020/02/07 10:11:34
5901173292,荐荃藥師藥局,台北市信義區虎林街６８之３號,(02)27492866,2,4,2020/02/07 10:11:34
5901173372,新永春藥局,台北市信義區忠孝東路５段４２３巷１號,(02)27667385,0,8,2020/02/07 10:11:34
5901173390,馨馨藥局,台北市信義區虎林街８２巷１９號,(02)27491208,22,44,2020/02/07 10:11:34
5901173407,康怡健保藥局,台北市信義區吳興街４６７巷２弄１２號,(02)27206193,200,68,2020/02/07 10:11:34
5901173587,新興健保藥局,台北市信義區永吉路３０巷１１３號,(02)27494892,384,76,2020/02/07 10:11:34
5901173603,松德盛康藥局,台北市信義區松德路４０號,(02)87891622,30,20,2020/02/07 10:11:34
5901173658,杏一永春藥局,台北市信義區松山路２９２巷１７號,(02)27495938,0,36,2020/02/07 10:11:34
5901173676,杏一光復藥局,台北市信義區光復南路４４９之１號,(02)87804626,0,4,2020/02/07 10:11:34
5901173685,富熙仁康藥局,台北市信義區松仁路２６０號,(02)27587608,202,28,2020/02/07 10:11:34
5901173694,洪暘藥局,台北市信義區富陽街８６號,(02)27337099,6,10,2020/02/07 10:11:34
5901173701,壹間藥師藥局,台北市信義區虎林街１２０巷１４８號,(02)27672833,200,50,2020/02/07 10:11:34
5901173729,康健信安藥局,台北市信義區信安街１５１號,(02)87324166,0,20,2020/02/07 10:11:34
5901173738,尚頤中西藥局,台北市信義區虎林街１４５號,(02)27253818,190,50,2020/02/07 10:11:34
5901173756,信義盛康藥局,台北市信義區永吉路２８６號,(02)23460521,21,0,2020/02/07 10:11:34
5901173765,上好藥師藥局,台北市信義區永吉路３０巷１０１弄４８號,(02)27677088,190,56,2020/02/07 10:11:34
5901173774,立赫北醫藥局,台北市信義區吳興街１１８巷２６弄１７號,(02)27320100,200,46,2020/02/07 10:11:34
5901173792,柏愛藥局,台北市信義區基隆路２段１３１之９號,(02)27325472,0,2,2020/02/07 10:11:34
5901173809,愛維喜藥局,台北市信義區莊敬路２７８號,(02)27586989,336,100,2020/02/07 10:11:34
5901173818,博亞藥局,台北市信義區莊敬路４６２號,(02)27580506,112,34,2020/02/07 10:11:34
5901173827,松美藥局,台北市信義區市民大道６段３２０號（實際營業地址：１樓）,(02)27651099,0,4,2020/02/07 10:11:34
5901180037,崇信藥局,台北市中正區齊東街８８號,(02)23417557,0,4,2020/02/07 10:11:34
5901180055,日生大藥局,台北市中正區汀州路１段５３號１樓,(02)23031393,192,64,2020/02/07 10:11:34
5901180108,三元藥局,台北市中正區三元街１５８號,(02)23052839,8,18,2020/02/07 10:11:34
5901180126,民生藥局,台北市中正區濟南路２段４５－１號１樓,(02)23416470,0,30,2020/02/07 10:11:34
5901180162,濟仁藥局,台北市中正區濟南路２段２２號,(02)23514576,166,46,2020/02/07 10:11:34
5901180206,大安藥局,台北市中正區新生南路１段１０６號,(02)23213186,160,50,2020/02/07 10:11:34
5901180215,上海聯合藥局,台北市中正區衡陽路３２號１樓,(02)23117744,74,42,2020/02/07 10:11:34
5901180224,中心藥局,台北市中正區汀州路３段１２１號,(02)23689889,200,50,2020/02/07 10:11:34
5901180304,祥全藥局,台北市中正區信義路２段７９巷１５－８號１Ｆ,(02)23939339,0,16,2020/02/07 10:11:34
5901180322,南昌大藥局,台北市中正區南昌路１段８６號１樓,(02)23510322,4,0,2020/02/07 10:11:34
5901180368,古亭藥局,台北市中正區汀州路３段１１７號,(02)23683618,200,60,2020/02/07 10:11:34
5901182031,新獻安藥局,台北市中正區羅斯福路１段１５號,(02)23519891,198,50,2020/02/07 10:11:34
5901182068,永興藥局,台北市中正區汀州路１段９２巷２８號,(02)23050986,42,50,2020/02/07 10:11:34
5901182086,國杏藥師示範藥局,台北市中正區延平南路１７１巷３號,(02)23811322,194,66,2020/02/07 10:11:34
5901182111,東華藥局,台北市中正區汀州路３段１１３號,(02)23640852,0,8,2020/02/07 10:11:34
5901182219,連雲藥局,台北市中正區連雲街７９號,(02)23410504,50,60,2020/02/07 10:11:34
5901182255,全民藥局,台北市中正區廈門街８７號,(02)23695759,4,44,2020/02/07 10:11:34
5901183323,和平藥局,台北市中正區中華路２段４３號,(02)23755303,186,68,2020/02/07 10:11:34
5901183387,丞良藥局,台北市中正區南昌路１段７８號地下１樓,(02)33938868,0,32,2020/02/07 10:11:34
5901183396,慶安藥局,台北市中正區徐州路２６號,(02)23582385,0,6,2020/02/07 10:11:34
5901183510,怡誠藥局,台北市中正區汀州路２段２１２號,(02)23626905,198,66,2020/02/07 10:11:34
5901183645,大愛生活藥局,台北市中正區汀州路２段２３２號,(02)23661155,200,50,2020/02/07 10:11:34
5901183672,博昇藥局,台北市中正區連雲街７２號,(02)23581898,64,44,2020/02/07 10:11:34
5901183716,台醫藥局,台北市中正區公園路３０巷４號,(02)23141202,2,12,2020/02/07 10:11:34
5901183789,佑康大藥局,台北市中正區汀州路２段６４號,(02)23683602,192,48,2020/02/07 10:11:34
5901183798,佳和藥局,台北市中正區黎明里公園路３０號,(02)23117102,198,50,2020/02/07 10:11:34
5901183823,南昌健康人生藥局,台北市中正區南昌路１段１５３號,(02)23969382,0,2,2020/02/07 10:11:34
5901183887,中英大藥局,台北市中正區永綏街６號,(02)23615654,202,50,2020/02/07 10:11:34
5901183896,琪基藥局,台北市中正區杭州南路１段８９號,(02)23414988,200,50,2020/02/07 10:11:34
5901184062,建祥武昌藥局,台北市中正區武昌街１段２９號１樓,(02)23314038,38,42,2020/02/07 10:11:34
5901184071,進達健保藥局,台北市中正區中華路２段４５３號,(02)23039829,4,6,2020/02/07 10:11:34
5901184080,活力健康藥妝藥局,台北市中正區中華路２段３１５巷１號,(02)23392625,0,4,2020/02/07 10:11:34
5901184142,新三醫藥局,台北市中正區汀州路３段１２５號,(02)23648180,198,78,2020/02/07 10:11:34
5901184213,71恩典藥局,台北市中正區信義路２段７１號,(02)23223371,0,8,2020/02/07 10:11:34
5901184259,汀州健康人生藥局,台北市中正區汀州路３段２１１號,(02)23688902,0,8,2020/02/07 10:11:34
5901184366,宏越藥局,台北市中正區中華路２段３１３巷４號,(02)23050880,0,8,2020/02/07 10:11:34
5901184375,大盛藥局,台北市中正區中華路１段２１巷１６號,(02)23713838,50,28,2020/02/07 10:11:34
5901184437,安藤健保調劑藥局,台北市中正區南昌路１段１３０號、１３２號,(02)23962120,198,52,2020/02/07 10:11:34
5901184455,躍獅南寧藥局,台北市中正區南昌路１段８１號,(02)23967072,174,48,2020/02/07 10:11:34
5901184464,和眾藥局,台北市中正區忠孝西路１段６號,(07)010119100,184,52,2020/02/07 10:11:34
5901184473,中力藥局,台北市中正區襄陽路１３之５號、１５號,(02)23313768,200,50,2020/02/07 10:11:34
5901184491,躍獅南門藥局,台北市中正區中華路２段３９巷１０號,(02)23141111,140,38,2020/02/07 10:11:34
5901184517,躍獅東門藥局,台北市中正區金山南路１段１０８之１號,(02)23920339,202,52,2020/02/07 10:11:34
5901184535,桐心藥局,台北市中正區金華街１８之６號１樓,(02)23581663,10,36,2020/02/07 10:11:34
5901190024,長泰藥局,台北市萬華區西園路２段２８０號,(02)23012869,10,4,2020/02/07 10:11:34
5901190033,世欣藥局,台北市萬華區東園街１７３號１Ｆ,(02)23074263,366,100,2020/02/07 10:11:34
5901190042,裕和藥局,台北市萬華區萬大路１１５、１１７號,(02)23063219,142,52,2020/02/07 10:11:34
5901190060,秀全藥局,台北市萬華區開封街２段６６－３號,(02)23811357,0,8,2020/02/07 10:11:34
5901190079,建和藥局,台北市萬華區青年路１６８巷４４號,(02)23010838,72,62,2020/02/07 10:11:34
5901190104,大嘉藥局,台北市萬華區梧州街６０號,(02)23084402,198,80,2020/02/07 10:11:34
5901190177,信昌藥局,台北市萬華區長泰街３６號１樓,(02)23054898,0,4,2020/02/07 10:11:34
5901190211,民和藥局,台北市萬華區民和街５號１樓,(02)23038134,6,0,2020/02/07 10:11:34
5901190220,生活大藥局,台北市萬華區貴陽街２段１２４號,(02)23618609,38,32,2020/02/07 10:11:34
5901190284,民鈺藥局,台北市萬華區環河南路２段１３９號１樓,(02)23084270,200,49,2020/02/07 10:11:34
5901190408,您永安藥局,台北市萬華區昆明街１６２號,(02)23317119,200,50,2020/02/07 10:11:34
5901190426,皇祥藥局,台北市萬華區萬青街１６５號１樓,(02)23375676,132,18,2020/02/07 10:11:34
5901190515,日昇藥局,台北市萬華區廣州街１２４號,(02)23062975,2,7,2020/02/07 10:11:34
5901190668,聯慶大藥局,台北市萬華區萬大路３０６號１樓,(02)23039850,88,50,2020/02/07 10:11:34
5901190686,信義藥局,台北市萬華區青年路２８號,(02)23074599,198,50,2020/02/07 10:11:34
5901190695,益源藥局,台北市萬華區大理街１６０巷２６弄２號,(02)23087321,28,16,2020/02/07 10:11:34
5901190784,欣安藥局,台北市萬華區東園街１９０、１９２號,(02)23327830,198,50,2020/02/07 10:11:34
5901192064,三源藥局,台北市萬華區康定路１９７號,(02)23022111,0,2,2020/02/07 10:11:34
5901192126,恩達藥局,台北市萬華區梧州街６４號,(02)23024467,0,26,2020/02/07 10:11:34
5901192144,健華藥局,台北市萬華區康定路３２８號,(02)23063083,200,78,2020/02/07 10:11:34
5901192162,寶興大藥局,台北市萬華區寶興街１１９號,(02)23013375,0,2,2020/02/07 10:11:34
5901192180,康之友藥局,台北市萬華區青年路２０號,(02)23011598,84,50,2020/02/07 10:11:34
5901192448,健誠大藥局,台北市萬華區環河南路２段１８５號,(02)23042223,6,26,2020/02/07 10:11:34
5901192546,躍獅西園藥局,台北市萬華區西園路２段２６０號,(02)23094063,200,50,2020/02/07 10:11:34
5901192653,吉安藥局,台北市萬華區廣州街１８２號,(02)23085268,346,102,2020/02/07 10:11:34
5901192751,好視多藥局,台北市萬華區萬大路２８５號,(02)23018100,0,44,2020/02/07 10:11:34
5901192831,偉安藥局,台北市萬華區西藏路１０９號,(02)23037186,198,68,2020/02/07 10:11:34
5901192975,萬華藥局,台北市萬華區萬大路２４８號實際營業地址１樓、２樓,(02)23012221,0,14,2020/02/07 10:11:34
5901192993,萬華健業藥局,台北市萬華區東園街６８－３號,(02)23012292,200,50,2020/02/07 10:11:34
5901193025,華達藥局,台北市萬華區環河南路２段１７１號,(02)23082785,0,20,2020/02/07 10:11:34
5901193070,榮勝藥局,台北市萬華區萬大路２３３號,(02)23331121,2,12,2020/02/07 10:11:34
5901193105,安誠貴陽藥局,台北市萬華區貴陽街２段１４８號,(02)23812190,2,0,2020/02/07 10:11:34
5901193123,千誠北護藥局,台北市萬華區內江街１１４號,(02)23123530,26,2,2020/02/07 10:11:34
5901193132,松本藥局,台北市萬華區西昌街２３３號,(02)23029559,10,38,2020/02/07 10:11:34
5901193150,日森人文藥局,台北市萬華區和平西路３段１４９號,(02)23082100,200,50,2020/02/07 10:11:34
5901193169,柏祥藥局,台北市萬華區西藏路１４１號,(02)23018272,38,6,2020/02/07 10:11:34
5901193178,展源健康藥局,台北市萬華區國興路１０４號,(02)23035179,185,68,2020/02/07 10:11:34
5901193187,富安藥局,台北市萬華區萬大路４２６號,(02)23377878,0,44,2020/02/07 10:11:34
5901193196,青年宏越藥局,台北市萬華區青年路４４號,(02)23011037,200,52,2020/02/07 10:11:34
5901193230,啟仁藥局,台北市萬華區環河南路２段１７７號,(02)23362771,196,52,2020/02/07 10:11:34
5901193249,光華藥局,台北市萬華區華西街１９－５號,(02)23613609,116,64,2020/02/07 10:11:34
5901200070,裕康藥局,台北市文山區木柵路１段１２號,(02)22367756,158,44,2020/02/07 10:11:34
5901200105,建興藥局,台北市文山區木柵路２段８１號１樓,(02)29399993,64,18,2020/02/07 10:11:34
5901200114,健群藥局,台北市文山區景興路４１號,(02)29328898,42,4,2020/02/07 10:11:34
5901200123,瑞安藥局,台北市文山區溪口街６９－１號１樓,(02)29312888,94,20,2020/02/07 10:11:34
5901200141,景美藥局,台北市文山區景文街１２５號,(02)29335741,200,38,2020/02/07 10:11:34
5901200187,全銨藥局,台北市文山區木新路３段３４９號１樓,(02)29370689,108,24,2020/02/07 10:11:34
5901200490,永明大藥局,台北市文山區興隆路１段２９７號１樓,(02)29314428,0,6,2020/02/07 10:11:34
5901200534,日信專業藥局,台北市文山區木柵路２段１３９號１樓,(02)86618322,96,46,2020/02/07 10:11:34
5901201540,逸仙藥師藥局,台北市文山區興隆路２段２１８－１號１樓,(02)29312597,0,6,2020/02/07 10:11:34
5901201568,康宜庭生活藥局,台北市文山區興隆路４段６４號,(02)29385363,200,50,2020/02/07 10:11:34
5901201675,博揚藥局,台北市文山區景興路１８１號,(02)89321707,0,8,2020/02/07 10:11:34
5901201728,東京晟藥局,台北市文山區辛亥路４段９７號,(02)29356354,0,22,2020/02/07 10:11:34
5901201746,仙瑩藥局,台北市文山區景華街１６６號,(02)89321817,134,44,2020/02/07 10:11:34
5901201755,銘依藥局,台北市文山區興隆路２段３０１巷４－１號,(02)29308538,198,50,2020/02/07 10:11:34
5901201826,舒博威藥局,台北市文山區興隆路２段９５巷３號,(02)29306805,32,40,2020/02/07 10:11:34
5901201835,巧康藥局,台北市文山區木新路３段２６２、２６４號,(02)29372061,0,2,2020/02/07 10:11:34
5901201951,慶豐好藥局,台北市文山區興隆路４段１３５號１樓,(02)29384775,172,12,2020/02/07 10:11:34
5901202154,安誠藥局,台北市文山區景華街１２４－１號,(02)29308542,2,2,2020/02/07 10:11:34
5901202216,皇興藥師藥局,台北市文山區木柵路２段１２１號,(02)29365553,216,66,2020/02/07 10:11:34
5901202396,宇康藥局,台北市文山區羅斯福路５段２１８巷７號,(02)29307066,118,44,2020/02/07 10:11:34
5901202583,康宜庭景文藥局,台北市文山區景文街９７號,(02)29302801,200,50,2020/02/07 10:11:34
5901202592,人人健保藥局,台北市文山區保儀路３９號,(02)86610761,16,5,2020/02/07 10:11:34
5901202645,永源大藥局,台北市文山區興隆路３段３０２號,(02)22396166,22,24,2020/02/07 10:11:34
5901202672,美迦藥局,台北市文山區保儀路２３號,(02)29362815,13,16,2020/02/07 10:11:34
5901202681,振大藥局,台北市文山區永安街２２巷１６號,(02)29393385,162,50,2020/02/07 10:11:34
5901202752,躍獅奕新藥局,台北市文山區木新路２段２７５號,(02)22340378,156,52,2020/02/07 10:11:34
5901202789,宜康藥局,台北市文山區保儀路７號,(02)86619862,182,50,2020/02/07 10:11:34
5901202841,欣安景美藥局,台北市文山區景文街７７號,(02)29316008,191,50,2020/02/07 10:11:34
5901202850,北一藥師藥局,台北市文山區木新路３段４７號,(02)22348686,200,49,2020/02/07 10:11:34
5901202949,萬隆大藥局,台北市文山區羅斯福路５段２１８巷１５號,(02)29334580,204,54,2020/02/07 10:11:34
5901202976,健康家藥局,台北市文山區興隆路２段１３３號,(02)29330858,198,52,2020/02/07 10:11:34
5901202994,躍獅永健藥局,台北市文山區木柵路１段１７７號,(02)77285780,196,76,2020/02/07 10:11:34
5901203026,健康人生藥局,台北市文山區興隆路３段１０６號,(02)29347813,200,48,2020/02/07 10:11:34
5901203062,大樹文山藥局,台北市文山區興隆路３段１３號（１、２、３樓）,(02)29342226,200,50,2020/02/07 10:11:34
5901203071,景華盛康藥局,台北市文山區景華街６９號,(02)29310188,4,18,2020/02/07 10:11:34
5901203080,杏一木柵藥局,台北市文山區木柵路３段９８號,(02)29371839,191,50,2020/02/07 10:11:34
5901203106,光明大藥局,台北市文山區忠順街１段６６號,(02)29390275,0,4,2020/02/07 10:11:34
5901203124,福興藥局,台北市文山區福興路５６號,(02)89313868,66,6,2020/02/07 10:11:34
5901203160,路加健康藥局,台北市文山區興隆路２段２２０巷３９號,(02)29302336,138,18,2020/02/07 10:11:34
5901203213,綠杏萬芳藥局,台北市文山區興隆路３段１１１號,(02)29349516,216,58,2020/02/07 10:11:34
5901203222,躍獅景新藥局,台北市文山區羅斯福路６段３０號,(02)29356221,10,4,2020/02/07 10:11:34
5901203240,大愛幸福藥局,台北市文山區木新路２段２２１號,(02)29379977,200,48,2020/02/07 10:11:34
5901203259,杏一萬芳藥局,台北市文山區興隆路３段１１８號、１１８號２樓,(02)82301606,200,50,2020/02/07 10:11:34
5901203268,躍獅木柵藥局,台北市文山區指南路１段２８號,(02)86617752,0,10,2020/02/07 10:11:34
5901203277,大樹景美藥局,台北市文山區羅斯福路６段２３４之１號,(02)29322951,6,0,2020/02/07 10:11:34
5901203286,康宜庭興隆藥局,台北市文山區興隆路３段２００號,(02)22304866,200,50,2020/02/07 10:11:34
5901203302,大樹木柵藥局,台北市文山區木柵路３段１０８號、１１０號（１樓、２樓、３樓）,(02)22340110,0,32,2020/02/07 10:11:34
5902010016,健康藥局,高雄市鹽埕區大仁路１０２號,(07)5510738,76,28,2020/02/07 10:11:34
5902010025,南京藥局,高雄市鹽埕區建國四路３８７號,(07)5514652,246,64,2020/02/07 10:11:34
5902010132,宏恩藥局,高雄市鹽埕區教仁里瀨南街１３３號,(07)5211318,0,10,2020/02/07 10:11:34
5902011308,昇安藥局,高雄市鹽埕區瀨南街２２５號１樓,(07)5216438,64,30,2020/02/07 10:11:34
5902011326,和生藥局,高雄市鹽埕區建國四路１７８－２號,(07)5315739,196,60,2020/02/07 10:11:34
5902011335,利百加藥局,高雄市鹽埕區大公路９６號,(07)5511098,0,52,2020/02/07 10:11:34
5902020012,永松藥局,高雄市鼓山區鼓山三路１３０－１５號,(07)5810657,2,26,2020/02/07 10:11:34
5902021153,世和藥局,高雄市鼓山區華豐里華夏路１９５號,(07)5522566,0,14,2020/02/07 10:11:34
5902021233,崧柏藥局,高雄市鼓山區華榮路５４３號,(07)5542027,36,24,2020/02/07 10:11:34
5902021242,快安藥局,高雄市鼓山區濱海一路３２號,(07)5514090,36,14,2020/02/07 10:11:34
5902021331,文山藥局,高雄市鼓山區鼓山二路１６６之８之９號,(07)5315681,0,4,2020/02/07 10:11:34
5902021377,藍玉藥局,高雄市鼓山區鼓峰里九如四路２００２號,(07)5837528,2,16,2020/02/07 10:11:34
5902022669,惠民藥局,高雄市鼓山區九如四路１４２６號,(07)5833228,8,0,2020/02/07 10:11:34
5902022687,元氣藥局,高雄市鼓山區南屏路５３３號,(07)5555995,8,22,2020/02/07 10:11:34
5902022721,永瑞藥局,高雄市鼓山區華榮路２９８號２樓,(07)5521376,212,84,2020/02/07 10:11:34
5902022749,安康藥局,高雄市鼓山區裕誠路１１５５號,(07)5536828,396,138,2020/02/07 10:11:34
5902022794,定國藥局,高雄市鼓山區九如四路１１３５號,(07)5815858,6,6,2020/02/07 10:11:34
5902022801,裕康中西大藥局,高雄市鼓山區裕誠路１５１９號,(07)5555352,208,52,2020/02/07 10:11:34
5902022829,弘興藥局,高雄市鼓山區鼓山三路４８－１１號,(07)5612677,248,60,2020/02/07 10:11:34
5902022874,康爾喜藥局,高雄市鼓山區慶豐街５０號,(07)5222650,32,26,2020/02/07 10:11:34
5902022892,大有藥局,高雄市鼓山區文信路２３６號,(07)5529402,62,34,2020/02/07 10:11:34
5902022972,高雄藥局,高雄市鼓山區九如四路９２４號,(07)5610031,0,6,2020/02/07 10:11:34
5902030063,紅心藥局,高雄市左營區崇德路２５５號,(07)3416697,0,6,2020/02/07 10:11:34
5902030090,宏仁藥局,高雄市左營區左營大路３９０號,(07)5817895,0,8,2020/02/07 10:11:34
5902030205,果貿藥局,高雄市左營區果峰街２２號,(07)5852825,234,122,2020/02/07 10:11:34
5902030269,立文藥局,高雄市左營區立文路５４號,(07)5572899,8,22,2020/02/07 10:11:34
5902030287,慈德藥局,高雄市左營重愛路５３號,(07)3416212,16,52,2020/02/07 10:11:34
5902030303,翔生藥局,高雄市左營區尾南里左營大路５１４號,(07)5827329,131,44,2020/02/07 10:11:34
5902030410,重仁藥局,高雄市左營區左營大路４０８號,(07)5824083,36,24,2020/02/07 10:11:34
5902030634,有機藥局,高雄市左營區榮耀街３號,(07)3596429,52,18,2020/02/07 10:11:34
5902030643,新高橋藥局,高雄市左營區民族一路１０２８號,(07)3100696,12,12,2020/02/07 10:11:34
5902031882,崇光藥局,高雄市左營區華夏路７５５號,(07)3452211,192,50,2020/02/07 10:11:34
5902031999,平安藥局,高雄市左營區中華一路５之１號,(07)5833688,2,64,2020/02/07 10:11:34
5902032174,光明健保藥局,高雄市左營區翠華路６０１巷８３號,(07)5812499,0,74,2020/02/07 10:11:34
5902032218,和信藥師健保藥局,高雄市左營區崇德路２６７號,(07)3419363,200,52,2020/02/07 10:11:34
5902032227,政大聯合藥局,高雄市左營區自由三路５０６號,(07)3454713,86,26,2020/02/07 10:11:34
5902032370,好幸福專業藥局,高雄市左營區明華一路２２０號,(07)5506816,96,32,2020/02/07 10:11:34
5902032432,威林藥局,高雄市左營區華夏路７２１號,(07)3414243,52,34,2020/02/07 10:11:34
