醫事機構代碼,醫事機構名稱,醫事機構地址,醫事機構電話,成人口罩剩餘數,兒童口罩剩餘數,來源資料時間
5931032955,博輝藥局,新北市永和區中興街６０號１樓,(02)89211766,0,190,2020/04/12 15:59:37
5931033103,皇家藥師藥局,新北市永和區中正路７２０號１樓,(02)89216867,1,4,2020/04/12 15:59:37
5931033176,緣來藥師藥局,新北市永和區福和路２５０、２５２號１樓,(02)29211798,36,451,2020/04/12 15:59:37
5931033194,廣惠藥局,新北市永和區中正路６４９號２樓,(02)29290675,333,500,2020/04/12 15:59:37
5931033201,級立健保藥局,新北市永和區保平路１３９號１樓,(02)29299995,3,6,2020/04/12 15:59:37
5931033363,保安藥局,新北市永和區保安路２１２號１樓,(02)29277623,2183,312,2020/04/12 15:59:37
5931033416,詠悅藥局,新北市永和區中山路１段１７４號１樓,(02)29205760,7,1000,2020/04/12 15:59:37
5931033498,亞佐藥局,新北市永和區中山路１段１２８巷１７號１樓,(02)89219038,0,837,2020/04/12 15:59:37
5931033523,永奕藥局,新北市永和區永平路２８６之１號１樓,(02)22327709,9,0,2020/04/12 15:59:37
5931033578,悅美保健藥局,新北市永和區保生路２２巷２１號１樓,(02)22323515,0,343,2020/04/12 15:59:37
5931033649,敦品民治藥局,新北市永和區民治街８１號１樓,(02)29494150,3,0,2020/04/12 15:59:37
5931033658,威成藥局,新北市永和區中和路４２９號１樓,(02)29263191,24,190,2020/04/12 15:59:37
5931033890,康杏安藥局,新北市永和區保平路６０號１樓,(02)29298968,279,20,2020/04/12 15:59:37
5931033916,宜田藥局,新北市永和區中正路１１１號２樓,(02)29425935,0,1856,2020/04/12 15:59:37
5931033925,康和藥局,新北市永和區中和路５８９號１樓,(02)22310300,9,0,2020/04/12 15:59:37
5931033943,崇恩藥局,新北市永和區成功路２段１３５號１樓,(02)89214022,0,1,2020/04/12 15:59:37
5931040144,安康藥局,新北市中和區圓通路３０９號,(02)22450837,3,0,2020/04/12 15:59:37
5931040153,上仁藥局,新北市中和區中山路２段１３１巷１１－１號,(02)22480074,7,0,2020/04/12 15:59:37
5931040215,華新藥局,新北市中和區華新街７３號,(02)29448345,153,0,2020/04/12 15:59:37
5931040224,欣祥藥局,新北市中和區民德路７４－１號,(02)29646442,0,2,2020/04/12 15:59:37
5931040313,亮安藥局,新北市中和區宜安路２號,(02)29469898,3,1,2020/04/12 15:59:37
5931040322,宏信藥局,新北市中和區永貞路２６２巷４號,(02)29294976,0,3,2020/04/12 15:59:37
5931040359,劉永安藥局,新北市中和區景安路２２７號,(02)29458377,2,7,2020/04/12 15:59:37
5931040395,旭豐藥局,新北市中和區民享街４１號,(02)22215393,9,0,2020/04/12 15:59:37
5931040402,健星藥局,新北市中和區景平路７５４號,(02)22403437,9,0,2020/04/12 15:59:37
5931040475,顧藥局,新北市中和區圓通路１４０號,(02)22470133,3,5,2020/04/12 15:59:37
5931040617,田邊藥局,新北市中和區泰和街４３號１樓,(02)22407725,3,6,2020/04/12 15:59:37
5931040662,仙正藥局,新北市中和區福美路３０９號,(02)22494081,0,8,2020/04/12 15:59:37
5931040680,博健藥局,新北市中和區忠孝街３７巷４號,(02)29402107,81,0,2020/04/12 15:59:37
5931040733,日發藥局,新北市中和區興南路２段５２－４號,(02)29424926,4,0,2020/04/12 15:59:37
5931041061,裕壬藥局,新北市中和區新生街２０６、２０８號１樓,(02)32349358,247,0,2020/04/12 15:59:37
5931042371,真成大藥局,新北市中和區光華街３８號,(02)22447008,18,0,2020/04/12 15:59:37
5931042611,安華藥局,新北市中和區圓通路２９３之２號２樓,(02)22489079,4,5,2020/04/12 15:59:37
5931042648,恩溢藥局,新北市中和區復興路７９號１樓.２樓,(02)22452450,1472,112,2020/04/12 15:59:37
5931042782,弘安藥局,新北市中和區德光路１２１之１號１樓,(02)29646489,505,755,2020/04/12 15:59:37
5931043136,聖康藥師藥局,新北市中和區自立路３９號１樓,(02)29478002,0,1243,2020/04/12 15:59:37
5931043216,億華藥局,新北市中和區景安路１５７號,(02)89421993,870,72,2020/04/12 15:59:37
5931043369,泰泰健保藥局,新北市中和區德光路９７號,(02)89642049,0,5,2020/04/12 15:59:37
5931043421,錦和藥局,新北市中和區錦和路１６４號１樓,(02)82282296,720,0,2020/04/12 15:59:37
5931043430,慶華藥師藥局,新北市中和區華新街９０號１樓,(02)29420666,7,0,2020/04/12 15:59:37
5931043538,三越藥局,新北市中和區復興路２７７號１樓,(02)22427215,6,7,2020/04/12 15:59:37
5931043565,一安藥妝藥局,新北市中和區中和路９號１.２樓,(02)22483778,414,0,2020/04/12 15:59:37
5931043636,雙合藥局,新北市中和區中正路２９１號１樓,(02)22476607,509,658,2020/04/12 15:59:37
5931043663,群芳藥局,新北市中和區和興里中興街７３號１樓,(02)22433729,1134,20,2020/04/12 15:59:37
5931043770,宜安健康人生藥局,新北市中和區宜安路１６２號１樓,(02)29224648,3,107,2020/04/12 15:59:37
5931043921,良安藥局,新北市中和區文元里連城路３６６號１樓,(02)22225798,0,230,2020/04/12 15:59:37
5931043930,三德和藥局,新北市中和區吉興里南山路２８９號１樓,(02)22471028,2,0,2020/04/12 15:59:37
5931044188,安和藥師藥局,新北市中和區錦和路４１０號１樓,(02)22433708,0,5,2020/04/12 15:59:37
5931044268,冠品藥師藥局,新北市中和區連城路１１９號１樓,(02)22452129,1814,230,2020/04/12 15:59:37
5931044286,好意藥局,新北市中和區景新街４６７巷３號１樓,(02)89416598,3,0,2020/04/12 15:59:37
5931044357,順心藥局,新北市中和區景新街４３９號１樓,(02)29429680,0,1,2020/04/12 15:59:37
5931044508,和欣泰藥局,新北市中和區永貞路２２３號１樓,(02)29290867,135,0,2020/04/12 15:59:37
5931044571,中和環球藥局,新北市中和區中山路３段１２１號１樓,(02)22211812,225,0,2020/04/12 15:59:37
5931044599,成合藥局,新北市中和區景平路４２９之２號１樓,(02)22483605,158,2,2020/04/12 15:59:37
5931044606,詠安藥局,新北市中和區員山路１５０之８號１樓,(02)22231606,283,3,2020/04/12 15:59:37
5931044624,奕采藥局,新北市中和區宜安路７７號１樓,(02)29429770,1,1,2020/04/12 15:59:37
5931044660,吉佑藥局,新北市中和區大勇街３４號１樓,(02)89416539,8,0,2020/04/12 15:59:37
5931044713,信毅藥局,新北市中和區捷運路５６號１樓,(02)29423663,936,100,2020/04/12 15:59:37
5931044875,誼安健業藥局,新北市中和區宜安路１１８巷２０號１樓,(02)86600058,9,0,2020/04/12 15:59:37
5931044884,壹品藥局,新北市中和區福祥路５５號１樓,(02)22481818,135,0,2020/04/12 15:59:37
5931044937,中和慈美藥局,新北市中和區中山路２段２０８號１樓,(02)22425835,0,1007,2020/04/12 15:59:37
5931044946,綠杏廟口藥局,新北市中和區中和路１１５號１樓,(02)22470547,0,107,2020/04/12 15:59:37
5931044955,安騏生活藥局,新北市中和區南華路１５號１樓,(02)22445130,6,7,2020/04/12 15:59:37
5931044982,萊恩藥局,新北市中和區景安路２０９號１樓,(02)29468395,0,50,2020/04/12 15:59:37
5931044991,曜群藥局,新北市中和區景安路２５號１樓,(02)89432206,1800,200,2020/04/12 15:59:37
5931045087,公園親子藥局,新北市中和區安平路１５８號２樓,(02)86688726,3,5,2020/04/12 15:59:37
5931045103,榮記大藥局,新北市中和區員山路４８２號１樓,(02)22239546,0,3,2020/04/12 15:59:37
5931050131,再生藥局,新北市新店區北新路３段６５巷９號,(02)29113781,96,5,2020/04/12 15:59:37
5931050211,耀生中西藥局,新北市新店區文化路２１巷６號,(02)29118598,303,50,2020/04/12 15:59:37
5931050408,昌順藥局,新北市新店區安康路３段２６５號,(02)22156798,0,9,2020/04/12 15:59:37
5931051558,信龍大藥局,新北市新店區安康路２段５６號,(02)22115533,438,0,2020/04/12 15:59:37
5931051601,昇旺藥局,新北市新店區建國路１０－１號１樓,(02)86659233,1775,203,2020/04/12 15:59:37
5931051692,安康佑康健保藥局,新北市新店區安康路３段１７號,(02)22144938,45,0,2020/04/12 15:59:37
5931051790,家得福藥局,新北市新店區安康路２段１２３號１樓,(02)22118346,3,6,2020/04/12 15:59:37
5931051816,康宜庭北新藥局,新北市新店區北新路２段４３號１樓,(02)89147015,0,10,2020/04/12 15:59:37
5931052135,椿萱藥局,新北市新店區建國路６９號,(02)29188311,9,0,2020/04/12 15:59:37
5931052313,欣康藥局,新北市新店區中正路２９３號１樓,(02)89113189,155,62,2020/04/12 15:59:37
5931052368,正安藥局,新北市新店區明德路５０號１樓,(02)29115809,0,3,2020/04/12 15:59:37
5931052439,德莘藥局,新北市新店區中正路４１３號１樓,(02)86655462,3,2,2020/04/12 15:59:37
5931052457,東碩藥局,新北市新店區建國路１６８號１樓,(02)29118281,18,0,2020/04/12 15:59:37
5931052608,佑成藥局,新北市新店區民權路１０１號１樓,(02)86673537,90,0,2020/04/12 15:59:37
5931052804,新店家安藥局,新北市新店區三民路３２－１號２樓,(02)29117207,0,5,2020/04/12 15:59:37
5931052822,瑞安健保藥局,新北市新店區中正路１４２號１樓,(02)29105252,0,5,2020/04/12 15:59:37
5931052868,均安藥局,新北市新店區民權路８９號１樓,(02)29127861,134,1,2020/04/12 15:59:37
5931052911,倍思特藥局,新北市新店區中興路２段２３９號２樓,(02)89116159,270,0,2020/04/12 15:59:37
5931052920,碧潭大藥局,新北市新店區碧潭路４１號１樓,(02)22112271,855,140,2020/04/12 15:59:37
5931052966,禾宜藥局,新北市新店區北新路３段１２８號１樓,(02)29150411,7,4,2020/04/12 15:59:37
5931052984,北一藥師藥局,新北市新店區北新路２段１６０號１樓、２樓,(02)89115686,362,0,2020/04/12 15:59:37
5931053007,康曜藥師藥局,新北市新店區安康路２段２４０號１樓,(02)86669660,106,0,2020/04/12 15:59:37
5931053034,康宜庭市公所藥局,新北市新店區北新路１段２８５號１樓,(02)29151709,9,0,2020/04/12 15:59:37
5931053052,巧新藥局,新北市新店區北宜路１段８４號１樓,(02)29183565,1413,140,2020/04/12 15:59:37
5931053061,耕莘健康人生藥局,新北市新店區民族路１８６號１樓,(02)22194743,906,110,2020/04/12 15:59:37
5931053070,美康中正藥局,新北市新店區中正路２１５號１、２樓,(02)29112669,30,0,2020/04/12 15:59:37
5931053089,昇活藥局,新北市新店區安民街２６９巷２號１樓,(02)22114166,6,0,2020/04/12 15:59:37
5931053132,康宜庭碧潭藥局,新北市新店區北宜路１段４１號１樓,(02)29186266,306,0,2020/04/12 15:59:37
5931053150,十二願藥局,新北市新店區中正路６８２號１樓,(02)22181899,1571,389,2020/04/12 15:59:37
5931060146,海山藥局,新北市新莊區景德路４２５號,(02)22019804,2,5,2020/04/12 15:59:37
5931060226,忠山藥局,新北市新莊區雙鳳路２號,(02)29027588,0,4,2020/04/12 15:59:37
5931060342,十安藥局,新北市新莊區中港路３１６號,(02)29922859,810,0,2020/04/12 15:59:37
5931060619,蘇藥局,新北市新莊區中平路６巷３７號,(02)29917818,3,4,2020/04/12 15:59:37
5931060628,錄新藥局,新北市新莊區後港一路７６巷１０弄１號,(02)22051849,199,0,2020/04/12 15:59:37
5931060682,勝安藥局,新北市新莊區中正路３３４巷２３號１樓,(02)29963394,4,0,2020/04/12 15:59:37
5931060824,禮安藥師藥局,新北市新莊區自立街１０９號１樓,(02)29942891,208,0,2020/04/12 15:59:37
5931065927,聯成藥局,新北市新莊區中正路３３２號,(02)29941915,760,1245,2020/04/12 15:59:37
5931067216,鍵豐藥局,新北市新莊區中和街１５８號１樓,(02)29917452,1251,40,2020/04/12 15:59:37
5931067494,福營藥局,新北市新莊區富國路１０７號２樓,(02)22059697,0,2,2020/04/12 15:59:37
5931067547,金翔藥局,新北市新莊區幸福路５９５號１樓,(02)29988528,3,5,2020/04/12 15:59:37
5931067565,豐年藥局,新北市新莊區中正路３７７巷１６號,(02)22071182,162,0,2020/04/12 15:59:37
5931067850,聯合藥局,新北市新莊區新泰路１９４號２樓,(02)22796464,0,4,2020/04/12 15:59:37
5931068008,北醫藥局,新北市新莊區思源路１１９號１樓,(02)29983670,501,0,2020/04/12 15:59:37
5931068268,新莊大東藥局,新北市新莊區幸福路８０６號１樓,(02)22766026,18,5,2020/04/12 15:59:37
5931068375,惠欣藥局,新北市新莊區全泰里建中街７２－１號１樓,(02)29978962,2,7,2020/04/12 15:59:37
5931068455,合康藥師藥局,新北市新莊區中平里中平路３０６號,(02)29924496,3,3,2020/04/12 15:59:37
5931068580,春元藥局,新北市新莊區南港里龍安路２７８巷２號１樓,(02)22085202,4,0,2020/04/12 15:59:37
5931068599,建昌藥局,新北市新莊區福營里中正路５５７號,(02)29015422,4,13,2020/04/12 15:59:37
5931068624,瑞豐大藥局,新北市新莊區建福里後港一路１０５號,(02)22049932,5,0,2020/04/12 15:59:37
5931068759,森活藥局,新北市新莊區民安路２２０－１號,(02)22027927,898,0,2020/04/12 15:59:37
5931068866,大愛藥師藥局,新北市新莊區後港一路６９號１樓,(02)22042119,9,11,2020/04/12 15:59:37
5931068875,旭生藥局,新北市新莊區裕民街４２號１樓,(02)29021289,1674,180,2020/04/12 15:59:37
5931068973,富安藥局,新北市新莊區復興路１段２５號－１，２樓,(02)22767620,0,4,2020/04/12 15:59:37
5931068991,新莊健業藥局,新北市新莊區昌平街３７號１樓至２樓,(02)22798808,90,0,2020/04/12 15:59:37
5931069265,錦安藥局,新北市新莊區民安路２０１號１樓,(02)22011242,1408,46,2020/04/12 15:59:37
5931069274,微笑埔銓藥局,新北市新莊區中平路７７號,(02)29901680,27,15,2020/04/12 15:59:37
5931069363,明亮藥局,新北市新莊區幸福路５１１號１樓,(02)29962671,0,1,2020/04/12 15:59:37
5931069498,新杏藥局,新北市新莊區新泰路９９號１樓,(02)22011012,450,0,2020/04/12 15:59:37
5931069532,聯盟藥局,新北市新莊區中港路２６７巷１號１樓,(02)29941168,5,0,2020/04/12 15:59:37
5931069569,心安藥局,新北市新莊區新泰路１９３號２樓,(02)22779773,0,669,2020/04/12 15:59:37
5931069765,健業藥妝藥局,新北市新莊區中和街１３０號１樓,(02)22796279,1286,182,2020/04/12 15:59:37
5931069792,宏泰藥局,新北市新莊區自信街３７號１樓,(02)29964649,315,0,2020/04/12 15:59:37
593106A011,八德藥局,新北市新莊區八德街３號２樓,(02)22071315,912,0,2020/04/12 15:59:37
593106A020,紅豆藥局,新北市新莊區龍安路７８號１樓,(02)29047700,0,5,2020/04/12 15:59:37
593106A039,大仁藥局,新北市新莊區公園一路３２號１樓,(02)22776023,21,0,2020/04/12 15:59:37
593106A093,環球藥局,新北市新莊區中港路４３６號１、２樓,(02)29901934,0,20,2020/04/12 15:59:37
593106A137,力源藥局,新北市新莊區復興路２段１３３號１樓,(02)89929919,18,8,2020/04/12 15:59:37
593106A155,日榮藥局,新北市新莊區龍安路４６１號１樓,(02)22051523,0,28,2020/04/12 15:59:37
593106A182,和昌藥局,新北市新莊區中安街１５號１樓,(02)29900669,0,11,2020/04/12 15:59:37
593106A226,詠康聯合藥局,新北市新莊區中榮街６６巷１號１樓,(02)29964436,0,420,2020/04/12 15:59:37
593106A244,巧心藥局,新北市新莊區建中街９２號１樓,(02)22778584,2,0,2020/04/12 15:59:37
593106A299,悅生藥局,新北市新莊區龍安路３４３－１號１樓,(02)22081219,6,0,2020/04/12 15:59:37
593106A324,向日葵健保藥局,新北市新莊區建福路５０號１樓,(02)22060377,56,13,2020/04/12 15:59:37
593106A351,平安藥局,新北市新莊區民安西路６０號２樓,(02)22082368,7,5,2020/04/12 15:59:37
593106A388,元大藥局,新北市新莊區富國路２０４號１、２樓,(02)22020082,1041,0,2020/04/12 15:59:37
593106A404,新新藥局,新北市新莊區新泰路６２號２樓,(02)29945994,0,3,2020/04/12 15:59:37
593106A422,英謙藥局,新北市新莊區新泰路２６１號１樓,(02)22774822,13,5,2020/04/12 15:59:37
593106A477,喜悅藥局,新北市新莊區後港一路５５號１樓,(02)22047442,18,0,2020/04/12 15:59:37
593106A520,臻善美藥局,新北市新莊區幸福路７８６號１樓,(02)89914303,0,2008,2020/04/12 15:59:37
593106A566,一心春天藥局,新北市新莊區中和街１３號１樓、地下室,(02)89929482,1136,100,2020/04/12 15:59:37
593106A628,中原藥局,新北市新莊區中原路９３號１樓,(02)89920668,90,0,2020/04/12 15:59:37
593106A637,薇妮藥妝藥局,新北市新莊區民安路９９號１樓,(02)82010817,171,40,2020/04/12 15:59:37
593106A646,薇妮雙鳳藥局,新北市新莊區雙鳳路２１號１樓,(02)29076993,81,10,2020/04/12 15:59:37
593106A735,樂家藥局,新北市新莊區中平路２７３號１樓,(02)29960723,19,0,2020/04/12 15:59:37
593106A762,新康健保藥局,新北市新莊區自立街１７２號１樓,(02)29962558,18,0,2020/04/12 15:59:37
593106A806,北安藥妝健康廣場佳康藥局,新北市新莊區雙鳳路２７號１樓，２樓,(02)29069899,18,0,2020/04/12 15:59:37
593106A842,鼎極藥局,新北市新莊區民安西路３７６號之１、之３（１樓）,(02)22073228,0,10,2020/04/12 15:59:37
593106A851,躍獅新豐藥局,新北市新莊區豐年街１６號１樓,(02)22058055,3,0,2020/04/12 15:59:37
593106A860,新莊至誠藥局,新北市新莊區中平路２９號２樓,(02)29980345,0,5,2020/04/12 15:59:37
593106A913,洋欣藥局,新北市新莊區中平路２７７號１樓及夾層,(02)89927489,0,3,2020/04/12 15:59:37
593106A940,樂福藥局,新北市新莊區幸福路４８號１樓,(02)29923388,27,0,2020/04/12 15:59:37
593106A959,新莊大藥局,新北市新莊區福壽街１３０號１樓,(02)29933885,1629,1,2020/04/12 15:59:37
5931070053,仁一藥局,新北市樹林區中正路６２２號,(02)26893915,21,0,2020/04/12 15:59:37
5931070062,鴻真藥局,新北市樹林區保安街１段２０巷６號,(02)26828977,9,0,2020/04/12 15:59:37
5931070142,江藥局,新北市樹林區日新街１０２號１樓,(02)26828001,12,829,2020/04/12 15:59:37
5931070348,久青藥局,新北市樹林區東華街３３號,(02)86844326,3,0,2020/04/12 15:59:37
5931071523,蔚海藥局,新北市樹林區鎮前街１７號１樓,(02)86754203,6,0,2020/04/12 15:59:37
5931071550,久豐大藥局,新北市樹林區復興路２８６號１樓,(02)26759156,15,0,2020/04/12 15:59:37
5931071658,大慶藥局,新北市樹林區鎮前街４２－１號,(02)26759212,2,3,2020/04/12 15:59:37
5931071836,弘昌藥師藥局,新北市樹林區保安街１段６５號１樓,(02)26871276,27,1,2020/04/12 15:59:37
5931071916,立欣藥局,新北市樹林區三福街１６６號,(02)26764728,659,0,2020/04/12 15:59:37
5931071961,綠蘋果藥局,新北市樹林區學勤路５９７號１樓,(02)89706050,5,3,2020/04/12 15:59:37
5931071970,保康藥局,新北市樹林區保安街１段３６４號,(02)86875503,36,0,2020/04/12 15:59:37
5931072066,琉璃水藥師藥局,新北市樹林區龍興街２１號１樓,(02)26764262,1730,205,2020/04/12 15:59:37
5931072137,保安健保藥局,新北市樹林區保安街２段２１１號１樓,(02)26898179,4,5,2020/04/12 15:59:37
5931072217,樹林健業藥局,新北市樹林區東華街８９號１樓,(02)86851736,873,10,2020/04/12 15:59:37
5931072404,伯安綜合藥局,新北市樹林區中華路１０８號１樓,(02)86856551,0,18,2020/04/12 15:59:37
5931072413,誠新大藥局,新北市樹林區中山路１段２４號１樓,(02)26870204,0,5,2020/04/12 15:59:37
5931072431,樹林大樹藥局,新北市樹林區育英街５４號１－２樓,(02)26815488,6,0,2020/04/12 15:59:37
5931072459,健康人生藥局,新北市樹林區博愛一街２６號１樓,(02)26814394,7,1,2020/04/12 15:59:37
5931072486,星禾藥師藥局,新北市樹林區學府路２９２號１樓,(02)77515255,242,0,2020/04/12 15:59:37
5931080031,林政德西藥局,新北市鶯歌區建國路２５６號１樓,(02)26781412,3,4,2020/04/12 15:59:37
5931081216,嘉泰藥師藥局,新北市鶯歌區鶯桃路２段３１號１樓,(02)26709668,149,0,2020/04/12 15:59:37
5931081289,唯新示範藥局,新北市鶯歌區建國路１６１號１樓,(02)86775363,1296,110,2020/04/12 15:59:37
5931081403,純安大藥局,新北市鶯歌區國慶街１７９號１樓,(02)26791791,6,5,2020/04/12 15:59:37
5931081412,小樹藥師藥局,新北市鶯歌區光明街１２６號１樓,(02)26785107,43,0,2020/04/12 15:59:37
5931081494,康群藥局,新北市鶯歌區建國路２０２號１樓,(02)26796690,3,6,2020/04/12 15:59:37
5931081510,鶯歌藥局,新北市鶯歌區鶯桃路２段１１號１樓,(02)86778778,116,0,2020/04/12 15:59:37
5931081529,正雅藥局,新北市鶯歌區建國路１７６號１樓,(02)26701128,10,0,2020/04/12 15:59:37
5931090117,大和藥局,新北市三峽區民生街１５０號,(02)26711010,21,0,2020/04/12 15:59:37
5931090180,人來安藥局,新北市三峽區文化路２６６－５號,(02)26721199,7,8,2020/04/12 15:59:37
5931091427,康美藥局,新北市三峽區民生街７９號２樓,(02)26745526,2,7,2020/04/12 15:59:37
5931091454,致安藥師藥局,新北市三峽區中華路１７號１樓,(02)26743418,0,1,2020/04/12 15:59:37
5931091481,盛加藥局,新北市三峽區民生街４９號,(02)26739797,9,0,2020/04/12 15:59:37
5931091678,如音藥局,新北市三峽區文化路２６６－１號１樓,(02)26732119,0,17,2020/04/12 15:59:37
5931091712,誠祐藥局,新北市三峽區光明路２２號１樓,(02)26746211,0,2,2020/04/12 15:59:37
5931091810,誠美藥局,新北市三峽區復興路１０６號１樓,(02)26718131,18,0,2020/04/12 15:59:37
5931091829,有新藥局,新北市三峽區學勤路１８號１樓,(02)26710769,9,0,2020/04/12 15:59:37
5931091892,三峽藥局,新北市三峽區介壽路１段２７號１樓,(02)26738868,6,6,2020/04/12 15:59:37
5931091981,悅兒藥局,新北市三峽區學成路３２９號１樓,(02)86741633,3,6,2020/04/12 15:59:37
5931092004,大家好藥粧藥局,新北市三峽區大德路１２７號１樓,(02)26747022,8,0,2020/04/12 15:59:37
5931092068,益銘藥師藥局,新北市三峽區大德路１８１號１樓,(02)26723662,0,3,2020/04/12 15:59:37
5931092102,升威藥局,新北市三峽區文化路２３號１樓,(02)26731120,32,0,2020/04/12 15:59:37
5931100154,尚運藥局,新北市淡水區學府路５１巷１弄２０號,(02)26225149,3,0,2020/04/12 15:59:37
5931100270,千代田藥局,新北市淡水區學府路１９號１樓,(02)26223185,0,1,2020/04/12 15:59:37
5931101455,日揚藥局,新北市淡水區民族路３０巷５號,(02)26242059,126,0,2020/04/12 15:59:37
5931101633,吉利安健保藥師藥局,新北市淡水區中山北路１段１００號１樓,(02)26295693,276,0,2020/04/12 15:59:37
5931101642,吳光祥藥局,新北市淡水區中山路１０４號,(02)26213020,161,0,2020/04/12 15:59:37
5931101651,天文大藥局,新北市淡水區新春街１３６號,(02)86312050,1143,70,2020/04/12 15:59:37
5931101704,聖天藥局,新北市淡水區重建街２１８號,(02)26215677,3,9,2020/04/12 15:59:37
5931101786,護鄰藥局,新北市淡水區油車里淡海路４７號,(07)10009047,5,1,2020/04/12 15:59:37
5931101937,文川藥局,新北市淡水區中山北路１段９３號１樓,(02)86319033,6,0,2020/04/12 15:59:37
5931101955,伯宇藥局,新北市淡水區新春街１０３號－８,(02)26236006,0,5,2020/04/12 15:59:37
5931101973,良順藥局,新北市淡水區中山北路１段２４號１樓,(02)26218111,1,0,2020/04/12 15:59:37
5931101991,淡水春天生活藥局,新北市淡水區中山北路１段４９號,(02)26257059,648,20,2020/04/12 15:59:37
5931102087,匯民藥局,新北市淡水區中山北路１段１０１號２樓,(02)26202620,122,13,2020/04/12 15:59:37
5931102103,四季寶健保藥局,新北市淡水區新市一路３段１１７－１號（含夾層）,(02)26283199,3,0,2020/04/12 15:59:37
5931102176,淡水健康人生藥局,新北市淡水區清水街９－２號１樓,(02)26269679,234,0,2020/04/12 15:59:37
5931102229,貝比爾藥局,新北市淡水區中山北路１段１７１號１樓,(02)26261577,1170,20,2020/04/12 15:59:37
5931102292,佑全淡水淡金藥局,新北市淡水區淡金路５５號、５７號１樓,(02)26228040,441,9,2020/04/12 15:59:37
5931102318,躍獅學府藥局,新北市淡水區學府路７７號（１樓）,(02)26295603,351,0,2020/04/12 15:59:37
5931110025,巧能藥局,新北市汐止區福德一路２０９號１樓,(02)26942858,408,582,2020/04/12 15:59:37
5931110258,春德堂藥局,新北市汐止區新台五路１段２２０號,(02)26422048,3,0,2020/04/12 15:59:37
5931111568,湖前中西藥局,新北市汐止區湖前街４５號１樓,(02)26925850,2323,0,2020/04/12 15:59:37
5931111755,幸福藥局,新北市汐止區大同路２段３３２號１．２樓,(02)26490127,0,7,2020/04/12 15:59:37
5931111773,江北藥局,新北市汐止區汐萬路１段３３號,(02)26918870,198,0,2020/04/12 15:59:37
5931111835,全家藥局,新北市汐止區明峰街１４３號１樓,(02)26954990,0,3,2020/04/12 15:59:37
5931111844,福恩藥師大藥局,新北市汐止區福德二路１７１之１號１樓,(02)26940835,23,151,2020/04/12 15:59:37
5931111915,康元中西綜合藥局,新北市汐止區大同路２段２１９號,(02)86923648,21,0,2020/04/12 15:59:37
5931111951,我家藥局,新北市汐止區中正路２９號,(02)86910840,8,0,2020/04/12 15:59:37
5931112047,吉安康健保藥師藥局,新北市汐止區宜興街１１號１樓,(02)26405881,346,450,2020/04/12 15:59:37
5931112083,裕和藥局,新北市汐止區宜興街４號１樓,(02)26609119,1845,0,2020/04/12 15:59:37
