醫事機構代碼,醫事機構名稱,醫事機構地址,醫事機構電話,成人口罩剩餘數,兒童口罩剩餘數,來源資料時間
5937140018,民生藥局,彰化縣芬園鄉社口村彰南路４段１１３號,(049)2522595,5140,550,2021/01/10 07:47:29
5939032224,文心藥局,雲林縣虎尾鎮信義路６號,(05)6362365,1060,100,2021/01/10 07:47:29
5939130029,見春藥局,雲林縣麥寮鄉橋頭村仁德路７４號,(05)6912265,6700,750,2021/01/10 07:47:29
5940111469,嘉安藥局,嘉義縣太保市麻寮里中山路２段４６號,(05)2387670,9130,780,2021/01/10 07:47:29
5941051453,佳佳藥局,臺南市佳里區中山路３８６號,(06)7227639,6660,830,2021/01/10 07:47:29
5941200045,慶豐綜合藥局,臺南市新市區新和里民生路５７號,(06)5014888,6170,780,2021/01/10 07:47:29
5945010289,易生藥局,花蓮縣花蓮市中正路４４３號,(03)8322927,7500,610,2021/01/10 07:47:29
