醫事機構代碼,醫事機構名稱,醫事機構地址,醫事機構電話,成人口罩剩餘數,兒童口罩剩餘數,來源資料時間
5931042282,慈光藥局,新北市中和區南山路１１７號,(02)22407700,0,571,2020/03/30 22:08:36
5931042326,璟福藥局,新北市中和區安平路７６號１樓,(02)29408669,129,463,2020/03/30 22:08:36
5931042371,真成大藥局,新北市中和區光華街３８號,(02)22447008,39,411,2020/03/30 22:08:36
5931042424,九崧藥局,新北市中和區南華路２０號１樓,(02)22451379,0,516,2020/03/30 22:08:36
5931042611,安華藥局,新北市中和區圓通路２９３之２號２樓,(02)22489079,75,1589,2020/03/30 22:08:36
5931042648,恩溢藥局,新北市中和區復興路７９號１樓.２樓,(02)22452450,134,218,2020/03/30 22:08:36
5931042728,上元藥局,新北市中和區景平路１６０號２樓,(02)29408050,246,1616,2020/03/30 22:08:36
5931042782,弘安藥局,新北市中和區德光路１２１之１號１樓,(02)29646489,143,2490,2020/03/30 22:08:36
5931042808,民德藥局,新北市中和區民德路６１－１號１樓,(02)89514746,0,250,2020/03/30 22:08:36
5931042817,家嘉藥局,新北市中和區員山路３７７號,(02)82281388,138,0,2020/03/30 22:08:36
5931042899,家家藥局,新北市中和區民德路４３號,(02)29587512,0,5,2020/03/30 22:08:36
5931043047,藥安藥局,新北市中和區廣福路１６號１樓,(02)22447066,0,140,2020/03/30 22:08:36
5931043109,育新藥局,新北市中和區中安街４０巷６號,(02)29283479,0,1091,2020/03/30 22:08:36
5931043136,聖康藥師藥局,新北市中和區自立路３９號１樓,(02)29478002,0,530,2020/03/30 22:08:36
5931043181,建琳藥局,新北市中和區景安路２０２－１號,(02)22427887,0,2515,2020/03/30 22:08:36
5931043216,億華藥局,新北市中和區景安路１５７號,(02)89421993,0,373,2020/03/30 22:08:36
5931043234,康荃優生保健藥局,新北市中和區福祥路６６號１樓,(02)22486532,0,1050,2020/03/30 22:08:36
5931043369,泰泰健保藥局,新北市中和區德光路９７號,(02)89642049,0,45,2020/03/30 22:08:36
5931043396,立健藥局,新北市中和區連城路３１７號１樓,(02)22230614,0,290,2020/03/30 22:08:36
5931043421,錦和藥局,新北市中和區錦和路１６４號１樓,(02)82282296,0,116,2020/03/30 22:08:36
5931043430,慶華藥師藥局,新北市中和區華新街９０號１樓,(02)29420666,0,110,2020/03/30 22:08:36
5931043501,悅聖藥局,新北市中和區圓通路１４９號１樓,(02)22429779,54,605,2020/03/30 22:08:36
5931043529,新雙和藥師藥局,新北市中和區中正路２８１－８號１樓,(02)22404276,51,521,2020/03/30 22:08:36
5931043538,三越藥局,新北市中和區復興路２７７號１樓,(02)22427215,97,194,2020/03/30 22:08:36
5931043565,一安藥妝藥局,新北市中和區中和路９號１.２樓,(02)22483778,171,189,2020/03/30 22:08:36
5931043592,美佳大藥局,新北市中和區景安路１８５號,(02)29496560,183,550,2020/03/30 22:08:36
5931043627,銓家藥局,新北市中和區員山路３１９號１-２樓,(02)22257728,387,0,2020/03/30 22:08:36
5931043636,雙合藥局,新北市中和區中正路２９１號１樓,(02)22476607,27,392,2020/03/30 22:08:36
5931043663,群芳藥局,新北市中和區和興里中興街７３號１樓,(02)22433729,0,323,2020/03/30 22:08:36
5931043690,捷勝藥師藥局,新北市中和區華順街１２２號〈１樓〉,(02)29646225,0,399,2020/03/30 22:08:36
5931043761,杏元藥局,新北市中和區員山路１７２號１樓,(02)22236868,204,0,2020/03/30 22:08:36
5931043770,宜安健康人生藥局,新北市中和區宜安路１６２號１樓,(02)29224648,0,462,2020/03/30 22:08:36
5931043798,永成藥局,新北市中和區景平路１５６號１樓,(02)29407619,0,115,2020/03/30 22:08:36
5931043921,良安藥局,新北市中和區文元里連城路３６６號１樓,(02)22225798,321,1855,2020/03/30 22:08:36
5931043930,三德和藥局,新北市中和區吉興里南山路２８９號１樓,(02)22471028,0,50,2020/03/30 22:08:36
5931044044,宥元藥局,新北市中和區德光路６２號１樓,(02)89535473,156,60,2020/03/30 22:08:36
5931044133,康富力藥局,新北市中和區仁愛街３２號１樓,(02)29429896,57,0,2020/03/30 22:08:36
5931044188,安和藥師藥局,新北市中和區錦和路４１０號１樓,(02)22433708,0,680,2020/03/30 22:08:36
5931044268,冠品藥師藥局,新北市中和區連城路１１９號１樓,(02)22452129,191,198,2020/03/30 22:08:36
5931044277,維康藥局雙和店,新北市中和區圓通路２５２號１樓,(02)22431962,0,466,2020/03/30 22:08:36
5931044357,順心藥局,新北市中和區景新街４３９號１樓,(02)29429680,0,1153,2020/03/30 22:08:36
5931044393,躍獅康銓藥局,新北市中和區莒光路１４６號１樓,(02)29646452,0,638,2020/03/30 22:08:36
5931044419,喬登藥局,新北市中和區景平路６９７號１樓,(02)22470273,0,394,2020/03/30 22:08:36
5931044464,健暉藥局,新北市中和區連城路４８７號１樓,(02)22231437,21,1145,2020/03/30 22:08:36
5931044482,悠悅藥局,新北市中和區安樂路２５號２樓,(02)29463755,0,2361,2020/03/30 22:08:36
5931044491,里安藥局,新北市中和區員山路２７１－１號２樓,(02)32347111,0,820,2020/03/30 22:08:36
5931044508,和欣泰藥局,新北市中和區永貞路２２３號１樓,(02)29290867,56,105,2020/03/30 22:08:36
5931044571,中和環球藥局,新北市中和區中山路３段１２１號１樓,(02)22211812,6,455,2020/03/30 22:08:36
5931044599,成合藥局,新北市中和區景平路４２９之２號１樓,(02)22483605,132,797,2020/03/30 22:08:36
5931044606,詠安藥局,新北市中和區員山路１５０之８號１樓,(02)22231606,236,1359,2020/03/30 22:08:36
5931044615,安泰大藥局,新北市中和區南山路３５號１樓,(02)82459423,0,80,2020/03/30 22:08:36
5931044624,奕采藥局,新北市中和區宜安路７７號１樓,(02)29429770,1,38,2020/03/30 22:08:36
5931044660,吉佑藥局,新北市中和區大勇街３４號１樓,(02)89416539,0,143,2020/03/30 22:08:36
5931044679,以法蓮藥局,新北市中和區中興街１５４號１樓,(02)22438983,111,1671,2020/03/30 22:08:36
5931044704,惠民藥局,新北市中和區中興街１５３號１樓,(02)22475303,3,0,2020/03/30 22:08:36
5931044713,信毅藥局,新北市中和區捷運路５６號１樓,(02)29423663,69,410,2020/03/30 22:08:36
5931044740,廣元藥局,新北市中和區興南路２段２７號１樓,(02)86681906,61,605,2020/03/30 22:08:36
5931044786,坤暉藥局,新北市中和區中山路３段９４號２樓,(02)82217939,0,664,2020/03/30 22:08:36
5931044795,三華藥局,新北市中和區中正路１２４號１樓,(02)22470928,141,155,2020/03/30 22:08:36
5931044802,皇秦大藥局,新北市中和區中山路３段３９之１號１樓,(02)22269636,21,135,2020/03/30 22:08:36
5931044848,和霖生活藥局,新北市中和區復興路２８９號１樓,(02)22458227,3,0,2020/03/30 22:08:36
5931044875,誼安健業藥局,新北市中和區宜安路１１８巷２０號１樓,(02)86600058,0,1050,2020/03/30 22:08:36
5931044884,壹品藥局,新北市中和區福祥路５５號１樓,(02)22481818,18,200,2020/03/30 22:08:36
5931044928,芳碩藥局,新北市中和區連城路４７巷２號１樓,(02)82458816,588,95,2020/03/30 22:08:36
5931044937,中和慈美藥局,新北市中和區中山路２段２０８號１樓,(02)22425835,228,2501,2020/03/30 22:08:36
5931044946,綠杏廟口藥局,新北市中和區中和路１１５號１樓,(02)22470547,267,507,2020/03/30 22:08:36
5931044955,安騏生活藥局,新北市中和區南華路１５號１樓,(02)22445130,2,40,2020/03/30 22:08:36
5931044982,萊恩藥局,新北市中和區景安路２０９號１樓,(02)29468395,108,0,2020/03/30 22:08:36
5931044991,曜群藥局,新北市中和區景安路２５號１樓,(02)89432206,60,230,2020/03/30 22:08:36
5931045014,藥安連勝藥局,新北市中和區連勝街３７號１樓,(02)22425266,210,0,2020/03/30 22:08:36
5931045032,朝安藥局,新北市中和區復興路２６２號１樓,(02)31511269,36,0,2020/03/30 22:08:36
5931045041,大誠藥局,新北市中和區民享街８７號１樓,(02)22258394,0,80,2020/03/30 22:08:36
5931045050,日發藥師藥局,新北市中和區華新街１９２巷４０號１樓,(02)89411088,0,60,2020/03/30 22:08:36
5931045069,禾昌藥局,新北市中和區中安街１７８巷２號１樓,(02)29267330,30,80,2020/03/30 22:08:36
5931045078,福澤員山藥局,新北市中和區員山路１２２號１樓,(02)22219551,165,101,2020/03/30 22:08:36
5931045087,公園親子藥局,新北市中和區安平路１５８號２樓,(02)86688726,258,585,2020/03/30 22:08:36
5931045103,榮記大藥局,新北市中和區員山路４８２號１樓,(02)22239546,6,308,2020/03/30 22:08:36
5931050033,仁淵藥局,新北市新店區北宜路１段７７號,(02)29128204,0,586,2020/03/30 22:08:36
5931050131,再生藥局,新北市新店區北新路３段６５巷９號,(02)29113781,33,646,2020/03/30 22:08:36
5931050211,耀生中西藥局,新北市新店區文化路２１巷６號,(02)29118598,9,9,2020/03/30 22:08:36
5931050364,瑞欣藥局,新北市新店區吉安街３３號,(02)22112723,36,0,2020/03/30 22:08:36
5931050444,活元藥局,新北市新店區民族路４９號１樓,(02)29125526,204,179,2020/03/30 22:08:36
5931051558,信龍大藥局,新北市新店區安康路２段５６號,(02)22115533,141,0,2020/03/30 22:08:36
5931051585,益生大藥局,新北市新店區建國路１３２號,(02)29177961,0,49,2020/03/30 22:08:36
5931051601,昇旺藥局,新北市新店區建國路１０－１號１樓,(02)86659233,0,19,2020/03/30 22:08:36
5931051674,金美藥局,新北市新店區北新路３段１３８號１樓,(02)29146365,69,697,2020/03/30 22:08:36
5931051790,家得福藥局,新北市新店區安康路２段１２３號１樓,(02)22118346,2,4,2020/03/30 22:08:36
5931051816,康宜庭北新藥局,新北市新店區北新路２段４３號１樓,(02)89147015,45,0,2020/03/30 22:08:36
5931052135,椿萱藥局,新北市新店區建國路６９號,(02)29188311,0,138,2020/03/30 22:08:36
5931052215,三民藥局,新北市新店區三民路７８號１樓－１,(02)89146301,127,123,2020/03/30 22:08:36
5931052251,昇育健康藥局,新北市新店區中央三街１１５號１樓,(02)86679631,0,3,2020/03/30 22:08:36
5931052288,正新藥局,新北市新店區中正路５７之１號１樓,(02)89145930,0,5,2020/03/30 22:08:36
5931052313,欣康藥局,新北市新店區中正路２９３號１樓,(02)89113189,0,1,2020/03/30 22:08:36
5931052368,正安藥局,新北市新店區明德路５０號１樓,(02)29115809,0,41,2020/03/30 22:08:36
5931052439,德莘藥局,新北市新店區中正路４１３號１樓,(02)86655462,0,157,2020/03/30 22:08:36
5931052457,東碩藥局,新北市新店區建國路１６８號１樓,(02)29118281,0,773,2020/03/30 22:08:36
5931052500,欣美藥局,新北市新店區寶橋路６巷２號１樓,(02)29137321,27,165,2020/03/30 22:08:36
5931052608,佑成藥局,新北市新店區民權路１０１號１樓,(02)86673537,504,0,2020/03/30 22:08:36
5931052653,正升藥局,新北市新店區順安街６１號１樓,(02)29139493,0,110,2020/03/30 22:08:36
5931052699,維顥藥局,新北市新店區中興路１段２７９號１樓,(02)29171986,0,207,2020/03/30 22:08:36
5931052715,陽光健康藥局,新北市新店區安民街２１４號,(02)22123919,126,0,2020/03/30 22:08:36
5931052751,新康藥局,新北市新店區北新路１段１９５號１樓、２樓,(02)29178179,0,10,2020/03/30 22:08:36
5931052797,安欣藥局,新北市新店區北宜路２段２６號１樓,(02)22175450,0,40,2020/03/30 22:08:36
5931052804,新店家安藥局,新北市新店區三民路３２－１號２樓,(02)29117207,189,855,2020/03/30 22:08:36
5931052822,瑞安健保藥局,新北市新店區中正路１４２號１樓,(02)29105252,6,0,2020/03/30 22:08:36
5931052868,均安藥局,新北市新店區民權路８９號１樓,(02)29127861,87,664,2020/03/30 22:08:36
5931052911,倍思特藥局,新北市新店區中興路２段２３９號２樓,(02)89116159,12,490,2020/03/30 22:08:36
5931052966,禾宜藥局,新北市新店區北新路３段１２８號１樓,(02)29150411,0,789,2020/03/30 22:08:36
5931052984,北一藥師藥局,新北市新店區北新路２段１６０號１樓、２樓,(02)89115686,1,4,2020/03/30 22:08:36
5931053007,康曜藥師藥局,新北市新店區安康路２段２４０號１樓,(02)86669660,153,0,2020/03/30 22:08:36
5931053016,佳泰藥局,新北市新店區建國路２２４號１樓,(02)89193422,18,110,2020/03/30 22:08:36
5931053025,健詮藥局,新北市新店區建國路１１９號１樓,(02)29116312,30,0,2020/03/30 22:08:36
5931053052,巧新藥局,新北市新店區北宜路１段８４號１樓,(02)29183565,110,0,2020/03/30 22:08:36
5931053061,耕莘健康人生藥局,新北市新店區民族路１８６號１樓,(02)22194743,91,63,2020/03/30 22:08:36
5931053070,美康中正藥局,新北市新店區中正路２１５號１、２樓,(02)29112669,383,645,2020/03/30 22:08:36
5931053089,昇活藥局,新北市新店區安民街２６９巷２號１樓,(02)22114166,0,3,2020/03/30 22:08:36
5931053098,仁心藥局,新北市新店區中正路４０２號１樓,(02)22186322,111,447,2020/03/30 22:08:36
5931053132,康宜庭碧潭藥局,新北市新店區北宜路１段４１號１樓,(02)29186266,3,0,2020/03/30 22:08:36
5931053150,十二願藥局,新北市新店區中正路６８２號１樓,(02)22181899,294,140,2020/03/30 22:08:36
5931060146,海山藥局,新北市新莊區景德路４２５號,(02)22019804,0,167,2020/03/30 22:08:36
5931060217,富國藥局,新北市新莊區富國路３１號,(02)29039334,0,1,2020/03/30 22:08:36
5931060244,七安大藥局,新北市新莊區民安西路５５號１、２樓及５７號１樓,(02)22026066,276,0,2020/03/30 22:08:36
5931060262,明生藥局,新北市新莊區福樂街１３號,(02)29913260,33,60,2020/03/30 22:08:36
5931060342,十安藥局,新北市新莊區中港路３１６號,(02)29922859,159,0,2020/03/30 22:08:36
5931060351,冠仁藥局,新北市新莊區四維路１２６巷６號,(02)22083611,0,405,2020/03/30 22:08:36
5931060440,楊氏武田藥局,新北市新莊區化成路３７３－５號,(02)85221868,168,15,2020/03/30 22:08:36
5931060548,二安藥局,新北市新莊區中港路６５號,(02)29914527,92,0,2020/03/30 22:08:36
5931060619,蘇藥局,新北市新莊區中平路６巷３７號,(02)29917818,157,0,2020/03/30 22:08:36
5931060628,錄新藥局,新北市新莊區後港一路７６巷１０弄１號,(02)22051849,16,19,2020/03/30 22:08:36
5931060646,王藥局,新北市新莊區昌盛街３８號,(02)29922404,23,0,2020/03/30 22:08:36
5931060682,勝安藥局,新北市新莊區中正路３３４巷２３號１樓,(02)29963394,0,96,2020/03/30 22:08:36
5931060744,祥好大藥局,新北市新莊區新泰路３３１號,(02)29939051,1,0,2020/03/30 22:08:36
5931060815,祐全大藥局,新北市新莊區建安街８８號,(02)22026008,0,157,2020/03/30 22:08:36
5931065810,吉田藥局,新北市新莊區西盛街３１３號,(02)22065185,354,115,2020/03/30 22:08:36
5931065927,聯成藥局,新北市新莊區中正路３３２號,(02)29941915,40,2265,2020/03/30 22:08:36
5931067092,恩泰藥局,新北市新莊區民安西路２６５號－１,(02)22038680,0,165,2020/03/30 22:08:36
5931067172,民安藥局,新北市新莊區民安路２３２號,(02)22038910,237,552,2020/03/30 22:08:36
5931067216,鍵豐藥局,新北市新莊區中和街１５８號１樓,(02)29917452,10,0,2020/03/30 22:08:36
5931067332,富祐藥局,新北市新莊區民安西路２１號１樓,(02)82012451,0,5,2020/03/30 22:08:36
5931067378,天給藥局,新北市新莊區幸福路６７０巷２弄１９號１樓,(02)29921451,783,40,2020/03/30 22:08:36
5931067412,幸寧藥局,新北市新莊區福壽街８４巷１２號１樓,(02)29971150,0,200,2020/03/30 22:08:36
5931067494,福營藥局,新北市新莊區富國路１０７號２樓,(02)22059697,0,648,2020/03/30 22:08:36
5931067529,北安藥局,新北市新莊區幸福路５２９號１樓,(02)29906923,0,328,2020/03/30 22:08:36
5931067547,金翔藥局,新北市新莊區幸福路５９５號１樓,(02)29988528,0,1635,2020/03/30 22:08:36
5931067850,聯合藥局,新北市新莊區新泰路１９４號２樓,(02)22796464,18,1160,2020/03/30 22:08:36
5931067985,蘋果藥局,新北市新莊區八德街１０５號,(02)22053933,288,0,2020/03/30 22:08:36
5931068008,北醫藥局,新北市新莊區思源路１１９號１樓,(02)29983670,138,3268,2020/03/30 22:08:36
5931068151,世鴻藥局,新北市新莊區八德里民安路１３７巷２弄２號１樓,(02)22050289,72,401,2020/03/30 22:08:36
5931068160,三大藥局,新北市新莊區建安里民安路１９７號,(02)22030503,588,0,2020/03/30 22:08:36
5931068268,新莊大東藥局,新北市新莊區幸福路８０６號１樓,(02)22766026,93,0,2020/03/30 22:08:36
5931068375,惠欣藥局,新北市新莊區全泰里建中街７２－１號１樓,(02)29978962,2,162,2020/03/30 22:08:36
5931068455,合康藥師藥局,新北市新莊區中平里中平路３０６號,(02)29924496,0,3,2020/03/30 22:08:36
5931068464,健安藥局,新北市新莊區光和里民安西路２０９號１樓,(02)22043765,12,150,2020/03/30 22:08:36
5931068508,凱盛藥局,新北市新莊區光榮里西盛街１９９號,(02)22024914,0,355,2020/03/30 22:08:36
5931068535,永安藥局,新北市新莊區中港里中港路３２１號２樓,(02)22765900,0,1258,2020/03/30 22:08:36
5931068580,春元藥局,新北市新莊區南港里龍安路２７８巷２號１樓,(02)22085202,9,0,2020/03/30 22:08:36
5931068599,建昌藥局,新北市新莊區福營里中正路５５７號,(02)29015422,40,708,2020/03/30 22:08:36
5931068633,福華藥局,新北市新莊區自立里復興路２段１０９號,(02)89917390,0,25,2020/03/30 22:08:36
5931068759,森活藥局,新北市新莊區民安路２２０－１號,(02)22027927,792,1300,2020/03/30 22:08:36
5931068866,大愛藥師藥局,新北市新莊區後港一路６９號１樓,(02)22042119,0,1,2020/03/30 22:08:36
5931068875,旭生藥局,新北市新莊區裕民街４２號１樓,(02)29021289,6,0,2020/03/30 22:08:36
5931068884,樂寶兒藥局,新北市新莊區中正路８２－２號１樓,(02)0229900185,0,157,2020/03/30 22:08:36
5931068973,富安藥局,新北市新莊區復興路１段２５號－１，２樓,(02)22767620,0,1058,2020/03/30 22:08:36
5931069265,錦安藥局,新北市新莊區民安路２０１號１樓,(02)22011242,12,2716,2020/03/30 22:08:36
5931069363,明亮藥局,新北市新莊區幸福路５１１號１樓,(02)29962671,78,766,2020/03/30 22:08:36
5931069372,羽豐藥局,新北市新莊區新莊路３８２號１樓,(02)22029812,21,167,2020/03/30 22:08:36
5931069498,新杏藥局,新北市新莊區新泰路９９號１樓,(02)22011012,207,0,2020/03/30 22:08:36
5931069505,陽光連鎖藥局,新北市新莊區中信街４０號１樓,(02)22774300,72,100,2020/03/30 22:08:36
5931069532,聯盟藥局,新北市新莊區中港路２６７巷１號１樓,(02)29941168,30,0,2020/03/30 22:08:36
5931069569,心安藥局,新北市新莊區新泰路１９３號２樓,(02)22779773,960,2409,2020/03/30 22:08:36
5931069765,健業藥妝藥局,新北市新莊區中和街１３０號１樓,(02)22796279,21,12,2020/03/30 22:08:36
5931069792,宏泰藥局,新北市新莊區自信街３７號１樓,(02)29964649,18,0,2020/03/30 22:08:36
5931069836,家安藥局,新北市新莊區昌明街３８－１號,(02)29911764,0,650,2020/03/30 22:08:36
5931069916,朝陽藥局,新北市新莊區新泰路１４８號２樓,(02)29983020,0,2,2020/03/30 22:08:36
593106A011,八德藥局,新北市新莊區八德街３號２樓,(02)22071315,108,0,2020/03/30 22:08:36
593106A039,大仁藥局,新北市新莊區公園一路３２號１樓,(02)22776023,240,1911,2020/03/30 22:08:36
593106A093,環球藥局,新北市新莊區中港路４３６號１、２樓,(02)29901934,261,0,2020/03/30 22:08:36
593106A137,力源藥局,新北市新莊區復興路２段１３３號１樓,(02)89929919,1,225,2020/03/30 22:08:36
593106A155,日榮藥局,新北市新莊區龍安路４６１號１樓,(02)22051523,1,118,2020/03/30 22:08:36
593106A164,家福健保藥局,新北市新莊區福壽街６７號２樓,(02)29942730,0,1510,2020/03/30 22:08:36
593106A182,和昌藥局,新北市新莊區中安街１５號１樓,(02)29900669,81,271,2020/03/30 22:08:36
593106A226,詠康聯合藥局,新北市新莊區中榮街６６巷１號１樓,(02)29964436,150,0,2020/03/30 22:08:36
593106A244,巧心藥局,新北市新莊區建中街９２號１樓,(02)22778584,2,160,2020/03/30 22:08:36
593106A299,悅生藥局,新北市新莊區龍安路３４３－１號１樓,(02)22081219,18,104,2020/03/30 22:08:36
593106A324,向日葵健保藥局,新北市新莊區建福路５０號１樓,(02)22060377,14,805,2020/03/30 22:08:36
593106A342,真美滿藥局,新北市新莊區幸福路７２９號２樓,(02)29919473,57,0,2020/03/30 22:08:36
593106A351,平安藥局,新北市新莊區民安西路６０號２樓,(02)22082368,11,415,2020/03/30 22:08:36
593106A379,輔大美康藥局,新北市新莊區中正路５１０號之１，１樓,(02)29013056,699,70,2020/03/30 22:08:36
593106A388,元大藥局,新北市新莊區富國路２０４號１、２樓,(02)22020082,334,0,2020/03/30 22:08:36
593106A404,新新藥局,新北市新莊區新泰路６２號２樓,(02)29945994,627,3,2020/03/30 22:08:36
593106A422,英謙藥局,新北市新莊區新泰路２６１號１樓,(02)22774822,729,1565,2020/03/30 22:08:36
593106A477,喜悅藥局,新北市新莊區後港一路５５號１樓,(02)22047442,3,314,2020/03/30 22:08:36
593106A511,明仁健保藥局,新北市新莊區民安西路１９５號１樓,(02)22085175,0,5,2020/03/30 22:08:36
593106A520,臻善美藥局,新北市新莊區幸福路７８６號１樓,(02)89914303,0,2008,2020/03/30 22:08:36
593106A566,一心春天藥局,新北市新莊區中和街１３號１樓、地下室,(02)89929482,160,0,2020/03/30 22:08:36
593106A600,全鎵藥局,新北市新莊區建中街２２號１樓,(02)22761550,42,45,2020/03/30 22:08:36
593106A628,中原藥局,新北市新莊區中原路９３號１樓,(02)89920668,363,55,2020/03/30 22:08:36
593106A637,薇妮藥妝藥局,新北市新莊區民安路９９號１樓,(02)82010817,24,0,2020/03/30 22:08:36
593106A646,薇妮雙鳳藥局,新北市新莊區雙鳳路２１號１樓,(02)29076993,9,0,2020/03/30 22:08:36
593106A691,大樹新莊藥局,新北市新莊區新泰路５９號１、２樓,(02)22010566,132,1382,2020/03/30 22:08:36
593106A708,宏福藥局,新北市新莊區自信街５５號１樓,(02)29985225,10,0,2020/03/30 22:08:36
593106A717,大樹幸福藥局,新北市新莊區幸福路６７２號１樓,(03)4333123,96,0,2020/03/30 22:08:36
593106A735,樂家藥局,新北市新莊區中平路２７３號１樓,(02)29960723,0,1,2020/03/30 22:08:36
593106A771,新佑康健保藥局,新北市新莊區中華路１段３５號１樓,(02)29947490,3,0,2020/03/30 22:08:36
593106A842,鼎極藥局,新北市新莊區民安西路３７６號之１、之３（１樓）,(02)22073228,0,1705,2020/03/30 22:08:36
593106A888,晉成藥局,新北市新莊區中正路７００－２３號１樓,(02)29017469,242,1484,2020/03/30 22:08:36
593106A904,杏佳藥師藥局,新北市新莊區建安街１２７號１樓,(02)22037077,460,11,2020/03/30 22:08:36
593106A913,洋欣藥局,新北市新莊區中平路２７７號１樓及夾層,(02)89927489,228,708,2020/03/30 22:08:36
593106A922,德翰藥局,新北市新莊區四維路１７１巷１、３號１樓,(02)22025576,78,390,2020/03/30 22:08:36
593106A931,建安藥局,新北市新莊區建安街１１７號、１１９號１樓,(02)22051969,63,2095,2020/03/30 22:08:36
593106A940,樂福藥局,新北市新莊區幸福路４８號１樓,(02)29923388,288,0,2020/03/30 22:08:36
593106A959,新莊大藥局,新北市新莊區福壽街１３０號１樓,(02)29933885,0,1,2020/03/30 22:08:36
5931070017,前回春藥局,新北市樹林區中山路１段５６號,(02)26812167,69,0,2020/03/30 22:08:36
5931070044,正宜藥局,新北市樹林區佳園路１段３９號,(02)26805678,14,0,2020/03/30 22:08:36
5931070062,鴻真藥局,新北市樹林區保安街１段２０巷６號,(02)26828977,12,717,2020/03/30 22:08:36
5931070099,日弘藥師藥局,新北市樹林區復興路２９號,(02)26871919,0,382,2020/03/30 22:08:36
5931070142,江藥局,新北市樹林區日新街１０２號１樓,(02)26828001,0,702,2020/03/30 22:08:36
5931070348,久青藥局,新北市樹林區東華街３３號,(02)86844326,0,115,2020/03/30 22:08:36
5931071425,又怡藥師藥局,新北市樹林區中山路１段７６巷２號１樓,(02)26816886,0,269,2020/03/30 22:08:36
5931071523,蔚海藥局,新北市樹林區鎮前街１７號１樓,(02)86754203,0,2,2020/03/30 22:08:36
5931071532,育生藥局,新北市樹林區保安街一段１９２號１樓,(02)26814385,0,5,2020/03/30 22:08:36
5931071658,大慶藥局,新北市樹林區鎮前街４２－１號,(02)26759212,17,34,2020/03/30 22:08:36
5931071836,弘昌藥師藥局,新北市樹林區保安街１段６５號１樓,(02)26871276,51,136,2020/03/30 22:08:36
5931071916,立欣藥局,新北市樹林區三福街１６６號,(02)26764728,0,1352,2020/03/30 22:08:36
5931071961,綠蘋果藥局,新北市樹林區學勤路５９７號１樓,(02)89706050,0,3,2020/03/30 22:08:36
5931071970,保康藥局,新北市樹林區保安街１段３６４號,(02)86875503,0,300,2020/03/30 22:08:36
5931072039,樹林藥師藥局,新北市樹林區鎮前街２４號１樓,(02)26823030,0,308,2020/03/30 22:08:36
5931072191,生光堂藥局,新北市樹林區龍興街３６號１樓,(02)26896504,126,0,2020/03/30 22:08:36
