593106A164,家福健保藥局,新北市新莊區福壽街６７號２樓,(02)29942730,0,3,2020/02/10 08:37:37
593106A173,華泰藥局,新北市新莊區昌明街８０號１樓,(02)89928500,0,4,2020/02/10 08:37:37
593106A182,和昌藥局,新北市新莊區中安街１５號１樓,(02)29900669,1,18,2020/02/10 08:37:37
593106A226,詠康聯合藥局,新北市新莊區中榮街６６巷１號１樓,(02)29964436,0,8,2020/02/10 08:37:37
593106A244,巧心藥局,新北市新莊區建中街９２號１樓,(02)22778584,0,10,2020/02/10 08:37:37
593106A299,悅生藥局,新北市新莊區龍安路３４３－１號１樓,(02)22081219,0,15,2020/02/10 08:37:37
593106A342,真美滿藥局,新北市新莊區幸福路７２９號２樓,(02)29919473,2,30,2020/02/10 08:37:37
593106A351,平安藥局,新北市新莊區民安西路６０號２樓,(02)22082368,60,58,2020/02/10 08:37:37
593106A379,輔大美康藥局,新北市新莊區中正路５１０號之１，１樓,(02)29013056,0,51,2020/02/10 08:37:37
593106A388,元大藥局,新北市新莊區富國路２０４號１、２樓,(02)22020082,0,4,2020/02/10 08:37:37
593106A404,新新藥局,新北市新莊區新泰路６２號２樓,(02)29945994,87,45,2020/02/10 08:37:37
593106A422,英謙藥局,新北市新莊區新泰路２６１號１樓,(02)22774822,206,88,2020/02/10 08:37:37
593106A477,喜悅藥局,新北市新莊區後港一路５５號１樓,(02)22047442,200,100,2020/02/10 08:37:37
593106A511,明仁健保藥局,新北市新莊區民安西路１９５號１樓,(02)22085175,0,18,2020/02/10 08:37:37
593106A520,臻善美藥局,新北市新莊區幸福路７８６號１樓,(02)89914303,0,41,2020/02/10 08:37:37
593106A566,一心春天藥局,新北市新莊區中和街１３號１樓、地下室,(02)89929482,0,2,2020/02/10 08:37:37
593106A584,記安大藥局,新北市新莊區天祥街４６號１樓,(02)22095331,0,1,2020/02/10 08:37:37
593106A628,中原藥局,新北市新莊區中原路９３號１樓,(02)89920668,1,4,2020/02/10 08:37:37
593106A637,薇妮藥妝藥局,新北市新莊區民安路９９號１樓,(02)82010817,166,50,2020/02/10 08:37:37
593106A646,薇妮雙鳳藥局,新北市新莊區雙鳳路２１號１樓,(02)29076993,72,40,2020/02/10 08:37:37
593106A655,家嘉藥局,新北市新莊區自立街１０３號１樓,(02)89926488,198,64,2020/02/10 08:37:37
593106A691,大樹新莊藥局,新北市新莊區新泰路５９號１、２樓,(02)22010566,2,32,2020/02/10 08:37:37
593106A708,宏福藥局,新北市新莊區自信街５５號１樓,(02)29985225,113,51,2020/02/10 08:37:37
593106A726,良和健保藥局,新北市新莊區龍安路４９號１樓,(02)29048157,0,2,2020/02/10 08:37:37
593106A744,永明藥局,新北市新莊區幸福路５９８號１樓,(02)89920019,1,26,2020/02/10 08:37:37
593106A753,宜安中西藥局,新北市新莊區龍安路２４號１樓,(02)29083318,4,0,2020/02/10 08:37:37
593106A771,新佑康健保藥局,新北市新莊區中華路１段３５號１樓,(02)29947490,14,2,2020/02/10 08:37:37
593106A824,家禾藥局,新北市新莊區立信五街６號１樓,(02)29972121,0,1,2020/02/10 08:37:37
593106A833,欣國藥局,新北市新莊區富國路５７號１樓、２樓,(02)29080958,2,0,2020/02/10 08:37:37
593106A842,鼎極藥局,新北市新莊區民安西路３７６號之１、之３（１樓）,(02)22073228,0,15,2020/02/10 08:37:37
593106A860,新莊至誠藥局,新北市新莊區中平路２９號２樓,(02)29980345,6,76,2020/02/10 08:37:37
593106A888,晉成藥局,新北市新莊區中正路７００－２３號１樓,(02)29017469,20,21,2020/02/10 08:37:37
593106A897,陽光豐年藥局,新北市新莊區豐年街１４號１樓,(02)22060665,200,50,2020/02/10 08:37:37
593106A904,杏佳藥師藥局,新北市新莊區建安街１２７號１樓,(02)22037077,0,4,2020/02/10 08:37:37
593106A931,建安藥局,新北市新莊區建安街１１７號、１１９號１樓,(02)22051969,0,16,2020/02/10 08:37:37
593106A940,樂福藥局,新北市新莊區幸福路４８號１樓,(02)29923388,1,1,2020/02/10 08:37:37
593106A959,新莊大藥局,新北市新莊區福壽街１３０號１樓,(02)29933885,66,36,2020/02/10 08:37:37
5931070017,前回春藥局,新北市樹林區中山路１段５６號,(02)26812167,0,80,2020/02/10 08:37:37
5931070053,仁一藥局,新北市樹林區中正路６２２號,(02)26893915,194,105,2020/02/10 08:37:37
5931070062,鴻真藥局,新北市樹林區保安街１段２０巷６號,(02)26828977,0,26,2020/02/10 08:37:37
5931070080,耀鴻藥局,新北市樹林區中山路３段７６號,(02)26808989,177,54,2020/02/10 08:37:37
5931070099,日弘藥師藥局,新北市樹林區復興路２９號,(02)26871919,201,50,2020/02/10 08:37:37
5931070142,江藥局,新北市樹林區日新街１０２號１樓,(02)26828001,0,24,2020/02/10 08:37:37
5931070286,協安大藥局,新北市樹林區鎮前街１２６號,(02)26810386,60,48,2020/02/10 08:37:37
5931070348,久青藥局,新北市樹林區東華街３３號,(02)86844326,0,28,2020/02/10 08:37:37
5931070393,羅群藥局,新北市樹林區東華街８８號,(02)86851833,200,44,2020/02/10 08:37:37
5931071425,又怡藥師藥局,新北市樹林區中山路１段７６巷２號１樓,(02)26816886,0,36,2020/02/10 08:37:37
5931071523,蔚海藥局,新北市樹林區鎮前街１７號１樓,(02)86754203,172,72,2020/02/10 08:37:37
5931071532,育生藥局,新北市樹林區保安街一段１９２號１樓,(02)26814385,182,50,2020/02/10 08:37:37
5931071550,久豐大藥局,新北市樹林區復興路２８６號１樓,(02)26759156,200,52,2020/02/10 08:37:37
5931071649,博生藥師藥局,新北市樹林區文化街３４號,(02)26825798,188,52,2020/02/10 08:37:37
5931071774,澤安藥師藥局,新北市樹林區保安二街２６號１樓,(02)26872764,14,36,2020/02/10 08:37:37
5931071818,合康藥局,新北市樹林區中山路１段１５１之１號,(02)26816559,6,14,2020/02/10 08:37:37
5931071836,弘昌藥師藥局,新北市樹林區保安街１段６５號１樓,(02)26871276,0,10,2020/02/10 08:37:37
5931071916,立欣藥局,新北市樹林區三福街１６６號,(02)26764728,0,40,2020/02/10 08:37:37
5931071961,綠蘋果藥局,新北市樹林區學勤路５９７號１樓,(02)89706050,200,44,2020/02/10 08:37:37
5931071970,保康藥局,新北市樹林區保安街１段３６４號,(02)86875503,4,6,2020/02/10 08:37:37
5931072039,樹林藥師藥局,新北市樹林區鎮前街２４號１樓,(02)26823030,0,58,2020/02/10 08:37:37
5931072066,琉璃水藥師藥局,新北市樹林區龍興街２１號１樓,(02)26764262,0,4,2020/02/10 08:37:37
5931072137,保安健保藥局,新北市樹林區保安街２段２１１號１樓,(02)26898179,0,1,2020/02/10 08:37:37
5931072191,生光堂藥局,新北市樹林區龍興街３６號１樓,(02)26896504,0,6,2020/02/10 08:37:37
5931072244,彰安藥局,新北市樹林區千歲街８２號,(02)26827341,24,26,2020/02/10 08:37:37
5931072280,啄木鳥藥局,新北市樹林區中華路３９１號１－２樓,(02)86851495,0,2,2020/02/10 08:37:37
5931072299,小蜜蜂中西健保藥局,新北市樹林區東榮街１１８號１樓,(02)86853677,170,44,2020/02/10 08:37:37
5931072404,伯安綜合藥局,新北市樹林區中華路１０８號１樓,(02)86856551,16,0,2020/02/10 08:37:37
5931072413,誠新大藥局,新北市樹林區中山路１段２４號１樓,(02)26870204,0,22,2020/02/10 08:37:37
5931072422,三樹食在好健康藥局,新北市樹林區學成路６００號１樓,(02)26807101,0,2,2020/02/10 08:37:37
5931072431,樹林大樹藥局,新北市樹林區育英街５４號１－２樓,(02)26815488,4,0,2020/02/10 08:37:37
5931072486,星禾藥師藥局,新北市樹林區學府路２９２號１樓,(02)77515255,0,16,2020/02/10 08:37:37
5931080022,藥濟藥局,新北市鶯歌區國慶街１５０號,(02)26781357,404,148,2020/02/10 08:37:37
5931081216,嘉泰藥師藥局,新北市鶯歌區鶯桃路２段３１號１樓,(02)26709668,0,2,2020/02/10 08:37:37
5931081234,文瑞藥局,新北市鶯歌區尖山路２９６號,(02)26780589,174,84,2020/02/10 08:37:37
5931081305,佑家藥局,新北市鶯歌區中正三路１５１號１樓,(02)26798282,0,6,2020/02/10 08:37:37
5931081378,鶯歌宏達藥局,新北市鶯歌區國慶街１３８號１樓,(02)26709693,4,10,2020/02/10 08:37:37
5931081396,祐康藥局,新北市鶯歌區建國路３６號,(02)26771223,0,14,2020/02/10 08:37:37
5931081412,小樹藥師藥局,新北市鶯歌區光明街１２６號１樓,(02)26785107,2,0,2020/02/10 08:37:37
5931081421,萊爾康健保藥局,新北市鶯歌區永明街１７號１樓,(02)26775092,200,50,2020/02/10 08:37:37
5931081430,華昇藥局,新北市鶯歌區鶯桃路５６７號,(02)86777961,31,42,2020/02/10 08:37:37
5931081458,食在好健康藥局,新北市鶯歌區國慶街１６５號１樓,(02)26702559,0,28,2020/02/10 08:37:37
5931081494,康群藥局,新北市鶯歌區建國路２０２號１樓,(02)26796690,0,44,2020/02/10 08:37:37
5931081510,鶯歌藥局,新北市鶯歌區鶯桃路２段１１號１樓,(02)86778778,0,40,2020/02/10 08:37:37
5931090117,大和藥局,新北市三峽區民生街１５０號,(02)26711010,148,46,2020/02/10 08:37:37
5931090180,人來安藥局,新北市三峽區文化路２６６－５號,(02)26721199,152,64,2020/02/10 08:37:37
5931090279,勝全藥局,新北市三峽區大同路２７之１號１樓,(02)26736186,16,44,2020/02/10 08:37:37
5931091427,康美藥局,新北市三峽區民生街７９號２樓,(02)26745526,0,34,2020/02/10 08:37:37
5931091454,致安藥師藥局,新北市三峽區中華路１７號１樓,(02)26743418,107,24,2020/02/10 08:37:37
5931091570,三恩藥局,新北市三峽區復興路４５１號１樓,(02)86711914,72,78,2020/02/10 08:37:37
5931091605,三峽文化藥局,新北市三峽區文化路２１２－２號,(02)26710825,0,8,2020/02/10 08:37:37
5931091623,兆康藥局,新北市三峽區中華路２２號１樓,(02)26717875,0,2,2020/02/10 08:37:37
5931091678,如音藥局,新北市三峽區文化路２６６－１號１樓,(02)26732119,0,34,2020/02/10 08:37:37
5931091696,祥祐藥局,新北市三峽區文化路１２５號１樓,(02)26738080,16,6,2020/02/10 08:37:37
5931091712,誠祐藥局,新北市三峽區光明路２２號１樓,(02)26746211,2,0,2020/02/10 08:37:37
5931091810,誠美藥局,新北市三峽區復興路１０６號１樓,(02)26718131,0,26,2020/02/10 08:37:37
5931091856,大家好學成藥局,新北市三峽區大學路８７號１樓,(02)26741538,0,8,2020/02/10 08:37:37
5931091892,三峽藥局,新北市三峽區介壽路１段２７號１樓,(02)26738868,0,34,2020/02/10 08:37:37
5931091945,弘宇藥局,新北市三峽區國際一街５號１樓,(02)26717108,0,28,2020/02/10 08:37:37
5931091972,三峽大昌藥局,新北市三峽區民生街５６號１樓,(02)26711560,200,58,2020/02/10 08:37:37
5931091981,悅兒藥局,新北市三峽區學成路３２９號１樓,(02)86741633,198,99,2020/02/10 08:37:37
5931092040,一大藥局,新北市三峽區橫溪路２３號１樓,(02)86766677,200,58,2020/02/10 08:37:37
5931092077,立雅藥局,新北市三峽區文化路８４號（１樓、２樓）,(02)26712601,0,12,2020/02/10 08:37:37
5931092095,禾雅藥局,新北市三峽區文化路１３０號（１樓）,(02)26718621,0,2,2020/02/10 08:37:37
5931092102,升威藥局,新北市三峽區文化路２３號１樓,(02)26731120,0,74,2020/02/10 08:37:37
5931100047,松和大藥局,新北市淡水區英專路９２號,(02)26203698,0,46,2020/02/10 08:37:37
5931100074,邱藥局,新北市淡水區中山路２７號,(02)26214255,0,12,2020/02/10 08:37:37
5931100154,尚運藥局,新北市淡水區學府路５１巷１弄２０號,(02)26225149,6,36,2020/02/10 08:37:37
5931100163,昇運藥局,新北市淡水區中山路１５７－１號,(02)26222083,4,12,2020/02/10 08:37:37
5931100305,璉恩藥局,新北市淡水區北新路１３１、１３３號,(02)26298454,0,3,2020/02/10 08:37:37
5931101419,淡水聯合藥局,新北市淡水區英專路９４號２樓,(02)86317699,200,52,2020/02/10 08:37:37
5931101464,伯聯藥局,新北市淡水區清水街９－１０號１樓,(02)26255847,0,38,2020/02/10 08:37:37
5931101599,聖元社區藥局,新北市淡水區北新路１１７－３號１樓,(02)26263227,200,60,2020/02/10 08:37:37
5931101615,大忠聯合藥局,新北市淡水區大忠街１１３巷３１號１樓,(02)26200021,4,12,2020/02/10 08:37:37
5931101642,吳光祥藥局,新北市淡水區中山路１０４號,(02)26213020,0,35,2020/02/10 08:37:37
5931101704,聖天藥局,新北市淡水區重建街２１８號,(02)26215677,1,18,2020/02/10 08:37:37
5931101919,優德仕藥局,淡水區新市一路３段１０３號,(02)26236573,0,22,2020/02/10 08:37:37
5931101937,文川藥局,新北市淡水區中山北路１段９３號１樓,(02)86319033,0,4,2020/02/10 08:37:37
5931102078,躍獅竹圍藥局,新北市淡水區民生路４６號,(02)28090565,0,4,2020/02/10 08:37:37
5931102087,匯民藥局,新北市淡水區中山北路１段１０１號２樓,(02)26202620,182,70,2020/02/10 08:37:37
5931102103,四季寶健保藥局,新北市淡水區新市一路３段１１７－１號（含夾層）,(02)26283199,0,4,2020/02/10 08:37:37
5931102167,天康大藥局,新北市淡水區學府路４９號１樓,(02)26206517,192,52,2020/02/10 08:37:37
5931102176,淡水健康人生藥局,新北市淡水區清水街９－２號１樓,(02)26269679,0,18,2020/02/10 08:37:37
5931102265,佳藥長照藥局,新北市淡水區學府路７５號１樓,(02)26211321,0,26,2020/02/10 08:37:37
5931102274,淡水藥局,新北市淡水區中山路１２７號１、２樓,(02)86313663,0,48,2020/02/10 08:37:37
5931102292,佑全淡水淡金藥局,新北市淡水區淡金路５５號、５７號１樓,(02)26228040,0,4,2020/02/10 08:37:37
5931102309,憲立藥局,新北市淡水區自強路２９５號１樓,(02)28092212,2,0,2020/02/10 08:37:37
5931102318,躍獅學府藥局,新北市淡水區學府路７７號（１樓）,(02)26295603,2,38,2020/02/10 08:37:37
5931110025,巧能藥局,新北市汐止區福德一路２０９號１樓,(02)26942858,1,1,2020/02/10 08:37:37
5931110070,德昌藥局,新北市汐止區中興路４號,(02)26423382,0,19,2020/02/10 08:37:37
5931111586,品康藥局,新北市汐止區湖前街４７號１樓,(02)26954441,0,7,2020/02/10 08:37:37
5931111602,汐止中西大藥局,新北市汐止區中正路４號,(02)26411746,102,68,2020/02/10 08:37:37
5931111611,向日葵藥局,新北市汐止區大同路２段３６８號１樓,(02)26488877,0,18,2020/02/10 08:37:37
5931111719,青苗藥局,新北市汐止區忠孝東路２４２號１樓,(02)26413666,0,35,2020/02/10 08:37:37
5931111773,江北藥局,新北市汐止區汐萬路１段３３號,(02)26918870,2,2,2020/02/10 08:37:37
5931111835,全家藥局,新北市汐止區明峰街１４３號１樓,(02)26954990,200,74,2020/02/10 08:37:37
5931111844,福恩藥師大藥局,新北市汐止區福德二路１７１之１號１樓,(02)26940835,0,51,2020/02/10 08:37:37
5931111951,我家藥局,新北市汐止區中正路２９號,(02)86910840,190,50,2020/02/10 08:37:37
5931112083,裕和藥局,新北市汐止區宜興街４號１樓,(02)26609119,0,2,2020/02/10 08:37:37
5931112136,汐芷藥局,新北市汐止區福德一路２５５號,(02)26924087,0,4,2020/02/10 08:37:37
5931112181,青山藥局,新北市汐止區莊敬街１２７號１樓,(02)26907959,0,20,2020/02/10 08:37:37
5931112225,杏恩健保藥局,新北市汐止區仁愛路１８９號,(02)26435728,192,54,2020/02/10 08:37:37
5931112314,杏光藥局,新北市汐止區建成路５９巷１９號１樓,(02)26411340,4,26,2020/02/10 08:37:37
5931112369,汐止立欣藥局,新北市汐止區汐萬路二段２４９號１樓,(02)26464546,102,38,2020/02/10 08:37:37
5931112378,翔云大藥局,新北市汐止區祥雲街２號ㄧ１、１樓,(02)26463119,0,11,2020/02/10 08:37:37
5931112430,忠孝藥局,新北市汐止區忠孝東路３２１號１樓,(02)86910788,170,47,2020/02/10 08:37:37
5931112467,建忠藥局,新北市汐止區建成路３７巷１１號１樓,(02)26422101,200,51,2020/02/10 08:37:37
5931112494,長頸鹿藥局,新北市汐止區新台五路１段１７８號１樓,(02)26917810,200,49,2020/02/10 08:37:37
5931112510,汐興藥局,新北市汐止區中興路１１３號１樓、２樓,(02)26927733,0,1,2020/02/10 08:37:37
5931112609,健康晨光藥局,新北市汐止區大同路二段５１６號１樓,(02)26433111,202,100,2020/02/10 08:37:37
5931112636,佳恩藥局,新北市汐止區民族三街７之１號１樓,(02)26950714,192,52,2020/02/10 08:37:37
5931112645,健成藥局,新北市汐止區新興路２０號１樓,(02)26428989,0,8,2020/02/10 08:37:37
5931112716,福多藥局,新北市汐止區福德二路６０號１樓,(02)86933378,0,4,2020/02/10 08:37:37
5931112798,益嘉藥局,新北市汐止區忠孝東路２４５號１樓,(02)86423527,0,110,2020/02/10 08:37:37
5931112832,安忻藥局,新北市汐止區樟樹一路１２２之１號１樓,(02)26487309,96,44,2020/02/10 08:37:37
5931112850,躍獅大同藥局,新北市汐止區新興路７號１樓,(02)26418399,0,42,2020/02/10 08:37:37
5931112896,永清藥局,新北市汐止區中興路１８１之１號１樓,(02)26925037,184,53,2020/02/10 08:37:37
5931112912,富康藥局,新北市汐止區忠孝東路４５９號１樓,(02)86481302,0,1,2020/02/10 08:37:37
5931112994,汐止藥局,新北市汐止區福德二路７０號１樓,(02)86932587,0,32,2020/02/10 08:37:37
5931113026,車站藥局,新北市汐止區忠孝東路２４７號１樓,(02)26919222,204,50,2020/02/10 08:37:37
5931120049,本平藥局,新北市瑞芳區瑞芳街４５號,(02)24972167,164,122,2020/02/10 08:37:37
5931120156,瑞聯藥局,新北市瑞芳區明燈路３段１１號,(02)24975852,50,52,2020/02/10 08:37:37
5931121224,千泰藥局,新北市瑞芳區中正路６３－１號,(02)24966347,0,68,2020/02/10 08:37:37
5931121242,崇德藥局,新北市瑞芳區明燈路３段３９－１１號１樓,(02)24976051,392,103,2020/02/10 08:37:37
5931121279,大埔藥局,新北市瑞芳區大埔路１２８－３號１樓,(02)24587020,0,110,2020/02/10 08:37:37
5931121297,瑞芳東亞大藥局,新北市瑞芳區中正路８４號,(02)24960179,1,0,2020/02/10 08:37:37
5931121304,揚明藥局,新北市瑞芳區民族街２號１樓,(02)24970925,1,0,2020/02/10 08:37:37
5931121377,瑞中藥局,新北市瑞芳區明燈路３段５－１號１樓,(02)24977879,4,10,2020/02/10 08:37:37
5931121386,瑞光藥局,新北市瑞芳區明燈路３段７０號１樓,(02)24972070,138,86,2020/02/10 08:37:37
5931121402,瑞慶藥局,新北市瑞芳區大埔路１３０號,(02)24586386,0,46,2020/02/10 08:37:37
5931121411,長興堂藥局,新北市瑞芳區明燈路３段６９號１樓,(02)24972050,192,108,2020/02/10 08:37:37
5931121420,永展藥局,新北市瑞芳區民權街６巷１之１號,(02)24960500,0,26,2020/02/10 08:37:37
5931121448,伊達藥局,新北市瑞芳區明燈路３段３６號,(02)24969654,172,44,2020/02/10 08:37:37
5931130045,景紀大藥局,新北市土城區學成路３４號,(02)22601403,0,18,2020/02/10 08:37:37
5931130205,瑞益藥局,新北市土城區廣明街６３巷４號,(02)89668598,0,8,2020/02/10 08:37:37
5931130214,崇愛藥局,新北市土城區永豐路１７號,(02)22665506,0,1,2020/02/10 08:37:37
5931130223,久達藥局,新北市土城區中央路３段４７號,(02)22696982,198,50,2020/02/10 08:37:37
5931130241,協成藥局,新北市土城區延吉街３３３號,(02)22653212,2,32,2020/02/10 08:37:37
5931130349,祥發藥局,新北市土城區青雲路２５５號,(02)22655056,0,5,2020/02/10 08:37:37
5931130358,盛安大藥局,新北市土城區中央路１段２５８號,(02)22668525,200,50,2020/02/10 08:37:37
5931130394,一和藥局,新北市土城區中央路１段６７之３號,(02)22631378,170,64,2020/02/10 08:37:37
5931130438,正仁藥局,新北市土城區中央路４段２４０號,(02)22682516,0,6,2020/02/10 08:37:37
5931130483,學安藥師藥局,新北市土城區學府路１段２１１號１樓,(02)22610565,196,50,2020/02/10 08:37:37
5931130545,恒生中西藥局,新北市土城區中央路２段１７０號,(02)22603485,0,30,2020/02/10 08:37:37
5931131579,祥安大藥局,新北市土城區立德路４２－１號,(02)22629707,0,42,2020/02/10 08:37:37
5931131800,立康藥局,新北市土城區中央路２段２３８號２樓,(02)82617535,126,80,2020/02/10 08:37:37
5931131828,咸安藥局,新北市土城區明德路１段４號１樓,(02)22627434,0,32,2020/02/10 08:37:37
5931131864,學府實和藥局,新北市土城區學府路１段１２１號,(02)22612111,0,36,2020/02/10 08:37:37
5931131882,裕達藥局,新北市土城區延吉街１７１號,(02)22739328,0,16,2020/02/10 08:37:37
5931131908,璨鴻藥局,新北市土城區延和路１９１號,(02)82622588,0,10,2020/02/10 08:37:37
5931132110,元崇藥局,新北市土城區金城路３段１７６－１號２樓,(02)22643076,0,34,2020/02/10 08:37:37
5931132138,心中外藥局,新北市土城區中央路２段１５７號,(02)22603023,0,2,2020/02/10 08:37:37
5931132165,佳佳藥局,新北市土城區中央路２段２２３－９號２樓,(02)82614558,6,8,2020/02/10 08:37:37
5931132183,尚安藥師藥局,新北市土城區中央路２段２２３之３號１樓,(02)22647622,4,56,2020/02/10 08:37:37
5931132236,善淳藥師藥局,新北市土城區福仁街１９號１樓、B１樓,(02)82627371,0,28,2020/02/10 08:37:37
5931132245,萬昌健保藥局,新北市土城區中央路４段１６０號,(02)22678057,0,52,2020/02/10 08:37:37
5931132263,立新藥局,新北市土城區光明街５號１樓,(02)82626111,0,6,2020/02/10 08:37:37
5931132272,富柏大藥局,新北市土城區水源街２２號１樓,(02)82626815,46,50,2020/02/10 08:37:37
5931132405,小倉藥局,新北市土城區青雲路１９０號１樓,(02)22744257,2,0,2020/02/10 08:37:37
5931132496,惠蒼藥局,新北市土城區中央路２段２１６號１樓,(02)22606812,32,74,2020/02/10 08:37:37
5931132521,儷生藥局,新北市土城區金城路２段３９０號１樓,(02)22609911,194,81,2020/02/10 08:37:37
5931132538,宏奇藥局,新北市土城區延吉街１２６號１樓,(02)82619585,0,16,2020/02/10 08:37:37
5931132576,佑安藥局,新北市土城區清水路３３４號２樓,(02)22643960,0,20,2020/02/10 08:37:37
5931132610,久安藥局,新北市土城區廣明街７０號１樓,(02)89671097,0,2,2020/02/10 08:37:37
5931132629,育佳藥局,新北市土城區金城路２段２４２巷７號１樓,(02)22645692,0,2,2020/02/10 08:37:37
5931132647,舒民藥局,新北市土城區明德路１段３５號２樓,(02)22748654,0,42,2020/02/10 08:37:37
5931132683,家庭藥師連鎖藥局,新北市土城區裕生路２３號１樓,(02)22633601,0,34,2020/02/10 08:37:37
5931132736,大眾藥局,新北市土城區明峰街６巷１號,(02)22666057,4,40,2020/02/10 08:37:37
5931132781,德隆藥局,新北市土城區裕民路１５３號１樓,(02)22656056,0,4,2020/02/10 08:37:37
5931132807,健業藥局,新北市土城區中央路２段２２３－１０號,(02)22704798,0,4,2020/02/10 08:37:37
5931132816,大康藥局,新北市土城區學府路１段７２號２樓,(02)22738004,2,94,2020/02/10 08:37:37
5931132852,佳霖藥局,新北市土城區學府路１段１７０號１樓,(02)22641425,176,66,2020/02/10 08:37:37
5931132870,健群藥局,新北市土城區裕民路８０號２樓,(02)22634747,196,72,2020/02/10 08:37:37
5931132914,健鼎藥局,新北市土城區學府路一段１１７號,(02)22633469,0,24,2020/02/10 08:37:37
5931132932,全家健康藥局,新北市土城區中央路４段２８８號,(02)22678143,6,28,2020/02/10 08:37:37
5931133019,學府松藥局,新北市土城區學府路一段３８號１、２樓,(02)82628665,0,14,2020/02/10 08:37:37
5931133108,三豐藥局,新北市土城區永豐路１３５巷８號,(02)22733766,0,8,2020/02/10 08:37:37
5931133126,成康藥局,新北市土城區學府路１段１８８號１樓,(02)22706596,166,60,2020/02/10 08:37:37
5931133171,誠恩藥局,新北市土城區金城路３段１３７號１樓,(02)22665533,128,48,2020/02/10 08:37:37
5931133206,樂利藥局,新北市土城區裕民路７７號１樓,(02)22630092,182,50,2020/02/10 08:37:37
5931133331,城安大藥局,新北市土城區金城路３段４０號,(02)22646561,0,40,2020/02/10 08:37:37
5931133340,大欣藥局,新北市土城區裕民路２５１號,(02)22653208,0,30,2020/02/10 08:37:37
5931133359,麗膚藥局,新北市土城區金城路３段１６４號１樓,(02)22640600,198,64,2020/02/10 08:37:37
5931133377,優嘉藥師連鎖藥局,新北市土城區中央路二段１１７號１樓,(02)82629788,194,44,2020/02/10 08:37:37
5931133395,順儷金城藥局,新北市土城區金城路３段１４７號１樓,(02)22621590,0,6,2020/02/10 08:37:37
5931133439,志仁藥局,新北市土城區學府路１段１０２號１樓,(02)22737222,0,22,2020/02/10 08:37:37
5931133466,土城金城藥局,新北市土城區裕民路２８０號１、２樓,(02)22631616,0,6,2020/02/10 08:37:37
5931133493,順儷學府藥局,新北市土城區學府路１段１４４巷２號１樓,(02)22701979,0,24,2020/02/10 08:37:37
5931133500,菩提藥局,新北市土城區延和路１１４號１樓,(02)22624866,0,44,2020/02/10 08:37:37
5931133519,埔銓藥局,新北市土城區裕民路１６４號１、２樓,(02)22630230,74,46,2020/02/10 08:37:37
5931133528,中央藥局,新北市土城區中央路２段８４、８６號（１樓）,(02)22630345,4,30,2020/02/10 08:37:37
5931133537,裕生藥局,新北市土城區裕生路４號夾層樓,(02)22705661,194,86,2020/02/10 08:37:37
5931140096,華信藥局,新北市蘆洲區民族路１５４號１樓,(02)22898116,0,30,2020/02/10 08:37:37
5931140112,施藥局,新北市蘆洲區信義路２３０號,(02)22814624,0,4,2020/02/10 08:37:37
